,type,category,review,star
19,아이폰12,별점,"폰구하기 어렵다던데 매일 확인하며 재고 보던중
운좋게 득템해서 빠르게 받았어요
자급제를 구매해본적이 첨이라 불안한맘과걱정이 앞섰는데 핸드폰 상태 좋고 결함없는 폰을 받아 만족스럽습니다
포인트 적립의 매리트도 굿!!
생각보다 가볍고 사이즈도 딱맞아요
실버색은 탁월한 선택이란 게 실물을 보니 더 확실하네요",5
20,아이폰12,별점,아이폰 초창기부터 계속 아이폰만 써왔어서 삼성폰은 손에 익지 않아서 계속 아이폰만 써오다 새로 나온 12가 예전 4모델처럼 각진 디자인으로 바뀌었다는 소리를 듣고 출시만 기다리고 있다가 구매했어요~ 예약구매 놓치고 정가 다 주고 구매했지만 정말 후회 없네요~ 4모델의 약간은 투박하지만 질리지 않고 견고해보이는 다자인을 좋아했던 저로서는 정말 12모델이 흠잡을데 없이 딱 제 맘에 들어서 개봉하자마자 감탄만 연발했네요~ 색상도 용달차 색상이라는 말 때문에 잠시 고민했었는데ㅎㅎ 전~혀 아니예요~ 훨씬 깊이있고 진한 네이비 느낌이구요 실제로 보면 더 고급스럽고 예쁩니다~ 12나올때까지 기다린 보람이 있네요~ 64기가 쓰면서 용량때문에 불편했어서 256기가로 선택했는데 그것도 잘 선택한거 같구요~ 오래오래 잘 쓰려고 보호 필름이랑 케이스 주문할 때까지 손 안대고 기다렸네요~ ~~!!^^,5
21,아이폰12,별점,"구매한 지 한달되었습니다.
사용할수록 여기서 사길 잘했다는 생각이 듭니다 :)

✔️ 포장상태도 좋고 안전하게 배송되었습니다.
연말임에도 불구하고 배송까지 3일 소요라는 점이 서프라이즈였네요 ㅎㅎ

✔️네이버 포인트, 플러스 멤버십이용시 큰 메리트가 있네요. 거의 10만원을 지원받았어요!
요즘 아이폰 온라인 구매로 말도 탈도 많던데, 이정도 상품에 이정도 혜택이라면 이유가 없죠!

✔️사진이 기가막히게 찍힙니다.
벚꽃에디션, 빛번짐 현상때문에 염려했었는데
모든 테스트 합격입니다. 사진찍을맛 나요!

주위에서 아이폰 구매 고민한다면 저는 주저없이
네이버 공홈을 추천할것 같습니다.
판매자님 흥하세요! 잘 사용하겠습니다 :)",5
22,아이폰12,별점,"배송 실화..? 하루만에 왔어요 •• 주문하고 그다음날 거의 하루도 안걸린것 같기도 합니다.

실버랑 그래파이트 고민많이 했는데 짝궁이 그래파이트 하반기에 구입하기로 하고 저는 실버로 했어요. 정말 마음에 듭니다 ♥️

네이버 스토어로 믿을 수있는 제품을 안전하고 빠르게 받아서 좋았어요. 포인트 쌓여서 두배로 세배로 좋은것 안비밀입니다 ㅋㅋ

이것저것 유튜브로 불량 확인했는데 전혀 불량 없었고 있어요!
저는 늘 중간 용량을 사용해와서 256으로 구매했어요. 6s 5년 사용하고 바꿨는데 . 배터리도 만땅시 하루반에서 이틀정도 사용하는거같아요. 사용자마다 다르겠으나 ! 그리고 별로 안무거워요. 6s보다 실중량은 높겠으나.. 체감으로 그닥 무게 차이안났어요.

잃어버린 에어팟도 그냥 요기서 구매해야겠어요..
여러모로 기분좋은 구매입니다.
새로산 12프로로 찍은 꽃열매도 같이 첨부합니다 ㅋㅋ ♥️",5
23,아이폰12,별점,"12월24일 오전에 주문하여 25일 휴일 건너뛰고 26일 수령완료! 휴일만 아니였어도 ㅎㅏ루만에 도착했었네요~ 포장도 안전하게 오고 불량 없는덧 같구요.. 색상도 간지 퍼시픽블루^^
아이폰5만에 사용하는지라 어색하지만 잘 적응해 보겠습니다~
자급제폰이라 연락처이동 걱정했는데 참 편하네요
많이 파세요",5
24,아이폰12,별점,"배송도 빠르구 만족합니다
내아이폰 ㅜㅜ
오늘받았는데 오래오래 행복하게 같이 살래요.
충전기두 같이샀어요
그레파이트 색이 사고 싶었는데
다른덴 재고가 없구
공홈은 1월에나 온대서 여기를 계속 살펴봤어요.
하루에 두번 11시, 5시쯤 재고 들어오더라고요.
그때 색상별 다 잘들어오니 꼭 득템하세요.
네이버 페이포인트두 받고 요기 넘 좋아요.
충전기두 다른덴 짭퉁 많대서 믿을 수 있는 여기서 샀ㅈㅣ욤. 이제 에어팟프로만 남았네요.
♡",5
25,아이폰12,별점,"통신사에서 1번으로 예약했는데도, 한 달 넘게 못 받고 있어서 이것저것 찾아보다가 자급제에 대해서 알게 되어서 이곳까지 들어오게 되었어요! 자급제폰 처음 구매인데다가 배송에 대한 불안감이 있어서 걱정했는데, 다행히 안전하고, 빠르게 잘 도착했어요!! 혹시 몰라서 언박싱 영상도 찍었는데, 제품 외부나 내부에 하자도 하나도 없어서 마음이 편안해졌습니다ㅎㅎ 개인적으로 제조일을 쫌 신경쓰는데, 받은 상품은 제조도 12월이었어요ㅎㅎ 그래파이트 진짜 너무 영롱하고 예뻐요ㅠㅠ 이렇게 빨리 바꿀 수 있는걸 왜 그렇게 미련하게 오래 기다렸는지ㅋㅋㅠ 아무튼! 좋은 제품 빨리 받아서 너무 좋습니다!!!",5
26,아이폰12,별점,"아이폰 프로, 특히 그래파이트 대란이 일어나고 사전예약 하신 분들도 이제서야 받는 분위기라 사전예약 광탈한 저는 아이폰 13이나 노려야겠다 하고 포기하고 있었습니다 근데 우연한 기회로 네이버 애플스토어에 들어와보았습니다 딱 그래파이트 재고가 있는 걸 보고 바로 구매하였습니다

전 핸드폰인 se2도 이 곳에서 구매하였기에 믿고 구매했습니다 그땐 리뷰 쓰는 것을 까먹어서 못 썼지만 이번엔 너무 좋은 기회를 잡았기 때문에 리뷰를 올려봅니다 !

이렇게 산 것만으로도 기분 좋았는데 하루만에 배송와서 더 좋았습니다 22일 새벽에 주문했는데 23일 점심시간에 도착했어요 케이스랑 필름도 주문했는데 그것보다 더 빨리와서 좋았습니다 크리스마스 선물을 받은 기분이었어요 ㅎㅎ 빠른 배송 감사합니다

이번 아이폰12프로는 4년간 쓰겠다고 다짐했지만 혹시 또 아이폰으로 바꾸게 된다면 ㅎ 공식 애플스토어 꼭 이용하겠습니다^ㅡ^",5
27,아이폰12,별점,"아이폰12프로...♥
그래파이트 영롱해요ㅠㅠㅠ

핸드폰을 5년만에 바꾸는거라 여기저기서 많이 알아봤는데, 요새 뭔가 오프라인도 이것저것 껴서 너무 많이 팔고 정신없어서 인터넷으로 알아보다가 공식판매처인 이곳에서 구입했습니다

원하는 색상이 나올때까지 판매자분이 말씀해주신 업데이트되는 시간마다 찾아보다가 드디어 득템ღ

진짜 진짜 너무 예쁘고, 유심만 바꿔 끼웠더니 원래 통신사에서 쓰던 요금제로 가능하더라구요^^

원래아이폰6s+ 제품써서 케이블선 똑같을줄 알았는데 그..c핀인가 뭔가네요ㅠㅠ 어댑터 하나 새로사야겠어요 힝 ㅜㅠ

그래도 배송도 빠르게오고 불량제품도 아니어서 지금 일주일째 쓰고있는데 너무 만족해요오 ♥",5
28,아이폰12,별점,"아이폰 xr을 사용하다가 아이폰 12pro로 넘어왔습니다
크기는 12pro가 xr보다 조금 작지만 베젤이 줄어들아 화면 크기는 비슷합니다
옆 테두리부분이 각지고 알루미늄 재질이라 예쁘고 새로 나온 퍼시픽블루 색상을 한달 사용했는데 아직 질리지 않네요
그리고 터치감이나 반응속도가 조금 더 빨라진게 느껴집니다
배터리 시간은 비슷한거 같은데 무선 충전이 가능해서 편리하네요
아주 큰 변화는 없지만 저는 전체적으로",5
29,아이폰12,별점,"두번째 구매입니다..남편 크리스마스 써프라이즈선물로 준비했더니..자기만 받을수없다하여 제것도 구매했습니다 커플로 골드..은은한 베이지컬러라 고급지네요.불량테스트결과 아주 좋습니다..갤럭시 노트시리즈에 녹아있다가 남편의 아이폰을 이래저래살펴보니 폰을 90프로 활용하는 사람으로서 불편한건 몇개밖에 없더라구요..아이폰에 그닥 관심없었는데 이번 12시리즈는 핵디자인에 마음을 확~~!! ㅎㅎ
케이스가 아직오지않아 고이모셔두었네요..
같이 온 리브엠 알뜰요금제도 사용해보려고합니다. 여러모로 좋은기회였습니다.. 다음엔 우리 아이들도 이곳에서 폰 선물해야겠어요",5
30,아이폰12,별점,"아이폰 7 만 4년 넘게 쓰고 있어요.
배터리 한번 교체했고 지금도 버벅거림없이 잘 쓰고 있는데, 내안에 새폰에 대한 로망이 스물스물 오르는겁니다ㅋㅋ
작은 아이폰7을 써왔던터라 작은폰이 좋아서 아이폰 12 미니와 프로. 고민고민 끝에, 카메라 때문에 프로를 선택했어요.
유심칩 그대로 꽂아쓰고, 아이클라우드로 고대로 사진이며 어플들이 복사되고.. 이렇게 편할수가ㅋㅋ
색상도 실버라 깨끗한게 넘 이쁘고 좋아용~
오래오래 잘쓰겠습니다.",5
31,아이폰12,별점,"역시 ㅠㅠㅠ 너무 이쁩니다
실버와 그래파이트 둘중 계속 고민하고 주문했다 취소하고를 반복한 끝에 그래파이트로 결정하고 주문했는데 너무 잘한 선택인거같아요
무광이 너무 고급지고 이쁩니다 ㅠㅠ
512기가를 기다리다가 도저히 재고가 안나서 256기가로 주문했는데 만족해요!
5s를 썼을때 디자인 너무 만족하며 썼었던지라
이번 12프로가 나왔을때 너무이쁘다고 생각해서 사용하던 지플립을 버리고 다시 아이폰으로 넘어왔어요
카메라안에 먼지가 있는 불량을 받았는데 서비스센터에서 교환을 받고 양품사용중입니다 ㅎㅎ",5
32,아이폰12,별점,"간단한 리뷰!!!

1. 아이폰 12 pro가 예뻐보여 여기저기(온라인, 오프라인) 뒤졌으나 재고가 없어 포기하려던 찰나 아이폰 재고가 있다는 소식을 듣고 바로 구매! 원하던 퍼시픽 블루가 있어 고민을 1도 하지 않고 바로 주문.

2. 12월 27일 주문하여 언제오나 눈 빠지게 기다렸는데 12월 30일 수요일에 도착 생각보다 빨리 도착해 너무나 감사했습니다.

3. 택배박스를 뜯었는데 뾱뾱이에 잘 감싸져 와 예쁜 자태를 뽐내더라구요. 양품이었고 바로 설정하고 유심을 꽂아 써봤는데 맘에 안드는게 하나도 없네요. 좋은 상품 감사합니다.",5
33,아이폰12,별점,"실물 하나로 구매, 배송에서 끓어 올랐던 화가 쿨링되었네요. ㅋㅍ, 11ㅂㄱ 다 실패하고 10월 26일에 포인트라도 받자라는 심경으로 구매했기 때문에 빠른 배송은 기대하지 않았어요. 11월 2일 발송되는것도 의외로 빠른데?? 싶었지만 인간은 욕심의 동물이라고.. 11월 3일 수요일에 배송완료되길 오매불망 기다리고 또 기다렸는데 C*대*통* 곤지암허브에서 하루가 날라가더라구요 이때 판매자분이 첨으로 원망스러웠습니다 ㅜㅜ 일,이십만원 물건도 아니고,,, 우*국택배를 이용했으면 얼마나 좋았을까 ㅜㅜㅜ 그런데 실물을 보는 순간 아쉬운 마음 다 날라갔어요 구매하기까지 방황했던 시간,,, 배송을 기다리며 맘 졸였던 시간,,, 다 아무것도 아니에요,, 진심 너무 이쁩니다,, 불량테스트도 해봤는데 다행히 양품으로 잘 걸렸구요 사물에 큰가치를 두지 않는데 아이폰 이게 뭐라고 사람 마음이 이리 요동치는지,,, 다들 양품뽑기 잘 걸리시길 바라겠습니다!",5
34,아이폰12,별점,배송빠르고 좋습니다. 지금잘 사용중이고 처음 박스를 개봉하면 리브m유심이 같이 들어있네요. 안에는 안내장이 같이 있습니다. 알뜰요금제로 바꾸시는 것도 좋은거 같습니다. 아이폰 박스는 포장 잘 되어있었고 개봉 미리 동영상 찍으면서 개봉하시는것을 추천드립니다. 혹시모를 불량에 대한 증빙자료가 필요하니까요. 다행히 제가 받은건 양품으로 온듯하네요.,5
35,아이폰12,별점,"구매결정할때까진 망설였는데 재고없어질까바
냉큼 주문했습니당 막상 받고 맘에 안들까바 걱정
했는데 받고 나니 괜히 걱정 했다는 생각이 들어요 색깔이 너무 예쁘고 배송이 빨라서 포장을 뜯자마자 신이 난 나머지 원래 쓰던 폰을 팔려고 초기화 하고 꺼서 포장해두고 새 폰을 다 세팅 하고 나니 새로운 녀석의 사진을 찍을 수가 없어서 폰 스스로 셀카를 시도해 봤습니다..
안전하게 배송해 주셔서 너무 감사합니다
빨리 받아볼 수 있어서 몹시 기뻐요
퍼시픽 블루 돌았어요 영롱 그 자체...
이렇게 간편하게 구매가 가능 하다 보니 아이패드도 얼른 사고 싶네요..",5
36,아이폰12,별점,아이폰12프로실버!!! 진짜 완전 예뻐욥 ㅜ.ㅜ! 일주일쯤 재고 언제 풀리나 들락날락하다가 갑자기 금욜인가 풀려서 오후 2시반쯤에 주문했는데 토요일 오전에 배송왔어요 ㅋㅋ 인천에서 배송시작인듯한데 제가 인천살아서 좀 더 빨리온것같기도하네요!! 아무튼 너무좋고요~ 공홈보다 싸게사서 더 좋아요 ㅋㅋㅋ 양품 잘 온 것 같습니다(아직까지는..!)ㅎㅎ 여러분 고민은 배송만 늦출뿐..! 지르십시오 ㅋㅋㅋ,5
37,아이폰12,별점,"23일 주문했는데 오늘 받았어요
배송 빨라서 좋네요
크리스마스는 지났지만 지난한해 고생한 저한테
스스로 주는 선물이에요. 전에 쓰던 핸드폰은 할머님께 드려서 영상통화도 가르쳐드리려구요.

2020년 코로나로 모두들 힘드셨지만 2021년에는
모든 분들에게 좋은 일만 가득하길 바랍니다.
마스크 없이 비대면이 아닌 만남으로 만나길 바라며",5
38,아이폰12,별점,기다리고 기다리던 제품 입고 되자마자 구매했습니다. 카메라 너무 좋고 게임할 때 스피커가 통화할때 들리는 구멍 하단 구멍으로 둘 다 나와서 입체감이 느껴져요. 각진 디자인 그립감도 넘 좋습니다 그냥 보는데도 화질이 좋은 느낌! 어플도 금방 다운 받아지네요,5
39,아이폰12,별점,실버색상 매번 품절이여서 구매하기 힘들었는데 12시쯤 들어와봤더니 재고가 있어서 얼른 구매했네요~!! 네이버 포인트도 십만포인트 정도 적립되서 할인받은 느낌이라 너무 좋아요 핸드폰 배송도 빨랐고 양품이라서 다행이에요 잘쓰겠습니다!!,5
40,아이폰12,별점,"여전히 좋아요~
구입하기전 아이폰미니와 고민했었는데,
프로 구입하기 진짜 잘한거 같아요.
배터리도 정말 잘 닳지않고 카메라 성능도 완전 만족스러워요.
정품 가죽케이스 씌워놨더니 비주얼깡패입니다.
.",5
41,아이폰12,별점,"일단 최신폰이라 좋고 모양도 이쁘고 색상도 너무너무 마음에 듭니다 그리고 통신사에서 구매하는거보다 자급제폰을 구매하는것이 통신사 이동이나 요금제 선택에 있어서 자유롭고 좋은듯 합니다
다른 앱을 깔지 않아도 사진도 잘 나오고 내손에 속 들어오는것이 진짜 마음에 듭니다",5
42,아이폰12,별점,"아이폰 XS 이후 정말 오랜만에 폰을 교체했습니다.
색상 고민을 많이 했는데 골드 정말 선택 잘 한 것 같네요!

기대도 안했는데 배송이 너무 빨라서 연말 선물 무사히 마쳤던 것 같습니다.

빠른배송, 공식 판매점의 신뢰. 제품자체야 아이폰이니깐^^

이곳에서 구매하시면 다들 ~",5
43,아이폰12,별점,"사전예약으로 구매해서 처음부터 매우 잘 쓰고 있어요. 폰 자체가 워낙 좋아요. 다만 그냥 폰 특성상 지문이 잘묻는게 단점이고, 다른 점은 만족스러워요! 임튼 자급제 폰을 네이버에서 살 수 있어서 매우 만족입니다! 앞으로도 자급제 폰은 네이버에서 구매할까 생각중입니다! 할인만 좀 더 있으면 좋겠네요 ㅋㅋ",5
44,아이폰12,별점,쿠팡에서는 알림을 해놔도 매번 실패했는데 운 좋게 여기서는 바로 구매할 수 있었어요! 지금은 아예 재고도 없어서 살 곳이 없는데 미리 안 샀으면 못 살뻔 했네요...!!! 더 써봐야 알겠지만 처음 받았을 때 외관으로는 하자 없었고 불량 테스트 해봤을 때 다행하게도 문제는 없었습니다 자급제 첫 구매인데 인터넷 구매도 처음이라 걱정 많이 했는데 지금까지도 문제 없이 잘 사용하고 있어요 배송 오래 걸릴줄 알았는데 3일정도? 주말인데도 받았고 결론은 아주 만족합니다~!,5
45,아이폰12,별점,"아이폰 xs를 사용하다가 이번에 아이폰 12로 바꾸게 되었습니다. 그래파이트와 실버색상을 보고 있었지만 재고 구하기가 너무 힘들어 포기하려던 차에 네이버 공식 스토어에서 구매하게 되었습니다.

주문은 했지만 재고가 없어서 취소 되면 어쩌나 걱정을 했는데 꼼꼼하게 포장해서 다음날 배송받았습니다.

할인은 없었지만 네이버 포인트를 많이 받을 수 있어서 좋습니다.",5
46,아이폰12,별점,일반통신사나 핸드폰가게에서 미리 선예약해도 못받은 사람도 많던데 후기읽어보고 하루 이틀만에 받았다하여 저도 시켜보았네요 역시나 출고문자도 바로뜨고 2일째 되는날 받았어요 아이들 두명 같이 시켰는데 너무만족하고 좋아요 잘쓰고있어요,5
47,아이폰12,별점,"2일만에 받았어요!! 대리점에는 재고가 항상 없고 다 전화해봐도 블루, 골드 이것도 있을까 말까
실버 재고있는 거 보고 그냥 질러버렸네요 ㅋㅋㅋ
포장도 꼼꼼하고 너무 빨리 받아서 당황 !!!
불량테스트 했는데 전부 통과
후기가 좋았는데 역시는 역시!!
무이자 카드 되는 것도 있으니 확인해보시고 결제하세용 귀찮은 거 싫어서 매번 자급제는 피했는데 자급제가 훨씬 간단하고 편리합니다.",5
48,아이폰12,별점,"24개월 약정으로 사려고 외부 업체에 기기변경으로 첫날부터 예약했는데 한달이 지나도록 폰을 안 보내줌...입고가 안되서 못보내준다는 말만 함. 남들은 다 들고 다니는데. 알아보니 다른데들도 마찬가지. 그냥 기기 사면 바로 받을 수 있는데. 결국 빡쳐서 여기서 주문하고 그 다음날 바로 폰 받음. 나 한달이나 왜 기다림??? 물론 기기 할인 못받고 무이자할부가 6개월까지 밖에 안되지만. 거기서 기다리다간 2개월 후에나 폰 받을 거 같았음. 클릭이 늦어 실버를 못 산건 좀 후회됨.
추가구매로 살 수 있는 쉴드와 케이스는 맘에 드는 걸 사기 전 까지 쓰기에 가격대비 나쁘지 않음.",5
49,아이폰12,별점,"배송이 정말 빨라서 좋았어요.
그리고 처음에 주문핦때 걱정했던게 보통 택배 부재시 문앞 형태로 받아서 누가 훔쳐가면 어쩌지 했거든요. 왜냐하면 보통 주문하면 주문 상품 이름이 그대로 배송표에 표시되잖아요.
근데 센스있게 그냥 전자기기로 표시 되어있어서 이게 핸드폰인지 아닌지 알수 없게 되어있어서 좋았어요.
그리도 취급주의와 함께 포장이 깔끔하게 되어있어서 좋았어요.
요새 불량같은거 많다던데 제가 받은 물품은 양품인거 같아요
아이폰을 처음사보는거라 아직 익숙치 않지만
좋아요",5
50,아이폰12,별점,"너무 좋아요. 한달쯤 사용중인데
튼튼하고 깔끔하고 변색도없고 최고에요.
요런 투명케이스들 변색심하고 얇거나 튼튼하면 무겁던데 요건 변색도없고 가볍고 튼튼해요. 그립감도 좋고 미끄럽지도 뻣뻣하지도 않아서 딱이에요.
투명이라서 제맘대로 스티커, 스마트톡 등으로 디자인할수있어서 더좋아요. 구매하세요.",5
51,아이폰12,별점,"쓰던 폰이 고장나서 빨리 받을 수 있는 곳을 원했는데 배송이 너무 빨랐어요! 토욜에 시켰는데 화요일 오전에 왔거든요. 오히려 폰케이스랑 액정이 늦게 도착해서 기다림,,
12시리즈는 다들 불량검사?를 하길래 저도 해봤는데 다 정상이었어요! 다들 폰 무겁다는데 전에 쓰던 폰보다 커서 무게가 더 나가는게 이상하지 않아요
너무 이뻐서 폰 볼때마다 기분이 좋아요 폰 잘쓸게요!
그리고 다들 폰사진 찍어올리던데 뭘로 찍어서 올리는 건가요? 저는 박스밖에 못찍었어요",5
52,아이폰12,별점,"배송도 빠르고 좋아요~~
포장 상태도 좋아요!!
제품도 좋아요~~ 역시 사과폰이에요^^
공식 애플 스토어라서 믿고 구매했어요 ㅎ
감사합니다~
또 구매하고 싶어요
덕분에 약정에 묶여서 통신사 노예를 벗어났어유~
자급제폰 최고예유^^ 짱짱♡♡",5
53,아이폰12,별점,"배송이며 제품이며 무슨말이 필요합니까
8플러스 쓰다가 넘어왔습니다
스크래치 없고 스피커 마이크멀쩡하고
오줌 벚꽃액정없고 아직 베젤없는 화면이란 버튼없는거에 적응이 필요하지만
그냥 보는 순간 박스두껑여는 순간 헉소리납니다
게다가 카메라!! 캬 놀랍고 또 놀랍습니다
(그렇다면 프로맥스는 얼마나 더 좋을까요)
물량 없는 이 상황에 구할수 있어서 가차없이 구입했습니다 뽑기도 잘한거같고 뿌듯합니다",5
54,아이폰12,별점,주문 한지 24 시간 도 되지 않아 받았습니다 재고가 없어서 주문 후 취소 된다는 이야기도 들어 못 받을 것도 생각하고 있었기 때문에 이렇게 빨리 상품을 받게 된 것이 매우 놀라웠습니다 iPhone 7 Plus 쓰다가 4년 만에 새 핸드폰으로 바꾸니 속도도 너무 빠르고 바뀐 점도 많아 적응 하는데 시간은 걸릴 것 같습니다 지금 리뷰를 음성인식으로 쓰고 있는데 이것도 너무 잘 되어서 신기하네요 ㅋㅋㅋ 골드 색깔 사고 싶어서 자급제 물량 풀릴 때까지 계속 기다리고 있었는데 우연히 들어와서 실버 재고가 있는 것을 보고 생각 없이 질렀는데 받고보니 너무 예쁘고 실버로하길 잘한 것 같습니다 인터넷 보고 찾아 보고 벚꽃 현상이나 오줌액정 등 이상 있는지 테스트 해 봤는데 지금까지는 문제 없는 상품인 것 같아요 좋은 상품 빨리보내주셔서 정말 감사합니다,5
55,아이폰12,별점,아이폰12 pro 넘 구매하고 싶었는데 자급제라 ㅋㅍ에서 대기하다 매번 놓쳐서 인터넷으로 알아보던 중 애플 공식 판매점이 네이버 스마트스토어에 있어 우왕!하고 재고 확인해보니 있어서 망설임없이 바로 구매했습니다 ㅠ 저는 네이버 플러스 멤버십이어서 적립을 많이 받아 조금 더 저렴하게 구매해 현재까지 잘 사용중이랍니다♡ 넘 좋아요옹~,5
56,아이폰12,별점,한달을 꼬박 기다려서 구매하고 2달을 사용했네요. 아이폰5s-아이폰se-아이폰6s-아이폰x를 사용해왔는데 역시 아이폰은 각진게 제맛이네요. Pro가 왜 pro인지도 확실히 느껴집니다. 카메라가 정말 신세계네요. 3년 바라보고 샀는데 잘 관리해서 오래쓰고싶어요.,5
57,아이폰12,별점,"1-2 주 내 입고예정이 확실하지않다고 해서
얼마나 더 기다려야하나 슬퍼서
미련을 버릴수 없어 계속 들락날락했는데
화요일 저녁6:3 분쯤 급 구매창이 떠서 보니 그래파이트였네요
전 블루를 기다리고있었으나 빨리 받아보고있어서
가리지않고 바로 샀어요
배송은 수요일 발송해서 목요일에 받았어요
단골혜택까지 해서 6만대포인트 받았구요
추가로 애플케어구매하면 친구에게선물하기 혜택은 받을수 없네요(추가상품구매시엔 선물하기안된대요)

11프로에서 넘어오는거라 크- 게 차이는 없지만
일단 차이가 있다면 외관이겠죠
오프라인에선 12프로 256 받아보기 너무오래기다려서 구매한건데 빠른배송 역시 감사드립니다.
. 행복해요",5
58,아이폰12,별점,23일에 구매해서 금요일에 오는줄 알고 엄청 기다렸는데 결국 토욜에 받았어요ㅠㅠ 그래도 8+쓰다가 오랜만에 바꿨더니 예전에 좋아하던 5시리즈 느낌도 있고 좋아요 계속 실버/로즈골드 사용했었는데 처음 써보는 어두운 컬러인 그래파이트도 예쁘네요 아이폰에서 카메라를 제일 많이 활용하는 편이라 새로운 기능들 익히느라 당분간 바쁘겠어요:-)),5
