,type,category,review,star
0,아이패드,별점,"제품 받자마자 전원이 들어오지 않아서 반품하고 교환을 요구했더니 충전이 제대로 안되어 있어서 그런 것 같다며 제품에는 아무런 문제가 없다고 하더군요.... 찜찜하지만 그 제품 다시 받았음.... 사용한지 한달정도 지나고 부터 애플로고 무한반복.... 참다참다 애플고객센터 갔더니 제품불량이라며 교환처리 해주겠데요... 데이터 복구불가, 액정보호필름은 다시 사야 한다고 함.... 그 때 환불받았어야 했는데... 판매자 말만 믿었다가 이렇게 됐네요....",1
1,아이패드,별점,상자 뜯었는데 기기 전원이 켜져있었고 밧데리도 90퍼센트였네요. 쓰던 제품이 온건가 해서 프리스비에 문의해보니 as센터 쪽에 문의하라고 해서 문의했더니 그쪽에선 또 본인들 책임 아니다.. 프리스비에 다시 문의하라고 하네요. 게다가 기기 휨 현상까지 있어서 불량 체크하니 에이포 용지 7장 넘게까지 들어갑니다. 교환 요청하려다가 프리스비에서 바로 교환 해주는게 아니고 as센터까지 직접 가서 요청해야한다는 얘기 듣고 그냥 쓰려구요~ 배송은 빨랐습니다.,1
2,아이패드,별점,"기쁜 마음으로 개봉했는데 액정은 아니지만 뒷면에 기스가 3군데 있었습니다. 교환이나 환불을 원했지만 애플본사측에서는 문제 없는 제품으로 본다며 안된다고 하셨네요...규정을 보면 이런 문제로 개봉하면 교환/환불은 불가라고 써 있어서 그냥 사용은 하지만..(우리나라에서만 인정하는...애플은 인정을 안한답니다.)개봉해야지만 상태를 알수 있는데...ㅜㅜ 복불복 일 수 밖에 없는....(귀사측에 7~8건? 정도 접수 되었는데 교환/환불 해준적 없답니다....ㅎㅎ)
어쩔수 없이 저희 아이 그냥 사용을 하지만...
많이 아쉽긴 합니다.
*사진은 저희 아이한테 보내라고 했더니...요 사진만 딸랑 보내네요..",1
3,아이패드,별점,"일단 사용해 보지 않아서 성능 기능 모릅니다.4시 이전 당일배송에 12월 23일(수)도착 예정 이라는거보고 21일 오전 9시쯤 결제 했는데 ~왠걸요..4시 이전 당일 배송인데 선물 할거라 꼼꼼히 보내달라고남겼더니 너무 당당히 다음날 출고 할거라는 판매자의 답변.어이없었습니다.그래서 주소지 변경 까지 하고 출고를 기다렸죠.다음날 22일 출고가 됐고, 그때까지도 23일 수요일 도착이라는 문구를 보며 안심 했습니다.크리스마스 선물로 구매한거라 배송때문에 걱정 했거든요..출고만 했을 뿐, 움직이지 않는 택배.그 다음날 23일 택배사. 11번가. 판매자측을로전화하기를 수차례.. 결국 목요일 오후에 판매자가 했던 말은 반품수거하고 환불해줄테니 오프라인으로 구매하세요;;-.-어이가 없었습니다.시간약속 배송약속 상담원이 기본적으로 갖춰야할언행등등 .. 너무 불쾌하고 기분 나쁩니다..당연 크리스마스 선물은 물건너 갔구요.이거 때문에 주소지변경 해서 다른지역을 두번이나 왔다갔다..구매하시는 분 신중히 구매하세요배송 늦어지면 구매한 구매자만 초조해 질뿐판매자측은 상당히 여유롭습니다.",1
4,아이패드,별점,"물건은 잘왔습니다.. 그런데 택배회사가 엉망이네요.
고가의 제품이라 배송전에 연락달라고 남겨놓았음에도 불구하고 배송완료라는 연락도없고, 빌라라서 무시하는지, 우편함위에 있더라구요... 집앞도 아니고.. 누가 훔쳐가면 이건 택배사에서 보상해주나요 ?",1
5,아이패드,별점,"크리스마스 선물로 21일 오전 결제했는데
26일날 도착해서 다 망쳤고요
똑같은 택배사로 이것보다 더 늦게 주문한 물건들 전부 더 빨리왔음. 택배 핑계대지말고 발송이 늦을거면 늦는다고 미리 고지를 했으면 여기서 안시켰을거 아닙니까",1
6,아이패드,별점,패드는 아직 개봉전이나 문제없을거구문제는 배송.. 월욜 점심쯤 주문한게 목욜 점심때 왔어요..알리서 배송오는것두 아니고.. 늦게와도 되는분은 여기서 주문하시고 아니면 우체국택배로 보내주는 쇼핑몰서 구입하시길 추천합니다!!,1
7,아이패드,별점,화요일 결제하고 목요일도착이라 했는데 토요일 저녁에 도착햇네요 대단한 배송입니다 젤 느려터진 cj를 쓰는 이유가 잇나요? 다시는 안사고 싶네요 cj전화해도 불친절함에 더 열받고...펜슬이나 케이스 필름등은 예정된날에 다왓는데 유독 본체아이패드만 토요일 도착합니까 ㅅㅂ 다신 안사고 싶네요,1
8,아이패드,별점,분명히 실버옵션골랐는데 스페이스그레이 왔어요. 그냥 쓸랍니다,1
9,아이패드,별점,색상이 다른게 왔어요 그리고 판매를 내려버렸네요.,1
10,아이패드,별점,"화면에 기스나서 와서 서비스센터에서 교환
받았어요",1
11,아이패드,별점,"상품은 마음에 드는데...저번에도 그랬지만 포장을.. 너무 성의 없이 하네요
가격이 저렴한 제품도 아니고 그냥 뽁뽁이 몇번 감아서 고정도 안되게 보낸다는게 참 어이가 없습니다",1
12,아이패드,별점,"제품은 마음에 들지만 서비스는 0점 드리고 싶네요
서비스가 이마0몰과 너무 비교 되네요
아무리 전달만하는 매장이라지만 픽업갔다가 웬 잡상인취급이라니요
다른판매점은 제품설명도 해주려한다는데...",1
13,아이패드,별점,파손된 물건 옴,1
14,아이패드,별점,"디스플레이 불량받음
이제 아이패드 안사야지. 교환도 서비스센터 직접 방문해야 하고 확인도 오래걸리고 시간낭비 오졌다",1
15,아이패드,별점,긁힌 부분 있었는데 교환도 안되고 해서 일단 그냥 씁니다.,1
16,아이패드,별점,추가상품 질이 너무 안좋아요못쓰겠어요 환불해주세요,1
17,아이패드,별점,주말에다 물량 부족으로 배송 늦는 건 이해하는데 받지도 않은 애플케어 기간이 시작된지 2일 다 지나서 밤늦게 받았어요 기간 연기 요청하려다 참았은데다시는 같이 신청 안할 것 같습니다,1
18,아이패드,별점,좋아요 제품은 좋은데 여기 직원친절도나 응대점수는 낮네요,1
19,아이패드,별점,"아이패드를구매하면 필름정도는 같이주셔야되는것아닌가요..?
배송왔는데 없어서 따로주문하고있네여 왕짜증!",1
20,아이패드,별점,"1. 재고 확보가 안됨
2. 애플코리아에 판매자가 직접 주문
3. 배송지 오입력으로 우체국에서 딜레이
4. 휴대폰번호도 제대로 입력안해둠
5. 여기서 사지마세요",1
21,아이패드,별점,배송너무 늦어요어어,1
22,아이패드,별점,다좋은데 그린으로 주문했는데 그레이가 왔네요 하아,1
23,아이패드,별점,배송이느려요,1
24,아이패드,별점,"배송은 무지 빨라요~!
6월 1일에 도착해서 뜯어보는 중 모서리부분에
기스발견.. 바로 사진찍고 QnA 남겼으나 상담원이 여기서 교환안되고 근처 애플스토어나 서비스센터 가야한다고 하심. 근데 이게 초기불량이라도 상황에 따라 교환이 안되는 경우도 있다고함..
오늘 전화로 센터 예약하고 퇴근하자마자 방문했더니 운좋게도 교환해주신다고함 몇일 기다려야하지만..ㅜㅜ 교환안됐으면.. 솔직히 화날뻔했음. 규정은 잘 모르지만 원래 구매한데서 교환해줘야하는거 아닌가요..? 그리고 여기 이름만 애플공식브랜드스토어고 리셀러샵임.. 여기꺼 위X프에서 선물용으로 에어팟 샀었는데 그땐 하자없어서 다행이었지 하자있었음 선물받은사람이 나처럼 고생했을 듯. 그리고 패드 사면서 애플펜슬이랑 종이필름+펜슬팁 세트 추가구매했는데 애플펜슬은 하자없이 잘 도착했음. 근데 종이필름 펜슬팁 세트는 팁이아니라 팁커버가 왔음. 상품명은 분명 펜슬팁인데 왜 팁커버를 보내주시는지...? 이름가지고 속은거 같아서 기분이 썩 좋진않고요. 저처럼 오해하는 구매자가 더이상은 없도록 상품명은 수정해야할 필요가 있어보이네요.",2
25,아이패드,별점,아니 어트케 사자마자 가격을 내립니까 기분나쁘게,2
26,아이패드,별점,그냥 그랬어요. 조금 까진 부분 교환이 안 된다는 사실을 처음 알었네요.,2
27,아이패드,별점,끝부분 데미지 있네요..걍 귀찮으니까 쓸게요,2
28,아이패드,별점,불량이 와서 교환했지만 만족이요,2
29,아이패드,별점,"아이패드는 예쁜데 카메라 옆 부분에 조금 찍힘? 흠집이 있네요 지워지진않네요 좀 별로지만
반품하고 새로 받기 귀찮아서 그냥써요",2
30,아이패드,별점,받은첫날 자꾸 꺼져서 본사에 전화했더니 배터리불량이라고 함 결국 교환신청하고 이틀만에 다시 받았음,2
31,아이패드,별점,여기서 받은 제품 디스플레이 문제로 교환받았어요.,2
32,아이패드,별점,충격방지되도록 포장이 더 꼼꼼했으면 합니다,2
33,아이패드,별점,케이블 불량이라 ....하...신사역까지 다녀왔네요....아..물건좀 확인좀 잘해주세요...,2
34,아이패드,별점,구매한지 한달도 안됐는데 충전기어뎁터가 고장나서 못쓰게됐네요..몇십만원대인데 충전기가 벌써 고장나서 실망이네요 품질에 조금더 신경써주셔야할거같아요,2
35,아이패드,별점,배송이 너무 너무 느렸습니다.,2
36,아이패드,별점,배송너무 느림 배송너무 느림 배송너무 느림 배송너무 느림 배송너무 느림 배송너무 느림 배송너무 느림 배송너무 느림 배송너무 느림 배송너무 느림 배송너무 느림 배송너무 느림 배송너무 느림 배송너무 느림 배송너무 느림 배송너무 느림 배송너무 느림 배송너무 느림 배송너무 느림 배송너무 느림 배송너무 느림 배송너무 느림 배송너무 느림 배송너무 느림 배송너무 느림 배송너무 느림 배송너무 느림 배송너무 느림 배송너무 느림 배송너무 느림 배송너무 느림 배송너무 느림 배송너무 느림 배송너무 느림 배송너무 느림 배송너무 느림 배송너무 느림 배송너무 느림 배송너무 느림 배송너무 느림 배송너무 느림 배송너무 느림 배송너무 느림 배송너무 느림 배송너무 느림 배송너무 느림 배송너무 느림 배송너무 느림 배송너무 느림 배송너무 느림 배송너무 느림 배송너무 느림 배송너무 느림 배송너무 느림 배송너무 느림 배송너무 느림 배송너무 느림 배송너무 느림 배송너무 느림 배송너무 느림 배송너무 느림 배송너무 느림 배송너무 느림 배송너무 느림 배송너무 느림 배송너무 느림 배송너무 느림 배송너무 느림 배송너무 느림 배송너무 느림 배송너무 느림 배송너무 느림 배송너무 느림 배송너무 느림 배송너무 느림 배송너무 느림 배송너무 느림 배송너무 느림 배송너무 느림 배송너무 느림 배송너무 느림 배송너무 느림 배송너무 느림 배송너무 느림 배송너무 느림 배송너무 느림 배송너무 느림 배송너무 느림 배송너무 느림 배송너무 느림 배송너무 느림 배송너무 느림 배송너무 느림 배송너무 느림 배송너무 느림 배송너무 느림 배송너무 느림 배송너무 느림 배송너무 느림 배송너무 느림 배송너무 느림 배송너무 느림 배송너무 느림 배송너무 느림 배송너무 느림,2
37,아이패드,별점,배송이 너무 느렸어요 이건 뭐 택배회사 잘못이니 어쩔수 없고.. 추가상품은...,2
38,아이패드,별점,"배송속도는 빨라서 좋았음.
제품을 수령해서 개봉한지 2시간만에 카메라를 처음 켰고 전면카메라 불량 확인됨.
하이마트 문의하니 애플제품은 애플에 서비스 받으라고 함. 그 내용은 페이지에서도 공지하고 있다고 함. 받은 당일날 현재 거주지에 서비스 센터가 없어 옆 도시로 40분가량 이동해 서비스센터 가서 확인 결과 불량으로 최종 판정됨. 애플서비스측에서 새상품으로 교환 진행. 물론 하이마트도 물건을 떼와서 파는 중개인역할일 뿐이지만 싸게 사는데는 이런 서비스에 대한 고충을 안고가야한다는 부분을 참고하시기 바라며 사시는 분들은 꼭 불량확인 해보시기 바람.",3
39,아이패드,별점,"사고싶었던 아이패드에어4를 네이버라이브로 통해서 할인받아구매한건 매우 좋지만 받고나서 훑어보니 검정화면으로 최대밝기했을때 화면에 흰색점하나가있어서 교환받으려했는데 그냥 귀찮아서 사용하기로했어요
그외 배터리가 금방 닳아서 이점은 단점이네요ㅜㅜ",3
40,아이패드,별점,처음에 받은 제품은 오른쪽 하단 부분(5시방향)에 빛샘현상이 있어서 공식 서비스센터에서 직접 교환을 받으러 2번을 왔다갔다해서 받았습니다. 빨리 쓰려고 여기서 시킨 거였는데 예상보다 1주일 더 시간을 썼고 조금 번거로웠네요ㅠㅠ 두 번째 기기는 성공해서 다행이지만 에어4에 빛샘현상이 워낙 많이 있는 것 같아서 뽑기운이 중요한 것 같네요ㅠㅠ 로즈골드색은 예쁩니다 아그리구 같이 시킨 필름은 비닐에 한번더 감싸져 있어서 오염이 안 되었지만 필름 들어있는 포장종이에 무슨 커피 쏟은 거처럼 큰 얼룩이 있어서 좀 그랬네요ㅠ,3
41,아이패드,별점,"상품은 마음에드는데 스페이스그레이를 주문했으니 스마트픽으로 받은건 실버네요~ 하이마트 스마트픽 담당자유선으로 통화하고 픽업 가능한 매장 알려줘서 굳이 멀리 갔으나 색상 잘못전달하고, 박스를 이미 깠으니 그냥 써달라는 하이마트~~~^^",3
42,아이패드,별점,초기불량증상때매 교환했습니다. 언박싱촬영 해야되는데ㅜ 직원분이 매장에서 그 자리에서 바로 세재품 뜯고 문제없는거 확인하고 가져가야 된대서 뜯어서 가져와서 언박싱촬영 못함..ㅜ 교환한 새제품 택배로 받는사람들이 훨씬 더 많은데 무조건 투바매장 그자리에서 바로뜯고 가져가야된다는건 쫌 이상한 경우같음. 그 직원분이 잘못 아시는거같음ㅡㅡ,3
43,아이패드,별점,"한번 배터리 충전이 안되서 AS. 센터에서 원인을 찾다 찾다, 리셋해서 깔아놓은 것 다 지우고 ... 여기에 의뢰했더니 미온적이었어요. 판매도 중요하지만 판매한 상품에 대해 문제발생 시 처리에 대한 적극성도 판매의 일부라 생각되는데요. 아쉽습니다.",3
44,아이패드,별점,CJ대한통운으로 배송왔는데 요즘 대란이라 그런지 한참 인천에 빠져있다가 오더군요. 원래 11월 3일 배송예정이었어서 빠른 배송은 감사합니다. 그런데 포장 상태가 너무... 그래도 70만원 넘는 전자기기인데 뽁뽁이 두겹은 좀 너무하지 않습니까. 박스도 튼튼하지도 않고 얇은 박스데요. 포장부분에서 많이 실망했습니다.,3
45,아이패드,별점,"배송상태 충격적이에요 취급주의 스티커한장이라도 붙여보내주세요. 박스 사이드에 취급주의 써있어 안보였는지 사정없이 망가져 왔어요
본체 카메라 밑 무슨자국인지 뭔가있는데 닦아도 닦이지도 지워지지도 않아요.",3
46,아이패드,별점,택배에 취급주의 없어서 조금 놀랐는데 . 잘 포장해 주셔서 상품 겉에는 문제가 없었습니다. 펜슬도 같이 구매 했는데 ㅠ 제품이 불량이라 리퍼 받았습니다.ㅠ 그 부분이 아쉽네요ㅠ 아이패드는 좋습니다~,3
47,아이패드,별점,좋은 제품 잘 받았습니다.,3
48,아이패드,별점,"빛샘은 크게 나눠서 2군데정도 있고, 휨은 괜찮은데 찍힘이 있네요ㅠㅠ 그것도 상단 전면쪽.. 케이스 없으면 눈이가서 엄청 거슬리는데 일단은 써봅니다..휴우..",3
49,아이패드,별점,배송이 늦게 왔어요 ㅋㅋ,3
50,아이패드,별점,매장픽업시 재고 좀 온라인에 등록 잘해주세요. 주문하고 받으로 갈려고하니 펜은 재고가 없다고 하니 ㅉㅉㅉ,3
51,아이패드,별점,첨에 불량품이 와서 교환하는데 애먹었지만 지금은 잘 쓰구 있어요,3
52,아이패드,별점,처음엔 불량으로 다시 받느라 시간이좀거렷네요,3
53,아이패드,별점,참 좋네요. 제한보증날짜도 앞당겨져있고,3
54,아이패드,별점,잘 된다네요 배송은 삼일 거렸어요,3
55,아이패드,별점,우리 아들이 너무 좋아합니다,3
56,아이패드,별점,상품은 제대로 왔는데 배송이 엄청오래걸렸어요 ㅋㅋㅋ 2주넘게걸린듯,3
57,아이패드,별점,싸게 잘 샀네요,3
58,아이패드,별점,배송이 진짜.최악입니다ㅜㅜ,3
59,아이패드,별점,아이패드는 완벽한데 택배 배송이 ;; 박스가 찢어져서 왔어요 나중에는 신경좀 써주세요.,3
60,아이패드,별점,깔끔하게 배송되었네요 시원한 화면이 좋습니다,3
61,아이패드,별점,잘쓰고 있어요^^좋아요,3
62,아이패드,별점,"배송이 빨라서 좋았어요,세트로 샀는데 그부분은 후회중이네요.케이스 펜슬 필름 따로 사는게 원하는 스타일 사고 비용 절감할 것 같아요",3
63,아이패드,별점,물건이 없어 2주 정도 기다렸어요..다른 색깔 있는 줄 알았으면 진작 바꿨을 텐데..안내를 안해줘서 몰랐네요,3
64,아이패드,별점,"전 골드색상을 시켰는데 아무런 말도없이
로즈골드가 왔네요? 황당하지만
귀찮아서 그냥 씁니다.",3
65,아이패드,별점,좀 많이 느리긴 수급 여건이 그러하여 이해하기로.좋습니다~,3
66,아이패드,별점,추가 구성품은 너무 비싸게 팝니다...절대 사지 마세요~~~,3
67,아이패드,별점,보통,3
68,아이패드,별점,일단 패드는 좋은데. 케이스는 엉망입니다패드와 맞지 않아 수정했는데도 맞 않아 버렸습니다그런 케이스가 어디 있는지 ...돈이 아깝습니다,3
69,아이패드,별점,재고가 있었나봐여 예정일보다 1일 빨리 받았어요 좋아요,3
70,아이패드,별점,라아누나채프리기헤ㅠㅡㄴ,3
71,아이패드,별점,2일 걸렸고 빠르게 배송해주셔서 감사합니다 그치만 아이패드 화면이 살짝 휘어있네요 그 점만 아니면 좋습니다,3
72,아이패드,별점,배송빠르고 좋아요 감사합니다,3
73,아이패드,별점,좋은 상품 잘받았습니다.,3
74,아이패드,별점,"배송 빠릅니다
그린색 이쁩니다",3
75,아이패드,별점,배송은 아쉬우나 싼가격에 잘샀음,3
76,아이패드,별점,무난합니당 넷플봐요,3
77,아이패드,별점,dhdjdjcjdfjfjf,3
78,아이패드,별점,상자가 살짝 찌그러진거 버이시나요? 롯데택배입니다.,3
79,아이패드,별점,그냥 빨리배송되서 구매함,3
80,아이패드,별점,좋아요 쓸만해요 적당해요 괜찮아요,3
81,아이패드,별점,할인받아 기분좋게 주문했다가 출고자체가 너무 늦어 늦게 받음. 택배사지연이 아닌 업체출고지연.,3
82,아이패드,별점,아주아주 만족합니다 ~~,3
83,아이패드,별점,150원준다고해서 리뷰 남겨요,3
84,아이패드,별점,딸래미가 좋아하네요,3
85,아이패드,별점,결제 완료하고 목빠지게 패드를 기다려 일주일만에 받았는데 흠없이 상품은 좋으네요^^,3
86,아이패드,별점,청구할인 되는 줄 알고 여기서 구매했는데 아니였네요 ㅠㅠㅜ 제품은 괜찮아요,3
87,아이패드,별점,1일에 주문하고 13일에 도착했어요... ㅠㅠ,3
88,아이패드,별점,배송은 토요일주문해서 수요일에 받았구요 제품상태는 옆 테두리 모서리에 기스가 좀 있었어요 기스는 어차피 쓰다보면 나올테니 그러려니 넘깁니다 그외엔 제품은 괜찮습니다,3
89,아이패드,별점,늦게도착했으나상품 마음에들어요쿠폰으로저렴히구매하게되서 좋아요,3
90,아이패드,별점,디자인 색상이 좋아요,3
91,아이패드,별점,배송은 진짜 빨랐습니다 조금 기다렸다 프로로 주문할걸 후회스럽습니다,3
92,아이패드,별점,와이프 생일 선물로 줬는데 너무 좋아하네요 ~,3
93,아이패드,별점,두군데 정도 긁힌자국이 있네요. 케이스 씌우니 안보이고 반품 귀찮아서 걍 씁니다,3
94,아이패드,별점,잘 받아보았습니다! 감사합니다.,3
95,아이패드,별점,전화 통화는 안되고 찍힘있는 물건 받고 애플 공홈에서 사는게 훨씬 낫겠네요 돈 몇만원 싸게 사려다 스트레스만 받네요 짜증나서 그냥 씁니다 다른 구매자 한테는 하자 없는 제품 파세요,3
96,아이패드,별점,포장이 너무 허술하지만 상품은 안전하게 잘 왔어요,3
97,아이패드,별점,롯대 택배 문제로 트러블 발생,3
98,아이패드,별점,선물로 샀는데 만족합니다.,3
99,아이패드,별점,배송하자없이 잘 왔습니다,3
100,아이패드,별점,"상품 빨리오는건 좋았는데.. 택배사가
롯데 ㅡㅡ",3
101,아이패드,별점,생각보다 별로ㅠㅠ배송은 생각보다 빨리왔어요,3
102,아이패드,별점,배송은 신속했으나 상자를 아파트 엘리베이터에서 밀어 보낸듯 문에 부딪치는 소리가 났습니다. 다행히 종이 완충재로 꼼꼼히 감싸져있어 충격 흡수가 됐을 것 같습니다. 애플 펜슬을 활용하기 위해 아이패드 에어를 선택했는데 기대대로 필기 감도가 괜찮네요.,4
103,아이패드,별점,"솔직히 주문하면서도 에어4는 워낙 말도 많거 탈도 많아서 불안했는데,
뜯고 보니 충전 단자쪽에 스크래치가 있더라구요. 근데 배송도 빨리해주시고 내가 써도 이정도 안 생기겠나 싶어서 그냥 사용하려고요!
양품 검사도 이것저것 해보니 액정이나 소프트웨어등등은 문제없어서 그냥 쓰려합니다!
아직은 몇일 더 써봐야겠지만

좋은물건 저렴하게 구매했습니다 감사합니다",4
104,아이패드,별점,쿠팡처럼 빨리 온다는 리뷰 보고 주문했는데 주문 수량이 밀려서 배송일도 하루 늦어졌어요. 평일이었으면 괜찮았을텐데 주말을 끼고 받느라 정말정말정말.... 목이 빠질 뻔 했습니다. 양품으로 보내주신 덕에 받고나서는 기분 좋았습니다. 그린 색이 아주 이뻐요.,4
105,아이패드,별점,"아이패드는 말해 뭐해~! 당연히 좋구요 업으로 삼을 사람이 아니라면 프로까지 갈 필요 없이 에어로 스펙 충분합니다. 용량도 요즘은 클라우드 쓰면 64로 충분합니다.
스그 제품에 ESR 그린 스마트커버 착용해서 사용중입니다. 폴리오케이스랑 고민했는데 폴리오는 옆면은 보호해주지 않고 좀 더 무거워서 스마트커버로 골랐습니다. 케이스 탈착시에 휠 걱정을 많이들 하시는것같은데 자주 탈착할게 아니라면 스마트커버도 좋은 선택입니다.",4
106,아이패드,별점,"왜인지 모르지만 딱 한개의 이모티콘이 보이지않아요 다른 에어4기기 친구는 보이는데 카톡도 많이쓰고있어서 자주보여 아쉬웠어요
기능들은 다좋아요 그림그리려고 구매했는데 펜슬필압인식도 너무좋고 앱기능도 좋고 영화도보고 유튭도보고 책도읽으면서 잘쓰고있어요:)
아이패드없이 어찌지냈나 기억도안날정도로 잘쓰고있어요",4
107,아이패드,별점,"상품은 하자 없는 것으로 잘 왔고, 문의 남기면 바로바로 답변도 잘 주셔서 전반적으로 만족합니다.

배송이 생각했던 것 보다 조금 늦어서, 고것 때문에 별 한개 뺐어요:)
온라인으로 사도 괜찮네요~ 다음에도 조금 저렴하니 온라인 구매로 진행해도 되겠어요!",4
108,아이패드,별점,"배송 빠르고 안전하게 왔어요!
상자도 구겨진 곳 없고 깔끔합니다.
다만 아이패드 자체가 휨 문제가 많다보니 종이 테스트를 했는데, 종이가 여러 장 들어가더라구요..ㅠ
스크래치나 액정 등 다른 불량은 없고, 겉으로 봤을 때 심각하게 보이지는 않아서 일단 그냥 써보려구요.",4
109,아이패드,별점,"전자책이랑 피디에프 문서를 이동 중에도 보려고 뒤늦게 구매했는데 주문하자마자 초 스피드로 도착했습니다.
용량대비 가격이 사악하나 뭐 제가 선택을 그렇게 한 것이니 후회는 없습니다. 애플 이쁜거야 뭐 말할 필요도 없구요.",4
