16,일부 한두달만에 10%이상의 SSD 수명이 없어졌다는 사례는 대부분 특정 프로그램의 오류로 잘못 측정된 것이라고 합니다! 오늘 영상으로 안심되셨길 바라요 감사합니다🙏🏻,지금까지 제가 본 테크 유투버중에 단연 내용1등 퀄리티1등입니다. 자극적인 소재를 통해서 어그로를 끌고 시청하면 아무 내용없는 이야기하는 그런 유투브와는 비교할수없을 정도로 최고입니다 항상 감사합니다!,"호수형님 영상보고 오늘낮에 m1프로로 지른1인
순간  제목만보고 뇌절이 올뻔하였으나. 
영상이 끝남과동시에 나의 입가는 다시 미소를 머금게 되었다.","용호수님 영상 보고 영상작업이 뭔지?  그 느낌~ 그러니까 감만 잡고 있습니다.
전문적으로 영상편집을 하는 것이 아니라 취미로 간단한 것만 필요해서요 ㅎㅎ
감사합니다 ^^",설명도 좋고  마지막에 마이크 테스트 부분도 너무 좋았습니다 당신은 멋쟁이 ㅋㅋ 컴내장 스피커로 들어서 큰 변별력은 없겠지만 깨끗하고 녹음 상태 좋은거 같습니다,"오늘 M1 40분 넘는 리뷰를 처음 봤는데.. 좀 당황스러울 정도로 퀄리티나 관점이 다르네요.. 심플 이스 베스트라고.. 정보와 시선은 정확하게, 영상은 간결하게 누구와 비교하기도 애매할 정도로 신박하고 제대로 된 리뷰어를 만났네요..ㅎㅎ거참.. 구독이나 누르고 갑니다",M1 구입하려고 고민중이였는데  많은 도움이 된거 같아요! 감사합니다!!,"오늘 처음으로 영상을 시청하여 바로 구독과 좋아요, 알림 설정했습니다. 용호수님은 제 스타일에 너무 맞아 좋습니다.
너무 안심이 될 수 있게 디테일하게 설명해 주니 좋습니다. 앞으로 꾸준히 애플 제품 콘텐츠 부탁드립니다.
응원합니다^^",영상 깔끔하고 말씀도잘하셔서 멋집니다 저의 영상편집 롤모델 용호수님 항상 흥하시고탈없으시길 기원합니다,"미이크가 목소리 덕을 톡톡히 보네요!!
오늘도 감사합니다!","목소리 수음 너무 좋다 좋다하면서 봤는데
마지막에 마이크 얘기가 나왔네요
수음진짜 잘되고 목소리가 고퀄",이런 영상너무좋습니다!,오픈하는 용호수. 솔직한게 최고야! m1 너무 뽐뿌오는데여...ㅋㅋㅋㅋ see u soon guys! nice👍,강의 너무 잘듣고 있습니다. 감사합니다!,"좋은 정보, 고맙습니다. 크롬의 캐쉬 폴더를 외장하드로 변경하기 위해 노력하다가 실패 좀 했는데 그럴 필요가 없어졌군요. 
글구 마이크는 목소리는 좋은 것 같습니다. 그냥 목소리 수음은 좋은데 혹시 다른 경우는 모르니 다양햐게 테스트 해 보시죠. 👍","인트로에서 연기력이..ㅎㅎ 이번 영상도 너무 재밌고 유익했습니다. 
다만 기계린이라 삼성 ssd수명 같은 내용은 그 수치들이 실제 사용 기간에 있어서 어떤 의미인지 잘 모르겠어요..ㅠㅠ 
마이크는 너무 좋습니다. 이전 영상들과 비교하자면 마이크 없이 생목소리로 듣는 느낌처럼 자연스럽고 좋습니다.",항상 세상을 꿰뚫어보는 날카롭고 냉정한 말씀해주시는 영상 정말로 정말로 헤비하게 존경합니다 씨유순가이즈~,이야~~용호수님도 썸네일 어그로 적극 활용하시는걸 보니 프로 유튜버 다 되셨군요...ㅋㅋㅋㅋㅋㅋㅋㅋ 😅😅😅,마이크 음질이 정말 좋네요 특히 가까이서나 말할때나 멀리서 말할때나 편차가 크지 않아서 컴프레서가 내장된거 같은데 똑똑해 보입니다. 조금 아쉬운게 있다면 테이블 위에 마이크를 올려두고 사용하게 되는 형태 인데 스텐드 바닥 부분에 진동 흡수 할 수 있게 다른 재질이 좀 덧 입혀 졌더라면 몹시 좋았을것 같습니다. 15:40 15:56 16:22 16:27 쿵쿵쿵쿵,이정도면 애플에서 용호수에게 광고의뢰해야할판 ㅎㅎ M1 아이맥을 기다리고있는 1인입니다,처음부터 역시 신뢰 을 보여주셔서 ^^,씨유순 가이즈를 들어보았을때 용호수님 목소리를 잘 전달해주네요. 좋은 마이크라고 봅니다 ㅎㅎ,"2월부터 M1 맥북프로를 사용했는데 그때부터 자주쓰던게 디스코드, 로직프로, 크롬 이였는데
큰 문제는 느끼지 못했으나 로직이 좀 느려지긴 했습니다.",12:20 Today's 갓성 point ★,"슬픈 현실이라고 말씀하신 것에 많이 공감이 됩니다... 애플 말고도 여러 기업의 여러 사례에서 조금은 뻔뻔한 대처를 하는 경우도 있고, 아예 피해자를 블랙 컨슈머로 만드는 파렴치한 짓을 하기도 하죠. 그나마 애플은 소프트웨어적 사후지원을 보장해줄 것이라는 믿음이 있는 기업이라 생각합니다.","혹시 허브 꽂고, 로직보드 나가는 이슈도 설명해주실 수 있나요..?
뭐 맥북 충전기 먼저 꽂은 후에 허브를 연결하는 등의 로직보드를 지키는 그런 방법이 있다고는 하지만, 불안해서요...
영상 항상 너무 잘보고 있습니다ㅎㅎ 감사합니다!","이번엔 구독까지 하고 갑니다~~
귀에 쏙쏙들어와서 좋네요^^",m1 최저사양에서 a7s3영상 편집이 잘된다니 성능좋군요!,"소수의 악플러, 혹은 무조건 까고보는 생각없는 사람들 말 귀기울이지 않으셔도 되요 ..
조용히 영상 매번 챙겨보는 구독자로서 항상 응원합니다.",저도 용호수님 영상보고 구매해서 파컷 강의보고 잘쓰는 중입니다ㅎㅎㅎㅎ 조만간 아이폰으로도 갈아탈거같아요...ㅋㅋㅋㅋㅋㅋ,"M1 맥북을 사진 않았지만,
이슈대응에 이런 퀄의 영상을 준비하셨다니
고생하셨어요!

마이크 음질 좋아여!
주관적이지만 보통 마이크보다 좀 사실적으로 들리는 것 같아요.
중간 중간 시계 찰랑찰랑 소리도 들리구요.
성능 좋은 비싼 초지향성 마이크인가요?

그리고 책상을 살짝쿵 칠 때마다 퉁퉁 하는게 엄청 예민하네요.
진동에 약하니까 마이크 밑에 뭘 깔아야할 것 같습니다!",저도 일러스트 쪽에 종사하는 사람으로서 최근  m1 맥미니 512기가 /16기가 램으로 구입해서 쓴지 2개월  쯤 되었고 매일 영상 켜놓고 일러스트 작업에 사용했는데 ssd수명 검사 해보니 1퍼센트도 안줄었더라구요. 말씀대로 뭐 별 신경 안써도 될 것 같습니다.,"예티x(아 언급하면 안되나요?) 두말할 필요 없이 짱짱이죠 ㅎㅎㅎ
다만 책상 때릴때 소리가 잘 들어가서 ㅠㅜ",m1노트북 중에 영상편집용으로 에어도 프로와 크게 다르지 않다고 하던데 어떤 걸 추천하세요?,마이크 아주 깔끔하고 좋네요 ㅎㅎ 듣는내내 불편감이 없었습니다.,화나셨던 영상을 보면 누가 감히 혼을..ㄷㄷ,음질은 너무나도 듣기 좋네요! 보다가 궁금한게 생겼는데 저런경우에 맥북에 음성을 녹음하면서 동시에 화면녹화처럼 카메라를 설치하고 쓰는건가요?? 아니면 음성만 따로 녹음하고 영상은 메모리카드에서 뽑아쓰는건가요? 어떤 방식으로 동시녹음을 하는지가 궁금해졌습니다-,"소리 문제 없이 잘 들립니다 ㅎ
책상에 손이 올라갈때 진동음만 살짝식 수음되구요 ㅎ",난... 용호수가 왤케 좋지...>_<..,12:22 오늘의 하이라이트❤,"용호수님이 이런 썸네일을 만드실 줄이야! ㅋㅋㅋ
참! 오늘 용호수 몰에서 이것저것 주문할 건데요, 지난 번에 배송이 조~금 느리던데 요번엔 괘안겠죠?","M1맥이 아니라 M1 아이패드에 관해선 혹시 어떻게 생각하고 계신건지 궁금합니다 !! 저는 영상, 디자인,음악쪽으로 관심있는 사람입니다.!",믿고보는용호수!!!,"애플 pc 사용자 아닌데도 해당 이슈가 워낙 유명해서 접하고 있었는데 이 영상 통해 걱정을 덜게 되었네요.

감사드립니다^^","어멋,,,! 고막이 녹아내렸어요 💕","소스가 차분하니 좋아서 마이크 덕인지 ^^ 
영상 잘 보았습니다. 참고 할께요.",마이크도 마이크지만 당연히 목소리가 너무 좋으심....^^7,마이크 음질 정말 좋습니다!!! 마이크 무슨 제품인가요? 안 그래도 마이크 알아보고 있어서요....(직접 광고영상 만드는 제품인데 전혀 문제 안 됩니다^^),오 ㅠㅠㅠ 저 안그래도 ssd문제 찾아보고있었는데 감사합니다!,호수형 이렇게 자주 와버리면 너무 좋아서 정신 못 차릴 거 같아,오이오이 애플 믿고있었다구!,PC에서도 이런 문제 가지고 있는 어플들이 있지만 맥에서 더 :이슈가 되는건 ssd교체가 안되서 그러는거라 추가 ssd포트라도 달아줬으면 좋겠네요,갓⭐️성   👍,"정말잘보고잇고 존경하는 분인데, 아이티덕후라 문제없는거 알면서도 용호수님이 말하니까 아진짜 문제잇나하고눌러봣내요..",찰지게 들리는 목소리 ...마이크 성능 괜찮네요.^^*,좋은 영상이네요. 감사합니다 :),이번 이슈에 대한 영상 기다렸어요,"저 마이크는 언제부터 쓰신 건지는 잘 모르겠지만 마이크 음질 자체는 괜찮은 것 같아요. 영상 잘 봤습니다
.
그냥 재미로...... 아이폰 프로에 들어가있는 마이크와 지금 사용하신 마이크를 비교해보시는 건 어떨까요...?? 
.
개러지밴드로 녹음 퀄리티를 조절하면 보이스 레코딩 시에도 그게 반영된다고 하네요.",마이크 로지텍 블루 예티x 맞으신가요? 얼마전에 구입한게 이 모델이거든요. 저도 얼마전에 사서 쓰고 있는데 진짜 좋아요 ㅎ  수음좋고 모드도 여러가지라서 용도에 맞게 쓸 수 있구요. 묵직하고 재질이나 마감도 고급스럽구요. led 라이트 있어서 심미적인 부분도 있고 가격적인 면이나 접근성이나 방송용으로는 이만한게 없다 봅니다,씨순가이즈 들으려고 17분을 기다렸따!!,"ㅎㅅㅎ 안심하고 쓰겠습니다
+ 컬러솔루션 업그레이드판은 언제나오는지 궁금해요!","이슈해결 참 좋은 영상이었습니다 ㅎ
.
아이폰xr로 계속 들어본 마이크 느낌은 이전 슈어제품인가요? 그건 깨끗하고 차분한 느낌으로 괜찮다 생각했는데 이번 마이크와 비교를 하니 슈어는 조금 이질적인 느낌이 듭니다. 너무 고급진 스튜디오 느낌이랄까요? 좋다 나쁘다 비교가 아니고 이번 마이크는 사실적인 목소리입니다.
참 애매한 평가네요 ㅎ",용호수식 만우절 기념 영상 ㅋㅋㅋㅋ,이렇게 자주 영상이 올라와도 되는 겁니꽈? 아이 신나~~~~~~ ^^* 선댓글 후감상! 오늘 주제 정말 궁금한거였음. 자알했다 용태시기~,SSD수명이 줄고 늘고 하는 거는 어떻게 알 수 있나요? 결국 다 닳을 때까지 써 봐야 알 수 있는거 아닌가요? 체크할 수 있는 프로그램이 있는건지? 궁금해서요.,요즘 다시 자주 보니까 뇌절 할 거 같아요~!!,"무료로 확인하는 방법도 있습니다.
터미널에서 brew를 설치해주시고
아래와 같이 명령어를 입력하시면 

brew install smartmontools && sudo smartctl --all /dev/disk0

아래와 같은 항목에 사용률이 나옵니다. (숫자가 높을수록 수명이 다되어가는것)
Percentage Used:                    0%

저는 m1 최소사양이며 주용도는 상업영상제작 이며 사용률은 0% 입니다.",엠1을 사고 나서 드래님을 알게 되었는데 썸네일보고 깜놀해서 들어와봤네요 허허 천만다행,쿵쿵 울리는 소리가 저희집 층간 소음인가 했는데 용호수 님이 책상 만질 때마다 울리는 소리였어요.,설명 모두 완벽합니다,마이크 얘기가 많길래 왠가 했더니 물어보셨구나 ㅋㅋ 비교해보려고 다른 영상 보고왔는데 주관적으로 이건 훨씬 쫀쫀하네요 진공상태같은 스튜디오같은 느낌들고 이전영상은 뭔가 공간감이있는거같기도하고...그래서 머가 더 비싼소린지는 살면서 비교해본적이 없어서 모르겠지만요😂전 이게 더 귀에 꽃혀서 더 좋아요 ㅎㅎ,"역시 펙트를 봐야 하네요! 
어렵고 사세한 사실을 알아야 하는 이유!!
자극적인 이슈에 현혹이 되어 판단이 흐려지는 것을 경계해야겠네요!",믿음의 아이콘..,이제 사기전에ㅜ램 업글 ssd 업글만이 답이군,작업용 앱들이 맥최적화된 탈 어도비 ~ 제품들이네요,m1는 아무리봐도... 크리에이터에게 미친 노트북....세상이 변한다....형님같은 리뷰는  없었습니다.  여유돈있으면 사보고 싶당...,평소에 목소리가 좋으셔서,에어팟 기준으로 들었을때 아주 조금 먹먹한감이 있네요~ 이전 영상들보단 울림대가 줄어든(?) 느낌입니다 :) 이상 막귀가 ㅋㅋㅋ,강의 듣고 있어요 ㅋ 영상 감사합니다. 바로 맥북 프로 가요 ㅋㅋ,썸네일의 각도가 재밌어보이긴했는데 역시 !,알람 뜨자마자 들어와서 썸네일을 못봤는데 일단 영상 다 보고 썸네일 볼께요 ㅋㅋㅋ,갓호수~ ㅋㅋㅋ 잘보구 가용~~,좋은 정보 너무 감사합니다 근데 용호수님께 해명까지 요구하는 건 좀.. 웃기네 ㅋㅋ,"디자인과 학생입니다. 
더 바쁘게 살 이유를 만들어주시는 것에 대하여
감사드립니다.",무릎 스트레칭 열심히 ㅋㅋㅋㅋ,그냥.. 구독자가 영상 하나라도 도 올리는거 볼려는 의도로 해명댓글 아닐까..싶네요. 머..사람마다 다르지만 그렇기 수명생각하면서.. 사용중임 장비 수명을 쳐다보긴...할지... 일단 잘봤습니다.,"목소리가 예전 마이크보다 더 선명한 느낌이에요. 둘 다 좋은 음질이지만 느낌으로는...이번마이크=갤럭시폰카느낌, 예전마이크=아이폰폰카느낌? ㅋㅋ 개인적으로는 부드러운 느낌의 예전 마이크 목소리가 더 좋아요",저도 지난 영상을 보고 M1 맥북 프로를 구매했습니다. 2주 되가네요. 그리고 마이크는 괜찮은 것 같은데요?,음질 좋아요. 듣기 나쁘지 않습니다.,아 ㅠㅠ 속쉬원해ㅠㅠ 감사힙니다,천년 만년 쓸것도 아니고 걍 쓰고 싶은대로 쓰는거죠 ㅋㅋ 헤비하게 작업하면 더 좋은걸로 사면 되는거고!! 영상보고 더욱 더 잘쓰고 있습니다 희희힇,LR classic은 rosetta 쓰는거 맞죠? ㅠㅠ,영상 잘뵜습니다 감사합니다 음질 좋습니다.,마이크가 그냥 디피인줄알았는데 영상 다보니 마지막에 광고찍고있으며 테스트용으로 쓰고 있다 말해서 놀램ㅋㅋㅋㅋㅋㅋㅋㅋㅋㅋ 생각보다 음질 그 이상하는거 같아요 마이크 광고영상이 기대됩니다!!!,"질문 있습니다.
7월쯤에 맥 구매 예정입니다.
사용 목적은 로직+파이널컷+포토샵+라이트룸 이고
전부 하이 아마추어 이상 정도로 고퀄리티 사용을 하려 합니다.

파이널컷 같은 경우에는 용호수님 영상 보고 걱정이 1도 없는데
로직같은경우에도 m1 사도 괜찮을지 
아니면 m1x 기다리는게 좋을지 여쭤보려 합니다.
m1으로도 가능하다면 m1x 살 돈 줄여서
다른 플러그인에 투자하고 싶은 마음이어서요.

용호수님이 로직도 하드하게 사용하시는 것 같아서
실사용 후기 여쭤봅니다!","진짜 신경 안썼는데 싫어요 가 다른 영상보다 많은거 보고 깜짝 놀랐네요. 근데 이미 아시겠지만, 예민한 주제를 가지고 말을 하면 아무리 탄탄한 자료를 가지고 말해도 싫어요는 늘어나니 신경 많이 쓰시지 마시길 바래요. 

좋아요 눌렀어요. 진짜 안누르는데 눌렀어요 앞으로도 눌러드릴께요.

+ 마이크 음질 정말 좋아요","제 M1 맥북 프로 16gb 모델 에서는 부팅직후 아무것도 실행하지 않고  있어도 메모리 사용량이 9gb정도 되는데 이게 저만 그런거 같진 않고, 주위에 몇몇분들도 이런거 같은데 만약 제가 8gb 램을 선택했다면 이미 램을 오버해서 사용하고 있다는 뜻인데 다른분들도 그런지 궁금합니다..",막귀지만 이전에 쓰시던 마이크 보다는 음질이 약간 모자란것 같지만 그래도 이정도면 매우 훌륭한거 같아요. 말씀 안하셨으면 몰랐을것같습니다!,왜 살이 더 빠졌나요 ? 제가 이번에는 고기 사야겠어요,그러면 이제 로제타2로 구동되는 프로그램 예를들어 이클립스같은것을 마구 써도 된다는걸까요?ㅠㅠ 이클립스 쓰려고 했는데 이슈때문에 고민하고있었는데요..ㅠㅠ,마이크가 팔꿈치를 올릴때마다 저음이 쿵쿵...? 그러네요 ㅋㅋ,저는 SSD 이슈모르고 집에 노트북이랑 컴퓨터가 느려서 동생이 고등학교 과가 영상 관련 과라 맥북이 필요해서 2020 맥북프로 사전 예약해서 사줬는데 이런 이슈가 있다는걸 최근에 알았는데 다행이네요 휴 ...,소리 조아요!,자기  게시물에   책임지는  태도   바람직   해요.^^,ssd말고 빅서나 다시 만들었으면.....,갓성 SSD,블루예티x인가요?? 음질 너무좋고 듣기좋네요 !!,,그 맥으로 디스코드 하면서 게임하는 나란 남자.,감사합니다.,수음 음질이 좋아서일수도 있지만 책상에 뭔가 닿거나 할 때 그 진동이 그대로 전달돼서 마이크에 녹음되네요 영상을 보다가 저역대 웅웅대는 소리가 들리길래 뭔가 했더니 그렇네요,마이크 괜찮은것 같아요 가격대가 얼마인지는 모르겠지만요,썸네일보고 놀랬자나요ㅠㅠ 고개숙여 사과영상이런건줄...  마이크짱조아요👍🏻 음질아주깨끗하게 들려요!,"하.. 이형 때문에 a6500 샀는데..
이번에 맥북도 사겠네...후후",마이크 좋습니다,12:00 SSD는 SamSungDisk의 줄임말이잖아요?,"어제 맥북에어 m1 기본 모델을 구매했습니다. 구매해서 별다른것 하지 않고 업데이트 하고 유투브 보다가 해당 이슈를 접했고 호기심에 확인 해보니...
TBW 가 377gb 더라구요..

애플뮤직이랑 유투브랑 웹서핑에 11.4 업데이트 했을뿐인데요...

이후 사용하면서 계속 체크하니 수치는 
변함이 없네요..

정상일까요?",이미 처음 이슈 나왔을때 테스트 해보고 깨달았죠...쓸데없는 걱정이었구나 ㅋㅋㅋㅋㅋ,형땜에 저번주 맥북 바로 질렀으ㅠㅜ  내지갑책임져~~~~~,혹시 m1 맥북 사용자 분들 중 xcode 다운로드가 안되는 부분에 대해서 아시는 분 있으신가요..?,전 딱 2달 썼는데 5퍼가 줄었네요 ;; 디스코드를 항상 사용해서 그런거겠죠 ㅠㅠ 이제라도 안줄어들면 되는거겠죠 ?,마이크 굿~👍,행님 마이크 좋은데요?,홀린듯이 누르는 좋아요,"마이크 저는 좋은데요? 녹음하실 때 주변 소음이 어느 정도인지 궁금하네요. 

개인적으론 유튜버 분들이 광고 하시것 보다 TV의 뒷광고(PPL)이 더 심하다고 생각합니다.",애초에 그게 문제였다면 출시를 하지 않았겠죠.🤔,"개인 음질 느낀점

장점 : 마이크와 입의 거리에 비해서 소리가 크게 녹음이 되는것 같습니다. 라디오 방송 마이크처럼 얼굴 앞에 마이크가 있는것 같은 느낌.
단점 : 다른 마이크보다 소리가 크게 녹음되는 만큼 말하는 사람의 목소리가 아주 조금만 커져도 소리가 울려서 저는 듣다보면 머리가 아프네요.",저는 사진쟁이인데… 혹시 루미나AI는 어떨까요?/ 루미나로 사진편집을 좀 헤비하게 하는 편이라 ㅜㅜ (할당메모리 47기가 쌓여서 앱 종료해야된다고 경고창까지 뜨더군요),턱선 모냐고...🤩,❤️❤️❤️❤️❤️❤️❤️❤️❤️,"마이크 소리 좋긴하네요. 근데 용호수님 계속 책상에 팔 올라가고 손 올리고 그럴 때마다 계속 판형이 울리는 소리도 같이 녹음이 되어서 듣는데 좀 불편하더라고요... 근데 그건 저 마이크가 너무 수음을 잘해주는 것도 있긴하지만, 저 마이크의 한계점인 것 같기도 합니다.

일단 목소리는 깔끔, 수음 좋음(다만 수음이 너무 잘 되어서 소음도 수음된다.) 이런 느낌이네요 ㅋㅋ",사랑해용,ssd 다 쓰지도 못할 사람들이 걱정 더함,그러고보니 이 채널 좋아서 구독해놨는데 1여년 지나고 이제 영상 뜨네.. 구독한거도 잊고있었음,형도 어그로좀 끌줄 아네,10:37 눈에 살기봐........,이 영상을 보고 m1을 사고싶어졌습니다,안낚였어. 어차피 형은 대충하지 않으니까.,좋아요,사랑해요,카톡 m1 최적화 돼 있나요?? 로제타2로 구동하는 것으로 봤는데,"아니 무슨 걱정이야 한 2년 쓰면 새것 사고 싶어할 거면서...
고장나서 안 쓰나...업글하려고 바꿀텐데 뭐...",그게 뭔상관이야 애플 살사람은  20프로 래도 살텐데,ㅋㅋ 쥬래곤 레이크 선댓글 후감상,스왑메모리 부분에서 블랙..?,nvme ssd수명 10년동안 매일 24시간써도 수명남아..제발 그냥써,아 근데 맹목적인 헤이터들 꿀밤때려주고싶넹,무릎스트레칭이었다는걸 영상다보고 알았네요..👀,마이크 스탠드에 쇼크마운트?가 없어서 책상칠떄마다 통통거려요,줌은 메모리 스왑 문제에 해당이 안될까요?..,그러니까 시작하자마자 싫어요를 누르라 이건가요?!?!?!,맥수식용.으로.사용가능하나요?,"요즘 휴대용 마이크 하나 사고 싶어서 그런가
어쩐지 마이크가 눈에 띄게 낯설다 했는데...

음질 좋아요

개인적인 느낌으로는
사용하시던 마이크 보다 조금 상위버전이라고도 생각할거 같아요

평소에 큰불만없는 ... 막귀이긴 합니다 ;;;",마이크 예티 스타일 같네요.... 음색은 무난한 정도로 느꼈습니다.,알라뷰~!,마이크 소리 괜찮아요^^,"책상 건들때마다 파열음이 거슬리네요 ㅠㅠ 
에어팟으로 듣고있는데 쿵쿵 거리는게 저만 거슬리는지 모르겠지만 고막을 때립니다 ~",한국어로만 검색하면 용호수님이 전해주는 정보가 나오지 않아요.. 슬프다.. 영어공부 해야지...,2010년에 맥북 한번 샀다가 이딴거 왜쓰나 했는데 요번에 에어사고 진짜 이 좋은걸 이제 샀나 싶다,음질 좋아요. 음성에 대해선 불편함? 문제점? 을 느끼지 못했습니다.,만우절이니까 싫어요가 좋아요가 아닐까요?..,마이크 모델명이 뭔가요? ㅎㅎ,M1 에어 사용중입니다. 문제 없이 잘 사용하고 있습니다. 현재까지 만족하고 있습니다.,호수형이 그렇다면 그런거다...,어그로 지렸다,"영상 잘 봤습니다.
조금 다른의견이라서 올려봅니다.
스왑 메모리 기능을 특정프로그램에서 과도하게 사용을 막는 업데이트로 SSD에 이슈를 해결했다.
이것이 약간의 말장난입니다.
M1 칩셋은 놀랍게 집약된 칩셋이고 잘만든 칩셋이나 싱글쓰레드 작업과 멀티쓰레드 작업에서 많은 차이를 보이는것은 스왑메모리가 주는 효과입니다.
스왑메모리(흔히 윈도우OS 가상메모리 또는 램디스크라고 칭하죠) 잘 아시겠지만 윈도우 운영체제에서도 수명이슈가 있습니다.
RAM(Random Access Memory) 랜덤 액세스 매모리라고 하죠 설명은 생략하겠습니다. 휘발성이죠
SSD(Solid state drive)라고 하고 낸드플래시 메모리의 집약체죠 비휘발성입니다.
위에 영상에서 말씀하신데로 TBW/DWPD 라는 걸로 보증기간을 주고 있습니다. 
SSD에 대해 약간 설명 드리자면 수명을 늘리고자 백그라운드에서 작업 몇가지를 합니다. 
Block Picking과 Gabage Collection이라고 하기도하고 Trim 이라고도 하죠.

이것은 과도하게 특정 셀에 썼다 지웠다를 반복하는걸 막기위해서 기능을 수행하죠.
플래시메모리는 하드 디스크처럼 바로 Overwrite될 수 없고 먼저 Erase되어야 합니다. 
따라서 블록 내의 공백인 페이지는 바로 쓰기가 가능하지만, Overwrite하기 위해서는 페이지들의 집합체인 블록을 먼저 지워야하고 드라이브가 사용될 때, 
데이터는 변하고, 변경된 데이터는 블록 내 다른 페이지나 새로운 블록에 Write되게 됩니다.
이 순간 이전 페이지는 인베일드(Invalid)로 마킹되고 전체 블록을 지움으로써 새로운 Writing이 가능하게 되고, 
이렇게 하기 위해서는 블록 내 다른 페이지들의 유효한 데이터들은 다른 블록으로 이동되어야 하는 과정을 거처야 합니다.

쉽게 말해서 스왑메모리를 과도하게 사용하면 SSD에 수명이 무조건 줄어듭니다. 순차적으로 수행해야 할 SSD에 RAM이 와서 휘젖는것이기 때문입니다.
스욉메모리는 M1맥북에 성능과 밀접환 관련이 있습니다. 그래서 기능을 없애면 성능이 줄어들죠.
멀티태스킹 작업이 많거나 SSD용량이 80%이상 찼을 경우 그현상이 뚜렷이 나타날겁니다.
작은 용량에 파일을 자주 썼다 지웠다하면 파일잔상또한 나타날겁니다.

스왑메모리 기능은 사용자가 조절할 수 있거나 사용할 공간을 지정 또는 사용안할수 있도록 하는게 맞습니다.",마이크 탐나네요 😯,혈임 걱정되었는대 다행입니다 ㅜㅜㅜㅜㅜ ㅗㅓㅇ헝 사랑합니다,어도비... 또 너야...?,"잘 언급 안하지만 공공연한 비밀을 사용자로써 하나만 말씀드릴게요.. 
M1 쓰시면 사용하시는 프로그램들 정품으로 구매&구독 하셔야 합니다.!!
돌려말한거지만 무슨말인지 아시겠죠? 특히 돈없는 학생님들",두괄식 싫으다...,용호수님 채널은 다른 채널에 비해 싫어요 수가 높네요 왜 그러죠?,앗 ㅋㅋㅋㅋㅋ 낚였어~ ㅋㅋㅋㅋ,마이크 괜찮은데요  책상 퉁퉁 하는소리가 너무 큰것 같아요,싫어요 벌써눌렀네 ㅋㅋㅋㅋㅋㅋㅋㅋㅋㅋㅋㅋ,아 놀래라 ... 아 ..,낚였다 ~~~~~~,마이크가 퉁퉁 거려요...,애플에 트럭 보내!?,갔엉,"@    
이영상을 보고 생각을 좀 바꾸시길..  애플빠로 살지 말고.   ""마포대교는 무너졌냐""   라는 말 아시죠.   다른 경우수가 수도 없이 많은 놋북 시장에서  영상 편집에 M1이 좋다고, 시장이 바꿨다고 생각하는거 자체가 객관성을 많이 잃어버린 주장이고 이런 영상이 필요하지 않는 이유입니다.  이런 영상 보고 M1 사는 사람이 없기를..  영상만 만들 사람이  M1을 쓴다.   가성비를 그렇고. 스타벅스 커피 포대용로 M1 산다면 인정.  영상용 인정.  하지만, 가격이 메모리 8기가로는...  너무 비싼 거지.   애플은 메모리 만들지도 않으면서 장난질은 몇년째 하고 있고.  정말.  이런 기업은 망해야 하는데.  정말 정당한 댓가를 요구해지.   자기들이 반도체 제조 하는 삼성인줄.. 아는가.",아   꼴보기싫어,Don't minid~!🛀,어그로 ㅎ 짱 ㅎ,낚였다,1빠다,싸퐈리,제목질이네 싫어요 꾹,,,,,,,,,,,,,,,,,,,,,,,,,,,,,,,,,,,,,,,,,,,,,,,,,,,,,,,,,,,,,,,,,,,,,,,,
