9,어머 서울리안님 싸이월드 세대이신가봐요! 전 아니에요! ㅋㅋㅋㅋㅋㅋㅋㅋㅋㅋㅋㅋㅋㅋㅋㅋㅋㅋㅋㅋㅋㅋㅋㅋㅋㅋㅋㅋ,"다른 애플리뷰어들처럼 칭찬일색이지 않아서 좋습니다.  누군가는 인색하다 이야기할 수 있겠지만, 저는 그래서 더 서울리안님 리뷰에 신뢰가 갑니다. 감사합니다",일촌평이라눀ㅋㅋㅋㅋㅋㅋ 동년배 서울리안님ㅋㅋㅋㅋㅋㅋㅋㅋㅋㅋ 깨알같이 WWDC 기다리는 중에 볼 수 있는 영상 올려주셔서 너무 감사합니다!!! 요즘 자주 영상 올려주시니까 너무 좋네요 ㅠ3ㅠ,"요즘 바빠서 오랜만에 들어왔는데 오늘 스타일이 설님에게 최적화라고 생각합니다!
영상 비유도 좋고 너무너무 좋았지만 설님에게 치이고 갑니다...ㅋㅋ","아직 M1 제품을 한번도 써보지 못했는데, 덕분에 한번에 감이 딱 오네요~!",서울리안님 영상 꾸준히 많이 봤는데 이 영상이 진짜 제일 좋고 재밌네요 ㅋㅋㅋ,2:40 결국 WWDC에서 아이패드 비포장도로에 아스팔트를 깔아주지는 않은것 같아요 ㅋㅋㅋㅋㅋㅋㅋㅋㅋㅋㅋ,ㅋㅋㅋ 아직 미혼이셔서 아이맥 일촌평 빼곤 다 공감했어요 ㅋㅋㅋ,ㅋㅋㅋㅋㅋㅋ 일촌평 너무 찰떡입니다,이런 컨텐츠 많이 만들어주세요 비유가 소름돋아요!!,"1:57 내 이어폰이 순간 이상한줄 알았는데 
5:23 다시 들어보니 서울리안님의 매력! 똑똑한 서울리안님의 중간중간 허당끼 발산~",와 일촌평 표현 오졌네요 ㅋㅋㅋ 귀에 쏙쏙 박힘 ㅋㅋㅋㅋ,"항상 영상 잘 보고있어요 ^^
싸이월드 스킨(?!) 입히고 일촌평 적어주셨으면 더 귀엽지 않았을까 감히 생각해보았습니다 ㅎㅎ","지나가던 길에 붙잡힌 정겨운 단어,
'일촌평'에서 빵 터졌네 ㅋㅋㅋㅋㅋ
Kia~ 반가운 미니홈피 세대! 나의 도토리","wwdc에서.. 신제품이 없는 
이 시점.
최고의 영상!",진짜 정리 잘해주셨다ㅎㅎ 이해가 쏙쏙가요ㅎㅎ,마지막 아이맥 일촌평 진짜 최고에요 ㅋㅋㅋㅋ 더 예뻐졌는데 실속은 이전에 쓰던 것들이랑 똑같아서 뭔가 심드렁한 느낌 ㅋㅋ,이 언니 .. 월급 울려준 아까 그 알바생 할때 터졌네ㅋㅋㅋ,"M1 아이맥을 사면 어디에 둘지가 젤 고만이에요. 보통 안전을 위해 벽에 붙이는데, 요건 뒷면을 보여주는게 제품 가치의 80%이니.",센스있는 한줄평 잘 읽고 갑니다. ^^,우와 진짜 카피 짜시는게 예술이에요!!!ㅋㅋㅋㅋㅋ,파도타기하고 가요 서울리안님~ 맥북에어와 맥북프로 일촌평 끝내주네용!! 가격대비 차이점이 확 와 닿아요!!ㅋㅋ,알맹이만 쏙쏙 골라주시는 것 같네요. 감사해요^^,"질문 있습니다. 아이패드 프로, 맥북에어, 맥 미니 등에 쓰인 M1칩은 다 같은 칩인가요???? 칩 안에 들어 있는 CPU랑 그래픽카드 성능 차이가 있는거 아닌가요?",일촌평 너무 찰떡이에요ㅋㅋㅋㅋ,ㅋㅋㅋ ㅋㅋㅋㅋ 일촌평 나올 때 마다  빵 터져요^^~ 비유가 어쩜 그렇게 찰떡인지 ......  역시 서울리안 👍👍👍,"이번 WWDC에서는 도로포장을 해준게 아니라 ""이 모든 제품을 사시면 내부 순환도로를 이용하실 수 있습니다"" 같은 느낌",ㅋㅋㅋㅋㅋㅋㅋㅋㅋㅋㅋㅋㅋㅋㅋㅋㅋㅋㅋㅋ 하이라이트는 아이맥 일촌평이었군요 ㅋㅋㅋㅋㅋㅋ 아니 쿠키에 맥프로도 ㅋㅋㅋㅋ,서울리안님 아주 쌈빡한 일촌평 잘보고가요 ㅋㅋㅋ,이거좋다 ㅋㅋㅋ 시리즈내줘요,"ㅋㅋㅋㅋㅋ 맥북 프로 ㅋㅋㅋㅋㅋ 아까 그 알바ㅋㅋㅋㅋㅋㅋ
찰떡이네","맥북에어는 최저시급을 받는 경력직 알바생,  맥북프로는 월급 올려준 아까 그 알바생 ㅋㅋㅋㅋ 센스 좋으시네요!",이번 wwdc에서 아이패드는 도로 포장을 안해줬네요ㅠㅠ  이뻐지긴 한 것 같아서 퍼블릭 베타 올라오면 올리려고요 😁,"아니 예쁜 개수작 아니었어요?! ㅋㅋㅋㅋ
실화가 되지 않게 잠시후의 WWDC! 제발~~",아까 그 알바생 너무 웃기다 ㅋㅋㅋㅋㅋ,WWDC 이후 M1 아이패드 프로: 번역과 메모 잘 되는 100만원짜리 판때기,"승자는 맥미니랑 맥북에어!!
각자 용도에 알맞게 구매들 하세요^^",일촌평 너무 찰떡이라 바로구독눌러버렸다…,세상에나... 역시 안주무시네요 ㅌㅋㅋㅋ WWDC 기다리면서 총출동 일촌평 ㅋㅋㅋ,m1 아이패드는 전버전도 arm방식이라 속도면에서는 크게 차이가 없습니다 ㅎㅎ,M1 아이맥으로 osx 돌려봤으면ㅋㅋㅋ,"2:48 솔직히 저도 M1 에어 3달정도 써보니 애플에게 '가성비 갑'이라는 평가를 해주기는 처음이었더라죠
아무 CTO도 없는 기본형인데도 램이나 용량이 아직 부족하다 느낀 적도 없고,
노트북으로서의 휴대성 + 무소음 + 팬리스치고 굉장히 저발열이 너무 압도적임....
심지어 전 신학기 프로모션 기간때 교육할인으로 사서 에어팟까지 덤으로 얻은 덕에 체감가격이 더 싸졌어요 ㅋㅋㅋ","오늘 WWDC21을 통해서 우리 서울리안님이 리뷰할만한 새로운 OS나, hardware가 나오면 좋겠네요. 아직 많은 제품들이 improve할만한 공간이 많이 남긴것 같아요, ipadOS도 그렇고 아직은 조금 부족한 m1도 그렇고","어쩌다가 오게 되었는데 구독하게 되네요 ㅎㅎ 
말씀 재밌게 잘하시네요~~",넘 쏙쏙 들어오게 설명 잘해주시네요! ㅎㅎ 알차게 잘 봤습니다. 한줄요약 넘 웃겨요ㅋㅋㅋㅋㅋㅋ 다이어트 성공한 남편 아냌ㅋㅋ,"이번 영상뿐 아니라 전에도 서울리안님이 아직 아이패드 os에서 m1의 성능을 제대로 활용할 방법이 없고 로드맵도 없다는 걸 저격하셨었는데...
오늘 wwdc 후에도 여전히 없습니다 ㅋㅋ엌ㅋㅋ",일촌평 ㅋㅋㅋㅋㅋㅋ 파도타기 갑시다~,우와너무 재밌게 봤어요 서멀패드진짜 뽐뿌오네요.,저거 다 돈이 얼마야 ㅎㄷㄷㄷ,일촌평 ㅋㅋㅋㅋㅋㅋㅋㅋㅋㅋ,아주 재미있는 시간이었습니다,비유가 아주 찰떡이네용 ㅋㅋ,서울리안 일촌평에 대한 저의 평은 ' 올해의 노벨 일촌평 수상작',현관 들어오면 뮤직플레이어로 쓰는 아이맥.. 그거 저희 집에 그렇게 해놓고 씁니다. 2009년 모델,"항상 좋은 컨텐츠의 영상 올려 주셔서 감사히
잘 보고 있습니다. 영상 편집하시랴 업로드 하시랴 고생 많으셨겠습니다
저의 '좋아요'를 받아주세요!!
행복한 하루 되시고 화이팅 하세용!!
😍😍😍😍😍😍😍😍😍😍😍",아이맥 비유 ㅋㅋㅋㅋ,"하... 맥북 프로 M1 유저인데... 보면서 울었습니다 ㅠㅠ



((이거 가지고 4k 60fps 고사양 작업하는 내 인생이 참...))",어라?! 싸이월드가 돌아 온 다고요? 알아봐야겠네요. 좋은 정보 고맙습니다.,m1 정말 넘 탐나네요ㅎㅎ 맥 미니 대박 귀엽고 깜찍하다..,이정도면 요즘 드는 생각은 애플에서 아이패드를 너무 빡세게 만들어서 맥북 라인 위협 할까봐 일부로 죽이는거 같다는 생각이….,일촌평이 완전 정수일침 이네요,이야 기가막힌 정리입니다,"아이맥 궁금한 게 있습니다
닌텐도 스위치랑 플레이 스테이션 hdmi 연결 시 아이멕에서 모니터 용도로도 사용이 가능한지 궁금합니다",난 아이패드 프로 5세대로 기변하려고 했으나 오늘 새벽에 wwdc를 보고 크게 실망해서 기변을 내년으로 미루기로 마음을 고쳤다 아니 m1을 위한 앱 용량 제한 해제 대한 언급도 없고  팟컷 지원 특히 외부 모니터 지원이 이번에도 없다는 점이 나를 분노하게 했다,영상 잘 봤습니다~,역시 너무좋아용 ㅎㅎ 컨텐츠가 ㅎㅎ 일촌평이라닛!!👍😍,"외주 편집하고, WWDC 영상은 언제 올라와요? 

ㅋㅋㅋㅋㅋㅋㅋㅋㅋㅋㅋㅋㅋㅋㅋㅋ",진짜 이번 암패드는 돼지목에 진주목걸이가 맞는것 같아요...써먹을데가 진짜..,1촌평 ㅋㅋㅋㅋ 너무 웃겨요,M1이 몇개야 ㄷㄷ,일촌평 정말 잘다셨네요,역시 애플은 성능도 가격도 미쳤다! 😂,"🎵역시 서울리안
그나저나 오늘도 미모 뿜뿜 💜🥰☺️",m1 맥북에어 깡통 평 : 가성비와 가심비를 동시에 채워주는 물건. 아이폰 4S 이후로 이정도로 만족한 전자제품이 없네요,와 연세가 많으셨구나 ...싸이를  아시다니,ㅋㅋㅋㅋㅋㅋㅋㅋ 이건 일촌평이 사장님 입장이죠???ㅋㅋㅋㅋㅋㅋ,역시 서울대생,재밌는 한줄평이라고 쓰고 촌철살인이라고 읽는다 ㅋㅋ,맥북미니만 있으면 나머지는 중복이라는 말씀인듯,살 뺀 배우잨ㅋㅋㅋㅋㅋㅋㅋ,싸이월드가 돌아온다면 옛날의 흑역사들도 돌아오는건데 ㅋㅋㅋㅋ,2021 WWDC : 애플은 왜 아이패드에 16기가를 넣어줬을까? 쌍욕이 절로 나와요 ㅎㅎ,비유 찰떡 ㅋㅋㅋㅋ,일촌평 ㅋㅋㅋㅋㅋ,맥북에어와  아이맥 중 어느것이 가성비라고 할지요,아이맥7분55초 hello영상 다운받고 싶은데 어디로 가서 다운받을 수 있나요?,그래도 산다면 맥북프로를 ㅠㅠ흐윽,"싸이월드라니..
애플보다 충격적인 소식이다ㅎㄹ",프로가 쓰기엔 너무 부족한 M1들..하,맥북에어m1이랑 아이패드프로m1둘중에 고민중인데 뭐가 좋을까요?… 아이패드가 맥북을 대체할수 있을까요?,세상에 저게 다 얼마야 ㅇㅂㅇ,그대도 싸이월드 세대군요:),재밋게보고갑니다. 퍼가요~,일촌평 ㅋㅋㅋㅋㅋㅋㅋ 아아.. 옛날사람 ㅋㅋㅋㅋ,아이패드 프로 케이스 정보좀 알려주실 수 있을까요?ㅠㅠㅠㅠ 유익한 영상 잘 보고 가요!!!,지금 컴퓨터가 완젼 먹통인데 어도비 많이 쓰려면 올해말까지 기다렸다가 새 맥북 사는게 맞겠죠? ㅜㅜ,일촌평 좋다요!!! ㅋ.ㅋ,일촌평을 하라했더니.. 뼈를 때리시는 비유,10년 넘게 앱등이지만 아이패드는 1도 관심없는게 저만 그런가요?,서울리안... 당신이 옳았어...,win11: 유학갔다 왔는데 겉멋만 들고 더 깐깐해져서 돌아온 친구,OS 업데이트 돼면 아이패드 맥북 최고의 조합으로 만들놨어요. 이번 아이패드는 않살수가 없어요.,아이폰 개발이 필요해서 찾아보고 있었는데. 이거 보고 맥북에어 구매했어요,이번 영상 대박이네요 잘 만드셨어요!,"안녕하세요. 궁금한게 있어서 댓글을 남겨요^^
제가 영상작업용으로 맥북을 사려고 하는데요
1번
2020년 맥북 프로 13인치
M1 칩셋 8코어 CPU 8코어 GPU
램 16기가
SSD 1테라
 
 
2번
2020년 맥북 프로 13인치
CPU 10세대 I7
램 16기가
SSD 1테라

 
 
M1이 좋은지? 10세대 I7 좋은지 궁금합니다.
답변 부탁드려용~",재밋다 ㅎㅎ,"ㅋㅋㅋㅋㅋ서울리안좌,,, 결국 옳았다,,",일촌평 ㅎㅎㅎㅎㅎ 방명록 남겨드리고 싶네요 ㅎㅎ,컨텐츠력 최고!! 👍,아이패드 OS가 제한적인 게 아니라 아이패드용 앱들이 제한적으로 나오는 게 맞지 않을까요...,맥북 살까요 아이맥 살까요ㅠㅠㅠㅠㅠㅜㅠㅠㅠ,"그래서 뭘 사면 되죠 ? ㅋㅋㅋ
로직 위주로 쓰고싶은데
아이패드프로는 로직이 안되고 ㅠ
아이맥을 사자니 키보드 마우스 세팅을 또 해줘야되서 번거롭고 ㅠ
맥미니를 사서 모니터를 하나로 쓰면 편할까요 ?","WWDC...아무 일도 없었습니다.
아이패드 프로는 1년 동안 비포장도로 확정입니다.",아이패드 프로 3세대 : 역시 그 때 사기를 잘 했다!,"일촌평 남겨요. 
아이패드세트 3백만원 ㅈㅣ른 당신은 흑우리안!",맥북프로는 과부하 업무하는 사람한테 필요한거죠  경력직이 야근 안하고 칼퇴하는 겁니다 리뷰 잘하세요,전기차 + 미니 + 디스플레이 (프로젝터),"일촌평이라.. 추억이 잠기네욬ㅋㅋ 
전 비포장 도로 람보르기니
뽑으려다 기름값 많이 들거 같아서 겸손한 서울대생 신입사원을 뽑았는데 와.. 잘뽑은거 같아요 영상 열심히 만들던데요!?","요약하자면,
알바를 뽑았는데,경력직이어서 일을 잘해서 이뻐서 월급을 올려주고 진급을 시켜주고 보니 서울대 생이었고, 결국 결혼을 하니 다이어트까지 했군요.
역시 애플제품은 위험하군요.

전,아이유 퍼플로 갑니다. 아니,아이맥 퍼플요.",WWDC 기달리기 지루하니 영상 보라고 지금 올리신거죠??덕분에 안지루하게 기달리고 있네요 ㅎ,지금 시기에 M1맥북에어 사도 괜찮을까요?? 개인적으로 M2사고싶기는한데 디자인이 불호여서요 ㅠ,과연 프로를 살 명분을 만들 수 있을지....,"6:52 
아름다운 이땅에 금수강산에~",서울리안 당신이 옳았어.......,"서울리안님은 싸이를 안써보셧나보네
님이 정해준 이야기는 일촌평이라기보다 일촌명이라고 보는게 맞는듯",애플기기 가성비 좋다고 생각해 왔는데 주변기기 합한 소리 들으니까... 세대 올라갈 수록 전 세대 호환 제한하는 몇가지 주변기기 떄문에 제대로 그 성능을 최대한 발휘 한다 라는 조건을 만들려면 가성비 부분은 그냥 목구멍으로 쏙 들어가는 군요...,이 영상만보면 맥북에어를 사야겠다는 생각이드네요 ㅎㅎ,"아직까진 애플이 맥북, 아이패드 둘다 팔고 싶은가봐요...흑
M1달아놓고 성능 뽑을게 없다니",서울리안님 의자 뭐 쓰시는지 궁금해요 알려주세요~,내 V50 비록 친정이 풍미박산 나고 주변에서 욕먹지만 착하고 일잘하는 배우자,서울리안님 평가는 봐야종 ㅋ필수시청,맥북프로 비유 찰진거보소 ㅋㅋㅋㅋㅋㅋㅋㅋㅋㅋㅋㅋㅋ극공감,총 얼마 정도 되나요..,캔싱턴 거치대는 사라졌네요 ㅠㅠㅠㅠㅠ 눈물이 나네요 ㅠㅠㅠㅠ,"옥구슬 굴러가는 목소리로 설명 해 주시니 이해가 쏙쏙 잘 됩니다.
WWDC 기다릴께요 ^^
서울리안님 화이팅~!",wwdc엔 관건이 없없습니다..,누나 아까 그 알바생에서 빵 터졌어요ㅎ,서민리안님 리뷰 훌륭하십니다.,ㅋㅋ 서울리안님 에너지 너무 좋으세요😆😃,귀여워요,맥북프로 일촌평에서 피식했어요 ㅋㅋㅋㅋ,않이 이게 다 얼마야!! 다 모아놓으니 례쁘네요..,맥북 프로 샀는데 에어샀어야했나요 ㅠㅠ…,"맥프로한테만 박하시네요 ... 모든 m1에 대한 이야기 아닌가요 그건 ... 
가격대비 성능으로  아이맥이 오히려 더 비싼 느낌인데 .. .아무리 사견이지만 .. 나도 사견하나 내면 ...",와 애플 매장이네여 ㄷㄷ,아이패드는 포트 하나인것만으로도 십만년동안 까일거같은데.,아이패드는 포트 하나인것만으로도 십만년동안 까일거같은데.,아이패드는 포트 하나인것만으로도 십만년동안 까일거같은데.,싸이월드 일촌평 ㅋㅋㅋ  람보르기니 사서 도로 좋아질 줄 알았는데  아니네요 ㅋ 그러므로 아이패드는 아이패드다 ㅎ,이번영상 일촌평 : 가볍지만 촌철살인 백종원 아가씨,6초전은 못참지,알고리즘 따라 파도타기 하다가요~,비유 진짜 귀엽,그럼 다 똑같으니까 하나만 저한테 팔아줘요 흑흑,M1맥북 경력직은 맞는데 다른사람들 이랑 협동할 생각은 안하고 독고다이로만 일하려고 안하는 알바생,"중2 남학생입니다
집에 삼성 노트북 2017형 always5인가(cpu i3) 있는데
부팅 시간이 5분 넘게 걸리고 그래서 그거 초기화 시키고 맥을 하나 사려고 하는데
저중 어느 것을 사면 좋을까요..?
방송부원이라 영상 편집도 해야합니다",서울리안님 람보는 우르스가 있어서 비포장 도로도 날라다녀요 ㅎㅎ,1촌평:비유의 마술사?,2:43 도로포장공서는 없었더고 합니다,와. 다얼마... 인지 오아ㅜ,"저도 싸이월드 세대이긴 한데, 뭔지 모르고 지나갔다는..ㅋㅋㅋ
도토리 아직 5개 남아 있는 듯.....

그나저나 반도체 수급 문제로 반도체를 사재기하지만 않았어도지금즘
서울리안님이 추천하신 3D프린터 어드벤처3랑 아이맥 M1 샀을 텐데...어흐흑...자영업자의 설움....
사실 반도체를 이렇게 많이 살 이유가 없었는데, 대리점에 발주한건 대부분 취소.
내년에 갑자기 양산물량 터지면 부품 없어서 또 난리겠죠. 흐흑....암튼...
대부분의 신설중인 FAB들이 2023년에나 가동에 들어갈 거기 때문에 23년 하반기에나 공급이 안정화될텐데...
암튼암튼..
맥북에어2018과 맥미니 2018, 아이패드프로4세대+펜슬2세대 보유중인데....
사실 아이폰용 앱 개발할려고 이렇게 갖춘 건데... C언어로만 개발하다보니....(원래 주업. 것두C++이 아니라 그냥 C....)...
가끔 스터디하려고 Xcode로 테스트 코드 돌려보는 정도입니다.
요즘 포인터랑 유니온등 좀더 고급기술을 활용해야겠다 싶어서 공부중이기도 하네요. xcode나 웹의 Repl.it을 이용하죠.
전혀 활용을 못해서 중고로 팔아야 하나...싶은데...M1때문에 중고가도 제대로 안 나올 것 같네요.
그래서 배터리 충방전만 잘해주고 있는 실정이에요. 20%~ 80% 왔다갔다 하게끔....ㅋ
암튼... 지름신이 잠시 휴업중이라는....

고나고님과의 콜라보도 너무너무 재밌게 보고 있습니다.
화이팅입니다.",촌평이 정곡을 찌르네요~😆😆,"평범한 애플 유저 한줄평
아이폰 : 더 좋아질게 없는거 같다..
아이맥 : 인텔!!!!!!🤯🤯
M1 아이패드 : 응 맥북 안써!
애플워치 : 코로나로 집에만 있어서 늘 배터리 100프로
홈팟 : “시리야” 부르면 초음파 수준으로 귀가 밝음",지금 M1 맥 미니 사도 될까요?,퍼가요 ~ ♡,아이패드프로는 진짜 공감 돼지목에 진주목걸이라는 말을 실감함,도토리 나눔 부탁해용,에므원이 애플에게 심장이식했다!!!,아까 그 알바 ㅋㅋㅋㅋ,싸이월드 혹시 흑역사가 ㅎㅎㅎㅎ,2:22 누나 귀여워,아이패드는 라면그릇 받침 말고 쓸데있던가요 ㅋㅋㅋ 아무리 성능 좋게나오고 해봤자 패드는 패드 인듯.. 최종은 누어서 넷플릭스나 유튜브 보는 빌드…,지금 맥북에어 사도 될까요,자기전 서울리안은 못참지,어색한 연기 신선하네요,롤스로이스 타는데 길이 비포장 도로.,허허,소리바다 벅스 아이맵스 세대이시면서...,"나의맥에어 일촌평
채용은 했지만,일 시키기 싫은 알바생  

애지중지 사용중이랍니다.","m1 아이맥은 보면 볼수록 너무 넓은 베젤이 거슬리더라구요. 
애플로고도 빠져 있어서 더 휑해 보이는 느낌도 들고..
기존의 베젤리스 디자인 예상도와 너무 엇나가서 기대와 멀어진 이유인 듯도 싶습니다",퍼가요~♡,이거 보는데... 윈도우 광고뜨는거 무엇...,비유 적절하네요 ㅋㅋ,방명록 남기구 갑니당👌👌👌👌,당신을 돋보이게 할 페로몬 20% 함량의 존아자르 향수를 만나보세요~,네 잘보고갑니다,1:56 ㅋㅋㅋㅋㅋㅋㅋㅋ,퍼가요~~~~,"이번 영상은.....
모든걸 다가진 반 친구를 얄미워하는 소심한 애가 한마디 한다면, 인정하긴 싫지만(나도 모르게 박수치며) 인정!",일촌평 남긴다 했을때 아무런 거리낌이 없었는데... 못알아듣는사람들이 있구나 ... 나 늙응ㅇㄴ건가...,우오아아아앙,파도타고 왔어요~~~~,우와.....👍🏻,"오늘 wwdc를 보고 이걸 봤는데....
결국은 M1 아이패드 프로 들고 개발자로 일하라고 합니다.",개수작 제품인 아이맥 결국 사신건가-...,M1 칩 무슨 스마트폰 칩같아요 ㅎㅎ^^*,"서울리안님 결혼하셨어요?? 마지막 아이맥의 일촌평이 정말 대박이네요~~ :) 결혼해 본 사람의 말 같아요!! 최고!! 
나머지 일촌평도 정말 촌철살인이예요!! 👍👍",맥북에어 지르고싶다...........,파도타고 왔는데…퍼가요~,ㅋㅋㅋㅋㅋㅋㅋㅋ,"이번 WWDC에서 맹목적 앱빠들 확인사살 해줬네요
제품이 나오면 당연히 그 시점부터 평가를 해야 하는데
WWDC남았으니 아모른직다 연발하던 맹목성이란.. 
M1칩 달면 뭘하나요.
써먹을데가 있어야죠.
날개는 달아줬는데 연료는 안넣어줘요",wowㅋㅋㅋㅋ,일촌이 뭐죠,비포장 도로에서 람보르기니를 타던 아까 월급 올려준 그 알바생은 알고보니 겸손한 서울대생이었고 다이어트에 성공한 내 배우자가 되었다.,"누나,,,, 나 일촌 평이 뭔지 모르겠어,,,",6:52 는 우리땅,m1맥 전면이 못생겨서 후면만 보여주는게 트렌드,역시 사과는 위험한 과일이였음 ㄷ ㄷ,결론은 맥미니엠원👍,Wwwdc 자느라고 못봄요 라이브 말고 그냥 영상으로 봤어요,일촌평?,동감요,WWDC 망했다고 합니다...,"문방구에서 유아용 문구완구 멀티터치   공기계팝니다 
 통신기능은 탑재해드리지않으며 통신기능에대한 보증은없습니다",서울리안님은 B형 아니십니까?,근데 그런 일촌평 남기면 일촌 끊겨요.. ㅋㅋㅋ,그냥 후기를 남기면 깔끔하구 좋았을텐데 뭔가 뇌절의 향기가 솔솔 나요!,M1 맥미니는 여전히 가끔씩 분홍화면이 뜨면서 강제재부팅되네요 ㅠㅠ,중간중간 아형st 자막 맞나요??,안뇽히 계세요오오오오 ^o^)/,,,,,,,,,,,,,,,,,,,,,,,,,,,,,,,,,,,,,,,,
