,0,1,2,3,4,5,6,7,8,9,10,11,12,13,14,15,16,17,18,19,20,21,22,23,24,25,26,27,28,29,30,31,32,33,34,35,36,37,38,39,40,41,42,43,44,45,46,47,48,49,50,51,52,53,54,55,56,57,58,59,60,61,62,63,64,65,66,67,68,69,70,71,72,73,74,75,76,77,78,79,80,81,82,83,84,85,86,87,88,89,90,91,92,93,94,95,96,97,98,99,100,101,102,103,104,105,106,107,108,109,110,111,112,113,114,115,116,117,118,119,120,121,122,123,124,125,126,127,128,129,130,131,132,133,134,135,136,137,138,139,140,141,142,143,144,145,146,147,148,149,150,151,152,153,154,155,156,157,158,159,160,161,162,163,164,165,166,167,168,169,170,171,172,173,174,175,176,177,178,179,180,181,182,183,184,185,186,187,188,189,190,191,192,193,194,195,196,197,198,199,200,201,202,203,204,205,206,207,208,209,210,211,212,213,214,215,216,217,218,219,220,221,222,223,224,225,226,227,228,229,230,231,232,233,234,235,236,237,238,239,240,241,242,243,244,245,246,247,248,249,250,251,252,253,254,255,256,257,258,259
0,"끝없는 M1 맥북 논란과 이슈,
이번에는 화면만 열어도 깨지는
디스플레이가 도마 위에 올랐습니다.",2020 맥북 프로 13인치가 저렇게 된 적 있는데 이건 m1만의 문제가 아니라 맥북 QC의 문제인 것 같습니다... 결국은 뽑기..,개인적으로 애플은 내구성에 대해 조금더 발전된 모습이 필요해 보이는거 같음. 아무리 소프트웨어 지원이 길어도  하드웨어가 제기능을 못하면..,"고압적인 A/S 정책, 강제적인 업그레이드 정책, 제한된 자유도.... 이 3가지때문에 전 애플로 못가겠어요",이 영상을 M1맥북으로 보는 심정이 참.. ㅜㅜ,두목님이랑 같이가면 AS ㅆㄱㄴ,"애플: 영어 할 줄 아세요?
고객: Yes, I can.
애플: 유감이네요. 영미권 국가들도 다 유상수리 받았는데.
고객: WTF",뽑기 확률이 유난히 극악인 제품인거 같긴 한데 제 아는 형님은 1년이 되가도록 아무 문제 없이 쓰고 계시답니다. 에어인데 너무 가볍고 성능이 좋아서 만족한대요,"모든건 호갱님 잘못입니다 
ㅋㅋ수리비는 유료입니다 
ㅋㅋㅋ",그래도 영국이나 호주 분은 영어할줄 알아서 서비스 센터 갔네… 우리나라는 입구컷인데 ㅠㅠ,"확률적으로는 맥북의 불량률은 낮고 기본적으로 마감이 훌륭하다 생각하면 그냥 고민없이 맥북 사는게 만족감이 높을것 같지만
만에 하나 그 불량이 내가 걸린다면 어차피 다 거기서 거기인데 그냥 가성비나 챙기자 모드로 바뀔것 같기도 하고 흠..","소프트웨어 문제랑 하드웨어 문제는 별개로 봐야하지 않나요? 새로운 하드웨어, 새로운 OS인 만큼 프로그램 호환성은 프로그램들이 챙겨줘야지 OS가 챙기는건 한계가 있죠... 과도기에 어쩔 수 없는 부분이고.",이래서 내가 맥북을 못산게 아니라 안산거야ㅎㅎ,"가운데 잡고 각도조절 해야합니다
ㅋㅋㅋㅋ 얼마전에 학교선생이 대각선으로 잡고 각도 움직이다 깨놓고 웰케 약하냐고 그래서 유상수리 하고 왔습니다 ㅋㅋㅋㅋㅋ",애플: 검사해도 연관성 없음= 고로 보상X...이럴듯,그냥 아이패드에 애플케어 조합말고는 대안이 없는듯,맥북에어는 예전과 폼팩트는 같지 않나요?,애플 제품 내구성 좋다고 그렇게 강조하면서 그냥 화면만 닫아도 맛이 간다니 ㅋㅋㅋㅋ,"삼성 애플보면
그 무협소설 같음

애플은 내공 고수
삼성은 외공 고수","삼성이 짱임 디스플레이 1자 줄 그어진거 AS 센터 갔더니 걍 무상으로 해줌 하는김에 버튼이랑 싹다 갈아줌 
AS 무상 2개월 남았을때는 거의 다 갈아 엎어줌 무상 얼마 안남으셨다고 
진짜 아이패드 빼고는 애플 제품은 탈애플 성공함",애플케어플러스의 중요성,"m1 지금도 만족하면서 참 잘 쓰고 있는데, 초반에 애케플 들어두길 잘했네요. 제품 결함이면 스테인게이트 처럼 소송가고 리콜가는거 아닌가요. 리콜되면 땡큐 ㅋㅋㅋ",맥미니는 웃고있다,요즘 영상이 하루에 몇게씩이나 올리시네요 멋지세용 👍,맥북 디스플레이 문제는 14년부터 있던거라 아마 본인들 과실 혹은 패널 업체 과실로 판명날 사건이네요 그러면 무상수리해주고 이미 유상수리 받았으면환불 가능합니다,"맥에게 바라는건 하드웨어장사 말고 맥os를 편히 설치할 수 있는 소프트웨어장사를 했으면 좋겠음. 소프트웨어가 넘사로 좋아서 하드웨어를 사는 꼴이니;
소프트웨어 딱 30만원에 팔자",저번주에 사려그랬는데 안사길 잘했다..  내년에 M2존버해야겠다 ㅋㅋ,"삼성: 애초에 소재자체가 얇아서 키보드가 잘눌리고 화면이 잘 휘어짐
애플: 그렇진않지만 불안을 안으며 써야함.

😑","이번건은 문제가 너무 심각합니다. 아마도 패널 가공문제에의해 측면 태두리 보이지 않는 미세한 기스로인해 쉽게 금이가거나 멋대로 금이 가는 경향이 있는거같습니다.
이건 1990년 초반에 겪었던 초창기 LCD모델에서도 그랬는데 지금에 와서 이런 사건이 일어났다는건 그만큼 패널제작에 신경을 못썻다는 반증...",아이패드에선 비슷한 결함이 없나요?,ㅋㅋ...애플은 감성을 파는곳이지 좋은 제품을 파는 곳이 아니다,"응, 내가 더이상 애플을 사지 않는 이유. 아이패드 프로 전원 버튼 수리비 900 호주 달러 나왔다.",리콜에 피해보상 해야 할텐데 해주긴 할까?,하 2017 논터치에서 존버하길 잘 했네. 맥뽕 유튜버들은 이 사실에 대하여 얘기조차 꺼내지 않을 듯,와;;; 애플... 이집 맛집이네 !,돈없어서 강제 존버 성공….?,오늘의 맥북은 내일의 맥북보다 젊다,뭐든지 1세대는 거르는게 답이다.,팀쿡: 마진쿡!,7개월째 주말빼고 하루 7시간 쓰는데 이상없음..뽑기 운인가요,"ㅋㅋㅋ 편하게 쓰려고 비싼돈 주고 산걸
아주 깨질까바 불안한 마음으로 모셔놓고 써야되다니",이런 일로 120달러대까지 떨어진다면 줍줍할텐데..,2020버전 산 내가 승자인가..?,우리나라는 왜 많이 없지  발생하면 벌써 유툽 이나 엄청나게 이슈였을텐데,흑우 테스트 였던거냐고... 팀쿸!!,알루미늄이 충격에 약한건 맞는데..글쎄요 저건 왠지 무리수같은…,"내가 이래서 맥북을 안사 ㅋㅋ
돈 없어서 안 사는게 아니라니까?",이 증상이 방금 나타났습니다.. 유리는 아무렇지 않은데 말이죠,M1 맥북에어 잘만됩니다 전혀 문제없어요~~,니가 고른 애플이다 악으로 깡으로 버텨라,M1맥북 프로 팔고 아이패드 프로 산 나 칭찬해…,서피스 랩탑 ㄱㄱ,이번건 해결 잘해라 ㄹㅇ;;,현기와 맥북은 이맛에 사는거지,"애플아, 다 좋은데,
QC 좀 신경 쓰자! 팀쿡아~
돈 마이 벌잖아~
알았찌? 팀쿡?",이래도 애플을 쓰는게 신기,이래서 m1맥북에어팔고 맥미니로왓는데 생각해보니 한수인가?,누누이 말하지만 앱등이가 되는 여부는 애플기기를 샀냐 안샀냐가 아님. 애플에서 기기결함을 경험했냐 안했냐임,삼성이면 개욕처먹엇을텐데 애플이면 수리해주나 안해주나 걱정함 ㅋㅋㅋㅋ,저건 설계 문제겠다... ㅠ,지금 m1프로 사면 블랙카오겠죠?,난 2017인데두 저런뎅 ㅠㅠ 열받으면 저렇게 줄생김,"애플 양심 있으면 무료 수리해주자
m2 맥북 존버 타야지 ㅎㅎ",ㅋㅋ 이래서 레이저 쓴다,내가 이래서 맥북을 안사는거임..,2018 터치바 13인치 맥북프로 떨어트린적 없는데 같은 한 증상 (외부 파손없이 화면이 핑크색으로 나타나는데 초반에는 잘 보이다 핑크색으로 보이다 왔다갔다하길래  혹시 몰라 핸드폰에 영상 저장해뒀습니다) 나타나 최근에 애플에 방문했는데 원인은 모르겠다고 화면 교체비용으로 70만원 청구하였습니다. 애플 제품만 써서 울며 겨자먹기로 고쳤는데 이제부터 애플제품 줄여가려고요.,저는 지금 아이패드에어3 빈화면때문에 지금 애플이랑 한바탕하는중!,앞으로 맥찬론자들 이 영상 보여줘야겠다.,"의문인거는 2020 인텔 맥북에어, 프로는 화면 깨지는 이슈 못본거같은데 같은 디자인과 폼팩터인 M1 맥북은 왜 그런거죠…ㅜㅜ

커뮤니티에서 M1 맥북시리즈 유리 깨진 후기는 못봤는데 화면 표시 나간 후기는 꽤있더라구요…저도 쓰는중인데 불안하기도하고 애플케어를 가입해야하나싶기도하고…ㅜㅜ 그러고보니 거진 10년동안 매년 모델들이 문제들이 많아서 제대로된게 없었네요.

애플제품들이 눈에보이는 디자인, 마감, 빌드 퀄리티는 좋은데 눈에 안보이는 품질문제는 참 많네요",영어못하면 수리하러못감ㅋㅋ,아.. 이거보고 맥북에어 깨질까봐 무서워서 어떻게 써.. ㅠㅠ,멀쩡한 삼보컴퓨터 놔두고 왜 앱등이를 고집하는지 이해가 안되는 1인,중국에서 액정 없이는 맥북 본체를 파는 이유,이건 애플이 보상해 줘야 할 것 같은데...,어제 할머니가 쓰던 m1 받았는데 설마 ㅠㅠ,애플제품이 싸진다고해도 난 영어를 못해서 as못받으니까 절대 안살거임ㅋㅋ,말투와 목소리가 뭔가 테크몽님이랑 비슷하세요!!,오마이갓,또 소비자에게 전가시킬건가,저 비싼 맥북을 디자인 예쁘다고 부모님 주머니 탈탈 털어서  구입해 놓고는 맥OS 사용법 몰라 윈도우 깔아서 쓰는 흑우들 보면 도대체 뭐하는 인간인지 궁금함,화면이 경량하며서  생기는 현상임   갤럭시 북s 시용하면서  난 언제 깨질까  이렇고있음,맥북프로는 300만원 넘는데 이런 이슈 있음 사기 꺼려질듯,이거 저번에 arm윈도우10 라즈베리파이에 깔았을때 저런일 생기던데.. 근데 그건 금방 돌아오던데 ?,진짜 ㅋㅋㅋㅋㅋㅋㅋㅋ 품질 실화냐,모든 기계는 새롭게 바뀌면 1세대는 걸러야되는거 국룰,저거는 내가 6년 전에 90주고 산 삼성노트북에 일어난 일인데,아 마루타 고맙고 2세대 갈끄니까,애플이 잘못 만든것 때문에 보험을 든다 아 이해 안가는군요,제발......... ㅜㅜ 지금도 애지중지 하는데 아주 보물처럼 다뤄야하나...,이정도면 애플에서 배상을 해줘야하는 것 아닌가? 안해주면 양아치지.,그래도 애플유저들은 아랑곳하지않고 쭉 살거같은 예감,이걸 m1에어로 보고있는 내가 레전드,해가 서쪽에서 떴나요? 매가이버님이 감히 애플을?ㅋㅋㅋ애플빠가 왠일이지? M1은 호환되는 앱이나,"맥북은 잠시 넣어놔야겠네
애플13프로맥스하고 패드,워치만 사야지","앱등이들은 그래도 사니까
M1맥미니가 갑같은데","어 저거 싸게 사서 뻘짓연구소에 나왔던, 대가리리스 모드로 사용하면 가성비 핵상타치겠다 ㅋㅋㅋㅋ 모니터 사서 아이맥 하나 만들 수 있겠는걸?",2014년 맥북프로 샀다가 모니터 코팅이 슬슬 일어나길래 모니터를 건드리지 않고 보조모니터와 외부키보드로 작업함. 머 저것도 다들 겪을 일일듯. 화면 케이스의 알루미늄 두께를 줄여서 비틀림에 의해 파손? 유리도 약해보이고.,이번엔 또 어디 원가절감이냐? 매년 디자인이라도 바뀌면 실수다라고 핑계라도 들어주지 바뀌지도 않으면서 대체 왜 그러는겨?!,"맘편히 쓰려면 애플케어플러스를 들어야한다는 현실이 안타깝다
애플 배때지장사좀 적당히해라","증국산 이가 ?? 삼성 재품인가 ??

액정 유리의 파손은 결함이 존재 하기 때문에

자연 크랙으로 파손 !!!

무결점은 표면 화소 화질만이 아니라

판넬 유리 끝 부분 연마 기술이

자연 크랙을 방지 할 수 있다 !!

삼성 판넬 쓰면 ㅋㅋ 이렇게 된다",다른 나라돈을 잘 몰라서 한국돈으로 몇원인지 알려주시면 더 좋을거 같아요,???: 그래도 맥북쓰실거죠?...,하.. 사야되나..,1세대는 거르는게 맞지,"저도 동일한 증상입니다
 2017 맥북프로요",헐 나는 아직 이상없는데- ㅠ 걱정해야하는건지-?;;,영어할줄 아는사람만 서비스 받을수있다는게 함정.,맥북이 가성비였음????? 미친 ㅋㅋㅋㅋㅋㅋㅋㅋㅋㅋㅋㅋㅋㅋ,저딴 쓰레기를 돈주고 판다니ㅋㅋㅋ,영어 필수로 있어야 기능하겠네,맥미니는 안심하고 보긔,"난 안깨지는데
맥북프로 169만원",맥북은 다 좋은데 내구성이 정말 구리긴하죠. 최악입니다. 정말 최악 중에 최악,애플이 저런건 제발 무상 수리 해줬으면… 내 맥북이 지문하나 묻지 않게 해줄게 ㅠㅠㅠ 하휴,"애플제품을 살때는 하드웨어적 만듦새가 좋아서, 기계적 완성도? 소프트웨어의 부드러움? 최적화 이런걸로 구입했는데
생각해보니 문제 없었던 제품은 진짜 몇개 없음
1. 아이패드 프로 2세대 12.9인치-터치불량, 터치 안먹음 이슈 있었음. 물론 무상교체 안됨
2. 아이폰5 - 메인보드 나감 물론 무상교체 안됨
3. 맥북프로 2014 13인치 -  액정 코팅벗겨짐 이슈(무상리퍼), 메인보드 사망 물론 무상교체 안됨
4. 아이폰se-gps신호 못잡음 물론 무상교체 안됨
5. 맥북프로 2019 15인치(현재)- 액정에 가로줄무늬 생김, 블루투스 연결문제, 리퍼를 위해 방문해야하나 아마 무상 안될듯...??
-----------------------------------
이상없이 사용한것
1. 아이패드 미니 레티나 - 아주 잘 사용함
2. 아이폰 xs- 현재도 잘 사용, 배터리 용량 문제 이외에는
3. 애플워치se-잘 사용중

뭔가.....이상없이 잘 이용되는것 같긴한데.... 꼭 문제가 하나씩 나옴...
저렇게 문제가 생겨도 이 맥북 수리비 많이 나오면 부품용으로 팔고 m1 으로 갈아타야겠다는 생각이나 하고 있음...ㅠ
호구 개미지옥임....담엔 꼭 애케플 넣어야지........",맥북도 뽑기운인가😰,다음버전은 안그랬으면 좋겠다 ㅠ,무섭다..사용량이 많으니까 그만큼 불량이슈도 많긴할텐데 그게 내거가 될 수도 있으니까..,1세대는 거르는게 답 ^^,그래서 안 살거냐고ㅋㅋㅋ,아직까지 큰 문제없이 쓰고는 있는데... 화면 덮었다가 열면 키보드 지문 찍혀있는건 어쩔수가 없다,"애플이 우리나라에서만 A/S가 ㅈㄹ맞은게 아니였구나
저번주엔가? 뉴스보니까 미국에서도 애플 A/S 대해서 뭐라 한마디 했던데",애플도 결국 공산품 만드는곳이라니까.. qc에 문제가 생기는게 당연하지 이런거 보면 애플 명품취급하는 앱등이들보면 웃기다니까ㅋㅋ,아ㅋㅋ 난 영어할줄 몰라서 as못받는다고ㅋㅋ,곧 새로운 맥북 나오니까 난 그거 사면 되지 ㅋㅋㅋ 역시 1세대는 걸러야됨 아 ㅋㅋㅋ,영어학원 신청자 급증,색깔반전인줄..ㄷㄷ,"헐렝 왕크게ㅡ두번이나 떨어뜨렸는데 아직 멀쩡한데,, 애케플 안드럿는데 쥬땐곤가,,,,,,ㅇ<-<",삼성이 한건해야하는데...,중국산 LCD의 결함이지 않을까요?,또 리콜각,돈 없어서 애플 못 씀.,삼/엘이 노트북을 유달리 잘 만드는 거였구나,지희 누나도 이런 상황입니다,엥 애플이 그럴리가,그럼 맥시리즈 m1은 다이런건지,버즈 프로 외이도염급인데 ㅋㅋ,애플갬성,손으로 액정 부셔버리기!,오늘도 존버는 승리한다,??:ㅎㅎ 이때를 노렸어,그나마 애플케어플러스 하길 잘 했다..흠;;,이렇게 된다면.. m1 맥은 맥미니가 승자인게 되나유..,애플제품 망가져서 센터가면 가격 사악해서 정떨어지긴함 ㅋㅋㅋㅋ 난 이제 철들었다고 생각하고 삼성쓰기 시작함 ㅋㅋ 갤럭시도 가장 저렴한걸로다가 ㅋㅋㅋ 남은돈으로 애들 장난감이나 하나 더 사줘야지,아… 슬슬 또 영어잘해야하나,응 그래도 앱등이들은 살듯,"삼성아..쫌잘해봐..애플삽질할때 좀따라가지
왜 더 뻘짓하냐...",중국에서 대충만드니깐 그런거지,맥미니 m1산 나 칭찬해~,이때다 하고 저그마냥 바닥에서 튀어나오기 시작하는 저글링같은 삼엽충들의 등장! 이걸 맞대응 하기 위해 목숨걸고 키보드를 챙기는 앱등이! 정말 가슴 옹졸해지는 세계의 대결이 이 댓글창에서 시작된다!,팩트: 국내 맥쓰사등의 커뮤니티에선 아무 이슈 발생한 적 없음,1세대는 역시 거르는게답,왜 내꺼만 멀쩡하지?,내 친구도 그랬는 데 ㄹㅇ 이네.. 놀려야지,사과감성으로 가격도 정신나가게 잡으면서 품질이 가관이네;;,ㅋㅋㅋ 2019년형 쓰고 있는데 그나마 이게 이슈가 젤 적쥬? ㄱㅇㄷ~,한성컴퓨터 >>>>>>>>>>>>> 맥북,2019 16인치 저번달에 산 내가 승리자 ㅋㅋㅋm1충들 잘가라,"그돈임 AMD 라이젠 루시엔 5500U 터치스크린들간 DeLL 인스피론14 7415인가 929,000마논짜리 그것두무려 윈10Home기본탑재인거 사구두 남는돈잉디 둘다 램온보드납땜인거 감안해두 P눙물😭😭😭🩸",진짜 설계문제인거 확실함?,아 맥OS 시디로 팔았으면 진짜,애플제품 대만이나 중국에서 안만드나.ㅋ,잉? 막 떨꿔도 멀쩡하던디?;;ㄷㄷ 애플케어 들어놓길 잘했네 ㅎ,ㅋㅋ 죄다리콜하게생겻네. 품질 퀄리티보소,이거 어디아프나 ㅋㅋ 팔린게 몇대인데 몇개터졋다고 ㅋㅋㅋㅋㅋㅋ 그럼안터진건?ㅋㅋㅋㅋㅋㅋㅋㅋㅋㅋㅋㅋㅋ개웃기네 임마 ㅋㅋㅋ 그럼 삼성꺼살까 ?^^ ㅋㅋㅋㅋㅋㅋㅋㅋㅋㅋㅋㅋㅋㅋㅋ,휴....맥북 열지말아야지~,애플도 문제가 은근히 많아 ㅋ,이래서 내가 맥북 안쓰지ㅋㅋ,이래도 애플이 좋다고 난리이려나,"m1맥북이 지금까지 2000만대 이상 팔렸는데, 진짜 큰 이슈였으면 이렇게 조용할리가… 없겠죠. 

그리고 몇몇 유저들은 무상교체 받았다는데 그 사례는 아예 빼먹으시고 너무 악의적 편집아닌가 모르겠네요.",앜,참.. 애들 웃겨. 문제에 집중을 해. 왜 이 물건을 사거나 쓰는 사람한테 비아냥을 주는거야?? 왜 싸움을 처 못걸어서 안달인거지??!,태블릿도 휘어지는 걸로 문제더니 애플 디자인에 신경쓰는건 좋은데 그게 제품 수명이랑 품질 떨어뜨리면서 가져오는거면 반대 ㅠ 안 얇아도 되니깐 튼튼하게좀 만들어,일단 내꺼는 멀쩡,대깨애들은 그냥삼,아 m1 맥북 사려고 고민중이었는뎅... 아이패드하고 아이맥 중에서 결정해봐야겠어요,이런 파손이슈는 자기가 어떻게 관리했는지 앞뒤 다 자르고 무조건 애플 탓이라고 하는 사람들임 예를들어 노트북 전용 가방도 아니고 일반 가방에 무거운 책들과 함께 넣어서 압력에 의해 파손된 경우 절대 가만히 있는 물체가 물리적으로 파손될 수는 없음  상판에 과도한 압력을 가한다던지 웹켐 스티커 같은 악세서리를 부착해도 하판과 액정의 간격이 극히 좁기때문에 파손되는 기기임 맥북은 씽크패드같은 밀스펙 인증 기기가 절대 아님 해외같은 경우는 전자기기를 정말 말그대로 소모품처럼 험하게 사용하기 때문에 평소의 스트레스가 누적되서 생기는 경우도 있을거라고 생각함,맥가이버님 영상은 중립적이고 객관적으로 이슈를 소개해주는게 제일 좋은듯,아 ㅋㅋ 영어할줄아냐고,역시 하드웨어는 삼성이다,맥북 가운데 화면 잡고 열어야 하는데 지들이 사이드 잡고 열어서 망가진거 아님? 화면 나간거 보면 딱 보이는데,애플이 이거는 화면에 설탕 넣고 만드나. 화면이 너무 약해. 만지지도 않았는데 화면에 금가는걸 보면.,"네~ 호갱님~
기기엔 문제가 없습니다.
니잘못입니다.
영어 잘하세요?",영어 못하면 고치러 가지도 못하겠네 아ㅋㅋㅋㅋㅋ,에반데,저거 설마 삼성 lg 디스플레이임?,돈 값이 얼만데 저러냐,"고치러 가기전에 영어 단디 연습들 하고 가셈~!!!
아니면 영어 졸라 잘하는 아는 지인 데리고 가던가...ㅠ.ㅠ",저만 그런 줄 알았네요..,삼성이 이랬다면?,"저도 m1맥북을 구매해 외장 모니터에 연결하여 사용하고 있는데요 3월에 구매해 지금까지 한 7번 정도 그냥 갑자기 화면이 핑크색, 검정색으로 변하면서 자동으로 재부팅 됩니다.",역시 1세대는...,"m1 맥북프로 사용하는 유저입니다
아직 큰 문제는 없지만 요즘 맥북 완성도가 점점 떨어지는거 같아 불안하고 아쉽네요",중국에서 만들어서 그럼,"제 추측으론 디스플레이 뒤에있는 부품들이 디스플레이로 쏠리면서 깨지는거 같네요
참고 : 제 예상입니다",? 크랙 생긴거 사진 보면 누가봐도 물리적으로 힘가해서 망가진거구만 무슨 가만히 있었는데 망가졌다고 그러냐,맥북에어 M1 사용자입니다.... 너무 걱정되네요,중국산 저가형 디스플레이 쓰니깐 그렇지 마진 많이 남겨 먹을라고.. 소비자만 피해보는거,아아... 애플 정말 실망스럽게...,고갱님 영어할줄아세요? 고장이라뇨 문제 없는데요?,"극히일부사용자한테만 발생하는 문제인거같은데 그리고 영상에서 나온 사례전부 사실여부가 확인되지않은거같은데 멀쩡히 사용하고있는 사용자로서 어이가없고, 공산품이 어떻게 완벽할수있을까요? 그냥 애플이 잘나가서 비난하시는거아닌가요? 꼭 맥은 안써본사람이 욕하더라",마감만 좋으면 뭐해...,내껀 멀쩡한데.,해외는 무상 해주고 한국은 안해주겠지ㅋㅋ,"애플 초기불량 오진다고 이야기했었는데
이제야 이슈화되네요
팀쿡은 이익만 챙길께 아니라 품질 챙길때가 된것같은데 과연 어떨지..",디스플레이는 삼성이다,???:영어 할 줄 아세요?,이렇지만 애플은 더 잘팔리는 그대는 흑우,아직 m1이 막 도입하는 시기이니 인정,역시 1세대는 거른다,뭐여 나 내일 살려고 하는디,혹시 이것도 영어 못하면 안고쳐주려나?,이러면서도 잘팔리는거보면 ㄷㄷ,가격도 비싼데 기본이 안되어있네,중국산 썼나 왜 저래...?,안사요 안사 ㅋㅋ,중국산 패널쓰나,저는 아이패드가 이랬는데 그냥 파우치에서 꺼냈는데 패널이 깨져있었음 유리는 멀쩡하고,애플답지 않은게 아니라 저게 애플이고 니네글은 갱 환상에 찬 흑우들인거지 ㅇㅇ,저런대도 사면 ㄹㅇ 흑우 인증이지 ㅋㅋㅋ,삼성은 팔리지도 않아 이런 경험도 없지....어휴 불쌍한 삼성 오늘 아침 뉴스 보니까 유럽에서 1위가 샤오미라든데 이제 망할일만 남았네,"도대체 애플은 이런문제를 다 소비자가 잘못했다 했을텐데, 솔까 애플 왜씀?",중궈 디스플레이씀?,"애플 as 창렬스한데
우야노",음 꼬시다,"고객 저기여  화면이  이상해요
AS 센터  잠시만요 
고객  네
AS  센터  해당문제에. 대한 보고가 없어요 소비자 괴실입니다
고객  말도 안되요  가만히 있었는데  화면이 저러는데요
AS 센터  음 우선 고객님  영어 할줄 아세요??
고객  네???",나 영어 못하는데,벌써 M1맥북에 사기친게 들통나네,역시 노트북은 ASUS,범인은 고양이다,???:영어할 줄 아세요?,MAC북 아니죠 CRAC K 북 이죠,"""Do you speak English""",솔직히 750 호주달러가 얼만지도 모르는데 자막에라도 괄호치고 적어두든가요 이러면 시 청자들이 얼만지 어케알아요,이런걸 사는 인간들 멋짐,부분수리 안됩니다. 고객님 잘못으로인하누파손같습니더. 리퍼하셔야됩니다 에플케어 가입 안하셨어요? 아이고 화성갈꺼니까~,이게 한입베어문사과 갬성이지 엌ㅋ,앱등이=과학,이제 국산 씁시다요,,,,,,,,,,,,,,,,,,,,,
