4,"하~  저번주에 엄청 뽐뿌 왔는데~ 참고 있었는데..
이렇게 리뷰를 해주시니 또 고민되네요 😂😂
일단 14, 16인치 나올때까지.. 조.. 존버..",이번 m1맥북은 예전에 아이폰 처음나왔을 때의 충격임... 혁명 그자체,"헤헤.. 맥북 프로 m1 유저입니다… 이번을 계기로 맥북을 처음 사고 앱등이가 됐는데 항상 이런 영상 볼 때마다 제 맥북이 느린 게 아니라 다른 맥북이 더 느린 더 조금 더 빨라진 거라는 점에서 조금이나마 위안을 받고 있습니다 ㅎㅎ
항상 좋은 영상 감사합니다!",정말 이시기에 필요한 리뷰였는데!!! 호환성에 대한 더욱 심도있는 테스트 부탁드려요~ ㅎㅎ,형 M1 진짜 최고인 것 같아…,저는 그래픽 성능때문에 ㅠㅠ 프로급 라인업 나올 때 까지 존버.. ㅠ,저는 아무래도 13인치는 너무 작아서 15인치 16인치 나오면 사려고 존버 중입니다!!!,저도 M1 다음 모델 기다리고 있는데 M1 뽐뿌가 많네요~,빡센 그래픽 작업 일절 안 할 거고 가끔 프리미어로 영상 편집하고 개발용으로 m1 에어 살까 싶은데 잘 돌아갈까 모르겠네요 ㅜㅜ,감사합니다... 진짜 궁금했는데 해결되었습니다,저도 맥북으로 편집 한번 해보고싶네요..ㅠ,"쿠팡 24개월 할부 지를까 고민하다 놓치고... 다시 24개월 안올라오나 강제 존버중입니다
 이러다 M1X 살판이네요:(",m1이 파컷에서도 작업속도는 매우 좋으나 출력이나 렌더링은 그렇게 빠르진 못하더라고요 i9인텔과 비교해서요,"도움되는 영상 잘보고갑니다,",저도 너무 잘쓰고 있어요!!! 프리미어도 아주 원활하게 잘 돌아가더라구요!,M1 에어 사용중입니다. 고민하지 않고 구매해서 파이널컷 사용하는데 정말 좋습니다. 이전에는 에어로는 파이널컷 꿈도 못꿀 수준이었는데... 이제는 에어로도 프리미어도 돌릴 수 있게 되다니... 그렇다보니 요즘 드는 생각이 곧 나올 맥북프로는 얼마나 좋아질까라는 기대감이 오면서 기기변경 뽐뿌까지 옵니다.,비됴님 피부가 점점 좋아지시네요,"선생님,, 저는 에어m1으로 영상 작업 중인데, 
언제부턴가 프리미어에서 블러, 와이프 등 대부분의 이펙트가 안 먹힙니다. 
이펙트를 적용하는 순간 프로그램 패널의 영상부분이 까맣게 기본화면으로 변하고 
해당 부분의 오류로 인해 렌더링도 안 된다고 합니다. 
프리미어프로 삭제 후 재설치해도 해결되지 않고요... 대체 원인이 뭘까요?
(소프트웨어 업데이트도 최신입니다)",모션그래픽+시포디 용도로 맥북 뭐가 좋을까요? 추천부탁 드립니다!,"하줜님! 체감상 느끼시기에,
M1칩 성능이 
데탑 i7, 32g램 정도 되는것 같나요?
편집용으로 사고싶은데 고민입니다ㅠㅠ","이게 있어야
스타벅스에서 작업할수 있다구욧   ",이거 혹시 데스크탑은 IBM 인데 영상편집시 왔다갔다 호환은 잘될까요?,모션브로도 잘 적용 될까요?,플러그인들이 네이티브 지원을 하게 되면 더 빠릿하게 되겠죠? 지원을 해 준다면이지만..,저는 m1 맥북에어로 4k도 프록시 안쓰고 편집하고있네요 ㅎㅎ; 근데 렌더링은 정말 느려요 ..,"제가 영상 편집 공부하려고 맥북이 필요한 시점인데 ㅠ (곧 졸업 후 편집 학원을 다닙니다..!) 이걸로 프리미어, 에펙, 시네마4D 돌릴 수 있을까요? 지금 노트북 사양이 너무 안 좋아서 ㅠㅜ 얼른 노트북 바꿀까 하는데, 맥북이 비싸서 고민됐거든요....ㅜㅜㅠ",다음 영상은 에펙에서의 호환성이 어떤지도 올려주실수 있으신가요,어도비 포토샵도 잘 다운되고 실행되나욤~,시포디도 수월할까요..,M1이라도 프리미어 모션그래픽 화려한건 렌더링 지옥을 경험하게 됩니다. 아 그래도 기존에 i3 7세대에서 렌더링하다 뒤질랜드 갔다오던 시절에 비하면 지금은 극락을 맛보고 있네요~,영상편집은 진짜 맥북만한게 없는듯,이정도면 다음 세대 맥북이 많이 기대되네여,이 영상보고 m1프로 사고 프리미어 돌리는데 계속 끊겨서 화가나요!!!!,요즘 풍경 사진 등을 이용해서 영상 10분 정도 만들려고 하는데 첫 노트북 맥북으로 하려고 하는데 영상에서와 같이 120만원대 사도 괜찮겠져??!! ㅠㅠ,24 아이맥도 부탁드려요!!!!!!,"저 처럼 맥북에어m1으로 이거 보고 계시는분? 손
혹시 구입 예정이신분 참고 하세요 램이나 SSD추가하실분들은
저 처럼 8기가 512하지 마시고 ㅜㅜ
램 16기가 꼭하세요 아무리 생각해봐도 나중을 생각하면 그게 맞음!!
SSD는 외장으로 커버 가능한데 램은 답없음..........
아직은 램8기가 딱히 불편한건 없지만 나중에 생길거 같음","프리미어 프로도 사용할 것 같은데, 깡통으로 사도 문제 없겠죠???",네형님 사겠습니다!!!!,여어 진짜 이거 궁금했는데,이게 ㄹㅇ 고인물 리뷰인데 조회수가 아쉽;,"이제 한달이 되가는군
어떤가요?
지금 맥북이랑 윈도우 노트북이랑 고민중입니다",안녕하세용,골수삼엽충인데 M!맥북겁나뽐뿌옴..ㅠㅠ 네이티브지원되면얼마나빨라질까,"프리미어프로 컷편집은 맥북으로 하고, 자막효과는 조립컴퓨터로 하려고 하는데, 외장하드 사용해서 노트북이랑 컴퓨터에서 같이 편집이 가능할까요? 혹시 아시는분 계실까요?",4등!!아~하줜님 저도 맥북있어요! ..(물론 제가 박스로만든거에욥..),"돌고 돌다가 댓글 달아요 .ㅜㅜㅜ  intel HD graphics 620 unsupported video driver 
이렇게 뜨면서 fix 라는 파란색 클릭버튼이 옆에 뜹니다.
눌러서 그래픽카드 업그레이드 했는데도.. 해결이 안되는데...ㅜㅜ
방법이 없을까요??",사지마삼 복합적인 업무를 하는 사람은...유니티 겜 개발자 특히 전문직쪽 아직M1은 정확히 모든 툴들에 호환성이 준비되지 않음 그냥 웹써핑하고 동영상 애플툴로 편집하는 사람들이나 사세요 조금만 전문적인 통합적인 업무를 하는 사람은 지금 구입은 아닙니다,아이맥 m1는 어떤지 궁금합니댜!!!,혀엉 imac 24인치도 해줘어,헤으응 사구싶당..,"존버에 실패하셧군요…. 저돕니다,,,,,,,,,,,,,,또르르르",간단하게 베타 버전 프프랑 일반 프프 인코딩 테스트도 살짝 해주시면 좋을거 같은데..? 그부분이 조금 아쉽네요,맥북 m1쓰고 있습니당. 맥북은 업뎃하지 말라는 얘기가 있던데 하줜님은 없뎃 하시나요?.?,일단 돈이 있긴해야 한다구엿! ㅎ,"1등
+썸넬 머선129...ㅋㅋㅋㅋ",17:04,,,,,,,,,,,,,,,,,,,,,,,,,,,,,,,,,,,,,,,,,,,,,,,,,,,,,,,,,,,,,,,,,,,,,,,,,,,,,,,,,,,,,,,,,,,,,,,,,,,,,,,,,,,,,,,,,,,,,,,,,,,,,,,,,,,,,,,,,,,,,,,,,,,,,,,,,,,,,,,,,,,,,,,,,,,,,,,,,,,,,,,,,,,,,,,,,,,,,,,,,,,,
