,0,1,2,3,4,5,6,7,8,9,10,11,12,13,14,15,16,17,18,19,20,21,22,23,24,25,26,27,28,29,30,31,32,33,34,35,36,37,38,39,40,41,42,43,44,45,46,47,48,49,50,51,52,53,54,55,56,57,58,59,60,61,62,63,64,65,66,67,68,69,70,71,72,73,74,75,76,77,78,79,80,81,82,83,84,85,86,87,88,89,90,91,92,93,94,95,96,97,98,99,100,101,102,103,104,105,106,107,108,109,110,111,112,113,114,115,116,117,118,119,120,121,122,123,124,125,126,127,128,129,130,131,132,133,134,135,136,137,138,139,140,141,142,143,144,145,146,147,148,149,150,151,152,153,154,155,156,157,158,159,160,161,162,163,164,165,166,167,168,169,170,171,172,173,174,175,176,177,178,179,180,181,182,183,184,185,186,187,188,189,190,191,192,193,194,195,196,197,198,199,200,201,202,203,204,205,206,207,208,209,210,211,212,213,214,215,216,217,218,219,220,221,222,223,224,225,226,227,228,229,230,231,232,233,234,235,236,237,238,239,240,241,242,243,244,245,246,247,248,249,250,251,252,253,254,255,256,257,258,259
0,"진짜 보고싶은정보였는데 
잘보고갑니다♡",샤오미밴드에 대해서만 알고있었는데 샤오미워치에대해도 알게되어 기쁘네요~,0:28 하지만 스마트 와치 써보면 안쓰기 쉽지 않죠 ㅎㅎ,설명글ㅋㅋㅋㅋㄱㄲㅋㅋㅋㅋㅋㅋㅋㅋㅋㅋㅋ결국 애플워치..☆,"상세한 비교를 통한 퀄리티 높은 리뷰네요
보면서 설명 잘해주니까 좋다는 느낌이 들었어요","제가 운동갈때 핸드폰은 두고다니는 편인데 
gts2mini 같은경우 시계만차고나가서 러닝후
집에돌아왔을때 거리라던지 gos기록이라던지 추후에 어플에 저장되는건지 궁금합니다!",사야될 이유를 찾는 제품. 정말 정확한 말인 듯ㅋㅋㅋ,"어메이즈핏 gts2 mini 정말 추천..
스트랩만 잘 바꾸면 정말 가성비 최고 템입니당",미워치 라이트와 헬로우 솔라 ls05 둘중에는 뭐가 더 나은가요?,정보성인데다 깔끔해서 좋아요. 가끔 껴놓은 위트까지 좋네요. 요즘엔 앞뒤로 너무 길게.. 거의 1분가량 코메디하는게 이질감느껴지던데 곧 떡상하실듯,궁금한 3개의 워치를 비교해 주셔서 감사해요~^^,크으 잘보고 갑니다!!,구독!!,깔끔한 설명 감사합니다~어머님,시계형 녹음기 찾다가 여기까지 왔는데요.. 이 제품들 중에 녹음 기능 지원하는것이 있는지 알고싶어요🙏,이영상 하나로 뭘살지 결정되는 좋은 영상입니다,혹시 형님이라면 미밴드6 vs gts2 mini 중에 뭐 선택하실거 같으세요??,GTS2 mini 방수는 어느 정도 되나요?? 착용한 상태에서 샤워라던가 수영 가능 한가여???,사고싶네용,"영상잘봤습니다!
님 영상보고 gts2 mini 구입했는데요
사고나서 알아보니 미워치 gps가 4가지 사용하고 gts는 2개만 사용하더군요ㅜㅜ
전 매일달려서 gps때문에 샀거든요
혹시 두개 다 갖고계신입장에서 gps비교좀 해주실수 없을까요?
gts2mini 사자마자 다시 미워치 결제 직전입니다ㅠ","좋은 영상 감사합니다.  혹시 미워치 글로벌 버전을 구입하면
시계 메인화면에 제 가족사진을 올릴 수도 있나요??? 
은근 제가 가진 사진을 배경화면에 세팅할 수 있는 제품들이 많지 않더라구요....",테이블 탁구대 아닌가요?^^ㅎㅎ,영상 보고 방금전에 gts2 미니 질렀습니다 기분좋네요 ㅋㅋ,"혹시 간단한 문서 확인 도 가능 할까요?
애플워치는 문서 확인 가능 한던;;","난 어째 나이들수록 편한게 장땡이라 점점 애플에서 멀어지드라 ㅋㅋ
영상 음악 빼곤 다 장난감 수준임...",잘봣습니다!,타사 제품들은 카톡 채팅방 알림해제를 하더라도 상단바에 알림은 뜨다보니 워치에서 계속 진동이 일어나 불편했는데요. 그래서 외산제품의 한계라고 생각했는데 gts2 미니는 알림을 끈 방의 소식은 진동이나 알림이 없나요?,선택에 큰 도움이됐어요!!!,미워치 라이트 한글로 바꾸는 방법은 없나요?,잘 봤습니다. 많은 도움 됐습니다.,미워치 라이트는 그럼 스트랩 교체 못 하는 건가요?ㅜㅜ,오 리뷰가 엄청 깔끔하고 좋네요 30번째로 구독했습니다! 잘부탁드려요,아이폰 유저고 애플워치 거의 6개월째 앓이중인데 이 영상보고 어메이즈핏 살까 로 흔들렸어용.. 근데 더보기 란에 설명 결국 애플워치구매...는 뭐죠?ㅎㅎㅎㅎ 하 인생 최대의 고민🥲,gts mini 실사용중인데 모든기능(스트레스측정/수면측정등등) 다 키면 실제로 3일도 못버티네요. 하루에 30%이상 소모 되네요. 제꺼만 그런건가요?? 불량인건가 ㅠㅠ,Бротан от души✊✊✊,어메이즈핏은 샤오미랑 상관없어는 워치라네여,세개다 교통카드 기능이 있는 제품인가요?,gts2 mini로 갑니다. 영상 잘 보고가요. 감사합니다~,"내용 아주 좋습니다. 곧 떡상하실 듯. 그리고, 가성비가 아무리 좋아도 사회생활을 하게되면 애플이나 갤력시 중에 고를 수 밖에 없는 한국의 눈치보기 문화가 좀 그렇네요.",gts2 mini는 어디서나 아주 괜찮은 물건이라는 평가를 받네요. 제 미밴드4가 좀 너덜해지면 갈아타려고 하는데 이놈이 너무 멀쩡해서 원..,gts2미니 충전시 아이폰 충전 위젯에 표시되나요?,미워치 일정미리알림 안됨. 미밴드 3도 있는 기능을....... 미워치 사지마세요^^,처음 시청이지만 좋은 영상이라 엄지 누르고 갑니다,"gts mini를 알았다면 좀더고민해봤을텐데 고민한다고 샀는데 미워치 라이트가 배송중ㅎㅎ
미워치랑 미워치라이트랑 고민하다보니.. 
다활용할것같지가 않아서ㅜㅜ
올해는 일단 이거써보구 다음세대 미워치나 갤워치로 넘어가볼까해요~
시계 용도 이외는 거의 사용하지 않을듯해서 잘모르겠네용
잘봤습니다~",편집깔끔하게 잘하셨넹,잘 봤어요!! 화미 어메이즈 핏 너무 예쁘네요!,엡툰이나소셜볼수있나요?,하나내놔,잘 참고했습니다 ~~~,아닌데요 ㅋㅋㅋㅋ 더 좋은 방법도 더 있어요.,"햇빛이 있는 야외에서 시인성이 좋은 순대로 알려주실래요?
야외에서 잘보이는 워치로 살려구요......",아이폰인데 앱스토어에 샤오미 웨어 어플이 없어요 업데이트도14.4인데...,머리자르면 구독자 늘듯,갤럭시 포함 스마트워치를 차고 있으면 심박 센서 때문에 그런지는 몰라도 물리치료 마사지기 같은 느낌이 납니다.  장시간 차고 있으니 손목이 아프기 시작함. 그래서 한동안 안차고 다니니 다시 괜찮아짐. 주변 동료가 그런말 하기전까지 저만 그런 줄 알았고 왜 아픈지 생각해 보지도 않고 차고 다녔네요.,GTS2mini혹시 전화나 문자 유튜브되나요?,다 필요없고 애플워치보는 순간 다른건 안보이제 ㅎㅎㅋㅋㅋㅋㅋ 저도 구매한 흑우입니다 비싼 알람시계,훟,애플워치 좋다. 하지만 하루 이틀에 한번씩 충전하는 거면.. 짜증나고 극혐.. 그리고 미워치.. AOD 켜놓으면 4일에서 5일 간다. 그리고 진동도 약하고.. 아이폰에서 쓰면 연결이 끊어지고 나면 다시 자동으로 연결이 안된다. 비싸기만 하고 활용도가 좀 떨어짐 그나마 디자인은 셋 중에서 가장 좋음. 어메이즈핏 GTS2 미니가 가장 합리적인 선택.,"어머 아줌마인줄알고 들어왔는데 남자네
어머",여잔가요? 남잔가요?,,,,,,,,,,,,,,,,,,,,,,,,,,,,,,,,,,,,,,,,,,,,,,,,,,,,,,,,,,,,,,,,,,,,,,,,,,,,,,,,,,,,,,,,,,,,,,,,,,,,,,,,,,,,,,,,,,,,,,,,,,,,,,,,,,,,,,,,,,,,,,,,,,,,,,,,,,,,,,,,,,,,,,,,,,,,,,,,,,,,,,,,,,,,,,,,,,,,,,,,
