7,"쿠팡 정식 직구입 시작했네요 가격쌉니다~
🔥판매링크 입니다🔥
-미워치
https://coupa.ng/bQ0AOM
-라이트
https://coupa.ng/bQ0AZa",이쯤되면 애플워치가 얼마나 호구템인지 만천하에 드러나게 되는....,"저도 오늘 구매했어요. 런닝용으로 무게가 무거우면 힘든데, 이거 정말 가벼워서 좋아요~! 좋은제품 설명 감사합니다 ㅎㅎ","오홍! GTS2 미니가 나온지 얼마 안돼서 더 낮은 가격의 제품이 나오니 또 끌리네용ㅎㅎ
항상 좋은 영상 올려주셔서 감사합니다",감사합니당~~저도 이거영상보고 샀어여~~가성비는 가격에 비해 돈 아깝지않네요~~,와 이건 무조껀 사야되♡♡♡♡,05:59 눈 내리는 상황에서 고생하셨네요 ㅎㅎ,gtr2 mini와 비교하면 뭐가 괜찮을까요!? 둘중에 고민중입니다!,"Mini2랑 라이트랑 어떤게 더 좋은가요?  아몰레드 차이인가요?
고민되네요",영상 잘봤습니다!!  정말 뽐뿌오네요!! 혹시 궁금한 것 좀 물어봐도 될까요? 기존 미밴드 유저인데 이 미워치 라이트는 내장 스피커나 마이크가 없는거죠? 모든 알람기능들은 다 진동으로 알려주는거죠??,미워치 라이트와 헬로우 솔라 ls05 둘중에는 뭐가 더 나은가요?,요즘같은 날씨에 부상조심하세요 항상 잘 보고 있습니다~,미워치 원형도 나오지 않았나요? 그건 진짜 괜찮아보이더라구요ㅎㅎ,지금 미 워치 라이트랑 갤럭시 핏 2 중에 뭐를 사면 더 좋을가요?ㅠㅜㅠ,올해의 가성비가 될뻔했는데 아쉽네,뭔가 괜찮은데 확 끌리는 느낌이 안나네요ㅠ 요즘 워낙 다른 워치들도 잘나와서 그럴까요,버튼이 민희보다 훨 이쁘네요 아몰레드였드면 이걸로 갈텐데ㅠ,"어메이즈핏 GTS2 Mini 이제품도 샤오미껀가요!?
그리고 어느걸 더추천하시나요",워치에 블루투스 이어폰 연결되나요? 혹시 된다면 휴대폰을 끈 상태에서 워치의 음악 앱으로 노래를 들을 수 있나요??,미워치라이트 배터리 소모가 좀 빠른거 같아서 혹시 gps기능 끄는거라던가 어떻게 설정방법이 있을까요?,잘보고 갑니다~^^,오 첫댓글인가요ㅋㅋ썸넬보고 애플워친줄 알았어요,선생님 수영이랑 방수 잘 되나용??,7:29 샤오미 웨어 라이트앱 - 미밴드5도 사용가능한가요??,Gps있으면 이것만 차고 나가도 몇km뛰었는지 다 알려주나요?,저도 그거 쓰고 있는데 후레쉬를 어떡해 키는지 모르겠어요 ㅎ,"음성메모도 가능한가요?
가능하다면 최대 몇분 가능할까요?
음성메모진행 시 화면꺼짐은 유지 되나요?","샤오미 미워치 산지 3일만에 먹통됬습니다.
싼게 비지떡이라고 삿다가 3일만에 미~하고 꺼지더니 먹통되었습니다.",블루투스 연결할때 앱이 필요하다는데 어떤앱인가요,저는 걍 이런거 말고 그냥 갤럭시 워치 액티브2 질렀네요 ㅋㅋㅋㅋ 원하던걸 결국 질렀네요 🐃,처음 3초~7초 사이에 나오는 브금 제목좀 알수있을까요?,저도 이 제품 사려고 하는데 검색해보니 TFT액정이 영상과 달리 실제로 보면 별로라고 해서 망설여지네요...,손전등은 어떻게 사용하는건가요?,동그란 샤오미워치 리뷰는 없나요?,펌웨어가 뭐에요?,혹시 휴대폰과 연동했을때 휴대폰이 주변에있어야만 작동하나요?,연결이 계속 안되는데 어떻게 해야 하나요?,"샤오미 미워치 라이트에 카메라기능이있나요 
카메라같이 동그랗게 뭐가 있는거 같아서 ..",이 제품 듀얼타임 되나요? 듀얼 타임 띄우고 싶어서요...,알림이 오다가 갑자기 문자나 전화가 안 오는데 어떡하죠 ..? ㅜㅠ 그리고 원래 워치로 알림오면 진동같은게 안 울리나요 ?,혹시 녹음 기능이 있나요?,nfc기능도 있을까요,폰으로 현재위치 확인도 가능한가요? 할아버지 사드리려고 하는데 위치추적용으로는 사용가능할까요?,한글로설정가능한가요??,이거 설정에 들어가서  한글로 바꿀수 있나요?,이거 혹시 설정에 한글화는 안되나요?,배터리가 많이 아쉽네요 ㅠㅠ,혹시 분실 시 찾는 방법이 있을까요,"저 이거 디바이스 연결이 안 되는데 왜 이러는걸까요 (;´༎ຶД༎ຶ`) 
블루투스에선 뜨는 거 보면 둘다 정상작동하는것 같은데 어플에서 뜨질 않아요ㅜ",구매했습니다 고민하다가여,어플깔고 핸드폰이랑 연동하려고하는데 연동이 안되요ㅠ 설치방법 나와있는 설명 서가있는 사이트나 동영상이 있을까요?,애플워치처럼 잠금도 돼나요?,"5:58 
얘들아 좋아요/구독/알림설정 눌러드리자..
블리쟈드 추위에 아재 개고생 한다...",혹시 전화연결은 되나요??,사용 방법좀 알려주세요,한국어 설정이 가능한가요??,알림 설정하면 와치에서 진동으로 오나요? 아님 핸드폰이 울리나요?,화면 밝기는 못 올리나요..?,중국껀데 핸드폰에 연동해도 문제없나요,블루투스 통화되나요?,아이폰 사용중인데 워치에 알람이 안와요...,일정관리같은건 못하나요?,유튜브나 웹서치 가능한가여?,전화는 안돼죠?,,,,,,,,,,,,,,,,,,,,,,,,,,,,,,,,,,,,,,,,,,,,,,,,,,,,,,,,,,,,,,,,,,,,,,,,,,,,,,,,,,,,,,,,,,,,,,,,,,,,,,,,,,,,,,,,,,,,,,,,,,,,,,,,,,,,,,,,,,,,,,,,,,,,,,,,,,,,,,,,,,,,,,,,,,,,,,,,,,,,,,,,,,,,,,,,,,,,
8,저도 쿠팡에서 주문했어는데 다시 중고로 팔아버렸습니다..제가 잘 사용 안해서요 ㅋㅋㅋㅋㅋ,어떻게연결하나요?,"Cool nice video 😍😍😍 thanks for sharing
Keep connected friend",전화올때 수신자는 폰에 등록됀 이름으로 떠서 보이나요?,이거 금액대가 어캐 되나유?,한글 설정 어떻게 하나요,전화나 카톡올때 알림 같은거 소리나면서 울리나요?,이 어플 이름이 뭔가요?,카톡같은거 알림이 올때 딱 뜨나요??,전화는 못받나요?,"샤오미 절대 사지 말아요
산지 딱 3일 만에 먹통됬네요.
혹시나 하고 산는데 역시나였습니다.
3일만에 미~하고 꺼지더니 먹통이 됬어뇨",카톡되나요?,,,,,,,,,,,,,,,,,,,,,,,,,,,,,,,,,,,,,,,,,,,,,,,,,,,,,,,,,,,,,,,,,,,,,,,,,,,,,,,,,,,,,,,,,,,,,,,,,,,,,,,,,,,,,,,,,,,,,,,,,,,,,,,,,,,,,,,,,,,,,,,,,,,,,,,,,,,,,,,,,,,,,,,,,,,,,,,,,,,,,,,,,,,,,,,,,,,,,,,,,,,,,,,,,,,,,,,,,,,,,,,,,,,,,,,,,,,,,,,,,,,,,,,,
9,와 제가 it쪽 많이 보는데 다 곰세님 영상이네요 ㅋㅋ 벌써 검색으로 곰세님 영상 50개는 본것같아요 구독 누르고 갑니다 ㅎㅎ,"샀는데 이거 보고 쉽게 했어요
감사합니다! 행복하세요^^!",사용방법을 몰르고 있어서 안했는데 쉽게 알려주신 덕분에 잘 사용하고 있어요~~감사합니다,설명을 너무 잘해주셔서 감사합니다 오늘 주문 했는데 동영상 보면서 설정해야 겠어요 ^^,와 도움 많이 됬네요 알려주셔서 감사합니다 !!,쉽게 설명을 잘해주셔서 감사합니다.,"러닝 운동을 할 때 1km 단위마다 음성 안내가 나오는데, 본 음성 안내를 자연스럽게 설정하거나 혹은 차라리 음성 안내를 끄고 진동으로만 알림을 설정할 수 있는 방법이 있을까요?",설명 짱짱짱입니다,이거 살까 말까 고민중이였는데...이거 보고 사야겠네요!,"쉽게 설명 해 주셔서 감사드립니다.
블루투스는 항상 켜 두어야 하는건가요?
문자나 카톡, 전화수신시 무음으로 설정 가능한지요?(미밴드화면은 켜지면서요~!!)",이해하기 쉽게 알려주셔서 감사합니다,감사합니다↘️,큰 도움 되었습니다. 감사합니다.,"좋은정보 감사합니다
블루투스 연결했는데도 밴드와 폰 연결이 안되는데 뭐가 잘못되었나요",충전은  몇분 정도 해야하느요?,고맙습니다,너무 많은더움 됐어요 감사합니다,혹시 안드로이드 삼성 태블릿으로도 미핏 깔수 있나요?,"좋은 정보 감사합니다 
혹시 조교 출신이신가요?",각대협을 떡상 갑시다!,가격도 저렴하고 좋네요~^^,앱관리에서 문자메시지는 따로 없던대 문자도 받고 싶으면 설정하는 방법이 따로 있나요?,문자나 전화만 되도 좋을텐데요.. 음성이나 이모티콘이라도 되니까ㅜㅜ,백그라운드 설정을 따로 해줘야 되나요? 처음엔 전화가 시계로 오다가 나중에 안와서 보니 백그라운드 활성이라고 되있던데 어디서 해야되는질 모르겠습니다 ㅠㅠ 엘지폰입니더,기계치라  어려운뒛  차분히 해볼께요   감사합니닷,그럼 페어링을 꼭 해야 하나요?,"언녕하세요 궁금한게 있어서요~
제가 블루투스 이어폰을 항상 연결해서 쓰는데요~
미밴드랑 폰연결되면~블루투스 이어폰연결은 끊어지나요?",기기 찿기는 어떻게 하나요?,저 운동 측정 중일때 월래 메인 시계 화면 볼수 있는 방법 없을까요?,도움 받았어요^^  근데 만보기는 따로 설정하는게 있나요???  만보기가  멈춰 있기를 반복하내요,"다른폰에 연결했다가~다시 제폰으로 연결하고 부터는 카톡알림이 안오는데요~ㅜㅜ
공초도 해보고~카톡및 미핏 어플도 다시 설치 해봤는데~카톡만 안되는듯 한데~이유가 뭘까요?ㅜㅜ",에어팟이랑 미밴드랑 같이 연결할 수 있나요??,무음모드는 진동이 안 울리는 모드인가요?  미밴드는 소리도 나나요?,시계가느린데  조절어떻게하나요?,급해요ㅠㅠㅠ 업데이트하다가 실패뜬이후로 이상한글씨 나오면서 홈화면이 안나와요,혹시 친구추가 오류가 뜨면 어떻게 해야할까요?ㅜㅜ,미벤드5 뜨거운물에서 사용가능한가요?,샤오미 밴드5 구입했는데 음악 컨트롤이 안되요... 알송쓸데는 안되는데 lg폰 살때 들어있던 flo는 되네요? 왜그럴까요?,"핸드폰을 멀리 둬도 사용이 되나요? 
핸드폰을 전원을 끄면 아무기능도 사용이 안되나요?",산지 며칠안됐는데 밝기가 자동우로 어두워지는건 왜이런거죠 ㅠㅠ뽑기 잘못한건가요,감사해요 복받으세요,날씨는 어떻게 할까요?,스마트폰이 꺼져도 시계 같은 기능은 사용 가능 한가요?,음악은 어떻게 넣나요?,초기화 어떻게 하나요 ㅠㅠ,감사합니다👇,수면리듬은 어디서 보나요?,정발품을 구매했는데 한국어로 잘 쓰다가 워치페이스 업데이트 이후에 중국어로 바뀌어 언어가 한국어만 설정이 안되네요 왜 이런지 아실까요?ㅠㅠ,전미트앱에서 언어로한국어가없는데 어떻게바꾸나요?,블루트스가 안뜨는데 왜그럴까요?,앱 알림에서 카카오톡을 설정하려는데 저만 카카오이 없네요 ㅠ 이럴 땐 없는 아이콘을 어떻게 추가시켜 설정해야하나요?,저희 학교가 핸드폰소지 금지인데 핸드폰이랑 연결이 끊기면 어떤기능을 사용할수 있나요? 기계는 되겠죠..?,"초보 사용자인데요~ 
블루투스는 항상 켜두어야 하나요?","PAI  설정 방법은 어떻게 하죠?

아님 자동으로
작동되는건가요?",블루투스는 항상 켜놔여 하나요?,"한가지 질문드립니다 알람설정할수 있는 수가 3개밖에 없는데 ,저는 알람이 하루 10개정도 필요하거든요,늘쿠는 방법이 없을가요? 그렇지 않으면 알람이 많은 미밴드 추천 좀 부탁드리겠습니다",그..기기찾기를 눌러도 핸드폰에서 소리? 같은게 안나는데 뭘 설정해야 나나요??,제가 군대에서 미밴드5를 샀는데 핸드폰이랑 연동되는 미밴드5는 핸드폰이꺼졌을때 사용할 수 없는건가요..?,샤오미 미밴드 5 정식 한글판 : https://coupa.ng/bJXBqt,미밴드랑 연결되면 불투 꺼도 되나요?,5분26초에 보시면 백그라운드가 안나오는데 어떻게 보나요?문의드립니다,미벤드를 다시 연결하려는데 자꾸 미밴드를 초기화시키고 다시 연결하라는데 초기화는 어떻게 하는건가요???ㅠㅠ,혹시 공기계는 연결이 안될까요???,"제가 중고로 연결만 해본걸 샀는데, 제폰에 연결하는데 자꾸 폰에 연결 할려면 초기화 하라는데 어떻게 해야하나요ㅠㅠ",혹시 미밴드5 찔러보기가 왜 안되는지 아시나요..?ㅠㅠㅠㅜ 방해금지도 꺼놨는데 진동이 안와요ㅠㅠㅜ,아이폰은 화면잠금해제 기능이 원래 없나요?,계속 고객센터에 문의하라며 연결이 안돼여ㅠㅠㅠ,전화도 가능한가요?,블루투스에는 연결이 됐는데 앱에서는 연결이 안돼요ㅜㅜ,걷기등 운동기록이기록저장되나요?그리고그래프로볼수있나요?,카톡 수신하면 메세지가 계속 ?????? 로 뜨는데 뭔가요ㅠㅠㅠ,감사합니다 ⬆️,연구실이 없어요퓨ㅠ,노래도 들을수있나요?? 지니같은 노래어플 다운받아서 들을수있는지 궁금해요,이거 충전 다되면 켜지나요?,핸드폰 멀리 떨어져 있어도 미밴드랑 에어팟 연결해서 음악 들을 수 있나요?? 미밴드에 음악앱을 깔아서요 (유튜브 뮤직 프리미엄),미밴드5 한국 정식출시 까지 얼마나 걸렸나요?,화면 밝기를 좀 알려주시면 감사하겠습니다,저는 왜 화면잠금 해제가 없을까용?!,"스마트폰 기기찾기할때
동그란거 누르니 머가 안뜨는데
불량일까요?",알람 설정 미밴드 자체에서 할 수 있나요??,휴대폰찾기는. 앱을 킨상태로만 찾을수있ㄴㅏ요? 앱을 끄면 알람이 안울려서요 ㅠㅠ,노래는 어떻게 듣나요? 어떻게 넣고요..,저좀도와두세요ㅜㅜ 충전을했는데도 전원이 안켜져요 어떡하죠 휴대폰가까이연결해도 밴드연결이안되네요ㅜ,음악 제어 기능을 하고 싶은데 도움말은 뭐라고 하는지 모르겠어요 알려주세요ㅠㅜ,블루투스에 미밴드5가 뜨지않는데 어떻게 해야할까요?,앱알림이나 문자알림이 왜안될까요..ㅜㅜ,제가 다시 기기추가를 해서 연결을 하는데 자꾸 연결실패라고 해요 도움말에 있는거 다 했는데도 고객센터에 문의해보라고 하네요.. 왜이러는지 알 수 있을까요ㅠㅠ?,아이폰은 연구실이 없네요ㅠㅠ 카메라셔터기능 안되는가봅니다ㅠㅠ,한글판은 일본어 표시돼나요?,감사합니 다↓,아무리 찾아바도  카카오톡이 없어요 ㅜㅜ,노래 트는법은 없나요?,하고있는데 연결하려고하니까 연결할구없다고 네크워크를 확인하라는데요..,미밴드 시간이 이상한데 어케여..,카톡알림은 뜨는데 문자알림이 안떠요 블루투스 연결 했는데도 안되요,생년월일 다시 바꾸는 법은 없나요,이거 삼성도 돼나요????애플만 돼는건가요????,핸드폰이 없는데 어떻게 연결해요,이걸로 유튜브볼수있나요?,혹시저 아이폰인데 한국이 없어서요... 어떻게 해야 하나요?,연구실이 읍나요 아이폰은..,글로벌이죠?,이거 전화는 알림만 뜨고 전화를 받지는 못하나요?,전원 키는법.연결이안돼요 알려주세요,그거전화 돼나요?,노래어떻게들어요??,"스마드폰미밴드화면에 설정이없어요  상태화면밖에는ㅠㅠ 카톡 카메라 연결하고싶은데 ,,,알려주세요 ^^",카톡 알람 1나 끄기는 없나요?,"안녕하세요  
저는 이게 승인이 안돼요ㅜㅜ","카톡과 문자 알림뜨는거 설정해놨는데 알림이 안떠요
핸드폰이랑 거리가 멀리 있어야 뜨는건가요?떳다 안떳다 그래요",이거 노래나오게 한느법좀 알려주세여0,Lg폰도 되지요??,습니다~,저 아이폰인데 기기찾기가 안돼요 기기연결되있는데 기기를 찾을수없데요,No entiendo un pito!,저 연결이 안 됩니다만?,돠아~!,한국어가 없어요,틀니 딱딱~~^^,목소리가 이상해,것 같습니따.,,,,,,,,,,,,,,,,,,,,,,,,,,,,,,,,,,,,,,,,,,,,,,,,,,,,,,,,,,,,,,,,,,,,,,,,,,,,,,,,,,,,,,,,,,,,,,,,,,,,,,,,,,,,,,,,,,,,,,,,,,,,,,,,,,,,,,,,,,
