13,"배구는  팀  플레이 이기땜에
 호흡이  하나가 돼어야 한다
갓__연경은 주장으로써  최선을 다함
  국대 여자 배구팀___수고 했어요  쵝오심👍👍👍","한국 선수들의 투혼에 박수와 감사를 전합니다 👏👍🙏
영상 감사합니다 🙏",가장 중요한 점은 학폭 가해자들없이 이 성과를 해냈다는 것입니다. 너무도 잘 싸운 대한민국 배구 여자대표 선수들에게 응원을 보냅니다. 💖💖💖💖💖,"열악한 대한배구협회의 부실한 지원속에서도 
고군분투하는 배구대표팀에게 아낌없는 응원을 보냅니다.","정말 눈물 납니다
우리 여자배구선수들 
누구하나 나무랄데없이 정말 잘했어요 특히 박정아선수 
순간순간 힘을실어주는 모습
그리고 우리 김연경선수 보고만 있어도 행복해져요
배구 선수 모두 정말 수고많았어요",대한민국 배구 여자대표 선수님들 고생하셨습니다. 김사합니다 😍😍😍,김연경은 공격 수비 브로킹 다잘하는 세계적 선수인것이 드러났습니다 역시 우리 대한민국 김연경선수 입니다,"진짜 대단하십니다.
선수들 모두 고생하셨어요.
인생에서 손 안에 꼽을 경기였습니다","보는 내내 간절했는데
역쉬 대한민국 선수들 화이팅!
김연경선수를 비롯한 모든
선수님들 수고하셨습니다 👍","이처럼 걸어가는 길이 곧 역사가 된다는 말씀 진짜 와 닿네요
올림픽선수분들 진짜 고생 많으십니다👏👏👏","선수들 모두에게 진심으로 감사와 응원의 함성을 보냄니다
일본을 꺽었다는것이 올림픽메달을 딴이상으로 감동임
너무 고생들 많았어요!!~~~","기독교는 성경
불교는 불경
배구에는 김연경
나보다 나이어린 선수지만 존경합니다.","김연경 선수 
경기 내내 후배 격려 독려 승리를 위한 그의  열정
애국이 뭔지 가르쳐준  ...
고맙다 김연경 선수
국민 훈장으,로 보답하자","진짜 다들 열심히 최선을 다한 모습만으로
금메달감이였습니다 ~♡",일본 여자 배구 팀을 기적적으로이긴 것은 너무 기분이 좋다 남은 게임은 덤이다 부상 만 당하지 말자 김연경이 있어서 너무 행복하다,우리의 일본을 향한 울분을 이렇게 풀어주시니 배구선수분들 감사합니다,"습하고 더운 날씨에 짜증나기 쉽지만, 시원한 웃음으로 이겨내시고 건강하고 즐거운 8월 보내시기 바랍니다 
진포터님 화이팅입니다💪
대한민국 화이팅💪💪💪
김연경 화이팅💪💪💪
나두 화이팅💪💪💪
🍧🍦🍨",진정한 배구 황제 김 연경 선수를 응원합니다,"제가 이상한지는 모르겠는데 태어나서 정말정말 처음 겪는 일이었습니다.
경기 중 선수들에게 화이팅을 외치는 김연경 선수의 모습에 잠시 이순신 장군 모습이 오버랩되었었습니다.","김연경 선수 다리가 걱정되는 군요... 괜찮을 까요?? 8강에 진출했으니까, 마지막 다음경기는 김연경 선수 쉬게 해 주는 것도 괜찮을 듯 합니다. 무리할 필요가 없죠...",김연경이 이끌며.. 나머지 팀원들도 합세해주어서 잘 이겨낸거같아요 한일전은 당연히 이겨야하는...,김연경선수를 보면 가슴이 뭉클하다 그녀의 열정이 함께 승리를 이끌어냈다~,됐다.. 금메달 딴거나 다름없다 편한마음으로 돌아와라,"장하다
대한의 딸들이여
좋은결과를 쟁취하고
건강하게
귀국 하시라.!!!","대한민국 배구여자 대표님 라이벌 일본 이기느라 수고하셨고, 정말로 대단하셨습니다 ㅎ 불굴의 정신으로 ㅋ","다른 사람들 댓글이 맞음
8강전 준비하려면 김연경은 무조건 쉬어야함.
세르비아전 오늘 오전 9시 경기네.
이번 기회에 예비 후보선수들 큰 무대에서 뛰어보게 하는게 좋다고 생각.",이탈리아 감독도 히딩크처럼 좋아허더라구요 원팀 배구 울컥♡,눈물나는 부상투혼. 멋진 우리 선수들!!,"진짜,멋진 김연경선수 여자 배구대표팀,응원합니다",큰 박수 보냅니다. 김연경 선수를 포함하여 모두 사랑합니다~,"한국여자 배구 선수 여러분이 자랑스럽스니다!
그러나, 방심은 금물입니다! 우리나라가 일본하고 4강전이나 그 이후에 또 다시 만날수가 있기 때문입니다.
다음 일본하고 만나면 그때는 확실히 일본을 개박살 냅시다!","갓연경!!!!!
모두들 열심히 잘했지만 김연경 없이는 이룰수 없었던 승리~
갓연경이 대한민국 사람이라 자랑스럽습니다~♡",대표팀에서 뛰지않는 쌍둥이선수들 사진은 화면에서 좀 빼주셨으면 좋겠습니다,"허벅지 안쪽 혈관이 다 터졌더라구요 ㅜㅜ 
갓연경",김연경이 잘했지만 다른 선수 모두가 잘했기에 이길수 있었다.혼자만 잘한다고 될일이 아니다.,"일본 물멕였으면 1차 목표 달성. 편한 마음으로 최선을 다해 주시면 되요. 메달 색깔이 무엇이든
우리 국민은 박수칠겁니다.",김연경과 우리 선수들 고생많이 하셨네요  대한민국  이름을  걸고최선을 다하는걸 국민들은 압니다 너무 스트레스 받지말고 건강 조심하세요  그리고 당신들에 조국은 진심으로  응원합니다,일본을 이긴것만으로도 충분히 국민의 마음을 시원하게 해주었습니다. 감사합니다.,"쌍둥이 사진은 얼른 치우고
김연경 허벅지 보고 눈물났음ㅜㅜ","멋져요 연경이 선수님 그리고
한국대표 배구선수분들 모두 멋졌습니다!!",마지막 대표팀 명단 화면에 이재영이는 와 있는교? 빼소~,선수들이 다치지말고 그저 재미있게 경기하고 돌아왔으면..,부담갖지 말고 그냥 다 같이 가자     이   이상더  바라는것 없으닌까  잘 조심이 오셔  아프지말고   집으로  이쁘다,"일본에서 일본을 이긴 걸로 나는 대만족!!!ㅋㅋㅋㅋ
하지만 그녀들은 아직 목 말라 하고 있지 그렇다면 우리 국민들은 열심히 응원을 해서 그녀들에게 답해줘야지","짝짝짝..
지적 지성 대한조선 인의
걸어가는 삶 우리의 역사이며
후대 기록 입니다
대한 체육인 만세..","태극 여전사들
우리의 진정한 애국자들이다","대단한 대한민국 배구 선수들 입니다.
이겨 주어 감사합니다.

건강히 돌아와 주시고,
남은 경기도 힘껏 응원할게요❤❤❤김연경 👍 👍 👍",대한민국 여자배구 모든 선수에게 박수와 응원을 보냅니다. 김연경선수 끝까지 힘내주세요~~,그런데 왜 영구출전정지 선수 이재영 프로필이 국가대표에 올라가 있죠?,"다들 감사합니다.
스포츠는 축구조차도 관심없었는데
이번에 배구 돈내가며 봤습니다.
배구가 이렇게 재밌는 줄 처음 알았습니다. 저도 감동받았습니다.
최고.다들 감사합니다-","온갖 꼼수 편파판정 비열한 일본을 이긴것은 
이미 금메달이다","앞으로 어떤 결과가 나오더라도 오늘 준 감동을 고마워할 겁니다
너무 수고 많았어요 우리 선수들",기적같이 금메달 따는 모습 간절히 바래봅니다...김연경 만세!!!!!!!,참 김연경 선수 내색은 안하지만 속으로는 엄청 힘들것 같아요 몰래 울기도 할것 같은...ㅠ,"정말 최선을 다해준 배구 여자 대표팀 감사합니다
진포터님 9분 5초에 이재영 좀 지워주세요
부자격자는 필요 없습니다",마지막엔 울면서 볼수밖에 없었다 간절함이 느껴져서 금메달까지 화이팅!,"대표팀 얼굴에 폭력둥이가  왜 올라가 있습니까!
대표팀박탈된게 언제인데!!
축하받아야 할 대표선수들한테 먹칠을 하시면 ㅜㅜ
조폭둥이 얼굴은 삭제해주시기 바랍니다!","누가 배구여제냐, 배구황제다
김연경은 여자배구 1위가 아니라 그냥 배구 1위다♥",이번 국대경기를 보며 칼둥이들을 더 이해할수가 없게된.. 저정도 선수가 저런 마인드로 국대 경기에 임하는걸 옆에서 접하고도 그런 장난질이 가능한건가.... 월클 옆에서 모든걸 배우고 흡수할 시간도 모자랄을텐데..,"고맙고 고생 했습니다
배구 선수님들도 인물보고
뽑는건 아니죠
어찌나 미인들만 계신지
응원합니다 김 연경 주장 외 모든 선수님들 메갈 못따면 어떻습니까 일본한데 이겨주신 것만으로 감사 
꼭 꿈 이루어지시길 
화이팅🇰🇷🇰🇷🇰🇷👍🏻👍🏻👍🏻",대한민국을 세계에 알리는 배구 여제 김연경 선수.,"끝까지 최선을 다해서‥
해보자‥후회없이
여배 화이팅",언제나 감동을 주는 멋진선수,"우승 안 해도 돼요 무사히 돌아왔으면 좋겠지만,, 하고 싶은 대로 다하고 오세요🤧🤧💕
🇰🇷🇰🇷자랑스럽습니다💖💗💗✨✨",김연경선수를 포함한 모든 한국여자배구선수들을 응원합니다. ^^,진짜 김연경 선수는 대한민국의 보물입니다!,"라이카, 나이키, 아디다스, 김연경 형님에  관한  상품  어서어서  한정판으로  개발하셔요!!
사랑합니다  연경형님  정말  행복하시길  기원합니다 🙏🌸💕","우리 선수들 정말 얼마니 힘들었을지..눈물이 나네요
덕분에 행복 합니다.
그저 다치지 마시고 최선을 다해 주시면 됩니다.
늘 감사합니다.

진포터님께도 감사 말씀 드립니다","일본선수들이 전체적으로 우위인것 같다
하지만
한국선수들 잘했습니다~ 응원합니다",정말이지 여자배구팀 고생 많으셨습니다..김연경 선수는 정말이지 어떤 선수와도 비교할수 없는거 같어요!! 인성까지도요!❤️,일본을 침몰시킨 것 만으로도 이미 승리 한 것이다.  남은 경기도 최선을 다하고  귀국하기를 바란다 !!   화이팅 !!!,"눈물나네요
김연경선수 존경합니다~~♡
앞으로 꽃길만 걸으시길. . .","우리들의 겨울엔 김연아 있었고
함께하는 여름엔 김연경 있었네
그러므로 우리는 사계절 행복해",우리 선수들 고생 많았어요  남은경기 최선을 다하고  건강하게 돌아와요,"아..여자배구 화이팅 진짜 진심 완전 짱이다 감동과 사랑 희망  모든걸 당신대단하신분들이 전해주셨습니다.
감사!",마지막 쌍둥이 얼굴 보는 순간 기분이 팍....,여자배구는 할일 다했다. 남은 경기도 힘내서 건강히 잘 치루길 바랍니다.,"일본 이겨서 목표는달성,
마지막 힘을 메달의 결실로...
홧팅^^",김연경선수 주저앉은 모습 볼 때...그냥...눈물만 난다...,ㅠㅠ 학폭야들땸에 더 열심히 할수 밖에 없었을지 몰라도 정말 이런 세세한 설명으로 많은것을 알게 되네요.. 김연경외 배구팀 선수들 모두 화이팅입니다.,고맙다 연경아 너가 우리 팀이라 참 고맙다,"말이좋아 헝그리정신이지 한국대표팀, 말도 안되는 국내 리그 스케쥴 치르면서 컨디션 관리가 안된게 너무 안타깝네.
8강은 온전히 대표선수들과 코치진의 노력과 정신력이 만든 결과",칼둥이 사건으로 배구경기를 앞으로 손절하고 싶었는데 그럴 이유가 뭔가싶습니다. 😂🤔 대한민국 배구를 경기장에서 얼른 만나고 싶습니다,"배구선수 육성을 위해 능력있는 인재확보 ㆍ장학금지원 ㆍ투명환 선수 시험 기본만 지키면
제2,제3의 김연경이 나오지않을까 기대한다
선수들의 부상투혼 수술후2개월지나 바로 뛰어든 헌신적인노력 정말 눈물이
보이지않는 맨몸의 전쟁같은 모습
정말 선수들 수고하셨습니다",크...배구황제 김연경 ㅠㅠㅠㅠ 한일전 멋있었습니다 ㅠ 쭉가자! 가보자고 여자배구!!!!><,"김연경  당신은  정말 정말  진정한 애국자 입니다. 
사랑합니다 💜 💜 💜","김연경선수는 세계적인선수고 
중국서 백지수표까지 내민선수인데 
흥국생명의 낮은연봉에도 흥쾌히 계약하고 뛴 의리파죠.
외화벌이 마이했어도 자만심이 아닌 자부심제대로 탑재한 인서갑 선수중에 하나
당신이 존경스럽니다~~~~",훌륭한인품   실력있는운동  좋은성격 세계 최고의 선수 김연경 화이팅,김연경 대단한 선수다 해외리그 탑선수 였고 국내에서도 탑 김연경 금메달  따라ㅋ,"잘못한게 없는데 비난을할 이유가 없죠 
선수들도 사람이기에 컨디션이 나쁘면 질수도 
있고 좋으면 이기겠죠  경기내용과 결과는 비난할
이유가 안됩니다  우리 배구여제들 오늘 터키전 
이기든 지든 후회없는 경기 하길 바랍니다!!!","교회는 성경
불교는 불경
배구는 김연경…..",미래에서왔습니다 대한민국팀은 4강에진출합니다 넘나 감격스럽고 씬납니다 유아호~!!^^,배구계에 다시 없을 레전드가 될 선수가 아닐까 합니다,"쌍둥이의 퇴출로 여러모로 힘들어진 것에 대해서는 안타깝지만... 분명 이번에는 금메달을 딸 겁니다.
진즉에 폭력 문제가 해결되었으면 보다 더 실력있는 선수들이 떠나지 않았을텐데요...",매달이고 나발이고 언니들 하고싶은거 다 하고 건강하게만 돌아와라!!!,"이재영, 이다영은 이제 그만 두라. 멋진 여배구팀원들에게 누가 된다.어따 갖다 되나. 인간이 덜 된 것들을",김연경선수와 다른 선수들 모두 감사합니다. 김연경선수는 기량뿐 아니라 리더쉽이 뛰어나서 볼 수록 훌륭하다는  생각이듭니다. 감독님 선수들 모두 다시 한 번 감사합니다 ~~~^^,대한민국 모든 여자배구 대표팀을 진심으로 응원합니다 ^^ 감사합니다~,솔직히 다른 종목이 눈에 안 들어올 정도로 쫄깃하고 멋있는 경기를 보여주었어요 .. 나머지 팀원들도 모두 잘했지만 지친 팀원들의 기량과 사기를 북돋아주기 위해 중간중간 계속 소리치고 온 힘을 온 열정을 다 쏟아붓는 김연경 선수의 모습 보고 진짜 감격스럽고 존경스러웠...👍🏽,보는내내 심장이 터질것같았는데 김연경선수 최고중에 최고~~!!! 다른선수들도 모두 수고했습니다,와  너무 감동적이라 눈물 흘리는데 마지막사진에 이재영은 왜있나요  그것도 상단 가장 잘보이는곳에   너무하네,"김연경은 그저 빛이다. 존경할 수 밖에 없는
마인드와 말과 행동이 일치하는 언행일치와 카리스마! 무조건 응원하고 사랑합니다!!",정말 천재다 갓연경 존경스럽습니다. 역시 대단한 사람들은 멘탈이 갑이어야한다,앞으로  김연경 같은 대선수가  또 나올련지  힘든상황에서 팀원들을 잘 다둑여 숙명의 라이벌 일본전에 승리했으니 설령  최종 순위까진 가지 못할망정  최선을 다한 선수들에게 격려의  응원을 보내요,"갓연경 대한민국 만세
멀리서 응원하는 사람으로서.....",갓연정입니다,대한민국에 김연경이라는 배구선수가있어서 정말정말 행복합니다,"우리 여자 배구 선수들 너무 너무 자랑 스럽습니다..일본을 이겨줘서 고맙고 ...
메달 딴 거나 다름 없으니 ..이제는 홀가분하게 경기에 임하고 ..까지것  4강 못 올라가도 좋아요..
이것 보다 더 큰 일본을 잡았잖아요...마지막까지 다치지 말고 안전하게 한국으로 돌아오세요..","우리 배구  대표팀선수분들  모두 고생하셨고  감사합니다 .    
김 연경 선수  힘내세요","몸이 부숴저라 뛰는 선수들 보며 얼마나 짠하던지…
일본전은 정말 대단했습니다.",배구의 관심도 없던 저희딸도 이번 한.일전배구보고 넘 재밌고 박진감 넘쳤다며 칭찬을 아끼지 않았어요.끝까지 포기하지않고 혼신을  다한 김연경선수를 비롯해 모든 선수들 수고 많으셨어요.사랑합니다~~^^,"화이팅.
우리나라 선수들..
부디 무사히 귀환하시길..^^","훌륭한 김연경 장군.
그 밑에 훌륭한 병사들.
일본전 승리로 이미 성적은 중요하지 않다.
그래도 김연경 장군께 제발 메달 하나 안겨드릴수 있게 병사들이여 힘내주어라",터키도 잡은 거 보고 이거 다시 보고 있어요ㅎㅎ 너무 좋아요,연경선수 실력은 말할것도 없고 저는 언니의 리더쉽에 반했어요........,4:40 ...이건 좀 아니자나요..ㅋㅋㅋㅋ멋진선수들 멋진샷으로 해주시지...ㅠㅠㅠㅠㅠㅠㅠㅠ,"우리의  여제 김연경에게  힘찬 박수와 환호 보냅니다~~고맙습니다,  당신과 같은 애국하는 스포츠 선수가 우리에게 있어서 행복합니다.",미국에 농구의 천재 마이클 조던이 있다면 한국에는 배구의 천재 김연경이 있었다는게 영원히 기억될 것입니다~,"우리나라 대표팀 선수들 모두 잘 싸웠습니다. 
몸 건강히 남은 경기 잘 하시고 금의환향 하세요~💖💕👍","물의를 일으켰던 쌍동이 자매없이 이뤄낸 승리라 더욱 좋았습니다.
경기 중반에는 혹시 패배까 물의 자매 생각도 났지만 이겨내 코끝이 찡했습니다.
결코 왕따는 없어져야 할 몹쓸 병폐입니다. 메달을 못 따는 한이 있더라도!!","김연경이야 당연히 최고였고..
마지막 3득점 성공하며 5세트 에이스 역할을 햇던 박정아...
14 대 14 .동점 만드는 득점 성공 후... 그 얼굴 표정...
막중한 책임을.완수한 후의 담담한.표정..
멋졋음..ㅎㅎ

김연경..박정아.. 김희진..삼각편대...

쌍둥이가 필요없음을 증명..ㅎㅎ",역시 갓연경~대한민국 선수들 모두모두 대단하며 존경합니다  최선을 다하는 모두를 독려하는 그의 모습과 모두 그길을 최선을 다해 하는 우리 선수들 최고입니다,"우리 여자 배구 선수들 너무 너무 자랑 스럽습니다..일본을 이겨줘서 고맙고 ...
메달 딴 거나 다름 없으니 ..이제는 홀가분하게 경기에 임하고 ..까지것  4강 못 올라가도 좋아요..
이것 보다 더 큰 일본을 잡았잖아요...마지막까지 다치지 말고 안전하게 한국으로 돌아오세요..","감동이었죠ㅡㅎㅎ
갓 연경님 ㅎㅎ투혼을 발휘하며 한국의 정신적 지주로서ㅡ대단합니다
근사한 연경님 ㅎㅎ~^^","김연경 선수 너무 잘했죠~
TV를 통해 보면서도 너무 짜릿하고 감동적이었습니다
김연경 선수 아닌 대한민국 대표선수들 모두에게 진심으로
 박수를 보냅니다","무지성 노인성 쌍둥이 자매 빠져도 전력에 이상 없구만 ~
지들이 다른 선수들에게 서포팅 강요해서 잘해 보였겠지?
지들이 메인이 되야 했기에? 
이런식이라면 그 어떤 누구는 못할까?",김연경과 우리 선수들은 정말 애국자이더라. 국민들의 기를 살려줘서 기쁘다.^^♡,"뜨건 박수를 보냅니다~~♡
김연경선수 찐배구에 멋진모습~~^^
끝까지 응원에 박수를 보냅니다~~💖💖💖","국대김연경이 울나라 배구선수인것이 
몸을 아끼지않고 희생하는 최고리더
배구계 보물 존경스렆다.",브라질전은 김연경말고는 공격도 수비도 처참했는데 다음경기부터 수비도 좋아지고 김연경말고도 박정아 공격도 잘 들어가서 보는 맛이 있었음.,기적이 아님  오로시 실력임,"한국 축구에 필요한 정신이 아닐까 싶습니다
멕시코전
수비상황에 악착같이 해도 모자랄 상황에 걸어다니며 조깅하는 선수들
선수로서, 또 국가대표로서 간절함에 대해 많은 생각이 들게하는 장면들이 많았어요
정말 열심히 했지만 실력 차이가 너무 극명해서 지는건 납득이 됩니다. 하지만 ""열심히""라는 단어가 생각나지 않는 플레이는 이해가 안되네요","김연경도 김연경인데.. 염혜선의 발전은 우리의 큰 수확이다
Unsung Heroin 이 아닐까...",그래서 갓연경님이라구요 실력과 인성을갖춘 갓연경님 ㅋㅋㅋ 언제나 화이팅하세요,배구여제 아니고 그냥 배구황제입니다,김연경읇 보고 있으면 애기로만 듣던 유관순이 생각나네요 다른 건 몰라도 일본전에는 어떠한 일이 있더라도 이겨야 한다는 불굴의 의지~~ 언제 어디서나 무엇을 하든 대한민국 화이팅입니다.,"지금까지도 충분하다고 얘기해주고 싶지만, 올림픽 메달 꼭 따고 은퇴했음 좋겠다는 욕심도 나네요...
좋은 결과 내고 얼른 식빵언니 유튭에서 밝고 이쁜 모습 많이 볼수 있길 기도 기도할께요~~♡",국보급선수 김연경선수 대한민국 여자배구 선수 여러분 부상 조심 하시고 몸건강히 화이팅 하세요 화이팅 화이팅,조금 더  간절한  사람에게  기회가  온다는말이  이런데서  쓰는거구나.....김연경선수가  있어  우리는 너무  행복합니다,대천사 대한민국이 악마 니뽕을 토벌 할수 있어서 너무 기분이 좋다 대한민국의 특별한 클라스에 가슴이 웅장해진다!  우승 ㄱㅏ즈 ㅇㅏ 배구팀 화이팅,소름 돋아 ㅠㅠ 선수분들 최선을 다해주셔서 감사합니다 ㅠㅠㅠㅠ,정말 너무 날 싸워준 김현경선수 화이팅!!,"김연경선수는  특별대우해줘라
내나이70 대에 김연아선수가
원픽이었는데 한사람더늘었네요
갓연경  가슴이 뭉클하고대견하고
자랑스럽고 보고또봐도 찡한  울림을 주는 김연경선수는 우리의
보배로다 미모 인성 카리스마
팀을 아우르고 이끄는마력 말로는 
다표현못한다 표효하는그모습
역대급이다  연경선수 사랑합니다 응원합니다 건행",정말 감격적인순간ㅠㅠ눈물납니다😭너무 수고하셨어요 대신 싸워주시고 승리해주셔서 너무 감사드려요~~그대들은 정말 멋져요 한국여자배구 한국챔피언👍💃🕺,사설이 너무 긴대...썸네일에 보이는 포인트만 얘기해주면 안될까? 이런 영상들은 다 왜이러냥 ㅎㅎ,"연경선수님이하  대한민국 선수님들  고생많이  하셨습니다
그 두사람없어도  이길수 있다는걸  보여주시었네요
맘고생 몸고생 많으셨지요
대한 선수님들~~~사랑합니다
금메달  따신거나  똑같습니다
몸건강히  한국으로 돌아오소서~~~♡♡♡♡","7:42 일본 이시가와의
공격 범실이 15:14가 되었습니다. 박정아 선수의 스파이크는 13,14점에 나왔고 16점을 밀어내기로 ...",우리나라 선수들 잘했어요...하지만 감독님 코치님 주장 김연경 선수와 호흡 잘 맞춰서 금메달 따봐요...여자배구 화이팅~~~^^,"일본을 이긴거로 배구는 최고입니다.
너무 수고했어요..","15:14로 역전한것은 박정아 선수의 스파이크 득점이 아니라 상대 공격범실에 의한 득점입니다.
암튼 이 게임은 강동희였음","온국민이 소리지르고 박수치고 환호하며 응원했습니다
갓연경님과 우리선수들의투혼
 눈물나게 고맙습니다
그대들이 메달을 따지못한다해도
욕할사람 아무도없을겁니다
최선을 다했고 또 최선을 다할것임을 우리국민들은  알기때문입니다
편안한마음으로 임해주시고
 부디
다치지말기를 빕니다
그동안의 땀과 노력이 아까워서
좋은결과있기를 목청껏 응원합니다
대한민국 선수들 만세 
갓연경님 만세  최고 ~~~~!!!♥","충분히 대단했지만 , 김연경선수가 올림픽 메달을 목에 걸고있는 모습을 보고싶긴 하네요, 모든걸 이뤘지만 올림픽메달로 화룡점정을 찍길 소망합니다 응원할게요!",2002년같은 그 짜릿한기분..  감사합니다 한국대표팀,다른 툽과 스토리가 너무 같아서 이제 짱남..뭐 다른 1프로 라도 다른 이야기 없나요?,불교는 불경 기독교는 성경 배구는 김연경,"눈물났어요 진짜
이왕 이렇게 된거 
꼭 매달 땄으면 좋겠어요
너무 고생하셨어요♡♡
사랑해요 여러분~~
자랑스럽고 고맙고 ..","한국여자배구 국대선수들 응원합니다
여제 김연경덕분에 국대 인성정화도 된것같고 분위기좋아져 승리도 계속 할것같네요. 모두 건강히
마치고 귀국하셔요",이와중에 비난할 사람이 있을까 싶네요. 여배대표팀과 라바리니 감독님 및 통역사님 모든 스텝들께 감사합니다. 대한민국홧팅이네요.^^,일본의 우익 같은 유튜버들 많은데 진포터는 그러지 않은 것 같아 좋습니다.,"축구나 야구.
김연경 정신 절반이라도 배워라.
김연경이 군면제 때문에 저러냐?
부끄러운 줄 알았음 좋겠다.",감동적인 경기 볼수있어서  정말 감사합니다  수고하셨습니다,"그들의 열정!
갈채를 보냄니다 
부디 부상없이 잘~마치길
코리아 화이팅!","이기는것도 좋지만 몸상태가 걱정되네요.
남은경기는 금메달  부담감은 좀 내려놓고 하세요.
좋은경기를 보여줬고 
이미 당신들은 챔피언 입니다.배구팀 홧팅! 감사합니다.",국보 김연경! 그리고 모든 국대님들 감사합니다   건강한 모습으로 귀국하시길 바랍니다,금메달보다 일본이긴게 더 좋음 ㅎㅎ,허벅지 부상 경미하길 바랍니다. 부디 마무리 잘하길 바랍니다. 그래도 끝까지 최선을 다해서 메달까지 노려봅시다. 화이팅!!,정말 고생했다 우리 배구팀 김연경 화이팅!!! 이쁘다 아름답다 존경한다,"이렇게 위대한 대한민국
여자 배구를 두싸가지 없는
것들이 말아먹을뻔 했다지",전 세계 배구 최고!!!!  넘버 원 스코어 챔피언!!! No.1 score champion!!!!!!❤️,다 좋은데 쌍둥이 사진이 빠졌다면 더 좋았을듯,정말 배구계에 신이라는  말도부족할정도로  의지와 리더심이 존경스럽다,존경스럽내요. 김영경 포함 모든 선수들... 미모도 훌륭하고 실력도 훌륭하고 또...정신력도,갓연경...최고중에 최고..,"김연경선수 보면 ~!
 가슴이 울컥 , 
벅차오른다 고마워요 ~
 사랑해요 ~😊😁🙏
김 연경 ❤❤❤❤❤❤❤",전 세계가 전율했다? 누가? 아무리 국뽕이지만 어그로성 제목은 없어져야 됩니다.,"건강 하게 또 후회 없이 하고 돌았  왔으면 해요! 
메달이야 뭐 있으면 좋은데 
그래도 건강 조심 하면서 후회 없이 잘 하고 왔으면 더 좋을것 같아요",김연경 박정아 외 모든선수들 고생하셨어요 정말 응원합니다 부상당하지않도록 조심하시고 금의환향 하세요,신에게는 아직 5천만 국민들의 응원과 지지가 남아 있사옵니다,"일본 이겼으면 금메달 딴거나 다름 없음
앞으로 부상없이 부담없이 경기하다 복귀하시길","2:38 ""학교문제 의혹까지 제기되며"" -> ""학교 폭력 가해자임이 밝혀지며"" 수정 바랍니다
9:05 이재영 이다영 모자이크 바랍니다",우리나라 선수분들 다치지 않고 한국으로 돌아 왔으면 하네요...,"여자배구팀 선수분들 모두 자랑스럽습니다.
수고 많으셨습니다. 
감사합니다. 
그리고 수많은 관계자 여러분들과 스태프 여러분들 정말로 수고 많으셨습니다. 
감사합니다. 

모든 국가대표 선수 여러분들  수고많으시고 고생이 많으십니다.
모든분들 힘내시고 건강케어 잘하시고  끝까지 우리 대한민국을 위해서 열심히 싸워 주시기 바랍니다. 
아자아자 화이팅!!!
대한민국 만세!!!",어제 경기보면서 숨쉬기가 힘들었어요! 어떤 경기보다 열심히 몸을 사리지않고 뛰는 모습을 보면서 울컥했답니다. 결승전을 보는 기분이였달까. 앞으로 승승장구 진짜 결승전까지 가면 더 좋겠지만 어제 경기만으로도 감사하고 최고였음👍👍👍👍👍,어쩜 저리 훌륭한 선수가 있지!,"9:07 공장식 국뽕 채널인지 아닌지, 최종 엔트리 사진이 그대로 있을지 수정될지... ㅋㅋㅋ",김연경선수의 소원을 꼭 들어 주소서🙏🙏🙏👍👏🇰🇷🌹,"정말 고생하셨습니다
김연경선수 마지막 올림픽을 매달로 장식하면 더 좋겠지만
이미 국민들은 감동받았습니다
감사합니다","일본 이겼음 메달은 안따도 되요.
편안한 마음으로 남은 경기 즐기시고 건강히 복귀하시길!","넘멋져요 ,,김연경선수~~
한국선수들 다 수고하셨구,,,건강챙기시고 홧팅하세요♡♡","가장 중요한 순간에 김연경이 보여 준  이상한 동작은 뭔가요????????????????
그리고 영상 마지막에 이재영은 왜있죠??",4:46 경기 시작전 선수들 등번호를 모두 바꾸는 비겁한 짓을 일본대표팀이 벌였는데 그에 답한 여제의 말.,진짜 페로몬은 내 체향과 섞여 본인만의 체향을 만듭니다 존아자르 페로몬향수를 만나보세요~~,비하가 됄 수도 있지만  이분은 짝대기 그 짝대기 하나만 그 누군가 싫어하는 짝때기 하나 휘~ 젓고 나욌다면 ᆢ 뭘 가지고 오던 능력 성실 하고자 하는 의지 멋진건 번함 없읍니다  당신은 성을 떠나서 멋진 인간 입니다,국대 배구선수 모두들 수고하셨습니다,"쌍둥이도 런던올림픽때 없었음
아직도 쌍둥이 찾는 애들보면 답도 없더라 쌍둥이없이 배구 메달따자!!!",대표팀 흘륭하다 끝까지 Fighting! 하세요 김연경외 전선수 힘내세요~~^^ !,역사에 남을 명승부였습니다. 내내 ... 올림픽 시즌이 오면 언제나 언급될 기분 좋은 승리였습니다.. 아직까지도... 기분이 아주 좋습니다.. 대한민국 화이팅 !!! 대한민국 여자배구 대표팀 화이팅 !!!! 김연경 화이팅 !!!!!!!!!!!!!,"김연경 최고 입니다 ㅎㅎ
모자이크 이*영 , 이*영  대박입니다 ㅋㅋ",국가대표팀도 다시 없을 기회니 정말 기회를 잘 활용 했으면 좋겠네요.,,,,,,,,,,,,,,,,,,,,,,,,,,,,,,,,,,,,,,,,,,,,,,,,,,,,,,,,,,,,,
