19,두 모델 고민중이었는데 많은 도움이 되었습니다. 재미와 양질의 퀄리티가 공존하는 리뷰 항상 즐겁게 보고있습니다.,"며칠동안 두 가지 중에서 고민 많이 했는데 덕분에 결정 했습니다!
좋은 정보 감사합니다. 항상 재밌게 보고 있어요.
특히 인트로랑 인트로, 그리고 인트로가 참 재미있네요.",잇섭님 덕분에 핏2 구매했어요ㅎㅎ 이런분야에 문외한이였던 저를 인도해주신 당신 그저 빛....,리뷰 컨텐츠로써 쓰잘데없이 길지않고 독일의 MG42기관총을 능가하는 스피디한 토킹 어바웃이 난 가장 맘에 듭니다ㅋㅋㅋㅋㅋ 군더더기없이 머리에 쏙쏙 😄😄😄,역시 다른유튜버들과는달리 매인을 처음에 짧게 하고 아웃트로를 약10분정도를 하는 역시 잇섭님 멋있어요,"미밴드5 : 오 구해주러 왔구나!
핏2 : 아니 나도 잇섭한테 잡혀왔어...",고민하고 있었는데 이렇게 좋은 영상 올려주셔서 감사해용 역시 잇섭님 ㅎㅎ,운동 시작하면서 핏워치 알아보고 있었는데! 고마워요 잇섭!,방금 리더유님의 리뷰 보고 업데이트 영상 찾아보고 있었는데 덕분에 큰 도움이 되었네요,잇섭님 영상보고 저번에 핏2 구매했습니다. 원래는 그냥 시계 차는데 밴드 딱 써보니까 너무 편해서 원래 차던 시계가 더 비싸도 손이 안가더라구요ㅎㅎ,요즘 물량이 없는거 같던데 인기가 많은것 같습니다... 지금 쓰고 있지만 웨어러블 처음써서 그런지 만족스럽네요,앜ㅋㅋㅋ 마지막 깨알멘트들이 항상 재밌어요!,크으...........정리를 너무 잘해주셨는데요??ㅠㅠㅠㅠㅠ 최고다,형 영상보고 핏2샀는데 미밴드랑 비교 영상 보일때 마다 상대 적 박탈감 들어서 조만간 액티브 사지 싶습니다 ㅋㅋㅋㅋㅋㅋㅋ,어제 4년간 쓰던 미밴드2를 잃어버려서 뭘 살까 고민중이었는데 적절한 시점에 리뷰 감사합니다:),00:04 아아 역시 서울잭스킹님은 항상 기대를 져버리지 않아,핏2 빼는 방법 그냥 버클만 댕기고 그 상태로 버클을 더 댕기면 빠져서 편합니다. 따로 안으로 들어간 밴드를 빼려고 할 필요 없어요ㅎ 자동으로 쑥 빠집니다.,7:07 ㅋㅋㅋㅋㅋㅋㅋㅋㅋㅋㅋㅋㅋ꙼̈ 아 내 웃음포인트😍,"저도 잇섭님 영상 보자마자 갤럭시 핏 질러서 잘쓰고있습니다
칼질 하는 사람이다 보니 손 움직임이 많아 걸음걸이로 넘어가는게 아쉽긴 한데
반대로 내가 많이 움직였구나 하는 보상 심리가 생겨 만족합니다
궁금했던 비교영상 감사합니다",오 디테일 최고 덕분에 궁금증들이 거의 해소됐어요 감사합니다,ㅋㅋㅋㅋ중간중간에 재밌는 멘트들이 많다ㅋㅋㅋㅋ,잇섭님 영상보고 어제 새벽(?) 바로 미밴드5 주문했습니다 ㅋㅋㅋㅋ 고민 많이 했는데 도움 주셔서 감사합니다❤️,오 전 핏2쓰는데 이거보니까 이해가 더잘 되네요,핏2 가 이정도 나왔으니 핏3 가 더 기대 되네요~~ 화면이 조금만 더 컸으면 좋겠네요 ㅋㅋ,형 오늘도 깔삼한 리뷰 고마워 이 리뷰 보고 애플워치를 사야겠다고 결심했어^^,형의 인트로의 무궁무진한 발전을 기대할게!,잇섭님 핏2를 살까요.아님 미밴드2를 살까요?너무 고민 됩니다,와 진짜 세계관 최강자들의 싸움이다,핏2도 3.9만에 가능하네요,목소리가 좋으셔서 귀에 쏙쏙 들어와요....저도 스마트 워치 사고 싶네유ㅠ,"진짜 세계관 최강자들의 싸움이다..
잇섭의 근육이 웅장해진다..",이야 애국하시네. 그래도 핏2 최대한 좋게 잘 말해주려는게 느껴집니다 ㅋㅋㅋㅋㅋㅋㅋㅋㅋㅋㅋㅋㅋㅋ,외부활동시 진동을 못느끼실 수 있는데 미밴드는 진동을 새로 만드실 수 있어서 좋아요. 진동도 원하는 모양으로 만들고 그 진동을 넣고싶은 앱에 넣을 수 있어서 좋아요.,"시계관의 최강자의 싸움이라니...
손목이 웅장해진다",형이야말로 세계관 최강자......💪,아닠ㅋㅋㅋ 20g차이 난다고 근손실이 오넼ㅋㅋㅋㅋㅋㅋ 양쪽에 끼는거 진짜 개 귀엽(????),미핏 앱 생태계 진짜 개좋음. 샤오미 체지방 체중계랑 미밴드5면 체고조넘이 되어부려,"막상 국산 쓰고 싶긴 한데 미밴드가 둥글둥글해서 더 좋네요...
그냥 잇섭님의 조언처럼 갤럭시 워치로 한방에 가겠습다.",요번에 핏2  사야되나 고민했는데.. 그냥 미밴드5쓰다 액티브3로 넘어가야겠네요ㅋㅋ 감사합니당,잇섭님 목소리가 정말 중독성있음 ㅎㅎㅎㅎ,"하... 잇섭님 헬쑥해진거 봐... ㅠㅡㅠ...






그래도 목소리는 여전히 중독성이라 좋습니다 ㅎ",진짜 미밴드 1년정도 쓰면 진짜 잘풀림,저는 미밴드 새벽에 아침먹고 다시 한시간 잤을때도 측정되더라구요. 수면은 확실히 미밴드가 정확한 것 같아요.,"비교글보고 미밴드5로 샀는데 대만족중입니다.
특히 워치페이스를 직접 만드는게 가능한게 너무 좋더라구요. 배송 오자마자 워치페이스부터 만들어서 적용시켰습니다 ㅋㅋㅋ",저는 갤핏을 안써서 모르겠지만 미밴드5 착용하고 기능이 다 맘에 들어서 만족해요. 가성비는 확실히 좋은 듯요. 단점은 메뉴넘길때 부드럽지않다는거랑 가독성패치안하면 한글폰트가 넘 작아요. 시력이 좋아야 밴드쓰기 좋습니다 ㅜㅜ,정말 국뽕없는 잇섭님영상이 제일 믿을만함,좋은 정보 리뷰 잘보고갑니다.,형 이제 얼굴만 헬스유튜버가 아닌 진짜 헬스유튜버가 되려고 하는거구나!,무게를 맞출 때 워치로 똑깉이 맞추는 사람이 어디있엌ㅋㅋㅋㅋㅋㅋ,항상 좋은 영상 감사합니다🙏,방금전에 갤럭시핏2 영상 보고 뭐살지 고민하고 있었는데 이 영상 업로드되서 너무 고마웠어😄,갤럭시 핏과 미밴드를 구입하기 전에 이 영상은 꼭 필수적으로 봐야겠네요. 유익한 정보 감사합니다.^^,나루토 사스케 싸움 수준 ㅎㄷㄷ,폴드를 살리셨네요 ㅜㅜ,점점 개그센스도 늘어나는 듯 ㅋㅋㅋㅋㅋㅋ 인트로뿐 아니라 개드립치는 수도 늘고있음 ㅋㅋㅋㅋ,1:09 남들과 수준부터가 다른 포스 ㅋㅋㅋㅋ,진짜 잇섭형같은 사람 주변에 있으면 꿀잼이겠다 ㅋㅋㅋㅋㅋㅋㅋ,아니 1초부터 ㅋㅋㅋㅋㅋㅋㅋㅋㅋㅋㅋㅋ 똥쌀때는 또 뭐야 삼촌 ㅋㅋㅋㅋㅋㅋㅋㅋㅋ,와 자세한 리뷰 도움이 많이 되네요😊,잇섭님ㅠㅠ 갤럭시와치3 후기는 언제쯤 올라올까요...?! 지난번에 구매후 올려주신다고 해서 기다리고있습니다~!!!ㅎㅎ 항상 좋은 후기 영상 감사합니다!!,"에어팟 알아보다가 잇섭님 처음 봤었는데
그냥 챙겨보고있네ㅋㅋ",영상 초반에 등장한 몬스터 밀크가 더 눈에 끌림... 머거본 놈인지라 ㅋㅋㅋㅋ,형 영상보다가 모기때문에 다못봐서 한번 더봤어,"잇섭님 저번 영상 보고 갤핏2 샀어요
전 잘 쓰고 있습니다 💛 감사해요",잇섭님 추천으로 갤럭시핏2 구매했는데 생각보다 자전거타기할때 지도표기가 되지않는 문제가 있었어요~ 느낌이 소프트웨어은 많은 개선이 필요할 것 같아요~ 삼성에서 이걸 보고 많은 조금 더 갤럭시핏2에 집중해서 개선을 해줬으면 좋겠어요,오늘 미밴드5받았는데 너무 도움이 잘되여^^,충전 방식 등 기타 개선될 핏3를 존버한다,몸짱된 모습 기대할께용~,근손실을 막고 싶다면 양쪽에 애플워치6를 차면....(에르메스로...ㅎㅎ),헬스장 인싸 킹섭 😆😆,"형님 영상보고 오늘 핏2 구입했는데 
이게 올라오다니 ㅠㅠ","삼빠였지만, 밴드만큼은 미밴5가 너무 좋아..",핏좋아!,이...이제 잇섭도 잼들로 점령이 되어버리고 마는구나 옛날에 틀딱형님들의 개꿀잼 드립이 그립읍니다,"잘보고 갑니다~~ 덤벨 프레스 하는
인트로 웃겼어요ㅋㅋㅋ 저거 3키론가요...
저는 전에 미밴드4를 사서 쓰다가 갤럭시워치로
넘어온이후로 밴드는 못쓰겠네요ㅋㅋㅋ",6:01 진짜 미밴드 너무 잘빠지더라구요 ㅠㅠ,완벽한 비교실험을 하려면 날마다 양손을 바꿔가면서 해피타임을 가져야하는구나 형,그냥 미밴드5와 갤럭시핏2에 좋은점들만 합쳐져서 나오면 좋겠네요,"미밴드5 1달 쓰다가 핏2나와서 바로 사서 쓰는데 
핏2가 확실히 더좋음 수면측정부분 빼고  핏2가 확실히 더좋은듯",핏2 가 배터리만 더 오래갔어도..ㅋㅋ 핏3를 기다리겠습니다..,저로써는 블루투스연결되었을때 내폰 찾기 기능이 인상깊었던거 같아요 직접 찾지않아도 알려주니까 정말 편하고 좋았던거 같아요 하지만 블루투스 연결이 안되있을때는 못찾는다는게 조금 아쉬웠어요 ㅠㅠ,"일단 고무 밴드는 땀차고 찝찝한데~
나일론 찍찍이로 된거로 바꿔보시면 완전 핏감 찝찝함 거의 해결",잇섭 3대 500썰 푼다 ㅋㅋㄹㅋㅋ,갤핏2 내구성이 좋은거 같아요. 수영 매일해도 괜찮은듯요. 미밴드도 좋았는데 반년에서 1년 이상 가면 내구성 문제가 ㅠㅠ,형 정확도를 원하면 워치랑 같이 차고 측정해보면 되지않을까??,미밴드5 쓰고있는데 화면에 좋아하는 사진 넣어놓으면 볼때마다 기분이 좋아요. 갤핏은 워치페이스 커스텀 불가능 하다길래 미밴드 구매했는데 화면 볼때마다 기분 좋아서 만족합니다ㅋㅋㅋ 근데 미밴드 초기 설정이 좀 힘들었어요... 제품은 받았는데 뭘 어떻게 해야할지 모르겠더라고요. 미핏앱 말고 다른 앱 설치해서 폰트 패치도 따로 해줘야하고 폰트패치 했더니 알림이 중복으로 들어와서 해결한다고 시간 한참 썼고 커스텀 워치 페이스도 다운 받았는데 적용법을 몰라서 한참 시간썼고 카톡 알림도 이상하게 들어와서 결국은 미핏앱 알림 꺼버리고 알림 받아주는 다른 앱 설치하고 그걸로 알림 들어오게 설정하고 처음에 이것저것 할 게 많은데 친절하게 이거하라 저거하라 알려주는 곳은 없어서 문제 생길때마다 검색해서 해결하는데 번거롭고 골치아프더라고요ㅋㅋㅋ 걍 심플하게 쓸 거면 갤핏2이 최고겠다 싶었어요. 하루 고생해서 설정하고 나니까 진짜 좋습니다ㅠㅠ 가성비 짱짱인 것 같아요!,Active2와 Fit2를 동시 사용 중인데...Fit2는 끄기 기능이 없어서 Active2 착용 후 외출에서 돌아와 Fit2를 폰에 연결해보면 외출 시간 동안 잠을 잔 것으로 표시되네요. 수면 기록이 달라져서 불편한데 어떻게 해야 할까요? 가끔은 충전 중에도 수면으로 기록이 되네요. ㅠㅠ,핏2 심박수측정을 연속으로 해놓으면 배터리가 빠르게 줄어들까요??,"이형 운동하고 있었구나...어쩐지 영상 올라올때마다 잘생겨진다했더니,,...,,",와 세계최강자들의 싸움이다,ㅋㅋㅋㅋㅋㅋㅋ인트로 개귀여움,내가 아무리 바빠도 잇섭 인트로는 보고간다,잇섭님 헬창되면 홍지승 팔씨름선수가 될거같습니다.,1:13 인싸가 되고 싶으면 저렇게 하는 것이 아닌 저 워치들을 다 뿌리면 됩니다!!,마라톤 하시는분들중에 애플워치+가민스마트워치or갤럭시워치+가민스마트워치 양손에 차시는분있는것처럼 그런 느낌인거겠죠?? ㅋㅋㅋ,헬창은 2개의 스마트 워치를 차고 헬스장을 간다...,"비교 영상 나오면 결론은 항상 요건 이런 장점이 있고 단점이 있지만 
저건 또 저런 장점이 있고 단점이 있습니다 ~ 끝",핏2를 살지 어메이즈핏 gts2를 살지... 고민이고만요,수면측정에서 미밴드는 만약 아침6시?7시?쯤에 자면 수면측정 안 해줍니다,"혹시 둘중에 원하는 시간에 방해금지하는 설정이 있을까요??
미밴드4 쓰고있는데 벗어도 책상에서 계속 진동이 울려서 매번 진동 설정하기 번거롭네요ㅜ","워터락을 푸실줄 모르시는 분이 많으신데 홈버튼 누르고 물방울 버튼을 위아래로 왔다갔다 하면 풀려요
+그리고 폰에서 따로 워터락 기능 삭제 가능해요",핏1 쓰면서 미밴드 배터리가 부럽던데 배터리 타임은 어떤지 궁금합니다!!,웨어러블 기기 사용할 때 전자파는 안전한가요? 수면측정을 위해 잘때도 항상 차고 있는데 그 부분만 조금 걱정이네요,"저는 미밴드를 4년 전부터 쓰기 시작했는데... 
그 4년 동안 계속 미밴드 2만 사용했었답니다 ㅋㅋㅋ 완전한 노인학대 ㅋㅋㅋ 
이번에 미밴드5로 갈아타고 나니까 컬러화면에 다양한 기능들이 있어서 속이 편하더라고요 ㅎ","저도 양손에 둘 다 스칼렛으로 차고 며칠
비교하다가, 핏2만 남고 미밴드5는 상자 속으로... 뭐 그렇게 되더라구요.^^",친구가 이사람이 뭐하는 사람이냐고 물어보길래 인트로만드는 사람이라고 해버렸습니다...,잇섭님 요즘 오만상사 영상이 더 올라왔으면 좋겠습니다 ㅎ,"이거보고 엄마아빠 운동하실 때 쓰시라고 시켰어요
좋은 리뷰 감사합니다~!","1:08 양손에 두손 합치니까
철콩철콩하기 좋음 포즈... 음흡흡",삼성헬스와 연동된다는 점 하나로 갤핏 주문했습니다...ㅠㅜ 다좋은데 워치페이스 커스텀부분을 어떻게 할 방법이 없으련지요,0:46 그의 팔운동 ㅋㅋㅋㅋㅋㅋㅋㅋㅋ,핏2스트랩이 아직도안나오고있는게 함정,우리 폴드 2는 펴질 수 없어 ㅠㅠ,형 알림 뜨자마자 날아왔어 미밴드4 사용자로써 영상 잘 보고갈께 영상 퀄리티는 형이 최고다 진짜..,핏2 쓰고 있는데 우선 일상생활에서 가장 크게 느껴지는 불편함은 두께가 두꺼워서 옷이나 움직일 때 사물에 걸린다는 점? 기분 탓인지 뭔지 모르겠는데 살짝 헐겁게 찼는데 어느날 갑자기 손목 가만히 있어도 아픈 ㅠㅠ,"미밴드가 솔직히....더 이쁜것 같아욬ㅋㅋ
내일 시험인데 이러고 있는 내가 ㄹㅈㄷ","갤럭시 핏2의 경우 휴대폰과 핏2의 거리가 많이 떨어져 있어도 전화, 메시지, 카톡 알림이 오나요?   예를 들어 휴대폰은 집에 두고 핏2만 가지고 운동을 갔을 때도 위에서 말한 알림을 받을 수 있는 건가요?",아무리 겔 핏트 있었어도 미 밴드 에 갓성비 는 아무도 못 이기죠... ㅋㅋㅋㅋ,"지난번 핏2 영상 보고 미밴드5 구매 해서 사용 중입니다.
대만족중이에요 ㅎㅎ","오! 둘다 사고싶지만 아이폰에서 업뎃이 가능할까요???









나같은 사과덕후는 애플워치를 사는게 더 좋을것 같은 주관적인(?) 생각",섭아 이건 진짜 궁금했다 알려줘서 고마워 ㅋㅋㅋㅋㅋㅋㅋㅋㅋㅋㅋㅋㅋㅋㅋㅋㅋ,핏2 아이폰 연동 어떻나요?,개인적으로 최고의 제품이라면 갤럭시 핏2와 샤오미 미밴드5를 합치면 최고의 제품이 될듯,저도 어메이즈핏 밴드5 체험단때문에 액티브2유저인데 시계 2개씩 차고다녔는데 이질감이 엄청나더라구요....ㅠ,"미밴드와 핏2 자세한 사용 비교가 궁금했는데
이렇게 딱 올려주시니 시간만 버리고 갑니다.","스트랩과 충전 생각하면
뭐 무조건 미밴드5",뭐지 이형이 하는 말은 왜이렇게 귀에 잘들어오지?,"진핑이 형에게 일상을 공유하려면 미밴드!
낮은 완성도를 원하면 갤럭시 핏2!","카톡 같은 경우엔 작은 화면으로 보기 힘들어서 그런지
가장 최근에 온 메세지만 보이는 건 크게 신경 쓰이진 않았네요",미핏이 화면 귀엽고 예쁜게 많음 ㅋㅋ,"잇섭님한테 인트로 유튜버라고만 하면 잇섭님은
섭섭해 하신다
(잇섭 2행시)







사실 본영상은 10초정도 밖에 안됨","지난번 갤럭시핏2 구매기에서도 여쭤봤는데,
혹시 다른 블루투스 이어폰이나 차량용 블루투스와의 블투 간섭현상은 따로 실험해보시지는 않았을까요?
미밴드4 와 노트8을 쓰는데 블루투스 간섭현상이 심해요ㅜㅜ",잇섭님 아우성 자주가시는구나... 진짜 존맛이에연,마우스 mx master 3 쓰시는군요 ㅎㅎㅎ 정말 좋은거같아요 리뷰 하신적이 있었나?,삼성 헬스에서 식단 관리가 있어서 저는 갤핏2  써요. 식단 관리 필요 없고 다양한 신체정보 보시는 거 좋으신 분들은 미스케일이랑 미밴드(혹은 어메이즈핏) 쓰시는 게 좋습니다.,진짜 고민중일때 딱 올라오내 왕 굿,제가 봤을때는 미밴드쪽의 노련미가 돋보인다는 느낌이 드네요,1:10 길 위에서 야생의 흑우가 나타났다. 사과를 던져주니 효과는 대단했다,앜ㅋㅋㅋㅋㅋ 역시 인트로 맛집,"잇섭이형 ㅋㅋㅋ 인트로가 점점 고급(?) 지네 ㅋㅋㅋ
아이폰 12 영상 언제 올라와??","1:10 따라하다가 오히려 망할 것 같아요....
그러면 인싸 안되고, 따라하다 안되면 
잇섭채널 2주간 압수!!",핏이고뭐고 폴드 개쩐다,"지금은 추워서 자주는 안 가지만 아버지랑 야외운동을 다니는데(웃긴건 각자 다른거함ㅋ).. 저는 미밴드5 쓰고 아버지는 핏2 나오자마자 선물해드렸어요. 다른 건 몰라도 기기조작하는 거 잘 못하시는 어른들 같은 경우는 확실히 삼성꺼가 좋은듯요^^;
영상 잘 보고 갑니당ㅎㅎ",집에서 자전거로 운동하는데 둘중뭐가더좋나요?,형 오른손 운동 주로 뭐로 해?!,밴드 색깔도 완전 시선강탈 ㅋㅋㅋㅋ,갤핏도 페이스 커스텀 되면 좋겠다..,"0:00 잇섭형, 이거 할때 팔굽치를 70도 정도 가슴쪽으로 놔야해","미밴드 정말좋은듯
알림도 잘되고
충전도 잊을만할때 하고
가격은 정말 저렴",폴드의 화면이 의외로 직관성있게 와닿네요 접는 편리함에 그닥 의미를 두지않았는데 생각을 바꾸게되었습니다.,"저는 학생인데 갤럭시 핏은 1원정도 차이가나서 미밴드가 쫌더 가성비 갑인거 같아요 하지만 갤럭시 핏2는 왠지 갤럭시라는 이름때문에 뭔가더 좋아보임 ㅎㅎ 그리고 가장 장정! 핏2는 손목에 착용할시 손목에 맞겠지금 디자인이 돼있지만 미밴드는 갤럭시 핏2랑 다르게 평평해서 잠자고 있을떼 깔리면 쫌 아프더라구요 
그리고 밴드 줄은 갤럭시 핏2가 쫌더 딱 맞게 조절할수 있어서 좋은데 안에 뭔가 걸리는느낌이 있고 미밴드5 는 끼는겄도 조금 그런데 안에 걸리는 겄은 업더라고요 ( 맞춤법 틀릴수도 있어요 )",ㅋㅋㅋ왜인트로를 근손실로 표현해놓냐고ㅋㅋ,"수먄측정이랑 운동측정은 어째 핏1이 더 정확한거 같네요. 아버지가 핏2 제가 핏1 쓰는데 핏1이 더 정확한거 같습니다. 미밴드5랑 핏1 쓰는중인데, 어째 개인적으로는 핏1이 미밴드5랑 동급이 아닌가 싶습니다.

미밴드도 알림(진동)을 자주 받으면 베터리 빨리 달더라구요... 단톡방에 있으면... 흐흐흐.... 손목에 징징거림이란...",한쪽은 갤핏 한쪽은 헬스장 락커키면 균형 쌉가능,"있섭님의 ck108황축 리뷰 기원 1일차





아 그리고 나 내일 시험이네.......",워치쓰다 밴드쓰면 가벼운게 개지림...근데 디스플레이 크기 많이 답답함..,ㅗㅜㅑ 폴드2 디플 교체하셨군요,"형 요즘 운동하는구나? 
왠지 더 잘생겨지고 인물도 훤칠해지고 어깨도 넓어진거 같더라..",코리아는 코리아껄 써야지 ㅋㅋ,그래서 3주전에 커뮤에 올리셨던 Q&A영상은 언제 올리시는건가요?!,"0:41 똥을 싸는 신성한 시간엔 필수죠ㅋㅋㅋㅋㅋ


1:12 그건 형이 너무...












아니 뭐 그렇다고.....ㅎㅎㅎㅎㅎㅎㅎㅎ",7:42 이건 미밴드도 워치페이스를 바꾸면 가능하긴 합니당,캬~ 역시 밴드는 양손에 하나씩 차줘야ㅈㅣ,잇섭님이 쓰시는 미밴드 워치페이스는 직접 만드신건가요??,형님 오늘 핏2 업데이트 하니깐 미밴드처럼 여러 알림 볼 수 있습니다!,0:42 ㅗㅜㅑ 근손실 최강자,"갤핏2 실사용 중인데 풀기 편해요
똑딱이 먼저 풀고 당기면 쉽게 풀려요",둘다 써보면 잘 아시겠지만 핏2가 더 나아요... 특히 삼성이면...,"잇섭님, 혹시 오너밴드 (Honor Band)랑 미밴드 (Mi Band) 비교 리뷰 가능하신가요?","미밴드 핏2 둘다 가지고있는 입장에서 
미밴드 장점은 
꾸밀수있다
진동이 세다 

핏2 장점 손목이 더 편한다  
UI, 폰트가 깔끔하다
답장기능이 있다(사실 이거하나로 압승이긴함)","00:45 ㅋㅋㅋㅋㅋㅋㅋㅋㅋㅋㅋㅋㅋㅋㅋ
도랏네 ㅋㅋㅋㅋㅋㅋㅋㅋㅋㅋㅋㅋㅋㅋ",잇섭님 영상보고 미밴드5를 며칠전 쿠팡에서 구매 했어요 감사합니다 ㅎㅎ 헌데 수면체크가 안되서 기기를 교체 했네요 이번에 온것도 안되면 AS센터를 가야할지 모르겠습니다 ㅠㅠ 혹시 수면체크 안되는 증상에 대해 들으신거 있으시면 정보 부탁 드리겠습니다. 다른 건 모두 잘 작동 하는데 수면만 안되네요 흑흑,헬스장에서 인싸 된 기분은 어떻셨나요?ㅋㅋ,"아니 이 분 뭐죠?
제가 핏2랑 미밴드랑 고민하는거 어케 알고 비교영상을..? 이 영상을 보고 미밴드 결제했어요! 고민 해결 감사합니다 갓섭님 :D <3",혹시 워치랑 핏이랑 동시에 사용가능한가요?? 운동할땐 불편해서 핏을 하나 살까하는데..,인트로 너무 웃겨ㅋㅋㅋㅋㅋㅋ,"다른기능 다필요없고 혈압측정 기능있고 혈압측정 잘되는 스마트워치가 있을까요??

부모님 사드릴려하는데 혈압측정 하나보고 사기엔 갤럭시워치3가 넘 비싸네요ㅠ",와 자석지갑 저걸 샀네🤣🤣,갓밴드....,근손실 방지 = 흑우짓 멈추기 방지,미밴드 4 쓰다가 갤핏 2 쓰고 있는데 다른건 마음에 들더라도 시계화면 커스텀 안되는 거는 아쉬웠네요 ㅠㅠ,미밴드에 메탈 클립밴드 바꿔서 끼니까 크기도 더 커 보이고 테두리는 메탈이라 훨씬 더 맘에 들더라구요,진짜 감사합니다,미밴드 사용잔데 가끔 해피타임 즐기고 있는중에 갑자기 활동 목표 달성해서 진동 울리면 현타옴,핏2 구입했습니다. 운동할때 괜찮네요.,1:08 그래서 인싸가되려면 두개의 밴드를 투자해서 헬스장에 가면된다 이말이지...??,형사랑해 😻,잇섭님 진짜 다이어트 중이신지 홀쭉해지셨네요 ㅎㅎ,"커스텀 하나만으로 미밴드로 바로 끌려버렸다..
나머지 단점이 다 커버될정도로",헐 감사해요ㅠㅠ 저번에 아이폰 유저로 어떤게 나을까 댓글 달았었는데 미밴드 갑니다,왜 항상 바지에서 상품을 꺼내시는거죠?ㅋㅋㅋㅋㅋㅋㅋㅋ,핏2 와이파이 연결할수있나요?,일주일 동안 양손에 밴드..ㅗㅜㅑ...,형 이거얼마나 기다렸는데ㅋㅋㅋㅋ,"현장직인데 할때 미밴드 착용하고하면 간혹
영상에 말처럼 툭 걸려서 풀리는 경우도 많았습니다. 
그래서 화면은 팔안쪽에 둬서 바꿔 끼는게 이젠 아예 생활화되버림",07:04 ㅋㅋㅋㅋㅋㅋㅋ 형 사랑햌ㅋㅋㅋㅋ,잇섭님 그거 AKG 같은 경우 노이즈 캔슬링이라고 하면서 안에 어떤 부품이 들어갔는지...보여주는데.....혹시 그걸로 정지 해서 보이는 대로 조림을 했을때 사지 않아도 직접 집이서 만들 수 있을까요?,에어팟프로 리콜떳다는데 새로나온 톤프리도 리뷰해주세용,핏2 오늘 받았어요 사은품 ♥,아니 전에는 카드가 거기서 나오더니 이번에는 그게 거기서 나오네... 도라에몽이야?,0:05 아니 왜 맨날 이런데서 나오는뎈ㅋㅋㅋㅋㅋㅋㅋ ☺️😊,ㅋㅋㅋ 마지막에 애플의 미친가격 돌려까기 ㅋㅋㅋ 아 삼성폰 싫어서 아이폰 왔는데... 미밴드를 써야 하나요~? ㅠㅠ,ㅋㅋㅋㅋㅋㅋㅋㅋㅋㅋ아니 인트로 미쳤나고 ㅋㅋㅋㅋㅋㅋㅋㅋㅋㅋㅋㅋㅋㅋㅋㅋ,"""꼬셔볼려고""는  그 판매하시는 분이 ""오... 저 놈 돈좀 있나봐 꼬셔야겠다""의 꼬신다의 의미이지 이성을 꼬신다는 의미가 아닙니다.
네 머 그렇다구요","핏1쓰다가 동생한테강탈당해서 고민중이였는데
감사합니다",오른손 운동 미쳣 ㅋㅋㅋㅋㅋㅋㅋㅋㅋㅋㅋㅋㅋㅋㅋㅋ,1:08  헛된 희망 품지 마시죠 잇섭형님 ㅋㅋㅋㅋㅋㅋㅋㅋㅋㅋㅋㅋ,뭐살까 고민이였는데 많은 도움이 되었습니다 미밴드로 가겠습니다 ㅋㅋㅋ,그 형 두개쓰면 사람들이 그냥 이상한 사람으로 보는거야 꼬시려는게 아니라...,"화면크기, 배터리 빼고는 핏1이 나은듯","형 이거 기다리다가 없어서 그냥 미밴드 샀어...
1주일만 기다릴껄 ㅠㅠ 





형 그리고 라데온 리뷰 한번만 ..",1분마다 자동 심박수측정으로 했더니 7~8일만에 방전되던데 원래 이런 건가요?,저는 갤럭시핏2를 착용하면 찬 부위가 시큰거리는 느낌이 계속 있는데 저말고도 이런 느낌을 받으시는 분 계실까요??,안녕하세요 영상 너무 감사합니다. 여쭤볼게있어서 댓글 남깁니다. 갤럭시핏2를 운동용으로 구매할지 고민중인데 휴대폰을 집에 두고 뛰면 아예 측정이 안되눈건가요?,"형 카키색 맨투맨 너무 멋져요~~
어디건가요?",드디어..ㅋㅋㅋㅋㅋㅋㅋㅋㅋ,잇섭님 혹시 미밴드5 시계 24시간 말고 12시간으로 바꾸는 방법 아시나요..ㅠㅠ 한국 정발제품을 샀는데 어디서 하는지 모르겠어요..,ㅓㅜㅑ 형 살빠졌어? 손이 왤캐 예뻐졌어,어이어이 이 영상을 보고 있는 모두들 근손실 나니깐 운동하면서 보라구 (;' w ' ;),근데 핏2가  더 배터리가 오래가요,,,,,,,,,,,,,,,,,,,,,,,,,,,,,,,,,,,,,,,,
