12,"여러분들의 구독, 좋아요, 알람 설정은 저희에게 큰 힘이 됩니다❤

▶ 인스타그램 https://www.instagram.com/goniduyeonmon
https://www.instagram.com/duyoni_0131
▶ 페이스북 https://www.facebook.com/GoniDuyeon
▶ 매일 오후 7시 업로드!!
▶ 촬영 장소 : 하남시 망월동 1111-1
❗각 기계의 구성은 소유주의 권한에 따라 상시로 변경될 수 있음을 미리 공지드립니다","고니두욘몬 유튜브 채널 본지 어느덧 4년 ㅠㅠ 
중1 때쯤 인형뽑기에 빠져서 매일 봤는데 지금은 고등학생이 되어서 대리만족으로 계속 보고 있어요 ㅠㅠ
항상 응원합니다!💕💕","오늘의 교훈  세상은 넓고  가품도 많이 있다
오늘도  잘보고 갑니다",맨날맨날 잘 보고있습니다💕💕,"박스 흔들었을때 달그닥 소리 듣고 빵 터졌음.
ㅋㅋㅋ","푸쉬에 가품이 많은거 같아요ㅋㅋㅋ 
오랜만에 푸쉬~~ 잼있게 보구갑니당^^","ㅎ.ㅎ 저도 찐인줄 알고 뽑았는데
아닌건 둘째고 한쪽은불량.ㅋ.ㅋ
오늘도👍👍
수고하셨습니다 😊",헉 푸쉬 진짜 오랜만에 봐서 더 재밌네용 ㅎㅅㅎ,정품을 저런곳에 넣을리가 없죠 혹시라도 넣어놓으면 아예 꿈쩍도 안할듯 ㅋㅋ,오늘도 잘보고 갈게요~!,오오 정품은 아니여서 아쉽지만 그래도 밀대뽑기에 에어팟이들어있다니 신기하네요!!,"오늘도 잘볼게요옹!

고니두욘몬을 사랑한다고~~롤리~롤리~롤리",차이팟프로는 처음보네요ㅎ 신기하넹ㅎㅎ 오늘도 영상 잘보고갑니다 ✋,헉 축하축하 해요 형누나 다음에는 찐품 자동차 뽑앜 ㅋㅋ,이런 뽑기는 오랜만이네요!,"ㅋㅋ 오늘도 행복했습니다ㅡ
두분도 행복하고 건강한날만 되삼ㅡㅡ",와... 에어팟프로 정품은 아니지만 부러워요😭,오늘도 잘보고갑니다!!!!,오 푸쉬 잼나게 보구 가요~~😎,저도 낚였네요ㅋㅋㅋㅋ진짜 가품 만드는 기술은 나날히 발전하네요~,요즘은 가품도 잘 만드네요ㅋㅋㅋㅋㅋ,늘 응원해용,가품이 판치는 세상 ㅜ  잘 뽑으셨엉ᆢ^^,"진품명품 티비 프로가 생각나네요.
대다수가 한짝만 있는데 신상 인가봐요 😆","저것은 짝퉁이라면 차이팟프로 인가...ㅋㅋㅋㅋ
진짜 완전 정품이라 해도 믿겠어요",오늘 사자마자 꼈는데 왼쪽 귀에서만 바람소리처럼 소음을 내는데 왜이런건가요ㅠㅠ,저랑  비슷하네요 .저도 저거뽑았는데 .가품 똑같음  ㅎㅎ .잘보고  가요 .,저 대구에서 많이 뽑은 차이팟이네요... 박스 두께가 작은편이고 구성품이 달라요,오!!!축하드려요ㅎㅎ선댓후감상하고갈게용ㅎㅎ,영상 올리시느라 수고가 많으세요 영상 잘 봤답니다,나도 뽑으신거랑 똑같은거 뽑앗는데 정품인줄 알앗다가 가품이네요ㅋㅋㅋ 그래도 지금까지 잘쓰고 잇네용ㅋㅋㅋ,"저도 낚시에당해 지금잘쓰고있어요ㅠㅠ
기대이상 입니다",차이팟 프로 라고 하죠 성능은 괜찬은데 통화가 조금 노이즈 있음 잘쓰고 있음,그 어디에도 애플마크는...ㅜㅜ,와 그래도 짝퉁이라고 표기하지 진짜같이 만들어서 사람들 돈쓰게 하는 사장님은 데체 ㅋㅋㅋ,재미있네요 재미있게보다가요,요즘 짭도 거의 정품이랑 비슷하게 해요 심지어 정품인증도 조작해요 모르는 사람은 진짜인것처럼 착각해요,Killing point 7:26,ㅎㅅㅎ,박스만 봐도 알았음 ㅋㅋㅋㅋ 박스에 애플마크와  시리얼등등이안적혀있음 ㅋㅋㅋ,완전 겉박스에 낚이셨내욥!!,ㅋㅋㅋ,"오늘은 영상보시기전에 👍과  좋아요 눌러주세요 않하네요 ㅠㅜ 근데저는 구독과 
좋아요 누를게요😀","차이팟 프로라고 하죠^^
카피해서 중국에서 만듭겁니다~",에어팟 프로 가품 노이즈 캔슬링도 되나요~?,"뽑은신거 차이팟이예요ㅋㅋㅋㅋㅋ
아는분도 진품인줄알고뽑앗다가.. 
가품이라고 하더라구요
음질안좋데요~~~~","광훈대역  윗쪽  다  치워놨습니다 
힘이 아니라  집게가 잡지는 못하네요 
ㅜㅜ 
개털림   근처면 가서보세요  걸리적거리는거 없이 다치워 놨어요  
이어폰 뽑아가세요ㅜㅜ",저이어폰 혹시 차이팟프로는 아니까요?,Give way dong bos😁😁,"아 내꺼랑비고해보려했는데 정품이 아니네ㅠㅜ
옆에 애플로고부터가 없어서 바로차이남","정품이 아니여서 아쉬워요
겉박스에 낚였네요ㅠㅠ",가품 맞아요 ㅋㅋ 저도 겜방에 넣어놨길래 다 확인해봤는데 가품 안뽑았어요 좋아요 꾹 ㅋㅋ,짝퉁 중국제,"이거 에어팟프로 짭이에요 원레는 에어팟프로 글씨와 애플로고가 박스에 써있고 비닐도 잡아당겨서 뜯을수있는 손잡이가 있어요 그리고 케이그와유닛에
각인도 원레는 있는데 저건 없네요
중국놈들이 저거보다 훨씬 더 비슷한거를
만들더라고요 노캔하고 주변소리되는거하고 이어팁도 같고
공감음향도 되고 각인도있고요 이름도 바꿀수있는거요.이놈에 중국놈들...",🍀,짝퉁이네요ㅠ 겉포장이 허술하네요,악ㅡ 낚였네요 흑흑,저거 9천원짜리 에어팟 짭이에요,8,,,,,,,,,,,,,,,,,,,,,,,,,,,,,,,,,,,,,,,,,,,,,,,,,,,,,,,,,,,,,,,,,,,,,,,,,,,,,,,,,,,,,,,,,,,,,,,,,,,,,,,,,,,,,,,,,,,,,,,,,,,,,,,,,,,,,,,,,,,,,,,,,,,,,,,,,,,,,,,,,,,,,,,,,,,,,,,,,,,,,,,,,,,,,,,,,,,,,,,,,
13,진짜 민성님이 IT 유튜버중에 제일 쉽게 설명해주시고 귀에 쏙쏙 들어오는 것 같아요 최고👍,"크기가 크면 배터리랑 화면은 쾌적하지만 무겁고
반대로 크기가 작으면 배터리랑 화면은 작지만 가볍고
어쩔 수 없는 딜레마네요","배터리 진짜 공감합니다. 
12 프로 맥스 사용하고 나서 단 한번도 하루 종일 써도 10퍼센트 이하로 간적이 없어요.
애플의 배터리 순삭 문제를 못느끼게 하는 제품입니다.","저도 12프맥 사용하면서 느낀것들을 다적어주셧네요 ㅋㅋㅋ 물론 7플,xs max 쓰면서 누적된것도 있을거같긴한데 장점 단점 다 팩트 그자체 ㅋㅋㅋ","13프로가 카메아 더좋을꺼요?아니면
12프로맥스가 더 좋을까요?","진짜 배터리는 정말 만족합니다. xs쓸 땐 쑤욱쑤욱 닳았는데, 70프로대여도 그냥 출근하고 야근해요😋","xr이라 12,13시리즈 둘중 고민중이긴한데 일단 13 프로 존버",믿고보는 이츠오케!!👍👍,잇초(~~~-)케  할때 숨참고 봤어욬ㅋㅋㅋㅋㅋ,크면 무거운거 공감해요 ㅠ 아이폰은 아니지만 s21 울트라 사용중인데 너무 무거워서 케이스 빼고 삼케플 들고 쌩폰으로 쓰고있어요 ㅋㅋㅋ,"12프로 살려구 악세사리 다사놨는데
지금사서쓰고 14나15로 넘어갈지 
그냥 13프로 존버할지 심각하게 고민될때 어떻게하면  좋을지",저도 프로맥스 살려다 프로 사는데 프로가 딱맞는거 같네요,재밌어용❤ 민성님꺼 보면 항상 애플꺼 갖구싶어여..근데 삼성꺼랑 엘지꺼만써야 회사에서 휴대폰비가 지원이되서ㅠㅠㅠㅠ,으잉? s대 출신이면 미드는 자막없이 감상해줘야 하는 것 아닌지요? ㅋㅋㅋ,지금 이게 제 고민이었는데 ㅠㅠ 고마워요,오늘 왤케 귀여운거야,"이미 두 달 전에 12프로샀어요ㅠ
13존버 실패",12 프맥 256 그래파이트 주문박아두고 유튭망령으로 12프맥보고 다니는데 영상 잘봤습니다,어머낫 색상도 같네요❤,9:55 저도 폰이 무거운데 손가락이 휘었어요ㅋㅋㅋㅋㅋ,"12프로맥스 저도 8개월썼는데요,, 이번에 z플립으로 넘어가보려구요 ㅜㅜ 저는 남자인데 적응되서 그런지 들고있을때 무거운건 모르겠고 주머니넣었을때 바지흘러내림이랑 양말신을때 불편해요ㅋㅋㅋ",후기 잘볼게용 민성님 ㅎㅎ,ㅋㅋ 그냥 프로도 무거운데 저건..,아이폰 12프로맥스 아이폰13프로맥스 어떤걸 선택해야 할까요 흐아..,새끼손가락 받치면서 휴대폰 쓰는 사람 특징이 있네 ㅋㅋㅋㅋㅋㅋㅋㅋㅋㅋㅋㅋㅋㅋㅋㅋㅋㅋㅋ,민성님 너무너무 예쁘세요,맥스 넘모 무거웡.. 손목 아작남 ㅠㅠ,썸네일 귀엽ㅎ,잘보고 갑니다.,잇츠님 주말 잘지내셨나요,이이이.....  아 감질맛나...,크아고수.....,영상에서보면  왼손으로 자주 사용하신다고 하시면서 핸드폰을 들어올리신 손이 오른손으로 보이는데 반전되서 그런건가요? 아니면 말은 그렇게 하셨지만 오른손으로 들어올리신 건가요. 왼손을 언급하시고 들어 올리셨으니 왼손일것 같은데 영상으로 보면 오른손이라 트집을 잡는게 아니라 정말 궁금해서 여쭤보는 겁니다. 카메라로 찍으면 거울처럼 반전된다고 하는데 그런 경우 일까요?,6:53 자막이 se시리즈인데 12로 잘못나왔어요,이이이잇츠 ❤️,지금 딱고민중이었는데,배터리 용량이 작아서 아쉬워요..ㅠㅠ,큰 화면 되문에  사용중 ㅋㅋ,사도됨x10000 강추,1분전은못참지,저도 아이폰12 프로 맥스 유저로써 너무 공감이 됩니다 ㅎㅎ,아이폰13존버중,等13吧,잇하잇하~,00:24. 자막…,❤🧡💛💚💙💜,성형실패했네,마 운동좀해라 그기 뭐 무겁다고 엄살이고??,목소리가 짜는(?) 목소리라 하나 보고나면 귀가 너무 피로해짐 ㅜㅜ😭,"아이폰이 좋은 이유는 아이폰만의 소프트 웨어를 사용하니 배터리도 오래가고 보안도 좋은 것은 당연하다...거기다가 이전에 삼성에서 화면을 크게하니 멋대가리 없다는 식으로 소개를 많이 하더만요...다들 애플빠 들이 그런것을 모르는 사람들은 애플이 다 모든것에 좋다라고 한다...그러나...실제는 하드웨어는 차이가 없다..오히려 삼성이 앞선다.단 소프트 웨어는 태생이 그래서 어쩔 수 없다.가격과 AS는 개 거지다...그런데도 사는 이유는?????알 수가 엇다 특히 여자분들 많이 사더만요....이해 안가는 것은 뭐...어쩔 수 없어요...개인적인 의견,,,",,,,,,,,,,,,,,,,,,,,,,,,,,,,,,,,,,,,,,,,,,,,,,,,,,,,,,,,,,,,,,,,,,,,,,,,,,,,,,,,,,,,,,,,,,,,,,,,,,,,,,,,,,,,,,,,,,,,,,,,,,,,,,,,,,,,,,,,,,,,,,,,,,,,,,,,,,,,,,,,,,,,,,,,,,,,,,,,,,,,,,,,,,,,,,,,,,,,,,,,,,,,,,,,,,
