,0,1,2,3,4,5,6,7,8,9,10,11,12,13,14,15,16,17,18,19,20,21,22,23,24,25,26,27,28,29,30,31,32,33,34,35,36,37,38,39,40,41,42,43,44,45,46,47,48,49,50,51,52,53,54,55,56,57,58,59,60,61,62,63,64,65,66,67,68,69,70,71,72,73,74,75,76,77,78,79,80,81,82,83,84,85,86,87,88,89,90,91,92,93,94,95,96,97,98,99,100,101,102,103,104,105,106,107,108,109,110,111,112,113,114,115,116,117,118,119,120,121,122,123,124,125,126,127,128,129,130,131,132,133,134,135,136,137,138,139,140,141,142,143,144,145,146,147,148,149,150,151,152,153,154,155,156,157,158,159,160,161,162,163,164,165,166,167,168,169,170,171,172,173,174,175,176,177,178,179,180,181,182,183,184,185,186,187,188,189,190,191,192,193,194,195,196,197,198,199,200,201,202,203,204,205,206,207,208,209,210,211,212,213,214,215,216,217,218,219,220,221,222,223,224,225,226,227,228,229,230,231,232,233,234,235,236,237,238,239,240,241,242,243,244,245,246,247,248,249,250,251,252,253,254,255,256,257,258,259
0,"지병수 할아버지? ㅋㅋㅋ
지난번 극한직업 대사도 포함해서... 역시 대세(?) 유행(?)을 현실 반영해주시네요. ㅋㅋ 역시 인트로... 유튭.... ㅋㅋ
음... 저는 일단 무선 충전 케이스만 사렵니다. ㅋㅋ",영상 기다리고 있었어요 잇섭님 영상은 믿을 수 있으니까요! 얼른 한국에서 정발 되었으면 좋겠어용,역시 믿고보는 잇섭님 1세대를 쓰는 저로서는 안넘어가는게 답이네요 ㅎㅎ,"항상 유용한 정보들 감사해요!😄
이번에 아이패드 저렴한 가격에 구매하고 싶은데
아이패드 미니 5 vs 아이패드 6
둘 중에 어떤 걸 더 추천하시나요??
개인적인 의견 궁금합니다","전철,집에서 게임용으로 이번 월급날에 살려고했는데 그래도 충전포트가 있군요 감사합니다!",형인트로까지만 올려도 조회수 1만은 찍을것같아,"역시  궁금한점을 해결해주는 섭님! 당신은 사이다!
중고 구매시  1세대와 2세대 구분을 어찌 할까? 고민 이었는데..감사 감사 ~^^",진짜 1년 존버 하고 사려는데 쫄려서 형 영상 나올때까지 기다렸어!!,처음 보는데.. 전자기기 리뷰가 이렇게 재밌을 일인가 ㅋㅋ 구독하고 갑니당,"음질부분 하루종일 들으셨다고하니 믿음이 가네요 다른 유투버들은 잠깐들어보고 더 좋아졌다 똑같다 모르겠다 이러는데
너무 좋은 리뷰 였습니다!!!",인트로 미쳤네요 진짜ㅋㅋㅋㅋㅋㅋㅋㅋㅋㅋㅋㅋㅋㅋㅋㅋㅋㅋ 그 동영상 보고 오면 재미가 2배ㅋㅋㅋㅋㅋㅋㅋㅋㅋㅋ,잇섭님은 언제봐도 재밌으십니다!,왜 시리가 인식못했지 🤣🤣 잇섭님 넘 좋아여😍,"볼때마다 생각한게 한번식
눈치보여 소리없는상태로 볼때가 있는데 잇섭님은 자막을 달아줘서 참잘보고있습니다",와 ㅆ인싸!! 할담비 미쳤어를 벌써 패러디 하다니!! 인정합니다!!!!,잇섭님 진짜 감사합니다ㅜㅜㅜ아이폰 x를 사용하고 있는데 자막 때문에 그냥 일반 모드로 사용 하고 있는데ㅜㅜ또 잇섭님은 자막을 좀 더 위로 해주시네요ㅜㅜ 감사합니다,잇섭님 인트로 하나도 빠짐없이 다 맘에드는듯 ㅋㅋ 짱잼나요 전자기기 리뷰를 재밋게 하다니 ㅎㅎ 짱좋아염,애플이 머리 잘쓴것같다 진짜 무선충전케이스만 따로 파는것과 충전확인 불 위치도 밖으로 빼내서 케이스까지 따로 사야되겠끔 해놨네,설명 항상 잘 듣고 갑니당~,진짜 항상 인트로 넘 웃기게 잘만드세요 ㅋㅋㅋㅋㅋㅋㅋㅋㅋㅋㅋㅋㅋㅋㅋ,"오늘 킨텍스에서 잇섭님 덕분에 아이폰 샀다고 한 팬이에요!!! 사진요청 흔쾌히 응해주셔서 감사합니다 잇섭님 ㅠㅠ 
세상 이런 좋은 사람이 없 ㅠㅠㅠ",오늘 영상도 재밌게 잘봤습니다 혹시 차후360 한달 후기 업로드 예정이 있으신가요? 요즘 로봇청소기 구매 생각중인데 샤오미2세대랑 차후360 중에 너무 고민중이라서요ㅠ,인트로 모음 하면 기본 40만이야 형 가즈아ㅏ,인트로 너무 웃겨서 몇번째 돌려보는지 모르겠네요 ㅋㅋㅋ,게임 레퍼런시가 좋아졌다는데 어느정도 지연현상이 개선됐는지 궁금합니다 게임영상과 소리 리뷰되나요?,직구하는게 슬슬 오는걸 보니 이제 미니랑 에어도 볼수있겠네욥!!! 잇섭님꺼 보고 사야겠어요.,이 영상 인트로만 몇 번보는지.. 나도 모르게  흥얼 거린다,형은 피드백 잘해줘서 좋아 ! 백만 가즈아,1세대랑 2세대랑 게임실행시 딜레이 차이도 보여주실수있나요?? 궁금해서요,"인트로는 정말 최고네요. ㅋㅋㅋ 
어디서 그런 아이디어가 샘솟는지",2:26 에서 형님 클라스를 봤습니다. 그냥 내동댕이,미쳤어 왤케 중독되냐ㅋㅋㅋ,에어팟프로가 나온 이시점 유투브 알고리즘이 이곳으로 나를 이끌었다 ....,"개인적인 생가그
착용감 버즈 > 아이팟(1)
음질     버즈 < 아이팟(1)",아 잇섭님 말투 개좋아 ㅋㅋㅋㅋㅋㅋㅋㅋㅋ중독성있음 뭔가,2:26 라이트닝 케이블 확인을 위해 정작 본체는 던져버리는 상남자,무선 충전이랑 유선 충전 중에서 어느 것을 더 추천하시나요?,인트로 미쳤누 ㅋㅋㅋㅋㅋㅋㅋㅋㅋㅋㅋㅋㅋㅋㅋ 인트로 보고 구독하고 갑니다 ^오^..... 좋은 정보 감사드려요~~~,"잇섭님 혹시 에어팟2세대 유선도 힌지 부분이 무광인가요?
아니면 유광인가요?",데자와를 즐길 줄 아는 진정한 남자,아내몰래하실때 표정 ㄷㄷ,도입부 노래 왤케 해맑고 이상한데 신나냐고요ㅋㅋㅋㅋㅋㅋ손담비랑은 아주 다른느낌인데 묘하게 재밈ㅅ어서 모지 하면서 벌써 3번봄,1세대와 2세대중에 가성비만 따지면결론적으로 2세대가 더 좋은가요? 짝퉁구별법도 알려주세요,형... 매번 이런 제품이 나오면 굳이 살필요는 없다고 하지만 형은 결국 신제품을 쓴다는 점에서 사야한다는 욕구  필요성이 보이는걸?,할아버지가 훨씬 더 잘하시는거 실화냐 ㅋㅋㅋㅋ,쓰레기봉지에 아무것도 안들은 거 보니 인트로 찍고 다시 줍기 위한 것이로군요,형님 정말 상남자 이시네요. 박스를 과감히 던져 버리시네요. 저같으면 나중에 중고로 팔때를 대비해서 박스를 고이 잘모셔 둘것 같습니다. 항상 영상 잘보고 갑니다. 너무 무리 하지 마시고 몸생각 하면서 일하세요. 감기 조심 하세요.,인트로 미쳤어~ 너무 재재재재밌어~,"이런식으로 새로나온 버즈나 에어팟2 영상을 볼때마다 드는 생각이 2년 전에 나온 에어팟 1세대가 정말 잘 만든 기기구나 라는게 느껴지네요
진짜 최근에 나온 코드리스 이어폰에 전혀 딸리지가 않아서요",S9 쓰는데 버즈나 에어팟2 중에 고민되네요 ㅜㅠ 뭘 더 추천하시나요 ??,1:31 저건 박스에 무선충전 기능을 탑재해서 그런거 같습니다 ㅋㅋㅋㅋㅋ,"아.. 어제 인트로 겁나 돌려보고 
오늘 또 생각나서 보러옴..",잇섭이 10만명 때부터 지켜봤는 데 설명이 스무스하게 찰지네,이거 2세대 유선 충전은 진짜 1세대랑 거의 비슷합니다! 무선 충전은 좀 다릅니다 ㅋㅋㅋ,인트로모음집 이런거올려주심 꿀잼일듯ㅎㅎㅎㅎ,"에어팟이 워낙좋다보니 삼성폰으로 사용하는 혼종들도 많은데!!(저포함ㅎ)
갤럭시와의 호환도 영상찍어주시면 조회수 높을듯합니다~~","아놔ㅏ 아내 몰래 바꿀수 있다니!!! ㅋㅋㅋ 아내들 긴장해야 하는건가요 ㅋㅋ 
시리 ㅜㅠ 내 시리가 야단 났어요ㄷㄷㄷ 빵터짐!",플랫형 무선충전기가 아닌 스탠드형 무선충전기에서도 잘 충전되나요? 알려주세요~^^,"6
혹시 여기서 여쭐건 아닌거 같은데 원래 에어팟 2세대 무선충전인 본체 에 들어있던 유닛을 2세대유선충전인 본체에 끼워도 페어링이 되나요?",오늘도 인트로는 미쳤다 ㅋㅋㅋㅋㅋㅋㅋㅋㅋㅋㅋㅋㅋㅋㅋ,아 존버 실패인가 해서 걍 1세대 사려고 했눈데 잇섭님 리뷰보니 2세대 사야되나 싶고 돌아버리겟슈ㅠㅠㅠㅜㅠㅠ,만약 차이팟이 케이스에 들어간다면) 차이팟을 무선충전 케이스에 넣으면 충전이 될까여?,"구독자가 점점 느는소리가 들립니다! 
전 코드제로 언박싱할때부터 봐왔습니덩!","wlsrhks0401@naver.com 
믿고보는 리뷰 항상잘보고 있어요 형덕분에저도 전자제품은 알고 사야된다는 생각으로 관심을 가지고 있어요  항상 새로운걸 좋아하고 생각하고....무엇보다 성실한영상 감사해요~~~","인트로 미쳤어...
킹트로 유튜버는 다르구나",2:27 나만움찔했나 그냥 확 떨구다니 ㅜ,아내 몰래 화장실에서 노래 듣는 그는 도덕책...,2:27 라이트닝 케이블이 더 중요한 잇섭,너무웃기게 리뷰하시네 ㅋㅋㅋ 잘보고갑니다,진짜 미쳤어.....완전 내스탈ㅏ라랄ㄹ,"인트로 재미있네요

이번 에어팟 디자인은 그대로인데 의외로 다른부분들이 조금씩 보이네요 칩셋이라던가 케이스의 LED 위치라던가",하 너무 기다렸어...,"믿고보는 갓섭❤️❤️

아내가 어딧어요??????? 
솔로 잖 아 요 ^^",저 지금 이영상보고 일전에 구입했던 1세대 에어팟 케이스 오픈해서 보고 처음으로 라이트닝 케이블 들어 있는거 확인했습니다. ㅋㅋ 감사합니다.,모델명 구별법 감사해요 ㅠㅠ 유선에어팟2샀는데.. 케이스는 1세대랑 똑같아서 절망하고 있었어요.. 유선모델에는 엘이디등이 앞에 없네요,"결론은 1세대나올때 바로쓰신분들이 개이득
잇섭형 개이득^^",키야 역시 배우신분 데자와드시네요 ㅎㅎㅎ,구형도 무선충전 케이스를 호환이 되는 게 상당이 수상했네요.,형 이제 100만이네  좀만 더 화이팅입니다,항상잘보고갑니다 ㅋㅋㅋㅋ,"에어팟 1세대 1년 사용했는데 배터리가 뭔가 좀 줄어든거 같은데
담주 일본가서 무선충전 안되는걸 살까 하는데 어떤가요
아니면 그냥 양쪽 다 새걸로 교체를 할까요?
전 무선충전기를 사용을 하지 않아서 굳이 무선은 필요가 없을것 같아요",영상볼때마다 손흥민이랑 약간닮맞어요 ㅋ 신기 반기 ㅋㅋ,it 유튜버들중에 인트로가 기대되는 유튜버는 처음이다,역대급 인트로 ㅋㅋㅋㅋㅋㅋㅋㅋㅋㅋㅋㅋㅋㅋㅋㅋㅋㅋ,"월요일:레트로.이어폰
화요일:에어팟1
수요일:에어팟2
목요일:버즈
금요일:에어팟1
토요일:에어팟2
일요일:버즈
ㄷㄷ 새롭겠다","에어팟 2세대 기능중에 시리를 불러서 호출하는 기능이 추가 되엇다고 하는데, 혹시 아이퐁 설정에서 시리 음성호출기능을 꺼 놓는다면 에어팟에서 불러도 나오지 않나요 ?̊̈?̊̈ 
(존버중인데 시리를 많이 쓰지 않아서 궁금하네요)",오늘 잇섭님.실물을 봐서 신기했슺니다 영상 기다리고있겟습니다!,유튭보면서 댓글안다는데  원하는내용이 깔끔하고 시원하게 담겨져있어서 좋습니다^^,무선충전 케이스만 바꿔도 1세대보다 페어링이빨라지나요?,ㄹㅇ 개좋네요,형님 잘생기셨어요... 진짜로....,인트로보고 웃다가 눈물났다ㅋㅋㅋㅋ,혹시 리듬게임 할때도 싱크 차이가 클까요?,"에어팟 정품, 가품을 구별할 수 있는 방법으로 뭐가 있을까요 ㅠㅠ?",공홍직구인가요 아마존직구인가요 큐텐직구인가요??,비록 저번에 1세대랑 비교를 하긴했지만... 2세대가  나왔으니 갤럭시 버즈와 에어팟2 자세한 비교도 하면 좋을것같아요!!! 노트9을 쓰고있는 갤럭시 유저인데 갤럭시에도 에어팟이 더 나을지 아니면 버즈가 나을지 무엇을 사야할지 너무너무너무 고민이 됩니다 ㅠㅠㅠ,에어팟의 철가루를 블루텍이라는 고무접착제로 여러번 찍어주시면 없어져요 확실하게 아에 지워지진 않지만 써봤을때 거의 지워지더라구용,아 2세대 유선충전으로 살걸 어흑~ 무선까지는 필요없을듯,이 행님은 인트로랑 말투땜에 본다 ㅋㅋ,와 나이거 진짜 보고 싶었는데,0:00~0:05 중독 된닼ㅋㅋㅋㅋㅋㅋ,에어팟2로 맥북프로 에서 파이널컷 프로로 영상 작업시 음향 타이밍 딜레이가 어느정도 되는지 알수있을까요. 영상작업할때에도 유선을 벗어나고싶은데 이제 가능할까요,미이이ㅣ쳤어ㅓ어ㅓ,믿고보는잇쓰업°°,그럼 혹시 무선 충전 에어팟2를  사용하면서 충전하려면 무선 충전기가 따로 필요한 거겠죠?,잇섭님 2세대가 더 하얗고 깨끗 합니다!!,인트로 중독돼서 계속 보러들어옴....,저는 2세대 나온거 보고 1세대랑 2세대 중에 사려고 기다렸는데 별로 큰 차이가 없다고 해서 그냥 1세대 샀습니다 잘한건가요..?,가격 진짜 ㅎㄷㄷ하네,만약 1세대를 10만원 정도에 구입 가능하다면 1세대를 사는게 나을까요 그래도 2세대를 구매하는게 나을까요???,형 만우절 람보르기니 리뷰한 하고 진짜 람보르기니 리뷰해주는게 어때?,궁금한 건 새로운 2세대 케이스 사면 1세대 에어팟과 호환되나요??,아닠ㅋㅋ 인트로만 몇번째 보는거얔ㅋㅋㅋㅋ,"잇섭님. 멀티페어링은 어때요? 맥북, 아이폰, 아이패드 왔다갔다 하기 힘들지 않으신가요?",잇섭님 그래픽카드가 살짝 불에 탔는데 어제 온건데 as 무조건 가능한가요?,ㅋㅋㅋㅋㅋ아  ㅋㅋㅋㅋㅋㅋ잇섭님 진짜 사랑해ㅠㅠㅠㅠ 내가 잇섭님땜에 지른개 몇개더라...구독을 취소해여하나...나의 쇼핑요정이야,아 앀ㅋㅋㅋㅋ 인트로 미쳤네 ㅋㅋㅋㅋㅋ 진짜 형 아이디어 뱅크다 ㅋㅋㅋㅋ 형 솔직히 리뷰준비하는거보다 인트로 준비하는게 더 어렵지?,5:48 샤오미 공기청정기 필터 교체할 때 되신 것 같은데 필터 리뷰도 부탁드려요,영상 올린 날짜에 비해 좀 늦게 묻는 거긴 하지만 1세대와 2세대가 연결속도가 다르다고 하는데 안드로이드 유저도 해당되는 사항인가요? 노트9유저인데 에어팟 1세대와 2세대 중에 고민중입니다ㅜㅜ,잇섭님 파워비츠 프로 리뷰 해주실꺼져??? 믿고있을께요 그거나올때까지 1세대로 존버합니당,"파워비츠 프로도 리뷰 해주시면 안될까요!??!!^^ 요즘 새로 공개 되었는데, 에어팟이랑 비교해주세요~~ㅎㅎ",근데 진짜 바뀐게 무선충전빼고 거의 없네,와 최고,제가 2세대 유선을 샀는데 에어팟케이스 유선무선 상관없이 호환되나요?,"재밋게보고 가고 너무 유용해요!!
아무말도 안했는데 부모님이 이어폰필요하지않으시냐고 저한테 에어팟2사주신다고 하네요!!",잇섭님 오늘도 좋은 영상 감사합니다 근데 제가 에어팟 2가 이름 각인이 가능 하다는데 가능 한가요??만약 된다면 어떻게 하나요? 제가 에어팟 2살려고 하는데 각인을 하고 싶어서 ㅎㅎ,잇섭님 ㅜㅜ 아이패드 미니 5 리뷰도 부탁해요!!! 그저께 질렀는데 리뷰 빨리 보구시퍼여,케이스만 십만원 ㅋㅋㅋㅋ 여윽씨 마진왕..,"그는 에어팟 1을 쓰레기봉지에 버렸고 영상이 끊긴후, 아 다시 줍줍 ㅋㅋ",무선 충전 케이스 99000원 짜리는 에어팟1세대하고 호환이 된다는건가요??,에어팟2를 좀 더 오래사용한 후에 기존 1세대에서 문제가 되었던 철가루에 대한 정보도 알려주세요. 그리고 버즈와의 비교 기대할게요오~~,ㅋㅋㅋㅋㅋ 채시뉴앵 반영 인트로,형이제 영상은 안보고 인트로 보러 오는것 같아,1세대 14정도하는데 그냥 19만원주고 2세대사는게 나을까요??? 아님 5만원낮은가격인 1세대를 사는게 나을까요???,역시 대세 유튜버,형 만우절로 람보르기니 리뷰한다하고 rc카 리뷰해주는게 어때?,화이트노이즈부분은 1에 비해 2가 개선되었나요?,와 1세대 갖고싶다 두개가 다 있으면 어떤 기분일까 난 하나도 없는데...,진짜 인트로 대박이에요...,지금까지도 앞분 보는맛에 온다,"잇섭이 마시는 음료. ""동아오츠카의 데자와"" 은근슬쩍 PPL","그래서 24만원짜리 에어팟2는 무선충전기 그러니까 밑에 깜장색 그게 있단 말인건가요?
+수정 19만원 에어팟2와 24만원 에어팟2가 같나요?(무선충전 지원되는것 빼고)",검정 에어팟 나올 때 까지 존버 하겠습니다...,다시봐도 웃겨인트롴ㅋㅋㅋㅋㅋ,카카오에 무선충전기도 있더라구요! 리뷰해주시면 감사하겠습니당,"혹시  무선 충전을 사용하지 않으면 그냥 199000원  유선 충전을 사도 막 그렇게 
불편한 점은 없겠죠?",아이패드 에어는 아직인가요 ㅠㅠ 잇섭님 후기보고 구매할려고 하는데 얼른 올려주세요 ㅠㅠ,그렇다....그는 인트로 유튜버였던 것이다!!!,역시 인트로 깍는 장인ㅋㅋㅋㅋㅋㅋㅋ 인트로만 보고 댓달러 내려오게 만들다니ㅋㅋ,1하고2 뭐 사면 좋을까요 여러분이 골라주세용 ㅠㅠㅠㅠㅠ,드디어 나왔다 ㅋㅋ 리뷰보고 결정갑니다,유선충전 케이스를 사도 유닛을 케이스에 넣으면 충전이 되는건가요?아니면 케이스를 계속 충전해냐하나요?,역시 인트로 장인...👍,"인트로 ㅋㅋㅋㅋㅋㅋㅋㅋㅋㅋㅋ 
미미미미밈... 쳤어~~",반응속도에 대해서 궁금증이 생겼는데요 에이팟 2세대를 1세대 케이스에 넣고 에어팟 1세대를 2세대 케이스에 넣으면 2세대 케이스에 넣은 에어팟이 더 빨리 반응할까요...?,"원래 에어팟 본체가 두 대 있었는데
에어팟 본체를 한 대 잃어버려서 
집에 본체 1개 
유닛이 총 4개(두짝)가있는데
에어팟 본체 하나로 
유닛 총 4개(두짝)을 페어링 할 수 있나요?",인트로만 봐도 역시 잇섭!!,ㅋㅋㅋㅋㅋㅋ진심 인트로 현웃터졌다ㅋㅋㅋㅋㅋㄱ,에어팟을 귀에끼면 한쪽만 들리는 경우가 있다면 망가진거겠죠..?(물논 양쪽다 완충 상태에서도 그래요🤣),잇섭님 혹시 에어팟2세대 “유”선충전모델은 안에 유닛이 1세대인가요 아니면 2세대인가요?,형... 인트로부터 뿜어서 혼자 실실 쪼개닌깐 사람들이 미친놈인줄 알잖아..,"오프닝에서 엄청난 아재향이...



ㄷㄷㄷㄷ","애플:무선충전과 1세대호환 무선충전 케이스만 팔자~가격정하는중... 가격은 2세대는 칩셋하고 음질,무선 충전을 지원하니 가격을 올려야지~(24만원후반)케이스는 브랜드갑하고 무선충전이니깐(9만9천원~) 소비자:머야??? 왜케 비싸!!!!",ㅋㅋㅋㅋㅋㅋㅋ 인트로 노래 중독 미쳤어,"부모님이 갖고 싶어하셔서 생신선물로 사드린다하고 존버했는데 뭘사드려야 할까요...? 무선충전지원모델? 아님 No지원모델? ㅠㅠ
솔직히 이왕사드리는거 좋은거 사드려야지라는 맘도 있어요 ㅋㅋㅋ(통장 잔고는 제말을 안들어주네요 ㅠㅠ)",07:22 왜 주인을 구별 못하니ㅠㅠㅠ,지금 구매한다면 행사중인 약 10만원 안팎의 1세대와 정가의 2세대.. 둘 중 뭐가 좋을까요?,아 인트로 미치겠닼ㅋㅋㅋㅋ,"전2세대인데  뒤가 유광이네요 ㅎㅎ
그래서 모델명 확인했는데 2세대가 맞다라구요 휴 다행이다 ㅎㅎ",2세대 한국 출시 언제 할까요 ㅜㅜㅜ,이쯤되면 IT 유튜버가 아니라 인트로 전문 유튜버가 아닌가 싶네요,역시 1세대 쓰면서 다시 사기엔 너무나 애매한 물건이네요. 딱하나 문제라면 1세대 배터리 수명이 다되어가서 바꾸고는 싶다는거..?,제일 중요한 음질 비교는  추후에 해주실 수 있나요??  3년 더 존버해서 에어팟3을 살 지 고민중이에요 ㅠ,"질문) 에어팟 케이스에 꽂은 상태에서 무선충전기에 올려 놓으면 동시충전이 되나요? 
저는 에어팟이랑 충전 케이스 둘다 충전중이라고 옆에 번개 모양 뜨는데 정작 에어팟만 충전되고 충전 케이스 배터리는 조금씩 떨어지는데 정상인가요?",형 그 뚜껑에 먼지 묻는거 개선됬는지 꼭 알려줘!!,1세대랑 큰차이가 없다는게 아쉽네요...,무선충전 패드 정보도 알려주실수있나요?ㅠㅠ,에어팟1 쓰고있는대 오른쪽유닛만2로바뀌어도 음질차이느낄까요?오른쪽유닛2 왼쪽유닛1 싱크가 맞을까요?,ㅎㅎㅎ 결국 존버해서 사는게 답인듯 하네요,"에어팟 잘 모르는데 무선충전케이스는 1세대 사용자들 호환해서 쓰라고 나온거고 2세대 나올 사람들은 그냥 무선충전 모델 선택해서 사면 되는거 맞나요? 충전하려면 무선 충전기를 꼭 사야하는지, 케이스 안에 넣어놓기만 해도 충전 되는건 뭔지 알려주세요 ㅠㅠ",7:20 아오ㅋㅋㅋ 소환해서 미안하다는게뭔가했는데 바로 반응이.....,역시 InTro sub 잇섭 ㄷㄷ,"여러분~ 에어팟2세대 한국 정발은 언제쯤 될까요??  1세대 사려고 했는데 2세대 블랙색상 나온다해서 기다리고 있었더니만 ㅠ 어찌 됐든, 필요해서 구입은 해야 될것 같아서요.",외관상으로는 차이가 진짜 없네,2:26 본체를 버리고 케이블을 취한다,0:04 형 너무 살살버린다..ㅎㅎㅎ,아진자그동안인트로보고단한번도터진적없는뎈ㅋㅋㅋㅋㅋㅋㅋㅋㅋㅋㅋㅋㅋㅋㅋㅋㅋㅋㅋㅋㅋㅋㅋㅋㅋㅋㅋㅋㅋㅋㅋㅋㅋ미친개웃겨,"웃는 모습이 제가 아는 유튜버분과 매우 닮아보이시네요 
표정 좋다는거에요 오해 ㄴㄴ",역시 인트로는 갓섭,"형 인트로 모음집 한번 만들어봐
조회수 쭉쭉 오를것같아","잇섭님 페이유 빔블2 리뷰해주세요
핸드짐벌인데 183mm연장봉이 있어요!
(5번째 간청)",잇섭님 이번에나온 유선충전모델은 케이스?가 디자인이 무선충전모델과 다르다고 들었는데 그점이 약간 아쉽습니다,떠떠떠떠떠떠~할때 푱정 귀엽,벨킨 무선충전기혹시 화이트도 연동 되는건가요????,라이트닝 케이블 들어있는지 몰랐는데 이 영상보고 알았네요 ㅋㅋ 박스 버릴,아니 ㅋㅋ 아이패드로 보고있었는데 7:21 에서 자꾸 시리야 하시니까 시리나왔자나요 ㅋㅋㅋ,피넛 벌룬 가성비 이어팟 리뷰가능한가요? 🤗,철가루 많이 나오면 한번 철가루 방지스티커 붙여보세요.!,인트로 백퍼 끝나고 주웠다,갤럭시버드 랑 에어팟2 랑 뭐가 더 좋은가요??,에어팟1이랑 2랑 박스모양도 다른가요?,"인트로 도랏맨ㅋㄱㅋㅋㄱㄱㄱㄱㄱㄱ
개욱겨ㅋㄱㄱㄱㄱㅋㄱㄱㄱㄱㄱㄱ
역시 잇섭찡",형..! 1세대 W1칩이 복제되었다는데 달려봅시다!!,"아니! 잇섭(이)의 상태가?!?!
Black Malrangcow(으)로 진화하였다!",음 다음세대를 기다리며 ㅋ  설명 딱좋네용,"LG랑 IBM 합작해서 만든 90년대 노트북은 언제 켜보나요?..
계속 기다리고 있는ㄷ......",안녕하세요 잇섭님 영상 잘보고 있습니다. boss제품인 슬립버드 제품 언빡싱 부탁드리겠습니다 ( _ _),지금은 둘다 150000~160000때 ㅋㅋㅋㅋ엄청 가격 떨어짐,아 너무재밌어요 ㅋㅋㅋㅋㅋㅋㅋㅋㅋㅋㅋㅋㅋㅋㅋㅋㅋ진짜,궁금한게 있는데 일본에서 에어팟 2세대를 사면 ‘연결 하실건가요’ 일본어로 뜨나요?,ㅋㅋㅋㅋㅋㅅㅂ 오프닝 영상 개웃겨ㅋㅋㅋㅋ버버 버려ㅋㅋㅋㅋㅋㅋㅋ,1년정도 쓰고  2년정도 안쓰다쓰면 느려지거나 기능이 떨어지는 점있나요?,"에어팟1양쪽 유상수리 vs 에어팟2구입

에어팟1 2년정도 사용하고 있는데 한쪽 유닛은 거의 안들리고 요새 배터리도 짧아진게 느껴지기 시작하는데
유상수리를 받아야하는지 아예 웃돈주고 2세대로 넘어가는게 나은지 고민되네요",1세대와 2세대 유선충전케이스는 차이 없는건가요?,겔럭시 노트8인데 호환 좋나요?,1세대 케이스를 2세대 유선모델에 사용가능한가요?,"올리신지 1년이 지났는데, 글을 올립니다.😭
에어팟 프로영상보다가 잇섭님꺼 찾아보게 되었는데, 
현재 아이폰이고 에어팟은 1세대 사용중입니다. 
1세대가 배터리가 빨리 소모되서 다른 걸로 바꿀까 생각중이거든요. 
현재 생각하고 있는건 소니 WF-1000XM3와 에어팟 프로 생각중인데, 잇섭님은 어떤게 더 좋으신지 의견을 묻고싶어요!
(기기에 대해서 잘 몰라서 여러사람들의 영상을 보지만.. 추천받고싶습니다ㅠ)",1세대 충전케이스랑 2세대 유선충전케이스는 같나요?,"추후 컨텐츠:
1. 버즈와 에어팟 무선과 유선 충전속도 비교( 케이스 충전속도, 알맹이 충전속도)
2. 장시간착용시 착용감
3. 철가루(에어팟)
4. 기스개수 비교
5. 통화 음질비교
6. 에어팟-갤럭시 버즈-아이폰 연결해보기",ㅋㅋㅋㅋㅋㅋㅋㅋㅋㅋㅋㅋㅋ 인트로 ㅈㄴ 웃기닼ㅋㅋㅋㅋㅋㅋㅋㅋㅋㅋㅋㅋㅋㅋ 버려,에어팟2 유선충전은 철가루방지테에프 껴야하나요? 바뀐게 없나요?,ㄹㅇ창렬,"우왕! 에어팟이당! 에어팟 구매하신 거 진심으로 축하드립니다. 에어팟 누가 만들었는지 모르겠지만 정말 잘 만들었네요. 그 에어팟 제가 만들었거든요. 에어팟 쓰시는 모습 정말 보기 좋아요. 비록 에어팟이 완벽한 제품일 지는 모르지만 그래도 큰 돈 주고 구매해주셔서 정말 감사합니다. 한 번 더 말씀드리지만 제 발명품 사용해주셔서 감사합니다. 잇섭 같은 사람이 있기에 제 명성이 올라가고, 제 노력이 인정받고...그렇게 되네요. 제 노력을 인정해주셔서 감사합니다. 사랑합니다. 제 발명품을 사주셔서 사랑하는 것도 있지만 잇섭님께서 인성이 너무 좋은 게 마음에 드네요. 다름이 아니라 인성 좋은 사람이 제 발명품을 쓴다고 생각하니 제가 너무 뿌듯해지네요, 하,,,고생한 보람이 있다. 다음번에도 고생해서 더 좋은 발명품 만들겠습니다. 제갸  다행히 무선 이어폰 전문가니까 무선 이어폰(에어팟) 더 좋게 발명시킬 테니, 그때도 제 노력 인정해주세요. 그 대신 제가 진짜 좋은 발명품으로 보답할게요. 꼭 그렇게 할테니 제 노력을 인정해주셨으면 해요. 잇섭씨께서 제 발명품을 써주셔서 너무 감사한데 그 이유는 일단 제 노력을 인정해 주셨다는 게 너무 고맙고 이렇게 인성 좋은 분이 제 발명품을 사용한다니 기분이 한결 더 좋네요. 잇섭님! 에어팟 진짜 잘 어울리시네요. 최고로 잘 어울리십니다. 다음번엔 제가 더 좋은 에어팟 드릴 테니 그떄도 사용해주세요! 그럼 이만. (에어팟 진짜 잘 어울려요!!).","저는 에어팟 1세대 쓰다가 2세대 무선으로 넘어왔는데.. 좀 귀가 민감하신분들은 2세대 사시는게 좋을거같아요.. 1세대의 화이트 노이즈나 재생,정지 시에 툭 끊기는 소리가 엄청 거슬리더라고요 .. 사놓고 안쓰다가 2세대 무선으로 넘어오니 매일 매일 귀에 안낀것처럼 잘쓰고있습니다! 사실분을 참고하세용",안히 저 직구 3번 캔슬됨... 매번 다른 계정 다른 배대지 다른 카드로 해더 캔슬됨 ㅠㅠㅠ 팁좀줘여 ㅠㅠ,3만원으로 무선 충전 케이스 만들었넼ㅋㅋㅋㅋ,어... 음질을 비교하자면 1세대 에어팟이나 2세대 에어팟이나 변경된 점을 느끼긴 힘들었습니다. 다만 유선/무선 충전 변경에 따른 편의성은 확실히 느꼈습니다. 혹 2세대로 넘어가실 분들은 자금의 여유가 있으시면 상관없지만 아니면 현재 1세대 에어팟을 그냥 쓰셔도 큰 차이를 못 느끼실 가능성이 매우 높다는 점만 알려드립니다. 선택은 개인취향이기 때문에 절대 말리지 않습니다. 알아서 선택하시길,"혹시 
에어팟 1세대 사용하고 있는데 페어링 속도가 좀더 빨라지는걸 원하고있는데
콩나물은 1세대 사용하고 충전기만 2세대로 바꾸면 페어링 속도가 빨라질까요???
1세대 귀에 끼고 5초정도 있다가 뚜앙 소리
이 시간을 줄이고 싶어요 ㅠㅠ",데자와 먹는 이형.... 배우신분,"2세대 유선은 1세대와 같은 LED인디케이트가 안에 있다. 무선은 밖에 있지만, 유선은 안에 있단다.","어머 마침 에어팟2 영상 안올라오나 보고있었는데 마침 올라오네여ㅋㅋㅋㅋ
이건 설마?   (어멋)",ㅎㅎ2세대 사야겠네요 사고 나서 베리굿즈 가서 에어팟케이스나 괜찮은 거 하나 사오는 걸로.....,"이 영상에서 잇섭님이 ""때문에""를 몇번 외쳤을까요","에어팟2세대 제품언박싱을 이제보았네요
잇섭님 무선거리는 1세대에비해 얼마나 늘었나요?
블루트스 거리가 얼마만큼가능한지 궁금해서 이렇게
늦게나마 글을 올려보네요
감사합니다",그럼 공홈에서 파는 20만원짜린 그냥 1세대인건가용?,8:57 짧은요약,"무선충전기의 성능은 상관없나요??
아이폰을 가까이하면 되는데 중간에 뭘 끼면 충전이안되도라구요 ㅠㅠ",ㅁㅊ ㅋㅋㅋ 인트로 뻘하게 터졌네,점점 병맛이 되어가..,1세대 16.9에 사는 게 좋을까요 2세대 기다렸다가 사는 게 좋을까요? 인내심에 한계가 와서 사려고 하는데요,,,,,,,,,,,,,,,,,,,,
