18,근데 진짜 어쩔수없지... 부모님이 갑자기 아프셨을때 놓쳤던 전화는 진짜 평생 트라우마로 남음...,왜계속 끼나 혹시 했는데 그 혹시가 맞았네 ㄷㄷ 부모님이 최고지,"안녕이랑 앙녕사이의 애교스러운 마무리가
넘 매력적임",에어팟 용접설에 웃으면 들어왔다가 감동해서 가네요.. 이유가 고개끄떡여짐..,"나 맨 처음에 애플에서 협찬하는줄 알고 항상 차고다니는 줄 알았네
효자다",아! KCM 에어팟 한쪽 진짜 궁금했었는데 속이 뻥 뚫리네요. 효자십니다. 근데 애플워치 차고 있어도 전화오는 거 바로 알 수 있어요. 저도 그래서 애플워치 SE로 저렴하게 하나 장만했습니다. 글구 ㅂㅌㅅㄴㄷ × ㅁㄷㄴㄷ 너무 좋네요. 티셔츠 기념으로 하나 사고 싶습니다.,KCM 완전 호감..!!,KCM 호감 최대로!!!,저거 하루종일 끼고 있으면 정말 머리 아플텐데,진짜 kcm 왜 맨날 에어핏 끼고 있지 했는데 이유가 있었구나... 그와중에 용접설 개웃기네 ㅋㅋㅋ,"카메라 구도확인하고 안보이는 쪽으로 끼면 되지 않았을까? 라는 생각이 들긴하는데
뭐... 어머님을 생각하시는 그 마음 잘봤습니다. 
효자!",워치끼면 된다 뭐하면 된다 하지만 kcm 본인이 예전 일때문에 귀에 끼고있지않으면 불안해서 그런거아닐까요,와 KCM 형… 효자네..다시 봤어 ㄷㄷ,이젠 기믹이 발라드로 진출했누…..,BTS가 정말 대박이 나긴 났구나..,"이걸 14F에서 소개해주다니
KCM 제 2의 전성기가 진짜 오긴 한 것 같다","저 근육도 어릴적에 아버지 사고사 당하시고, 누나가 남자 깡패에게 맞고 온 뒤 내 가족은 내가 지킨다는 마인드로 지금의 저, 격투기선수 못지 않은 근육과 근력이 되도록 운동한거",와 갓 티에스,차라리 휴대폰을 항상주머니에 넣고 다님 되는거 아닌가 진동풀로해서,효자네 애플워치가 더 좋으실듯,형... 솔직히 처음엔 그런 이유였더라도 지금은 컨셉이잖아 ㅋㅋㅋㅋ 진짜 전화받는 게 목적이면 lte용 워치를 쓰겠지 ㅠㅠㅋㅋ,"에어팟은 모든 전화를 다 확인해야 하는 반면, 애플워치는 화면만 잠깐 보면 될텐데,,,
시리가 읽어준다 하더라도 다른 전화가 왔을 경우엔 그거 읽어주느라 더 집중이 안될듯한데 흠,,",강다솜 아나운서 누나는 이날도 존예였다,"하다하다 에어팟 끼고 있다고 욕하는 사람은 우리나라밖에 없을듯. 방송에서 화면 잡히는쪽으로 끼고있다고 컨셉이라고 감안해도 저게 보이는것때문에 불편하다고? 억까,불편러 진짜많다.
저거 보고 있기 힘들다고 하는 사람들은 일상생활 불편해서 어떻게삼?",스마트워치가 더 편하지 않을까 ...,우아 이때까지 그냥컨셉으로 끼는줄알았네요,그냥 애플워치 끼면 되지 않나…,용접설 ㅋㅋㅋㅋㅋ,애플워치 차세용ㅋㅋㅋㅋㅋ,갓치맨 빛치맨,착하네 효자다,애플워치 차고 방송중엔 엄마랑 병원 관계자 전화 빼고는 다 방해금지 해놓고 쓰는게 더 깔끔해 보이겠지만 에어팟으로 스토리 하나 더 만들어서 방송에 더 노출될수 있다는 건 좋겠네요. 지금이야 좋다고 해도 점점 인기 많아지면 흑역사로 남을듯..,용접설 ㅋㅋㅋ,뉴질랜드에서 입는지 한번 가서 봐야징 ㅎㅎ,그냥 애플워치를 끼시는게 낫지 않나? 제가전화를 잘 못들어서 항상 애플워치 끼고 살거든요 워치도 전화도 되는데!!,;; 저럴거면 애플워치로 손목 진동 확인하면 되는거 아닌가,귀여워,전화받는건 계기고 밀고나가는건 컨셉&패션도 이유가 좀 있겠지 ㅋㅋㅋ아닐수가 없음,"아니 잠깐만 맥도날드는 분명한 햄버거가게인데 맥너겟하고 감튀만 좋아한다라....
맥날 반성해라",애플워치까지 안가도 4만원짜리 갤럭시핏만 차도 알려주는데...,스마트워치 하나 사서 착용하면 해결될텐데,누나 너무 예뻐요,애플워치를 차시는게 나을거같은데 그냥,맥도날드 많이컸네 BTS랑 콜라보하고,난청생길텐데...난청은 한번 생기면 낫지 않고 차라리 스마트폰 워치 차고 다니지..,근데 꼭 카메라 보이는쪽에다 끼심...ㅋ 꼭 껴야한다면 반대쪽에 끼면 좋을텐데 꼭 그때그때 찍히는 방향으로 바꿔 껴서 너무 시선이가..,아 예상은 했는데 진짜였구나 아프지 마세요~,강창모님 효자네요,효팟ㅠㅠ,방송중에 계속해서 애플워치만 보면 민폐잖아요 ㅎㅎ 근데 에어팟은 전화오면 바로 알려줘서 그런것같아요!,진짜 효자구나..,일할때 에어팟 끼는게 말이 되나 ㅋㅋ,효자인 것도 있는데 지혜롭지 못한 것도 있네,그냥 애플워치 착용해요...,근데 내가 잘못봤나? 김준호인가 누구랑 나온 방송에서 왜 에어팟 끼고 있냐고 물어보니까 바로 빼던데 ㅋㅋㅋㅋㅋ,Kcm끼고 있는 에어팟 종류 뭐에요?,아니 라디오스타에서 오른쪽으로 껴두되는데 굳이 왼쪽으로 끼는거면 보여주기 식인가 ?,김치맨님 효심이 👍,존2나 컨셉같은데 차라리 폰을 진동으로 해놓고 갖고있으면 된 거 아닌가?,"1. 굳이 카메라에 비추어지는곳에 낄 이유 없다.
2. 에어팟이랑 핸드폰 상호작용 할 수 있는 거리가 길지 않아
결국 옆에 폰을 가지고 있어야한다.
3. 양해를 구하고 폰을 진동으로 올려놓으면 된다.
4. 애플워치를 차면 된다 
= 걍 컨셉",걍 애플워치 쓰는게 천만배 나을듯;;ㅋ,"진행하시는분은 아나운서인가요? 저분이 제일 궁금하네
너무 이쁨...",한쪽만 낀다하던데 굳이 카메라 나오게 낄 필요가 있나?,김치맨 !  극호다,창모형이 유명했어여 형들?,왜케 불편해하는 사람들이 많냐... 애플워치를 차라는둥 진짜 ㅋㅋㅋㅋ 그냥 효자네 한마디가 그렇게 어렵니,안녕~!!,나중에 중국에서 한글도 한자에서 비롯된것이다 ... 이러면서 한글은 중국소수민족의 전통글이다.... 이딴 개소리할까봐 무섭다...,ㅍ빠숀으로 끼시는거 같은데  저형이몀  그럴만두,사격중지 효자다,이게 레알 컨셉인거 정리해드림. 1. 엄마 아프실때 전화 못받았던 적이 있어서 엄마 전화 꼭 받으려고 한다 -> 그렇게 걱정되면 엄마랑 같이 먹고 자고 살고 하면 되는데 집은 따로 살고 낚시도 다닐거 다 다니면서 전화만 꼭 받으려고 한다? 좀 안 이상함? 2. 전화를 꼭 받기위한 목적이라면 그냥 전화기를 갖고 방송하면 되지 않나? 진동모드로 하건 벨소리 모드로 하건 그런 식으로 말이야. 다른 전화때문에 안된다고 하면 애플워치 차면 다 해결된다. 에어팟보다 100배는 더 유용하고 편함. 이거 반박하는사람은 애플워치 안차본사람임. 3. 마지막으로 이건 모든 사람들이 다 공감하는 부분일텐데 방송이라는 일을 하고 있는 와중인데 이어폰끼고 방송하는게 말이됨? 한쪽을 끼건 두 쪽을 끼건. 그리고 그렇게 급한 일이면 메니저가 없는것도 아니고 어차피 방송 들어가기전에 메니저한테 전화기는 다 맡기도 방송 들어간다. 그게 아니더라도 다 자기 주머니에 전화기 다 들어있다. 전화를 못받을래야 못받을수가 없다. 샤워할때도 끼고 하냐 그럼?,"아무리 그래도 노래부르며 무대위에서 차고있는건...좀 아니지않나? 
노래부르다가 멈추고 내려갈게아니라면
매니저에게 잠시 맡기고 연락을 받을수도있을텐데...
나로썬 의미는 알겠지만 무대위노래할때도 끼고있는건...이해되지않는다.",에어팟보다그럼 안튀는  버즈나 워치끼믄되지않나,맥도날드도 이제 중국꺼냐? 두렵네,쫌 너무 보여주기식 같은데... 녹화전에 매니저한테 폰 주고 오면 되지,뭐 또 위급상황 생기면 방송 중단할끼가?ㅋㅋㅋ,무슨 엄마 전화타령이야 그냥 폰을 맡기고 부탁하면 되는걸 ㅋㅋㅋㅋ,효자네 ㅋㅋ 근데 안 불편하나? 스마트워치가 더 나을 거 같은데.,애플워치 초강추,아니 뭘 자꾸 애플워치차랰ㅎㅋㅎㅋㅎ 자기맘이지,"컨셉이나 협찬같아요.
왜냐구요?
방송을 보면.
항상.
카메라 각도에 비추는 귀에 꼽고 나오더라구요.
왼쪽에 앉으면 왼쪽 귀.
오른쪽에 앉으면 오른쪽 귀.
부모님 건강상 이유로 전화를 받기위함이면.
굳이 에어팟 꽂은 귀가 방송에 잡히게 할 필요는 없겠죠?",맥날 뒷광고느낌,1:55은 제이발빈이 아니라 리암페인 같은데 맞는건가?,효자는 무슨 미친놈이지 낚시도 가고 지랄을 하드만 뭔.. 그럴거면 어머니 계시는 도시에는 있어야지... 말이되나,형님 애플워치를..,채널십오야에서는 시그니처라고 말했었는데,"아니 그렇다고에어팟계속끼는방법말고 다른방법많을텐데
구지 에어팟을...하루왠종일 방송에서나 어디서나 끼고있어야하나 .. 에어팟빼서 부셔버리고싶가..",컨셉이 맞는듯,에어팟이 kcm이랑 같이 캐릭터화 되서 난 좋은데...,"왜 효자인거지? 일을 하는데 에어팟끼고 일하는게 말이되나?? ㅋㅋㅋㅋㅋㅋㅋㅋㅋㅋㅋㅋㅋㅋㅋ 요즘엔 저런게 효자가 되는건가??? 분명히 애플워치, 매니저 등등 수많은 방법이 있는제 근무중에 한쪽귀에.에어팟끼고 방송촬영에 광고촬영?? ㅋㅋㅋㅋㅋㅋㅋㅋㅋㅋㅋㅋㅋ 개그맨인듯 진짜 ㅋㅋㅋㅋㅋㅋㅋㅋㅋㅋ ㄹㅇㅋㅋㅋㅋㅋㅋ","애플워치 차면 알림은 다 글로 뜨는데 
저게 뭔 짓임? ㅋㅋㅋ","방탄은 이정도면 올림픽 금메달보다 더 높게 쳐주고 군대가는거보다 활동계속하게해서 국격이나 높이는게 나을듯. 
스포츠에 비해 대중문화쪽에 너무 박함.
요즘 오죽하면 가장 민감한 부분 중 하나였던 병역기피에 그 어느때보다 비난여론이 가장낮을까?

더 나아가서 현역복무불가 남자는 사회복무가 아니라 면제가 맞다. 이제 그 자리는 여자가 채워주거나 돈 제대로주고 고용하길.",에어팟 낀 위치 갖고 욕하는 애들은 한국인밖에 없을 듯 이러다가 치아 갯수도 해명해야겠노,참내 유난스럽다... 워치사라 꼭 카메라에 보이는쪽 끼고나오더랔ㅋㅋㅋㅋㅋㅋ,근데.. 항상 카메라쪽으로 끼고계시긴하더라구요..ㅎㅎ;,kcm 매니저는 둬서 뭐에쓰냐,아니 근데 맥날 BTS 말고 스캇밀이나 한국에 좀 들여보내지;;;;,에어팟 광고모델 1순위,그런 이유면 애초에 애플워치를 차던지 아니면 카메라 안 보이는 쪽으로 숨겨서 끼려고 하던지 하면 될걸 방송이건 어디곤 항상 카메라 보이는 쪽으로 일부러 과시하면서 끼면서 무슨 부모님이 어쩌고...ㅋㅋ 그냥 특이한 컨셉 잡고 남들이 이유 알아봐주길 바라는 컨셉충 정도로밖에 안 보임;;,너무 컨셉인데ㅋㅋ,애플워치를 끼지 ;,일본 맥도날드도 한글 박힌거 쓰나?,애플워치....,맥도날드?,조금 멍청한 방법으로 효자인걸 알아주길 바라는 거같네요 컨셉잘못 잡으신듯,"근데 에어팟 배터리 안나가...?
두 갠가",매니저 없나?,군대 보내야 되냐?,솔직히 이정도면 광고 효과 좋은거 아닌가 싶은데 애플에서는 KCM한테 에어팟 평생 무상으로 제공해야 한다 엌,그랳던 적이 있었대잔아 본인이 다들 외 그렇실까?,"효심가득한건 인정하지만, 개인적으론 저걸 계속보고있자니 불편해서 못보겠더라. 그래서 나는 kcm님 나오는프로는 채널돌리거나 안봅니다.",컨셉으로밖에 안보임. 저 방법 외에도 정말 방법많음.. 어머니께 바로 도와줄 사람 붙여드리거나 메니저한테 시키면 됨..,"이거컨셉인이유 애플워치있음 애플워치가 거슬리고차기싫다?
반대쪽귓구녕도있는데 방송나오는쪽에참",KCM님에게 죄송하지만 컨센충인줄..,끼야 금요일이다,대충 사정 알게됐으면 그러려니 하고 넘어가면 되지 왜 사연 듣고도 지랄들임? 오지랖,카메라에 보이게 끼던 말던 왜이렇게들 꼬였어요 사람들이 . 애플워치끼고 활동하면 왜 애플워치끼냐 카메라에 너무 보여지는데 보여주기식처럼 보인다 이럴거에요 ?  본인이 편하고 익숙한걸로 귀에 끼고 다니고 방송관계자들한테도 양해까지 구한다고 하던데 뭘 그렇게 아니꼽게 봅니까 ; 그냥 아 그런가보다 하고 넘어가면 되는걸,"매니져 뭐함?
핸폰은 진동?
변명뿐",에어팟말고 아이워치를사 미친놈어,"애플워치 사세요 ㅋㅋ 저거 뭐야 어이없네
민폐다",kcm 머리스타일좀 바꿔라 안어울린다 전형적인 답답해보이는 급식 헤어스타일,에효팟,,,,,,,,,,,,,,,,,,,,,,,,,,,,,,,,,,,,,,,,,,,,,,,,,,,,,,,,,,,,,,,,,,,,,,,,,,,,,,,,,,,,,,,,,,,,,,,,,,,,,,,,,,,,,,,,,,,,,,,,,,,,,,,,,,,,,,,,,,
