6,"인자하신 아빠..
동생 장난을 잘 받아주는 착한 언니..
두분을 잘 골려먹는 
개구쟁이 유익뼝..

항상 잘보고 있습니다~^^",유익병씨 아버지는 정말 드라마에 나오는 화목한가정의 아버지같다,유이네는 항상 행복해보이는 집이라서 보기만해도 웃음이 나와 😆 아버지 너무 귀여우셔 ㅋㅋㅋㅋㅋ 사키쨩도 방탄에 진심인거 너무 귀여웡 ㅋㅋㅋㅋㅋㅋㅋㅋㅋ 아 물론 유이쨩은 항상 귀엽징 ❤️,유이가 언니 괴롭히는 영상은 항상 재밌음 ㅋㅋㅋ 사키 반응이 너무 재밌어 ㅋㅋㅋ,아버지는 항상 안드신다하고 이미 숟가락 들고계심,ㅋㅋㅋㅋㅋㅋㅋㅋㅋㅋㅋㅋㅋㅋㅋㅋㅋ 유이 아버지가 제일 재밌으시다 ㅋㅋㅋㅋㅋㅋㅋㅋㅋㅋㅋㅋㅋㅋㅋㅋㅋ,유익병씨 영상 잼게 보고갑니다. 언제나 그렇듯 화목한 가정 보기 너무 좋아요~~^^,곳곳에 유이가 편집한 흔적이  ㄷ ㄷ 고생 많았데이~,라이브 볼때도 알아차리지 못한 익병의 바꿔치기 ㅋ 다시 돌려 본 1인 ㅋㅋ 역시 고향의 맛 다시다!!,여기 가족 왜케 다 귀여운거야 ㅋㅋㅋㅋㅋ,유이 영상은 그냥 시트콤같고 넘 재밌음 보기만해도 좋아%,이번편은 내내 광대 승천해가지고 봤습니다. ㅎㅎㅎㅎ 고마워요 익병군,아버지 너무 귀여우신거 아냐? ㅋㅋㅋㅋㅋㅋㅋㅋㅋㅋㅋㅋ,냄비 가까이 하지 말라는거 너무 귀엽다 ㅋㅋ,언니가 착하구나......물론 유이도 착하지만.....항상 행복하길..........^^,귀여운 사키 ~ 유쾌한 아빠 ~ 그냥 유이뿅 잘봤습니다~,사키 진짜 착하다 ㅋㅋ,사키 한국어 발음 점점 자연스러워지는거 같네,가족분들이  너무  화기애애해서  참  좋아보여요~♡♡,결론 사키가 너무 착하다..,"ㅋㅋㅋㅋㅋㅋㅋ 유익뿅과 언니분의 콜라보가 나름 괜찮네요.
언니분이 더 자주 출현해주시면 좋겠어요",오...유이짱 바꿔치기 기술쩐다.타짜로 직업 바꿔도 되겠는데?ㅋ,이렇게 착한 언니라니,다 그렇다치고 아버님 미소가 너무좋아 ㅜㅜ,역시~ 익병씨 영상을 보고나면 엔도르핀이 마구마구 샘솟는다요~ 우울증은 무리다요~,정말 이정도면 진짜 좋은 동생이다.,유이뽕 가족들 다 귀여워용♡,이분 처음보는데 마지막에 귀여워서 구독 안할수가 없음ㅠ 구떡 ㅋㅋㅋㅋㅋ,"여~~윽~~시~~유이뿅님의 유튭 영상 최고!!!!!
요즘 가족분들의 예능감각이 점점 올라오고 있네요!!
항상 유쾌하신 가족분들 덕분에
또 한 번 웃고 갑니다 ㅋㅋㅋ","귀엽기도 한데
하는짓이 너무 사랑스러움 ㅋㅋ","언니랑 성격 진짜 달라 ㅋㅋㅋㅋㅋㅋㅋㅋㅋㅋㅋㅋㅋㅋㅋㅋㅋㅋㅋ
에어팟 깨끗이 쓰는거 나랑 독같네 ㅋㅋㅋㅋㅋㅋㅋㅋㅋㅋ
저런 동생 있으면 팻.... 사랑해줘야지이~~~~",사키짱 카와이~카와이~ 유이 가족은 엔돌핀이 넘침ㅋ,유이보다  언니가 왜~~~~ 더 귀엽다고 느껴지지?????????ㅋㅋㅋㅋㅋㅋㅋㅋㅋㅋㅋㅋㅋㅋ,언니 왤케 귀엽냐ㅋㅋ 애교엄청 많다 ㅎㅎ,언니 타격감이 너무좋네 ㅎㅎ귀여워요 둘다,가족들이 너무 다 귀엽다 ㅋㅋ,사키짱 많이 나와서 넘 좋아용ㅋㅋㅋㅋㅋㅋ귀여워,하루의 시작을 웃음으로 시작하게 해주시는군요. 감사해요.,아버님 팬이에요!!성격너무 좋으시고 재밌으세요~👍🥰🥰🥰,아버지 넘 귀여우심 ㅠㅠ,가족들이 너무 착하신듯,사키는 역시 넘귀어워💕💕💕💕💕💕,"유이님 아버님과 언니 분이 마음도 착하시고 귀여우세요. ^^ 영상도 재미있고 가족 분들의 밝은 모습을 보니 힐링이 됩니다. 유이 공주님 앞으로도 좋은 활동 부탁드리겠습니다. ^^
화이팅 ^^",아빠가 방송감이 있네 마지막까지 놀아주고 양보까지 훈훈한 마무리네,아버님 춤실력이 대단하시네요,"볼때마다 느끼지만 가장 이상적인 모습의 가정입니다

보는 내내 행복했네요 ㅎㅎ",유이님 알게되서 너무 좋아요~영상 더 많이 올려줘요^^,언니가 너무 착한거같다 ㅋㅋ,뭐냐고~~ 요즘 영상 왜케 퀄리티 미쳤냐고~~,유이 너무 착해 ㅠㅠㅠㅠㅠㅠ,진짜 집 화목한거같아 부럽다~!,가족들 너무 귀엽다 ㅋ,가족들보면 너무 행복해보이고 보는사람도 행복해집니다~! ㅎㅎ,"아 ㅋㅋㅋㅋ 외람되지만 아버님 너무 귀여우셔 ㅋㅋㅋㅋㅋㅋ
슈헌터♥",ㅋㅋㅋㅋㅋ이가족 유쾌해서 좋아,유이뿅 영상 뜨자마자 바로 달려옴 ㅋㅋㅋㅋ 알고리즘에 뜨고나서 며칠째 정주행 유며들었다....,사키짱 너무 착하고 귀여운것같아,아빠의 취향이 충격적이야ㅋㅋㅋㅋㅋ,ㅋㅋ 아버지 잘생기셨네,영상도 재밌지만 자막이 더 재밌어요. 귀여운(?) 아빠! ^^,ㅋㅋㅋㅋㅋㅋㅋㅋㅋ  언니 분 개 귀엽다!~!~,언니 아미! 아버지 춤 카와이~~! ㅎㅎㅎ,앜ㅋㅋㅋㅋ유이뽕 너무 귀엽닼ㅋㅋㅋㅋㅋㅋㅋㅋㅋㅋㅋㅋㅋㅋㅋㅋ,"앜ㅋㅋㅋㅋㅋㅋ보라해 뭐얔ㅋㅋㅋㅋㅋㅋㅋ뭔데 고퀄이야
파파 귀여우시네",ㅋㅋㅋㅋㅋ언니도 귀엽지만 아부지 완죤 귀여우심ㅋㅋㅋㅋㅋㅋㅋㅋ,언니 진짜 착하내...보통은 뒤통수 갈기고 대화 시작인데,ㅋ...아버님 너무 좋은신 분 같아요..웃으실때 매력 만점...^^,너무 좋다 이가족 ㅠㅠ,역시 유익병ㅋㅋㅋㅋㅋㅋㅋㅋㅋ귀여워 진짜,언니 엄청 귀엽다 ㅎㅎㅎ,BTS보이길래 일단 클릭 ㅋㅋ 유쾌한 가족이네요  편집도 너무 웃겨ㅎㅎ,잘보고 갑니다 재밌네요 ㅎㅎ,"까아아악 익병아 생선 고마워ㅋㅋ
일어났더니 익병이 영상이 ㅋㅋㅋ
최고의 생일선물이야ㅋㅋ",너무 좋아요 오붓한 가족의 모습...,"이런짓하는 여동생 있었으면 좋겠다
좋은 샌드백이 될텐데",역시 잼나네 요! ㅋㅋㅋㅋㅋ,ㅋㅋㅋㅋㅋㅋㅋ 유익병 영상은 믿고 본다,아  유익병씨 가족 억양이 너무 좋아요 ㅎㅎㅎ,사키 귀여워 ㅠㅠ,화목한 익병씨 가족 보니 기분이 좋네요,언니랑 동생이 눈웃음이 붕어빵이군,"유우이님, 착하시네~ ㅎㅎ. 언니께 방탄 이어폰도 선물해 주고.",너무 행복한 가정이네요 ㅎㅎㅎ,유이뿅네 가족 너무 화목해서 볼때마다 좋음ㅋㅋㅋㅋ,"아버지께서 훈남 스타일이시네요
영상 재미있게 잘봤습니다~",아빠 커엽. 근데 가족 전체가 선한 것 같다,"이 집안 자체가 사랑스러움으로 가득 차있다
익병이 가족이 늘 행복하길~~
사키도 너무 귀여워 ㅎㅎ",가족들이 다 너무 웃겨 ㅋㅋ,콘텐츠 생각하느라 고생이 많네요. 아프리카로 본지 오래된 콘텐츠인데 편집본도 잼나요. ^^,이정도면 이제 뭐 빌려달라고 하면 뭐 사놨나?할듯ㅋㅋㅋㅋㅋ,아버님 너무 귀여우시다 ㅋㅋㅋㅋㅋㅋㅋㅋㅋㅋ,한편의 시트콤... 이런 몰카는 좋아요,아 언니 엄청귀엽닼ㅋㅋㅋㅋ,가족 생활이 그냥 힐링이네~~,언니가 유익병 때문에 웃는날이 많아졌을듯ᆢ,와 인기 급상승 동영상 실화냐 유익병 ㄷㄷ;; 몇년전에 킹기훈이랑 에버랜드가서 울던 유익병 맞나 가슴이 웅장해진다.. 유익병 월클 ㄱㅈㅇ!!!,"악마미소 속에 천사가...
유이뿅~♡","아버지 너무 귀여우셔 ,,ㅋㅋㅋㅌㅌㅋ",오늘도 웃음 선물해주셔서 감사합니다.^^,ㅋㅋㅋㅋㅋㅋㅋㅋㅋ가족이 다유쾌하네,갑자기 언니가 뿅이랑 목소리 똑같이 내던거 생각나네 찾아봐야지,"확실히 사키짱 이쁨 ㅋㅎㅎㅎ
유익병씨는 마음이 참 착행",오늘도 귀엽당ㅋㅋㄱㅋㅋㅋㅋ,유이뿅 언니 사투리 쓰는거 왤케 귀여우심??ㅋㅋ 유이뿅 츤데레 스타일이었구나~,익병씨 개구지지만 천사 맞네 ^^,유이 넘 착해..ㅠㅠ,"방탄에 진심인 언니 너무 귀엽다ㅎㅎ
오늘 킬포는 아버님 이네요ㅋㅋㅋ",언니 자주 나왔으면 좋겠어요 ㅋㅋ,너무 좋아요👍👍👍,"언니 귀엽네 ㅋㅋㅋㅋ
아버님 또한 ㅋㅋㅋㅋ",가족분들이 전부 재미있네요.,"영상보면 항상 미소가 저절로 
감사합니다.",뉴입영씨 영상 재밌었어요 잘 보고 갑니다,아버지가ㅠ너무 귀여우심 ㅋㅋㅋ,아.. 사키 너무 귀엽다...,3:09 너무 귀여움 ㅋㅋㅋㅋㅋㅋㅋㅋㅋㅋㅋㅋㅋㅋㅋㅋㅋㅋ,저순간 만큼은 유이뽕이 언니같았다~,언니가 많이 귀엽당 😄😄💖💖👏👏👍👋,언니분 사투리 진짜 귀엽다,사키짱 조아요~ 유이짱도 좋고요~,사키 뭐야 ㅋㅋㅋㅋ 개귀여워,아버님 너무 귀여우심 ㅋㅋㅋ,말투 넘 귀여워 🥰,아빠너무 귀여우시다,둘다 너무 귀엽네 ㅋㅋ,아부지 너무 귀여우세요~,아버지 왤케 귀여우심,ㅋㅋㅋㅋㅋ 귀여워어어어💟💜💟,아버님 영상 수준이 배우신 분,아버님이 정말 유쾌하신 분이네요 ㅎㅎ,4:13 BTS 성유물을 영접하는 올바른 방법 ㅇㅇ,유쾌한 가족 이시네요 웃으면서 잘 보았습니다.,편집 왜이렇게 퀄리티 좋아졌오!!!!! 유이뼝~~~ ㅋㅋ,언니 너무귀엽다,가족 일상생활 보기 좋네요. ^^,사랑이 넘치는 가정이군요 ...,ㅋㅋㅋㅋ  이분 엄청 웃기네~ 텐션굳,사키씨 BTS덕질하는모습 귀여워~ 귀여워~~,머지?이 귀여운 언냐들은?ㅋㅋㅋ,귀여워❤,사키가 마스크 벗는 날 우리 모두 사쿠란보를~~,가족 분들 모두 너무 귀여우세요♡♡♡,이건 뭐 가족시트콤이여ㅋㅋ,여윽시 사키쨩이 미라이다,ㅋ 언니 귀여워~,아 웃기다 둘다 귀여워,아버지 너무 귀여우시네ㅋㅋㅋㅋㅋㅋㅋㅋㅋㅋㅋㅋㅋㅋㅋ,사키 귀엽네 ㅋㅋ,콘텐츠의 여왕 그 자체,너무너무 잼이따 ㅎㅎㅎ,자매가 어쩜이리 귀엽니,ㅋㅋㅋㅋ 재밌게 잘 봤어요,"편집 쩐다 단어나 문법 보면 직접 한 거 같은데 센스가 대단한듯..
그나저나 언니랑 아버님도 방송하셨으면 좋겠다 너무 좋아 ㅠㅠ",언니 이쁘다~,뿅 귀여워요 🥰😍😚,너무 재밌게 잘봤어요! ㅋㅋㅋㅋ 사키님과 유이뿅님! 그리고 아버님의 콜라보까지 너무 재밌게 잘봤습니다! 항상 잘보고 있어요 유이뿅님!!!,"아부지 진쟈 재밋으셔,,ㅋㅋㅋㅋㅋㅋㅋㅋㅋㅋㅋㅋㅋㅋㅋㅋㅋㅋㅋㅋㅋㅋㅋㅋㅋㅋㅋ 
장꾸 익병씨,,",아부지 휴대폰 ㅋㅋㅋㅋㅋ 화면 보여지고 살짝 당황하시는게 킬링포인트네 ㅋㅋㅋㅋ,언니 귀여우시네,"유이뽕상,,🤗😁😁😁🥰🥰🥰잘보고갑니다,,,",익병씨 ㆍ언니씨ㆍ아빠씨ㆍ다들 너무 귀여워요,아버지 재밌으시네 ㅋㅋㅋ,익병이가 친동생이면 맨날 빡칠듯ㅋㅋㅋ,아~사키 너무 귀여워 ㅋㅋ,"ㅋㅋㅋ
언제나 보기좋아요",왜 내가 흐믓하냐 ㅋㅋㅋㅋㅋㅋㅋㅋㅋㅋ,유이 씨 덕분에 한참 웃었습니다. 가족분들 모두 건강하고 행복하게 지내세요.ㅎㅎㅎㅎㅎㅎ,아버님 너무 귀여우신거 아니에욬ㅋㅋㅋㅋㅋ?,귀여운 익병이....,귀엽고 착한 가족이네요. 💙💜💙💜💙💜,1:31 msg 치트는 진리라는...,사키 동생 방속각을 위해 일부러 속아주는 척?ㅎㅎ,익병씨 아버님 죄송하지만 너무 귀여우세요ㅠㅠ,4:46 개웃기네 ㅋㅋ,아버지 볼때마다 너무 귀여우심 ㅋㅋㅋ,아부지 왤케 귀여우시지?,아버지 잘 생기셨어요!,편집자분 편집 지린다 ㅋㅋ 이걸살리네 ㅎ,"오늘 힘들었는데  
유이  너 때문에  웃었다  고마워",하이킥 이후 나를 만족시킨 최초의 가족시트콤 ㅋㅋㅋㅋㅋㅋㅋㅋㅋㅋㅋㅋㅋㅋ,아빠 너무 인상이 좋으세요 ^^,힐링된다 ㅜㅜ,가족들나오니까 좋네,언니 나 진짜 언니영상 1~2개만보고 구독했어 사랑해~~~^^,귀여운 사키 괴롭히지마!!,가족 화기애애 한거 보소 보기좋네,사키 카와이~,"나이 먹어 그런지 ㅋㅋㅋ
일본인 편견이 있는데
유익병 ㅋㅋㅋ 중독성 있네요
진심임 ㅋㅋ",ㅋㅋㅋㅋ아버님 너무 귀여우셔ㅠㅠㅠㅠ,"유익병 씨 너무 윾괴하고 ㅎㅎㅎ
아버님도 카와이~ ㅎㅎ",아빠 두 판 일부러 주먹내서 져주고 막판 가위 ㅋㅋㅋㅋ,아 배아프다 ㅋㅋㅋㅋ,아버지 인상 엄청 좋으시네여 ㅎㅎ,사키 너무 귀여워 ㅋㅋㅋㅋㅋㅋ내여자친구 삼고 싶다 ㅋㅋ,이 누님... 나이에 안맞게 귀여움 동안에다가 👍,"언니가 동생보다 더 동생같아

귀여워라",유이쨩 좋아,다시다를 그렇게 부어되면 맛없는게 더이상한거 아닌가요 ㅋㅋ,언니 4번 연속 보자기..,유이언니 넘이뻐 귀여...,이거 유이가 편집한거네 일본감성,ㅋㅋㅋㅋㅋ 진짜 귀여웡 ㄲㅋㅋㅋㅋㅋㅋ,ㅋㅋㅋㅋㅋㅋㅋㅋㅋ온니 개귀여웤ㅋㅋㅋㅋㅋㅋㅋㅋㅋㅋㅋㅋ,천사 맞음~^-^,노력 하는 싸이코는 이길수가 없다...,아 개욱겨 ㅋㅋㅋ,다시다 쏟은게 신의 한수ㅎ,아부지가 젤부럽네 저런 이쁜딸이 둘이나 ㅎㅎㅋㅋ,오까상 대박 ㅋㅋ ㅋㅋ,ㅋㅋㅋㅋㅋ 가족분들이 유쾌하시네유~~ㅎㅎㅎㅎㅎ,ㅋㅋㅋㅋㅋㅋㅋㅋㅋㅋ아 너무 웃겨........아프리카 볼까?....,최고다 아부지짱,유이님과 BTS의 콜라보~ 매우매우 어울림~~,구독자 수  대박~~~~,역시 👍,6:37 ㄷㄷ,아빠의 딸 사랑하는 마음 ㅠㅠㅠㅠ,와우!!!!오늘보니....유이 언니 웃을깨 유이랑 똑같네.ㅋㅋㅋㅋ,ㅋㅋㅋㅋㅋ이야 유이뽕 밑장빼기 잘하네,자유로운 영혼 유이뽕😉💐,아버지 좋은거 보시네,아빠가 은근히 귀여우시네 ㅋ,가족이 단란해서 너무 좋네요ㅎㅎ,대박잼~♡,아~~겁나 웃었네 ㅋㅋㅋ 사투리 엄청 찰지네요~ㅎㅎ,와유!,빨리 코로나 끝나서 한국에서 뵈었슴합니다^^,오늘도 평화로운 유이뿅네 ㅋ,7:43 힙하네 힙해 ㅋㅋㅋㅋㅋㅋ,나는 아버님 캐릭터가 너무 좋음♡ㅋ,유이뽕님 잘보고 갑니다,편집 레게노ㅋㅋㅋㅋㅋㅋㅋㅋ,유이뽕 아프리카에서 고생많앗는데 유튭에서 잘돼서 보기 돟네요 구독 좋아요 누르고 가요~,아버님 귀여우시네요 ㅎ,"익병씨 매력넘치는건 집안내력이였어ㅋ
오늘 이 영상으로 눈호강했네","천성 방송인집안ㅋㅋㅋㅋㅋㅋ
(익병씨는 내 댓글 무슨뜻인지 모르겠지)",설마 이 내가 중년남성 떄문에 유툽을 구독하게 될줄이야..이 채널 치명적이다,아무튼 가족 모두 행복했다.  ^^,유이짱  잘지내고 있지,귀여웡♡,ㅋㅋㅋ 귀여우셔,진짜진짜 귀엽구만,"우연히 지나가다 저의 댓글을 보셨을모든 분들 항상 행운이 깃든 날만 가득하길🥰❤
만수무강 하시고 어떠한 일이든 잘 해낼거예요!
오늘 하루도 수고했어요👍",익병이는 정말 착한거 같애,유이짱~~♡♡♡ 우울한디 덕분에 웃네~~♡♡ 이래서 자꾸보는겨~^^,유이뿅 아버지 예능감 좋으신듯 ㅋ,유이뿅은 천사야. 천하의 사랑스러운 색히 ㅎㅎ 가족이 모두 사랑스럽당 >.<,ㅋㅋㅋㅋㅋㅋ 언니 득템하셨네요~~~~ 유이님 아주 자연스러웠어요 바꿔치기~,오또~상 귀여우시네ㅎ,첨으로 빨리ㅜㅜ,ㅋㅋㅋㅋㅋㅋ언니가 귀여우시네,인방 최적화 가족 ㅋㅋㅋ,사키업.....😍😍😍 (0.75배속으로 보니 더 재미있네요😌😌),유이뿅은 착하구나 ^^,ㅋㅋㅋ재미있어요,아버지 비타민b 사드리세요. 구내염이 자주 오시는분한테 효과 좋아요,ㅋㅋㅋ ㅋㄲ넘 재밌당 ㅎㅎ,可愛いw,가족간 화목하게  지내는 모습 줄거워요 !,아니 아버지 ㅋㅋㅋㅋ 너무 귀여우셬ㅋㅋㅋㅋㅋ
7,전자기기는 모두 물에닿으면 고장납니다. 다만 잘만 닦으면 사용은 되겠지만 수명이 기존보디 빨리 끝날 수 있습니다.,옷이 이쁘네요 잘 보고 갑니다^^,에어팟 유닛의 배터리가 계속 100%여도 괜찮나요?,아니 ㅋㅋ 오래 사용할 수 있는 방법이라더니 내가 생각한 그런 게 아니네 ㅋㅋ,앞으로에어팟프로구입예정인데좋은정보잘보고갑니다,요약 : 방수안댐,찜질방 가도 되나 에어팟끼고 습관적으로 이미 글어왔는데,운덩할때 착용하려고 산건디 ㅠㅠ 슬프네요,요약 : 당연히 하면 안되는걸 안하면된다,습기는 없는데 뜨거운 곳은요...? ㅜ,자전거 타고 가다가 한쪽 떨궛는데 괜찮을까요?,다한증은... 어카누 ㅠ,비 오는 날에 끼는건 상관없겠죠??,영상의 반 이상이 방수가 안된다는 소리 반복이네,잘뫗어요 ^^,아 ㅋㅋ 지금까지 에어팟 프로끼고 샤워했는데 망했네 ㅋㅋ,손좀 가만히,,,,,,,,,,,,,,,,,,,,,,,,,,,,,,,,,,,,,,,,,,,,,,,,,,,,,,,,,,,,,,,,,,,,,,,,,,,,,,,,,,,,,,,,,,,,,,,,,,,,,,,,,,,,,,,,,,,,,,,,,,,,,,,,,,,,,,,,,,,,,,,,,,,,,,,,,,,,,,,,,,,,,,,,,,,,,,,,,,,,,,,,,,,,,,,,,,,,,,,,,,,,,,,,,,,,,,,,,,,,,,,,,,,,,,,,,,,,,,,,,,,
