18,"내일 수량하는데 정말 좋은 기능들이 많네요!
깔끔한 진행과 정리 감사합니다!",저번 헤드셋 후기부터 쭉 챙겨보고 있는데 편집도 정말 깨끗이 잘하시고 영상 전체가 다 맘에들어서 바로 구독 박습니다..ㅎㅎ 앞으로도 좋은 영상 많이 부탁드립니다!!! 화이팅!!!,하지만 오늘 오전 11시에 쿠팡에서 13만원에 주문한 아주 신난 중3은 이 모든 세팅법을 출시후부터 알고있었다.,그냥 맘에드는 설명입니다.. 구독박고 갑니다.,영상 잘 봤습니다 제가 버즈로 지하철이나 버스에서 통화하면 듣는 상대방이 제 목소리보다 밖에 잡음이 더 크게 들린다고하는데 이건 따로 설정이 없나요?ㅠ,와 기계치라 막막했는데 진짜 감사해요,에어팟 처럼 노래 들을때나 유튭등 볼때 진동이 느껴지게 할순없나요?진동을 느끼고 싶어서요...,영상잘보았습니다~ 충전은 울트라샀는데 초고속 충전기로 해도 상관없겠지요?ㅎㅎ,"혹시 전화올때 폰이 가방에 있을때
누가전화온지도 읽어주나요?
저장 되어 있으면  저장된이름
저장 안되어 있으면 번호로 읽어주면 좋을듯한데...",화면에 앞에 모니터랑 전선?...모니터는 나오더라도 전선이나 자잘한건 다 안나오게 해주시면 딱 휴대폰 설명 버즈에 더 집중이 잘 될것 같습니다!,감사합니다,영상 잘 봤어요^^ 음성이 좌우 밸런스 깨져있는게 조금 아쉽네용..,"멜론이랑 라디오 동시재생이 가끔되는데
고칠수있는 방법이 있나요?",1:00페어링을 한번도 안한상태면 페어링을 어떻게하죠?,이분 찐짜 왜 안뜨는거지 ㅠㅠ 구독 박고 갑니다!,좋은정보 잘얻고 갑니다 어제 주문했지요ㅋㅋ,"게임모드키면 게임할때만 실행되나요?
켜놓고 있는데 노래들을때도 빨리 닳을까봐 걱정이네요",첨에 받을때 충전을 해야지 연결이 되나요?,한번 버즈터치패드 눌러서 주변소리듣기로 바꾸면 앱 안쓰고 다시 주변소리 차단으로 바꿀 수 있나용?,감사합니다 저 버즈 플러스 쓰는데 파란색 너무 이뻐요,저도 버즈 플러스를 샀는데 혹시 주변소리듣기 켜면 원래 사아아아아아아아 이 소리가 기본적으로 깔리는건가요? 끄면 안나는데 켜면 조금 거슬리네요,"오늘 버즈 플러스를 처음 사용했는데요.
제가 뭐를 잘못 만졌는지 버즈를 연결했을 때 이어버드 좌우의 배터리가 각자 나와야 하는데 그냥 합쳐져서 배터리가 나오네요 처음에는 잘 나왔는데ㅜㅜ 해결방안이 있을까요?","저 진짜 의문인게 있는데ㅠㅠ
제가 중고로 버즈플러스를 샀는데
유닛+ 케이스 둘다 100퍼 충전을 하고 한 4시간뒤에 봤는데 케이스에 배터리가 사용을 안했는데 5%센트정도가 소모되어있었어요..
이거 제가 불량 산건가요?ㅠㅠㅠ",혹시 노트9하고 사용할때도 갤럭시 웨어러블이 필요하나요?,"양손으로 다른일을 하고
있을때 빅스비로 전화수신 
어떻게 하나요 
꼭 알려주세요 ^^~",스마트폰에 버즈를 한 번 연결 하고 가끔씩 쓸 때 옛날에는 뚜껑을 열고 귀애 꽂으면 바로 연결이 됐는데 지금은 휴대폰을 켜서 연결 버튼을 눌러야 연결이 되는데 혹시 방법  없을까요?,"버즈+ 새로샀는데, 케이스 열어서 페이링 될때마다 와이파이가 켜져요. 이부분은 어떻게 설정하나요ㅠㅠ",너무 감사합니당!,혹시 엘지는 어떻게 설정하나요??,감사합니다 게임모드는처음알았네요,"배터리 잔량 표시가 좌우 따로 되지 않고, 통합으로 나오는데 어떻게 해야하죠?;","가장자리 두번터치 켜면 되게이상한게
머리를 때려도 인식되고 윗쪽 귓바퀴를 두번 쳐도 인식되는데
이게 밖에서 뛸때는 수도없이 볼륨이 커졌다 작아졌다 합니다
이건 해결방법이 없을까요?",무선으로 음악을 듣고있을때 폰에서 카톡이나.문자가 왔을때 음성으로 빅스비가 알려주나요?만약 그렇다면 이기능은 어디에 있나요?알려주셔요~^^,버즈플러스 레드 너무 이쁩니다. 사진은 그냥 적색인데 실물은 아이언맨 수트 색입니다.,"저는왜 빅스비가없고 주변소리 음향,내리기  음성명령 지니뮤직이있는걸까요ㅜ?",충전할때 고속충전기 써도 될까요?,감사합니다.,"Lg 핸드폰과 버즈 연결은 괜찮나요?
끈긴다거나 호환성 좋나요?",아이팟6세대에도 버즈플러스연결될까요?,"안녕하세요! 버즈플러스를 부모님께 선물로 드렸는데! 
알림설정에서 전화수신을 선택했는데, 전화가 오면 oo님에게 전화가왔습니다 라고 알려주는데 
그 소리가 너무 작다고 하시는데 ㅠㅠ 이거 알림 소리를 키울수있는방법이 있나요~?",플러스는 왼쪽이랑 오른쪽이랑 배터리가 따로 뜨는데 저는 플러스를 구매하였는데 배터리가 한번에 뜨네요...해결법 아시나요?,전지금 버즈+ 블루로 듣고 있음 ㅋㅋ,버즈 플러스 외부소음듣기하면 작게 화이트 노이즈 들리는데 정상인가요?,"오른쪽만 끼면 통화할때 상대방이 상대방목소리가 울려서 들린다고 하네요,, 이건 기계문제겠죠..?",버즈 +를 샀는데 2주 후에 하루마다 3번씩 연결이 끊기는데 교환이나 환불 받을 수 있나요?,초이스 잇! 아잇! 어! 어제 갤럭시 버즈 플러스 화이트로 주문했어여! 유용한 정보 얻고 갑니다. (파란색 살걸),혹시 제가 공신폰을 쓰는데 공기계에서 설정후 제 폰에 연결하면 그 기능이 유지 되나요?,버즈 플러스 사려는데 색상이 너무 고민되는데 추천좀 해주세요~~ ㅎ,좌우 배터리 표시 어떻게 해요? 저는 둘다 통합되어 표시되는데...,목소리 멋져요 전 관종이라 핑크 풀렷길래 핑크 주문했는데ㅋㅋㅋㅋ,제가 버즈+ 사용하는데 계속 끼면 이상하게 마이크 느낌같이 되요 옛날엔 안그랬는데,한번 연결한 상태인데 열때마다 항상 연결을 눌러줘야해요..,"그럼 핸드폰과 갤럭시 버즈 페어링을 끌려면
어떻게 하나요 답변 부탁드립니다.",그  전화왔을때 알림울리는거하고같이 상대방이누군지 알려주는기능도 있나요?,모든기종 연결 가능한가요?,통화중 주변소리듣기를 켰는데도 통화를 하면 꺼지는거는 왜 그런건가요??,LG폰은 무선배터리공유 안돼나요?? 버즈+샀는데 안되요 구독누르고갑니다 꼭 유튭 잘 되시길!!!,혹시  불량확인 방법있을까요?,버즈 여러게 연결 가능 하는건가요?,smart things 앱을 사용해서 버즈플러스의 배터리잔량을 상단바에 항시표시할수 있다는데 혹시그것도좀 어떻게하는지알려주시면안될까요 ㅠㅠ,안녕하세요. 얼마전에 버즈플러스 구매한사람인데요. 케이스를 열었을때 자동으로 연결이 안되는데 어떻게하는건가요?,갤럭시 버즈 오늘 왔고 지금 한 3시간 정도 사용했는데요. 왼쪽 한 쪽만 꽂고(오른쪽은 책상에다 놨두고) 집안에서 돌아다녔는데 왼쪽이 갑자기 지직거려요.. 원래 오른쪽 왼쪽 떨어지면 이런가요?,"충전이 한쪽만 되는거 같아요ㅜㅜ
어플들어가면 케이스랑 오른쪽은 몇퍼센트인지 나오는데 왼쪽은 안떠요ㅜㅜ
불량인가요..?ㅜㅜ
방금 열었는데ㅜㅜ",버즈플러스말고 버즈는 게임모드는 없나요?,이거 게임모드 해도 배그할때 소리 좀 지연되는데 정상인가요?,주변소리 4단계 해서 노래들음 배터리가 더빨리 다나여??,"오늘 버즈플러스받은 유저인데용ㅜㅜ 끼고 터치를하니까 터치음이,한박자 좀 느리더라구용 이건 어떡해하나요?",S9도 무선충전 가능 한가요??,왜 배속한 느낌이 들지...?? 그래도 말이 빨라서 편하네요~~,갤럭시s7엣지인데 실함실 기능은 뭐가 있을까요?,어제 버즈 플러스를 샀는데 터치패드를 길게 눌러도 전원이 안켜지고 핸드폰이랑 연결도 안되네요ㅠ as센터 방문 해야겠죠?,A50게임모드 지원하나요?,"음악을 듣다가 유튜브를 재생했다가 
버즈 음악재생버튼을 눌루면 재생이 안되던데 어떻게 해야되는지 아시면 알려주실수 있나요?","다른분들은 말이 느리고 길어서 불편하거나 배속하는데 빨라서 좋네요
농담도 있고 내용도 잘들어있고 
자막크기가 조금 아쉽네요ㅜㅜ",아이폰은 버즈플러스 어케설정하나요?,안녕하세요 중2학생인데 버즈 플러스를 살려고 하는데 제가 평소 애들보다 귀가 작은데 이어버드도 크기별로 있나요? 만약에 없다면 제 귀에 들어갈까요?,"제가 스마트폰이랑 노트북이랑 페어링 해서 사용을 하는데, 스마트폰으로 연결해서 듣는와중에 노트북을 켜면 연결이 스마트폰에서 노트북으로 자동으로 넘어가버려요,, 아무리 찾아봐도 해결방법을 모르겠는데 도와주실수 있을까요 ,, 😭🙏",폰이 LG V50S인데 연결되나요? 된다면 앱 사용은 될까요..,이전곡재생 어떻게 하나요?,LG폰은 버즈+ 페어링할때 모션 안뜨나요?,"갑자기 터치패드가 안되면 어떻게 해야되나요?
터치잠금을 킨것도 아닌데 터치패드가 안되여. 어떻게 히야되요?",버즈 열고 갤럭시 웨어러블 가서 베터리 확인하는거 말고 열자마자 폰에 베터리 뜨게 하는 방법 없나요..? 다른분 되던데 전 모르겠어서ㅠㅠㅠㅠ,버즈 레드로 듣고있습니데이,이거 버즈 플러스 쓸데 모노오디오 켜도 상관없나요??,버즈도 에어팟처럼 페어링했을때 팝업창 나오나요?,전실험실에서 볼륨조절안뜨네요 ㅜㅜ,다 괜찮은데 저는 자꾸 연결이 끊기는듯한 현상이 일어나는데 제것만 약간 불량인건가요?,버즈 끼고있을때 전회오면 벨소리가 폰에서도 울려요ㅠㅠ 어케해야하나요?,음량 조절이 안되네요ㅠㅠ 가장자리 터치했는데ㅠㅠ 정확히 어디를 터치해야하나요?,갤럭시 s6도 버즈 플러스 호환이 가능할까요??  하나 시켜놨는데,안녕하세여 초이스 잇님! 궁금한게 있는데 현재 제 폰은 s10 lte 버전이구요. 초이스 잇 님은 버즈 플러스를 언결하면  각 이어버드들의 배터리 용량이 뜨는데 제 것은 아예 통으로 묶어서 이어버드 2개의 배터리 용량을 각각 확인 할 수가 없습니다. 케이스 배터리와 이어버드 배터리만 확인 할 수 있을 뿐 이어버드 각각의 배터리 용량은 확인 하지 못합니다. 혹시 이게 제 것만 그런 것인가 혹은 이번 업데이트로 인해 바뀐점인가 궁금 합니다 ㅠㅠ 알려주심 정말 감사드릴거 같아요,저기 질문 하나 해두 될까요. 제 버즈 플러스 뚜껑이 잘 흔들리는데 고칠순 없어요?,"제가 작년에 버즈 플러스를 구매했는데요 
전화를 나쁘지않게 되나 디스코드나 페메 영통 등 같은 경우에는 소리가 아예 지지직거리고 웅얼거리는 소리밖에 안들리는 데 이건 제 버즈플러스의 문제 맞나요? 맞으면 교체하려고 생각중입니다",버즈에서 심한건 아닌데 미세하게 화이트노이즈같은 고리가 나네요. 저만 그런건가요?,초이스님 버즈를 연결해서 통화할때 상대방이 아무말도 안하면 자동으로 상대방 소리가 없어졌다가 말을 시작할때 다시 소리가 나오던데 이 기능도 없앨 수 있나요?,잘보고갑니다,버즈 플러스를 샀는데 철가루 방지 스티커 꼭 붙어야 하나요..???,버즈 플러스 진품구별법같은거있나요? 제가중고로예전에샀는데 조금 불안해서 질문남기고갑니다.,궁금한게 있습니다!! 계속 통화중이 아닌데 주변소리 듣기가 안된다고 합니다!!,"저도 갤럭시 버즈 플러스를 쓰는데
실험실에 들어가봐도 게임모드가 없어요ㅠㅠ 어떻게 키죠?
참고로 폰은 갤럭시 s6쓰고 있습니다",제가 버즈 1세대 라고해야하나 맨 처음에 나온거 쓰고 폰은 s9+인데 실험실 기능이 없네요 ㅠㅠ,버즈 플러스 사용할 때 어지럽고 속이 안 좋아져요 왜 그러는지 아는 사람 알려주세요,버즈 플러스 사용중인데요 컴퓨터로 블루투스 연결해서 소리 들어보니까 막 소리가 끊겨서 들리더라구요 원래 이런가요?,"버즈 플러스 사용중인데여
통화 및 오디오 연결이라고 뜨는데 
통화할때 소리를 최대로키고 가장자리 눌러서 최대로 키워도 상대방목소리가 거의 안들리는데 고장인가요...?",발연기 잘봤습니다,이름은 어떻게 바꾸나요ㅠㅠ,웨어러블앱에서 케이스배터리가안나오는데 왜이런가요?,겔럭시 버즈플ㄹ러스 연결할때 애니메이션도 안나와요ㅠㅠㅠ이거뭐죠ㅠㅜ,버즈 플러스 쓰고 있는데 갑자기 오디오가 버즈에 연결이 안되고 통화만 됩니다 왜그러죠..,한쪽이 안들리는데 어떡할까요? 알려주시면 구독할깨요,한쪽이 연결이 안돼는데 어떻게 된거죠,lg폰인데 실험실에 게임모드가 없어요..버전은 최신버전인데 삼성폰에서만 게임모드가 나오나요?,저는 왜 게임모드가 없죠..?,"영상은 많은대 구독자가 없는 이유 까지는 아니고 고칠점??? 아니지 개선 해 주시기 바라는 점??? 이라고 해야 하나. 다른 단어가 있을텐대 생각이 안나네...  무튼
영상은 많은대 영상 5개 봤거든여.
모든 영상이 쓸대 없는 유머가 넣지 마세여.
이 영상에서 초반에 어디 갔지? 그런거 넣지 마세여. 웃기지도 않고 시간만 잡아 먹음. 그리고 제일 개선야할것. 이 영상 혹시 1.5배 빠르기로 올리신건가여??
그게 아니라면 말을 좀 천천히 하시길.
말이 빠르신것 같은대. 너무 느린것도 안좋지만 다른 영상에 비해서 말 두배는 빠르신듯. 천천히 하는걸 올리시면 될뜻해여. 영상은 다 좋은대 구독자가 별로 없어서 이렇게 끄적여 봅니다.
기분 상하셨다면 미안해여.
근대 구독자 늘리고 싶으시면 말 속도를 많이 줄이셔야 할뜻 자막 읽기도 버거워여. 
쓸대 없는 유머도 자제좀여",빅스비가 아닌 구글 어시스턴스도 되나요?,아이폰 쓰는데 어플이 호환이 안되네요ㅜㅜ,ㅇㄷ,돈없어서 QCY-T1 써요..ㅠ,아하~,저 빅스비가 안나와요 어떻게 해야하나요?,갤럭시 a7은 연결이 되나요? 구매고민중인데 연결되나 잘모르곗습니다ㅠㅠ,제가 버즈 플러스를 샀는데 왼쪽만  연결이되고 오른쪽이 연결이 안되는데왜그러는걸까요 뭘해도 계속 그러는데,실헙실탭은어디잇나요ㅠㅠ 보이지않네요 생기게하는법은없나오ㅠㅜ,제폰이 노트10+인데 실험실에 게임모드가 없어요 ㅜㅜ 불량인가요?,너무 빨라요,방수 되나요??,노트9인데 팝업창이안떠요 ㅜㅜ smartthings랑 웨어러블이랑다 깔려있는데도그러네요,S20쓰는데 왜 버즈 애니메이션이 안 뜨나요?,어? 저는 주변 소리듣기가 3개가 있는데 왜 최pd님은 주변소리 듣기가 4개에요? 버즈플러스 문제에요 아님 폰이 A30이라 그래요? 답해주세용 ㅠㅠ,JBL은 안돼나요?,저 아이폰인데 버즈플러스설정에가니깐 게임모드켜기가없네요;;,오늘 버즈와서 게임모드 할려고 들어가보니까 없네요??,저는 어제 샀거든요? 근데 본체베터리는 안떠요,엘지폰은 연결팝업창이 안되나요? 아무나 알려주세요,저는 음성명령이라고 떠요 빅스비가 아니라 어떻게 바꿔요?,혹시 s7엣지도 되나요?,내 버즈 플러스로 보고있음,전 실험실에 게임모드가 없습니다 ㅠ폰은 g6 에요,저는 실함실에게임 그거 하나바께옶어요..,말투가 보이스피싱 하는 조선족 같아요 ㅋㅋㅋㅋ,알림 받을앱에 알림 받는다고 켜 놔도 안떠요. 도와주세요.,제 폰이 s8이여서 실험실에 게임 모드박에 없어요ㅠㅠ,자막 크기가 너무 작고 말이 너무 빠름. 그리고 영상에 불필요한 요소들이 너무 많음.,별거 없네요,저 왜 케이스 배터리창이 안뜨죠??이유좀요,앞에 뻘짓말고 더 빨리 영상 소개 좀 해줬으면 하는 생각에 비추 눌렀습니다,사투리 넘모 심하누...,재미없습니다 하나 둘 셋 이런거 하지말아주세요,실험실이없네여,머하냐?,좋아요가 599여서 눌렀다,아이폰은 안 되나요..?ㅠ,초반연출 왜..오글ㅋ 사투리쓰시나봐요 발음도 부정확,,,,,,,,,,,,,,,,,,,,,,,,,,,,,,,,,,,,,,,,,,,,,,,,,,,,,,,,,,,,,,,,,,,,,,,,,,,,,,,,,,,,,,,
