5,"테크몽님은 칭찬할건 칭찬하고 깔건 확실하게 까셔서 확실히 구매할때, 참고하기 참 좋아요.-_-bbbb",골전도 소음까지 체크해주시네요 ㄷㄷ 최상 리뷰어 등극!! 저도 커널형 쓰면 그런게 신경쓰이던데 나만 예민한가하고 느끼던 부분 까지 언급해주셔서 너무 감사합니다 역시 믿고보는 테크몽님!!,단순히 이번 버즈 노캔이 좋다고만 하는 다른 유튜버들과는 격을 달리하는 리뷰! 이래서 제가 테크몽님 리뷰를 기다렸습니다!!!,16:41 갤럭시 유저는 이거보면 바로 훅,솔직히 방수 기능 감안해서 이 정도 음질이면 진짜 엄청난 발전이라고 생각합니다.,음질은 정말 진짜 칭찬해야 할 제품...,뭐하나 대충하는법이 없으셔서 가장 믿고 시청하고 있습니다^-^ 건강 잘 챙기시고 화이팅하세요~,결국 마지막은 여기서 보게 되네요 항상 감사합니다 ㅎㅎ,테크몽님의 리뷰는 언제봐도 참좋습니다. 대립하는 사람들에게도 기분안나쁘게  반대의견을  조근조근 말해준다고 할까요? 오늘도 잘 보고 갑니다,언팩보고 테크몽님 리뷰 기다리고 있었어요😀 덕분에 꼼꼼히 고민하고 구매결정할 수 있을것같아요! 항상 고퀄영상 올려주셔서 감사합니다😆 나중에 플렉슬 안드로이드버전 출시되거나 베타버전 테스트하게 되시면 꼭 리뷰부탁드려요🙏,테크몽님은 테크용어 간단하게 설명해주시는게 넘 좋음 ㅋㅋㅋㅋㅋㅋ,하고싶은 말이 많아서 유난히 테크몽님 말이 빠르게 느껴지네요 ㅎㅎㅎ 잘봤습니다 !,대부분 장점만 들고와서 궁금했었는데 어떤 단점인지 확실하게 알수있어서 좋았어요! 감사합니다!,두 제품의 방수등급 차이가 꽤 크게 나더군요. 그런 이유도 있는 게 아닐까 영상을 보면서 생각했습니다. 잘 봤습니다~,와 영상퀄리티랑 분석이 굉장히 좋네요 역시 테크몽님이십니다,"친구가 버즈프로 샀는데 통화할때 바람소리가 하나도 안들리고 목소리가 선명하게 들려서 정말 좋아졌다고 생각하고 있습니다
하루빨리 일본에도 출시되었으면 좋겠네요 ㅠㅠ 버즈에서 갈아타고 싶어요","솔직히 깔끔한 정리는 테크몽님이죠 :)
대부분 유튜버분들이 가장 중요하다고 생각되는
에어팟 프로와의 비교는 버즈 프로 제품 소개로
많이 뒷전이라 정보 구하기가 좀 어려웠는데
항상 좋은 정보 감사합니다!!","와.......진짜 꼼꼼하고 신경 쓰셔서 만든 리뷰네요...테크몽님, 항상 진짜 잘 보고 있어요! 기계알못인데도 테크몽님 영상은 편안하고 재밌게 봅니당ㅎㅎ 버즈플러스에서 버즈프로로 넘어가야겠네요 감사해요!","역시 테크몽님..  근거 확실하고 말씀도 잘하시고..
직상 상사면 일 배우고 싶은 상사일것 같아요..ㅎㅎ
s21 리뷰도 언능 보고싶네요..",테크몽님은 의견을 확실하게 나눠주셔서 유익한것 같아요~^^ 감사함다...!!,"0:24 삼성: 크흠...
0:57 케이스는 블랙인데 바이올렛 구매한 그는 도덕책

와... 진짜 테크몽님이 왜 영상 안 올리나 했는데, 언제나 심도 높은 퀄리티 때문이군요","이 영상을 버즈 프로를 착용한 상태로 시청중인데, 갤럭시유저라면 사지 않을 이유가 없지 않나 싶네요.. 저는 버즈플러스를 산지 6개월도 지나지 않아서 프로를 질렀습니다ㅎㅎ 프로로 갈아타기에 전혀 아깝지 않아서 그냥 질렀습니다!!! 바이올렛이 색상 정말 잘 뽑은거같아서 바이올렛으로 샀어용~~",댓글 진짜 안남기는데ᆢ대박 최고의 쌤이네요 !! 많이 배우고갑니다 ^^,이번 버즈프로는 안드유저로서 맘에 듭니다ㅎㅎ,버즈 프로 사서 처음 보는데 진짜 뭔가 잡얘기(?) 같은 거 하나도 없이 설명도 꼼꼼하고 말도 귀에 쏙쏙 박히고 너무 좋네요!  영상 잘 보고 갑니다 감사합니다!,"못참고 1주일 전에 라이브 샀는데 의외로 버즈 플러스에 꿇리지 않나보네요
영상 감사합니다~","버즈 프로를 끼고 영상 리뷰를 봤는데
상당히 공감이 많이가네요
저도 목소리 감지 기능이 정말 편리하고 좋더라구요","와... 오늘 처음 봤는데 이렇게까지 자세하게 설명해주시는 리뷰는 처음이네요
가격 살짝 떨어질 때 살 계획이긴 한데
이렇게 중립적으로 날카롭게 설명해주시는 리뷰어가 처음이라 감동받고 갑니다

테크몽님 처음 뵈었지만 흥하세요!",골진동 에 대한 정보는 정말 도움이 많이되네요 갤럭시 쓰는데 에어팟프로 쓰는 이유가 골진동이 안느껴져서 였는데 버즈프로도 어느정도 줄여준다니 한번 사용 해보고싶네요,테크몽님 신뢰성은 진짜 최고인듯 합니다 하늘이 빨갛다면 그런 줄 알겠습니다,ㅋㅋㅋㅋㅋㅋㅋ진짜 속시원하고 궁금한 점만 딱 딱 설명해주고 설명도 깔끔함..좋네,많이 기다렸습니다 믿고보는 테크몽,ANC TWS 리뷰에서 골진동과 윈드노이즈 언급을 해주시니 너무 좋은 리뷰라고 생각되네요.,언제나 궁금한부분 쏙쏙 자세히 알려주시는 테크몽님 감사합니다.,"리뷰 믿고 구매하게 됐어요...👍
에어팟 프로랑 고민하고 있던걸 해결해 준...👍👍👍
저도 이제 버즈 플러스에서 갈아탑니다...😭😭😭","테크몽님의 리뷰를 기다렸습니다
갤럭시폰을 쓰고있는 입장에서는 아쉬운 점이 있다고 해도 역시 버즈 프로가 끌리는건 어쩔 수 없나봐요ㅎㅎ",헣헣... 노캔 빵빵한 버즈 프로가 나온다고 해서 바로 사려고 했었는데 조금 더 기다려봐야겠네요..,노잼인 내용(ANC)을 어떻게 쉽고 재미있게 전달할지 노력한게 보여요 잘 봤습니다,테크몽님 리뷰하시길 기다렸어요ㅋㅋㅋㅋ 살말 고민하고 있었는데역시 갤유저라면 버즈프로구나!!!! 하고 확신을 갖게되네요ㅋㅋㅋㅋㅋ,기본적으로 어느 영상이든 2배속으로 보는 사람인데.. 테크몽 님 영상은 배속이 필요없네요..! 속 시원해요ㅠㅠ 심지어 발음도 너무 좋고 목소리도 좋으셔서.. 오늘 테크몽님 영상 처음 봤는데.. 바로 구독합니다.. 취저..!,항상 리뷰 볼때마다 느끼지만 공부도 많이 하시고 준비도 많이 하신게 느껴 지네요 오늘도 잘봤습니다!,"노캔기능 너무나 바라왔던지라(라이브는 성애 안 차서ㅠㅠ) 에어팟 프로와의 비교 궁금했는데 역시 테크몽님 👍 
색상이 너무너무너무 취향저격인데 조금만 더 존버하다가 가격 떨어지면 바로 사야겠습니다ㅋㅋㅋㅋㅋ
매번 성장을 보여주니 다음 무선이어폰도 더더욱 기대되네요.","와... 이분은 진짜 연구 많이 하시는 분이다...     신체내부에서 내는 소리는, 많은 리뷰를 밨는데 (노캔이어).  이부분을 다루는 사람은 거의 없었요. 사실 등산이나, 조깅 애호가면 이런부분이 진짜 신성쓰이는 부분이거든요.   
테크몽님 정말 감사합니다.",리뷰가 자세하고 차이점들을 하나하나 짚어 주셔서 깔끔하고 좋네요,"매우 분석적이면서도 객관적 비교, 납득할만한 설명들이 도움이 되었네요. 고맙습니다.",0:52 이번영상 본론은 이거군요! 기만자 테크몽님,가감없이 장단점을 모두 비교해 주셔서 좋아요,설명 너무 잘하시네요 에어팟프로를 사야하나..고민하다가 마지막 정리설명듣고 버즈프로로 마음 굳혔습니다 감사합니다!!👍👍,테크몽님 항상 좋은영상 감사합니다.^^ 톤프리랑 버즈프로랑 둘중에 고민중인데 톤프리 저번에 리뷰 본거 같은데 혹시 같이 비교해주실수 있을까요? ㅎㅎ,"와.. 설명진짜 잘해주시네요
잘봤습니다 감사합니다!!!",이거 너무 궁금해도 거의 아무도 에어팟이랑 비교를 안해줬는데 테크몽님이 해주시네요 감사합니다,결론을 짚고 가고 그다음에 상세 디테일을 말씀하시는 방식이 다르면서 속시원하네요 ㅎㅎ 노켄 기능이 많이 궁금했는데 감사합니다,역시 테크몽님. 다른 영상들과 퀄자체가 다르다,"테크몽님 영상은 처음보는데 버즈프로 살까말까 고민하다가 결국 갤럭시 유저고, 폰도 보라색이라 깔맞춤으로 질렀습니당ㅎㅎ 설명도 조곤조곤 필요한 내용만 쏙쏙 잘 설명해주셔서 너무 좋아요! 앞으로도 전자제품 살 일있으면 꼭 이 채널 봐야겠어요!!","자세한 부분을 설명해주셔서 감사합니다. 🙇‍♀️🙇🙇‍♂️
버즈 라이브인가 프로인가 긴 고민 끝에 프로 구입하기로 결정했어요.
결정장애가 워낙 심해서요.","08:57 ""엄마 저 아저씨 복도에서 춤춰"", ""쳐다보지마!"" 😁😁😁","갈수록 멋있어 지는 거 같아요 ㅋㅋ 파마 너무 귀엽쓰..
버즈 라이브 잘 쓰고 있는데 버즈 프로 보니 눈 돌아가네요. .. 2주 전에 소니 헤드폰 샀는데 ㅋㅋ 참아야 하겠죠 항상 상세한 설명 너무 감사합니다 항상 잘 보고 있어요 ^.^",저는 테크는 테크몽님 영상만 봐요.. 광고보다 리뷰에 집중하셔서 너무 좋아요!! 이제 살 제품이 아닌데도 보는 수준...,역시 믿고 보는 테크몽님의 리뷰 ㅠ,"케이스 형태가 바뀐 게 굳
이제 악세사리 귀여운 걸로 사용가능",요번 프로는 진짜 구미가 댕기는듯,"몽형 잘 보고 있어요.
혹시, 슈어 se846 + 슈어 tw1 조합 리뷰 생각 없으신가요?
보스 qc 이어버드는 액티브 노캔 끝판왕
슈어 se846 + tw1 는 패시브 노캔 끝판왕 느낌인데 ㅎㅎ","자세한 비교영상 감사합니다👍🏻👍🏻👍🏻👍🏻👍🏻👍🏻👍🏻
구매에 정말 많이 도움이 돼요!!!😃",믿보테 믿고보는테크몽 진짜 버즈프로 리뷰들 다보고있는데 제일자세하고 최고에여,노캔기능에대해서 정확한 비교가 필요했는데 감사합니다 !,와우 래퍼신줄.. 엄청 말 빠른데 발음 참 좋으시네요 영상 잘 봤습니다!!,언제 봐도 잘 가르치는 선생님 같다 ㅎㅎ,테크몽님 리뷰보고살까 바로살까 고민했는데 갤럭시 쓰시는분들은 큰 고민없이 질러도 될거같아요 걍 너무 좋음 ㅠㅠㅠㅠㅠㅠ 버즈플러스 버즈라이브 계속 넘기면서 존버했는데 존버한 보람이 이따.....,"라이브가 있지만 바로 구매했습니당...포기할까 고민많이했지만
색도좋고 특히 애니콜케이스..너무 귀엽더라구용ㅠㅠ",리뷰 진짜 깔끔하고 알아듣기 쉽게 설명해주시네요 굳,1주일 잔부터 해외 평을 봐왔는데 가장 진솔하고 솔직한 리뷰였습니다.  정말 공감가고 도움이 되는 라뷰입니다.  얼마 전 힘든 일 겪은 걸 알고 있지만 사실 정말 든든한 지원군은 아무 말도 하지 않습니다.  앞으로도 진솔하고 좋은 리뷰 계속 부탁드립니다.  힘내세요!,항상 새로운 전자기기를 찾아볼때 테크몽꺼를 먼저봐요! 다른분들보다 더 세밀하고 많은 정보를 주는것 같아서요ㅎㅎ 다른분들꺼 안보고 기다렸어욯ㅎㅎ,젠하이저 CX400이랑 비교하면 음질이 어떤게 더 좋은가요???,"버즈 프로 때문에 아이폰으로 넘어가지 않기로 했습니다.
코드리스 바꿈질 많이 해봤지만 여러가지 종합해볼 때 버즈프로가 역대급인듯..",저도 에어팟프로 정도의 노캔을 탑재했으면 좋겠다는 생각이 들어서 다음걸 기다려야겠네요...라이브에서 프로로 6개월 정도였으니 더 기다리면 금방 프로2나 + 나와주겠죠? ㅠㅠ,와 기다렸어요. 다른영상안보고 한참기다림!!,캬 잘보고갑니다 비교해주시니 최고에요,자세한 설명 감사합니다~ 노캔이랑 통품 궁금했는데 궁금증이 풀렸어요 ~,"흥하셔도 나중에 지금처럼 초반 잃지 마시고, 큰회사들 똥꼬빠는 흔한 리뷰어들과는 다른길을 가주세요 부탁드려요 너무 리뷰 좋네요",정말 지속해서 영상을 보게 만드는 분이시네요. 구독합니다.,테크몽 리뷰만을 기다려왔다 드디어!!,믿고 보는 리뷰어 잇섭 테크몽 정확한 리뷰 감사합니다,역시 테크몽님 리뷰를 봐야하는 것이다!!,그럼 문득 궁금한게 있는데 10:36 여기서  2개 기기 동시에 재생하면 소리가 어떻게 나는건가요?,테크 리뷰는 정말 테크몽이 최고다.,버즈 프로 노캔 진짜 레전드임,역시 노캔은 상대적으로 약하지만 편의성은 좋군요 보스꺼랑 번갈아 사용하면 될듯,플러스 사용중인데 무엇보다 방수기능이 부럽네요 저는 다음 세대 한번 기대해봐야겠어요,노이즈 캔슬링 알아보고 있었는데 이렇게 딱!!ㅋㅋ감사합니다!!,"노캔 부분은 IPX7 등급으로 올렸기 때문에 유닛이 완전 막혀있어서 그런게 아닐까 싶네요.
방수 스펙업를 택한거 같아요.",에어팟프로랑 비교하는게 넘 궁금했어요ㅠㅜ,"방수를 포기했다면 노이즈 캔슬링성능 더올릴수 있었을텐데 범용성과 내구성을 생각한듯...

이번 프로에는 또 노캔 켰을때 특유의 이압느낌이 덜하다던데 그것도 장점일듯",리뷰 정말 좋네요!!!,"역시...버즈프로의 노캔이여도...
에어팟프로의 노캔은..따라갈수없는건가?ㅠㅠㅠ",리뷰보다 유니크한 테크몽 케이스에 더 눈이가는건 뭘까요? ㅜㅜ,"플러스 산지 얼마 안됐는데 프로도 사고싶네요ㅋㅋㅋㅋ
플러스 싸게 사서 크게 후회는 안하지만 쫌 아쉽...",갤럭시 유저인데도 ANC때문에 에어팟프로를 놓지 못하고 있었는데 바이올렛 색상이 너무 예뻐서 출시되자마자 ANC  비교 영상을 계속 찾았어요. 진짜 가려운 곳을 시원하게 긁어주셔서 감사합니다😃,드디어 나왔네요 테크몽님 버즈프로 영상! 제일 도움돼요 기다렸어요 ㅎㅎ 잘보겠습니다,"역시, 멋진 사용기입니다. 저도 안드로이드를 주로 사용해서 버즈프로 구매했습니다~^^ 잘듣고, 잘 봤어요. :)",골진동 얘기하는 리뷰는 여기가 처음이네요👍👍,8:58 저 넓은 로비에서 춤추는 용자여...,"The verge 리뷰에서는 버즈 프로가 에어팟 프로 보다 바람 소리 차단 능력이 더 뛰어나다고 그러던데
나중에 한번 실제로 써봐야 겠네요",저 3가지 단점이 노이즈 캔슬링의 전부라고 할 수 있는데 그런면에선 에어팟 프로가 나은 모양이네요.. 아직까진 갈아탈 이유가 없겠어요,지금 버즈 사며 플러스랑 프로 중에서 어떤 게 좋을까요?,"침대에 누워서 영상보기, 이동하며 통화 
이 두가지를 젤 많이하는데 
 라이브랑 프로중에 뭐를 고를지 ㅠㅠ",프로불편러까지 생각하는 당신..수고하십니다,혹시 lg 톤프리7이랑 비교했을 때에는 음질이나 노캔 성능이 어떤가요?,이번에 바이올렛이 주력 색상인데 갤럭시 워치도 새로운 시리즈 나온다면 이 색상으로 나오게된다면 구매하고싶어질듯하네요.,"버즈 프로,에어팟,보스 중 선택하셔야 된다고 사고 싶은순으로 추천 부탁 드려요~",버즈 라이브 동영상도 보고 다른 유튜버 영상도 봤는데 너무 고민되네요 ㅠ  음질은 크게 고집하지 않는 편인데 통화품질 / 배터리수명 만 놓고 봤을때 어떤걸 더 추천하시는지요? ㅠ,"버즈 프로도 저정도의 성장을 보여줬는데
다음 세대 무선이어폰은 얼마나 더 좋을지 기대되네요.","이 집 정리 잘하네
구독 박고갑니다^^",테크몽님이 현대에 계속 남아계셨으면 더 좋은 차를 만들 수 있었을텐데라고 생각이 듭니다 물론 그 안과 밖은 다르겠지만 이런 마인드를 가진 사람이 많아야하는데라는 생각이 드네요,거의 다 써봤고 며칠째 버즈 프로 써보고있는데 노캔은 에어팟 프로가 더 좋은느낌 음질은 버즈 프로 커널형 최고야 짜릿해,"anc 원리 설명할때 제조사나 유튜버들이 파동 형태를 횡파가 아니라 종파로 설명하면 더 이해가 쉬울텐데 
뭐 홍보할땐 횡파의 형태가 더 직관적이긴 하지만","와 역시 내 최애 IT 리뷰어!!! 
에어팟 프로랑 비교 궁금했는데, 가장 먼저 비교해 주시네요:)
테크몽님 사랑합니다♡♡",일반적인 가장 깔끔한 통화나 음질은 어느게 낳을가요.강의 위주로 들으려고합니다,뭔가 말씀하신 단점들이 IPX7을 하면서 자연스레 생긴 단점 같습니다. 그나마 저 단점을 상쇄하려면 추후  이어폼팁이 나오면 PNC도 좋아져서 중고음역대 소음도 더 줄고 바람소리나 골전도도 조금더 안정적이게 되지 않을까 생각합니다.,테크몽님 리뷰가 가장 합리적인듯.,"궁금한게 있는데. 갤럭시 유저임에도 에어팟을 사용하는 이유가 한쪽만 사용했을 때도 ANC기능과 주변소음듣기 기능이 되기 때문인데요.
버즈 프로도 되나요?
에어팟 프로의 ANC보다 주변 소음을 자연스럽게 들려주는게 진짜 능력치라고 생각해요",와... 왜 난 버즈 플러스가 끌리지..... 너무 예뻐.....,잘 봤습니다. Akg n400 대비 음질과 anc이 어떤지 궁금 합니다. 짤게라도 알려주시면 감사하겠습니다 😃,제가 지금 버즈 플러스를 가지고 있는데 졸업 선물로 버즈 프로 사달라고 그럴려 그랬는데ㅜ 1개월만 더 버텼으면ㅜ근데 역시 프로는 프로네요,"하만이 드디어 성과를 내는군요 
음향기업을 인수한거 치고 음향쪽이 별로였는데
이젠 고민할거없이 as나 성능에서 최고는 아니라도 최선은 되겠네요",갤럭시에서 에어팟 프로 쓰다가 버즈프로 사서 번갈아가면 쭉 들어보고 있는데 테크몽님 말씀에 공감이 됩니다. 호환성 때문에라도 버즈 프로에 정착할 생각이지만 노캔은(그리고 주변소리 모드도) 확실히 에어팟 프로가 한 수 위라고 느껴지네요. 그래도 음질이나 배터리는 에어팟 프로 쓸 때보다 만족스럽네요,버즈 1세대 이제 보내줄때가 된것같다. 정말 오래기다렸다 노캔 ㅜㅜ 그리고 완벽한 통화 품질,테크몽님 리뷰 기다렸어요!!!,와 테크몽님 아주 예전에 구독자 얼마없을때 제가 박주영닮았다고 했었던거 같은대 이제는 엄청난 구독자 조회수의 유투버가 되셨네요 그땐 1만명도 안되었었는대 이렇게 잘되신거 보니 제가 다 기분좋네요 테크몽님 거의 초창기부터 봐었어서 ㅎㅎ항상 화이팅 하세용,"최고의 리뷰네요. 몇 년전 40만원 넘는 거금을 들여 Bose qc30 구매한 후 적지 않게 당황했습니다. 바람부는날  음악소리가 안들릴 정도의 풍절음, 걸을때 올라오는 골진동, 먹먹한 압력, 안티노이즈 소음.... 이번 버즈.프로에서 가장 궁금했던 점들인데... 테크몽이 유일하게 정확히 들려주네요!!  그동안 테크몽 보기는해도 구독은 안했는데 지금 바로 구독/알림설정 했습니다.","테크몽님 소개 덕분에 보스 qc 이어버드 출시된지 알고 바로 구입했던 터라 
다른 신제품은 관심이 없어졌네요(에어팟 프로는 이어버드 산날 바로 팔아버렸죠 ㅎㅎ)",다른 리뷰는 좋다 좋다 칭찬리뷰가 대다수인대 전문적이고 여러개의 비교하는것도 괜찮고 리뷰중에 이게 제일 좋은거 같아요,4달전에 라이브 샀는데... 나중에 프로2 나오면 사야겠다 ㅎ..,객과적. 비교분석.  감사합니다,액티브노이즈 캔슬링에서... 감탄하고..,라이브 쓰는데 성향이 프로랑 더 잘 맞을 거 같아서.. 고민되네요 ㅠ,02:31 에어팟프로 표정ㅋㅋㅋㅋㅋㅋㅋㅋㅋㅋㅋㅋㅋㅋㅋㅋㅋ,버즈에서 모다피프로로 한 1달 2달 전에 23마넌으로 갈아타서.. 갤럭시 유저지만 여러가지 리뷰를 보니 그래도 꽤 잘 바꾼것같네요 버즈프로 색상은 바이올렛이 이쁘네용,와....리뷰 완전잘하신다 ㄹㅇ설명 개깔끔,"카페에서 공부하기 적합할까요?
(물론 에어팟이 더 좋겠지만, 저는 지하철, 카페 용도 아니면 ANC를 사용할 일이 없을 것 같아서요.)","착용감과 음질
버즈프로 vs 에어팟프로
뭐가 더 좋아요?",안드쓰면 이제 더이상 에어팟쓸 이유가 없는듯,"예를 들어서 내가 전공하는 과에 따라서 누구한테 공부를 알려달라고 선택하는 입장이 될 수 있겠네요.

수학경시대회에서 대상은 기본이지만 전체 수능 등급이 1~3 등급 하는 이과생이 에어팟 프로면,
대회에 나가진 않지만 전체 수능 등급은 1~2등급 하는 문과생이 버즈 프로 같은 느낌?",방수가 있는데 이정도에 이가격이면 너무 잘만든듯,역시 믿고보는 테크몽,삼성 품질팀에서 스카웃 할듯... 전문가수준의 리뷰 감사요~,좋은 설명 감사합니당👍👍,"테크몽 짱 ㅠㅠ 저 갤럭시 유저고 에어팟프로 쓰고있다가 버즈프로 살까 고민하고 있는데 너무 유용한 영상이에요ㅠㅠㅠ 원래는 지금당장 에어팟프로 팔고 사려고 했는데 남친이 생일선물로 사준대서 존버하는걸로 결정했어요,,ㅎㅎㅎ 에어팟의 노이즈캔슬링을 좀더 느끼다가 갈아타려구요 좋은 영상 감사합니다!!","언제나처럼 착착 이해되게 설명해주셔서 감사합니다. 
궁금한게 하나 있는데, 주 이어폰으로 쓰신다던 보스 제품과 버즈프로를 비교해봤을때 오로지 통화품질과 착용편의성만 두고 봤을 땐 어떤 제품이 나을까요?",역시 ~ 확실한  리뷰입니다  사고싶네요   화이트로~,윈드 노이즈가 두드러진다고 하셨는데 에어팟이 아닌 중저가형 이어폰과 비교해서는 어느정도인가요?,"케이스 종류가 많고 귀엽네요!
가죽은 멋있네요! ㅎㅎ",보스 qc 이어버드 잘쓰고있는데 딱 하나 케이스 크기때문에 넘어갈까 고민이네요 ㅠ,"정말 알차네요
그냥 단순히 음질이 어떻고 이런게 아니라
이 영상 한편만드는데 얼마나 공들였는지 느껴질만큼 
내용 너무 좋아요. 뭐항상 그래오셨지만ㅎㅎ
오늘도 감사합니다^^

 죄송하지만 갤s21 후기도 부탁드립니다~~",확실히 전 버즈 프로가 좋은것같아요 라이브 쓰다 프로로 들어보니 너무 좋더라구요ㅠㅠ 그래서 프로를 메인 이어폰으로 쓰려구요ㅎㅎ 3.1 업뎃 기다리고 있어야되는건 좀 슬프네용ㅠㅠ,머리스타일.멋져요#~ 느~~어무 채널이름과 맞아떨어지는 헤어스타일이에요~~ 몽몽 원생이 ㅋㅋㅋㅋㅋㅋㅋㅋㅋㅋㅋㅋㅋㅋ시ㅏㄹ리라라라라,이어팁을 큰걸로 한번 교체해서 사용해보세요...전 그러니까 노이즈캔슬링이 확실히 달라지더군요,갤럭시유저라면 버즈프로를 쓰는게 좋은거같아요 왜냐면 전용앱에서 쓸수있는 기능들이 많아서:) 그리고 굳이 에어팟프로와 비교만 하지 않는다면 성능 꽤 좋습니다ㅎ,케이스 색감진짜 이뿌네요 ㅋㅋㅋㅋ 작아서 더이쁘게 보여요,꼼꼼한 비교까지 역시 영상의 퀄리티가 최고십니다ㅎㅎ,아이폰하고 연동성은 어떤가요?? 아이폰과 같이 사용해도 같이 사용해도 문제 없을까요?,이쁘다ㅠㅠ,저는 노이즈캔슬링 적더라도 화이트노이즈 작은건 좋네요.윈드노이즈는 아쉽지만 ㅜㅜ.이압같은것도 더 적으려나여,버즈는 둘째주고 라이브 사서썼고 라이브는 첫째주고 난 프로를 사서 쓰고있음ㅋㅋ 대만족,Akg n400이랑 버즈 프로랑 노캔성능 비교하면 뭐가 더 괜찮은가요?,"중간에 에니콜 폰 사진은 왜 보여주지? 했더만 케이스 였군요.
정말 귀엽게 뽑았네요.",8:58 하이라이트,진짜 리뷰를 위해 형만을 위해 기다렸다고,노캔이 중요하지 않아서 그냥 버즈 프로샀어요,이어팁을 변경해서 사용해도 에어팟프로랑 차이가 많이나나요?,"이걸 생일,크리스마스 선물을 다 생략하고 산 내 인생이 ㄹㅈㄷ","16:40 제가 쓰는 기기가 갤럭시s10 + 워치엑티브2 + 갤탭7 + 에어팟2(?) 이건데 진짜 불편해옄ㅋㅋ근데 드디어 버즈 프로가 출시해서 너무 기대됩니다!!! 몇년 전까지 아이폰, 맥북, 아이패드를 쓰다가 하나씩 바꿔 가는 중이었는뎈ㅋㅋㅋㅋㅋㅋ드디어 삼전플세팅!!!!!",확실히 테크몽님은 리뷰 퀄리티가 다르네요,통화품질 상대방 입장에서는 버즈프로vs보스 qc버드  알려주세요!,비교대상에도 제외.... 톤프리는 버려졌어...ㅠㅠ,"에어팟프로 쓰는 친구랑 오늘 삼디프 가서 버즈 프로 노캔 비교해봤는데용. 개인적으로 먹먹함이 덜한 버즈프로가 더 좋았어요.
에어팟이 노캔을 빡세게 해주는건 맞지만 귀를 꽉 막는듯한 먹먹함은 귀에 부담스럽더라구요ㅠ 
라이브 살까말까 한참 고민하다가 프로가 출시해버려서ㅋㅋㅋ 오늘 프로 결제 했슴당ㅎㅎㅎㅎㅎ 너무 기대돼요..ㅎㅎ",에어팟 프로보다 음질은 훨 좋을거라 믿습니다 N400과 비슷하다니 믿고갑니다,솔직하게 리뷰해주는 몽이님 정말 고맙네요. 👍🏻,그래도 곧 한국이 외국 이길 수 있을 듯 한국 화이팅!,주변소리듣기는 어떤가요?! (개인적으로 ANC보다 그게 더 중요),"에어팟 프로가 현재 판매량이 많기 때문에 갈아탈지말지 보기에 좋은 영상인거같습니다. 에어팟프로가 잇어서 궁금했는데, 저에게 딱맞는 영상이네요. 결론은 애플 신제품을 기다려볼랍니다 ㅋㅋ",애니콜 케이스 졸귀ㅋㅋㅋ,오늘 디프가서 한번 들어봤는데 1세대에 비해 엄청난 성장을 했더라고요. 조만간 지를.생각입니다,샤워하면서 버즈 프로착용 후 노래들을수있는 상상을해보았다...,갤럭시 버즈 프로와 LG톤프리7 중에 어떤게 더 괜찮을까요..? 갤럭시 사용자 입장에서 궁금하네요,원래 갤럭시버즈 사용 중이어서 버즈프로 나중에 미개봉중고나 가격 좀 떨어지면 사려고 했는데 오늘 디지털플라자 가서 실물 보자마자 홀린듯 사서 나왔어요ㅎㅎ 바이올렛 색이 너무 취저라 실물보고 바로 사시는 분들 많을거 같네요ㅎㅎ,주변음 허용이랑 노캔 자동으로 왔다갔다 하는거 디게 신기하네요... 에어팟 프로는 안되는데 ㅠ.ㅠㅋ,테크몽님 저는 귀가 정말정말 예민해서 소리 항상 한 칸만 틀고 이압도 크게 느끼는데요ㅠ 현재 버즈플 사용하는데 버즈프로로 넘어갈 만 할까요? ANC자체는 사과가 낫다하셔서 사과프로로 할지 걍 버즈플 계속 쓸지 버즈프로로 쓸지 애매해요ㅋㅋㅋ,탭7 s21 갤럭시버즈 점점 눈에 보일정도로 품질이좋아지네요...,갤럭시에 에어팟 프로 쓰는 중인데 중고로 처분하고 넘어가고싶은 마음이 굴뚝같네요ㅋㅋㅋㅋㅠㅠ,15:16 와 삼성에서 에어팟끼고 통품 테스트하시는 테크몽님의 그 용기 본받겠습니다,"솔직히 골전도 소음은 커널형의 단점이었고 어찌보면 당연히 있는 현상이었는데
애플이 장인정신으로 이걸 개선한거라 에어팟의 장점은 될 수 있어도 
골전도 소음 줄이는 기능이 없다고 단점은 아니라고 생각합니다","갤럭시에서 에어팟프로 1년 사용하면서 불편했는데, 이정도면 버즈 프로로 갈아탔야겠네요 좋은 영상 감사합니다^^",역시 리뷰는 테크몽!!!!,걀럭시버즈는 귀에서 잘 빠진다는 얘기가 있던데 프로는 잘 안빠지나요?,역시 테크몽님 리뷰 진짜깔끔하다... 귀에쏙쏙들어오네요,바람이나 골전도? 문제는 방수 능력을 높여서 그런거 같네요,이어팁 이슈기 있던데요 중고음은 사실상 패시브 차음인데 이어팁이 작게 나와 줄줄 센다고 하던데요... 들어보고 싶다  ㅎㅎ,버즈 플러스도 아닌 일반 버즈쓰다가 이제서야 곧 프로로 갈아타네요 후후.. 차이가 얼마나 날지 벌써부터 기대가 됩니다,리뷰 깔끔해서 좋아요,"방수기능을 뺏다면 아쉬운 부분들이 채워졌을수도 있겠다는 생각도 드네요. 다만 노캔은 그 특유의 답답함이 남아 있는한 호불호의 영역이니 약한 노캔과 방수기능을 더 선호하는 분들도 있을거라 생각이 듭니다. 
무선이어버드 사용자가 날로 늘어나면서 아무래도 신체에 밀접하게 착용하는만큼 다양한 호불호 의견이 나오고 있고, 같은 방향성의 업그레이드 보다는 다양한 방향성의 제품 출시가 더 기대되기도 하네요!","에어팟이 노캔이 더 잘된다는 유튜버도 많고 버즈프로가 노캔이 더 잘된다는 유튜버도 많아서 특히 이번 이어폰은 영상만으로 깨닫기 힘들군요 ㅠ
버즈프로가 먹먹함이 덜해서 약하게느껴져도 수치상으로 더 잘 잡아준다 라는 분도계셔서.. 아직 더 많이 찾아보는중 입니다",광고 안받은 리뷰 찾고있었는데 너무 좋네요,좋은 리뷰 감사합니다. 버즈프로 샀는데 열 때 처음엔 자석이 강하지만 다 열고 뚜껑을 조금씩 움직이니 덜렁거리는? 느낌이 조금 있는데 너무 부드러워서 그런건지 원래 그런건지 궁금하네요...,AKG n400제품과 버즈프로는 차이가 어떤지...,음질면에서  akg n400이랑 비교하면 어떤가요?,"버즈 프로 실사용기.
노캔도 에아팟프랑 비슷하거나 더 좋다고 느끼는 사람이 있을 듯.
음질은 확실하게 좋음. 
저음부터 고음까지 대부분 커버가 됨. 
물론 사람마다 좋아하는 소리가 있겠지만 버즈 프로는 저음부터 고음까지 소리를 들려준다면 에어팟 프로는 특정영역을 강조해서 듣기 편한 소리라고 할까요.
에어팟 프로랑 버즈 프로랑 한쪽씩 착용하고 듣다보면 알게 되는데 확실하게 에어팟프로가 공간감이 떨어지고 날려먹는 소리가 있습니다.
나쁜점은 대화감지를 켜 놓으면 원하지 않는 상황에서 기능이 작동되기도 함.
주변 소리 크기를 매우 크게는 왜 만들었는지 모를 정도로 크게 들립니다. 잘 하면 문으로 막힌 사무실을 도청 가능할 정도로 크게 들립니다.",Lg 톤프리7이랑 차이는 어떤가요?,IPX7에 이정도면 ㄹㅇ 좋다,사고 싶은데 돈이 없어서ㅜ 그냥 버즈 라이브 써도 되겠죠?,버즈 라이브 샀는데...프로 땡긴다............흐규 ㅠㅠ,"음질 → 버즈
노캔 → 에어팟",노캔도 버즈가 더 낫다는 평이 더 많던데 역시 어느 정도는 취향인가보군요,"얘도 좋긴한데 3달 존버하면 20만원으로 살수 있을것 같아서 지금은 안 샀습니다.
다른 분이 쓰던거 써봤는데 음질은 좋습니다.

너무 짧게 써서 노캔은 모르겠는데 라이브 보다는 아주 좋습니다.

통화는 라이브 보다는 좀 떨어지지만 본인이 말을 안하면 소리를 잘라주는 기능이 있다고 하니 라이브보다 상위로 봐도 될것 같습니다.

헤드폰 보다 좋지는 않아서 4월까진 헤드폰이랑 라이브로 버티다가 가격 떨어지면 살려고 합니다.","주로 밖에서 쓰니 음질보단 노캔성능이 중요한데 그점에선 버즈프로가 아쉽지만
안드로이드에선 진짜 에어팟프로 연결상태가 너무 안좋아요. 만원짜리 qcy t1보다 별로니 말다했죠.",영상처음보는데 미국대통령처럼 대중에게 신뢰를주기위한 카메라에 시선피하지않기 똑바로쳐다보고 눈을깜빡이지않으며 이야기하는 방법으로 영상을찍으셔서 민심과 여론이좋네요,근데 진짜 버즈프로 쓰고있는데 노캔은몰라도 음질은 에어팟프로가 못이겨요ㄷㄷ 그리고현재 통품도 버즈프로가 낫지않나요?,"버즈 플러스 산 이유 : 유닛 단독 배터리타임 12시간
버즈 프로 안사는 이유 : 유닛 단독 배터리타임 5시간",그냥최신꺼사는게 후회안한다,"버즈라이브는 액노 있는데 오픈형이라 싫고
버즈플러스는 액노 없고 커널형이라 좋고

근데 버즈프로는 액노 있고 커널형 2마리 토끼를 다 잡았네여! 이걸 사야겠어여",오오 잘봤습니다,,,,,,,,,,,,,,,,,,,,
