,0,1,2,3,4,5,6,7,8,9,10,11,12,13,14,15,16,17,18,19,20,21,22,23,24,25,26,27,28,29,30,31,32,33,34,35,36,37,38,39,40,41,42,43,44,45,46,47,48,49,50,51,52,53,54,55,56,57,58,59,60,61,62,63,64,65,66,67,68,69,70,71,72,73,74,75,76,77,78,79,80,81,82,83,84,85,86,87,88,89,90,91,92,93,94,95,96,97,98,99,100,101,102,103,104,105,106,107,108,109,110,111,112,113,114,115,116,117,118,119,120,121,122,123,124,125,126,127,128,129,130,131,132,133,134,135,136,137,138,139,140,141,142,143,144,145,146,147,148,149,150,151,152,153,154,155,156,157,158,159,160,161,162,163,164,165,166,167,168,169,170,171,172,173,174,175,176,177,178,179,180,181,182,183,184,185,186,187,188,189,190,191,192,193,194,195,196,197,198,199,200,201,202,203,204,205,206,207,208,209,210,211,212,213,214,215,216,217,218,219,220,221,222,223,224,225,226,227,228,229,230,231,232,233,234,235,236,237,238,239
0,애플의 자존심을 지켜주는 수많은 유튜버 사이에서 홀로 우뚝 서있는 테크몽...ㅠㅠ!!,버즈플러스 진짜 넋놓고 하루종일 음악 들어도 배터리가 안 후달려.. 무한재생이야 거의..,"진짜 이형은 안드로이드의 수호자다 ㅠㅠ 버즈플러스 사용하는데 좋아요.
버즈보다 확실히 발전했어요",저 솔직히 버즈 플러스 영상 너무 기다렸어요ㅠㅠ 감사합니다 정말 디자인도 살짝 바뀐건 눈치를 못챘었는데 보고 알게됬네요 정말 설명이 꼼꼼해서 좋아요,고민하다 버즈플 샀는데 테크몽님 영상이 떴네요 ㅎㅎ 음질 배터리가 확실히 개선된게 느껴집니다. 그리고 버즈는 유닛이 케이스에 붙을때 자성이 너무 약한데 그것도 조금 개선된 느낌이라 좋습니다.,"사려고 찾아보고 있었는데 테크몽님 영상보니 너무 반갑네요!!
제품 주문했는데 너무 기대됩니당!!",역시 믿고 보는 테크몽님! 테스트도 꼼꼼하고 내용도 알찬데....설명까지 이해하기 쉽게 쏙쏙! 테크몽님 영상보면 고민거리가 사라지는 것 같아요! 머리속에서정리가 싹!👍,테크몽님 작년 연말부터 봐왔는데 목소리도 차분하시고 IT기기에 대한 지식도 많으신 것 같아 즐겨 보고 있습니다!,진짜 한국 테크 유튜버 중에서 테크몽보다 더 자세하게 해주시는 분이 없는듯 화이팅♡,최고의 리뷰입니다. 굉장히 완성도가 높은 영상이에요. 도움 많이 되었어요 '좋아요' 응원드립니다~ ^^,구독박고 갑니다. 가전 리뷰어로서는 정말 최고네요~,"버즈 사려고 기다리는 중인데 리뷰 올려주셔서 감사해요! 항상 잘 보고 있어요~~
구글 드라이브같이 백업 장치도 리뷰 좀 꼭 부탁드려요!!ㅎㅎ",정말 믿고 보는 테크몽이네요!!,"언제 봐도 깔끔한 리뷰 👍👍👍
다음 노이즈 캔슬링 기능 적용된 버즈 리뷰 기대 만땅해 봅니다!!!",객관적으로 분석해주셔서 믿음이 갑니다. 버즈플러스 잘샀다는 생각이 드네요. 통화픔질이 제일 걱정이었는데 안내주신 영상 내용보면 괜찮은것 같아요. 모르던 장점도 알게 되었어요. 감사합니다 :),통화품질이 에어팟 프로보다 더 좋다니 ㄷㄷ 대박이네,acc코덱이 음질면에서 더 좋다네요. 지연시간 상관없은 단순 음악청취엔 acc코덱 이용하세요!,진짜... 형.. 군대에 있을때부터 개인정비 시간에 형 영상으로 시간 녹였는데 너무 좋은 리뷰 좋다 ㅠㅠ 같은 같은 폰 쓴다는것도 기분이 좋군! 수원 근처에서 군생활 했는데 수원역 반갑네 ㅋㅋ,오늘진짜 10만원주고 레드 구매했는데 레전드템 .. 이건 꼭 사야합니다,"와 다른것보다 배터리가 대박이네요
막상 써보다보면 확실히
효율이 떨어져서 배터리가
금방 없어지는게 느껴지는데 굳.",와 이 영상 기다렸어요ㅠ 버즈 플러스에 관심이 엄청나게 많아서 ㅋㅋㅋㅋ여러 영상 찾아보고 있었는데 테크몽님 영상도 올라왔네요! 잘 볼게요!,이렇게 플러스 영상을 보고나니 기존 버즈 유저들이 플러스로 얼마나 넘어갈지가 궁금해지네요,"노캔 기능이 없어서 아쉬웠는데, 가격과 배터리, 음질 통화품질 등을 종합적으로 생각해보면 매우 좋은 제품인거군요.!!",이게 바로 업그레이드군요!!ㅎㅎ,6:06 탈일반인인 테크몽 그는 도대체......,"와 엄청 꼼꼼한 리뷰네요 
플러스모델로 한두달뒤에 구매해야겠네요 
영상 잘봤습니다~",갓크몽 형님 akg 노캔 코드리스는 언제쯤 출시될까요...? 상반기엔 나올까요? ㅠㅠㅠㅠ 플러스랑 코드리스랑 고민중인데 뽐뿌 오집니다,테크몽님 덕분에 제 통장이 텅장이 됐습니다ㅋㅋㅋㅋㅋㅋㅋㅋㅋ탭s6도 사고 버즈+도 사고ㅋㅋㅋㅋㅋ!앞으로 더 좋은 전자기기 추천해주세요(*˙︶˙*)☆*°,항상 잘 보고 있습니다. 주말에도 열일하시는군요 ㅎㅎ,"이번에 사전예약해서 구매 후 사용하고 있는데, 통화품질 진짜 많이 좋아졌어요.
휴대폰 주머니에 넣고 버즈로 통화하는데 상대방이 폰 들고 통화하는 줄 알았다고 하더라고요ㅎㅎ",역시 테크몽님 오늘도 좋은 소식과정보 고맙습니다 항상 감사합니다,와 베터리 11시간이라해서 좋아졌구나.. 했는데 다른거 3~4시간인거 생각하니까 소름돋게 좋아진거네,진짜 다른 리뷰보다 너무 쏙쏙이해되서 좋아요 ㅎㅎ,"테크몽님은 못하는게 뭔가요?
말도 잘해.. 춤도 잘춰.. 랩도 잘해..
아~진짜 끼쟁이네요~
완전 부럽네요.
버즈플러스 완전 좋은데.. 써보고 싶은데.. 폰이 저가폰이라 쓸일이 없겠네요 ㅠㅠ","흰둥이님과 케미무엇...?!언니멋져요!ㅋㅋㅋㅋ
역시 상세 립뷰는 테크몽!b",1년후에 나온 버즈프로가 노캔안키면 6시간인데 버즈플러스가 11시간이면 개쩌는거였네...,아무 생각없이 재생을 눌렀고 영상이 끝났다... 5분 지났는 줄 알았는데 19분이 지났돠.. 이 몰입감은 ㄷㄷ,버즈플러스 구매 고민할 때 테크몽님 리뷰 보고싶었는데 없어서 슬펐었는데 이미 구매해서 쓰는중에 떴네요 ㅋㅋㅋ 친구들도 버즈플러스 잘나왔다며 공동구매수준으로 사버렸어요 고민중인분들 계시다면 추천드리고싶습니다! 저는 개인적으로 커널형을 좋아하는데 버즈플러스가 이압이 좀 심하더라구요 그거외에는 전 다 만족스러워요!,전자기기 무식자의 랜선 슨생님..😭!!! 버즈 라이브랑 버즈 플러스 중에 뭘 사야 좋을지 몰라서 선생님 찾아왔는데... 버즈 라이브에 대해서도 가르쳐주세요 !!!!! 흐흑.. 갤탭S6도 선생님 영상보구 사서 잘 쓰고 있단 말여요ㅠㅠ !!! 이제 전자기기 사기 전에는 테크몽님 영상 필수 시청입니다🙏🏻,18:15  완전 반전ㅋㅋㅋㅋㅋ 전 버즈플러스 선구매 해서 ㅋㅋㅋㅋ 잘듣고 있슴돠^^,미국인데 파는데가 없어서 배송비에 더비싸게 주고 샀어요ㅠ 써보니 넘 좋은데요ㅎㅎ 후기를  정말 잘해주셨네요. 잘 산것같아 기분이 좋네요!,버즈프로가 나와도 자체배터리 양이랑 두 번 두드리기 음량업다운은 버즈플만의 매력이라 못넘어가요☺,"그저께 버플구매 완료 후 사용소감 : 착용감, 음질 완전 만족 ㅋ 완전 내 스타일",올해 초에 갤럭시 버즈 하고 사용하다가 플러스가 나와버려서 진짜 박탈감이 장난 아니었는데 노이즈 캔슬링 기능이 탑재된 이어폰이 나온다는 말에 마음이 편해졌어요 ㅠㅠㅠ 저 원래 댓글 정말정말 안다는데 너무 기뻐서 하나 달아봅니당🤭🤭 앞으로도 좋은 정보 많이 전해주세용 감사합니다❣,"현재 저두 버즈플러스 사용하고 있습니다. 테크몽님이 말씀하신것처럼 꾸욱 눌렀을 때 이전 곡 및 다음곡으로 넘어가는 기능 추가해줬음 되게 편할거같아요! 그외에 앵간한 기능들 모두 만족했습니다. 특히 통화음질이랑 배터리 시간, 그리고 게이밍 중 레이턴시 줄이는게 너무 좋았네요. 좋은 기기 리뷰 감사합니당.","게임모드로 레이턴시 줄이고 사용할때, 평소보다 배터리 사용량이 체감될정도로 많아질까요?",사전예약 중인 AKG N400의 노이즈캔슬링 기능을 비롯한 성능 면에서의 리뷰를 에어팟프로나 버즈플러스를 비교하여 테크몽님의 리뷰로 얼른 만나봤으면 좋겠어요~!,흑흑 약정끝나면 바로 20사면서 살거에요.. 버즈플러스ㅜㅜ 버즈안사고 존버하길 잘했다,이번 화이트 색상 버즈는 안까지 완전히 회이트라서 예쁘네요 ㅎ 그냥 버즈도 안에가 소라색이라 예쁘긴 한데...ㅎ 그런데 제가 무게를 한 5~10정도는 느끼는데 0.7g이 느껴딘다는게 대단...,"테크몽님 설명을 들으니 확실히 좋아진 것을 느낄 수 있네요 
다음 버전에는 노이즈캔슬링 기능도 기대해 봅니다~~",삼성에 새로운 외계인이 추가된 모양이군요? ㅋㅋ 역시 테크몽님 리뷰 디테일이 최고예요!!!,형 오늘도 고마워요🙆‍♂️ 오늘도 열심히 만드셨어요 👍,버즈플러스 이번에샀는데 진짜 채고~~~~난개인적으로 애플보다 삼성 좋음ㅠㅠ💖,기어 아이콘X 2018 버전에선 PC에 연결하거나 폰에 연결 안 돼있을 때도 주변소리 듣기 가능했다가 버즈에서 pc 연결시 주변소리 모드 못 켰었습니다. 버즈 플러스 다시 PC연결or폰 미연결 상태에서도 주변소리 듣기 켤 수 있어서 좋아요,와... 배터리... 11시간은 정말 짱이네요!!,생각보다 타기기에 연결이 쉬운게 단점도 있더라구요...전에 ㅈ하철에서 어떤 돌+i가 제기기랑 연결했더라고요....,버즈는 가격이 부담스러워서 검색해 보니까 코원 ck11 cr5 등등이 가성비 좋다고 나오더라구요~ 음질 리뷰해 주셨으면 좋겠어요 ㅠㅠ,버즈 플러스 완전 만족ㅠㅠㅠ!!!!,버즈 플러스가 너무 이쁘고 무선 이어폰이 필요해서 찾다가 테크몽님 영상보고 s20 혜택으로 샀는데 완전 대 만족하면서 사용중입니다 감사합니다:),"음질은 에어팟<버즈<에어팟프로<버즈플러스 더라구요!! 생각보다 음질이 많이 좋아져서 놀랐어요. 통화품질도 에어팟프로하고 버즈플러스가 비슷하더라구요.. 다재껴도 배터리때문에 자꾸 케이스에 안넣어도 되는게 진짜 특장점이예요,,",그래서 저도 버즈플러스 살려구요 너무 좋네요~,너무잘만드신거같아요 잘보고갑니다^^,"진짜...테그몽의 고퀄 리뷰다
설명도 깔끔하고 전달력이 가히 생태계 파괴급
버즈플러스 바로 구매할뻔 ㄷㄷ
한가지 궁금한점은 모든 테스트가 최신 안드로이드에서 진행된것 같은데 아이폰에서는 어떤지 궁금합니다 에어팟 통화품질이 저렇게 안좋았나 싶더라구요",진정한 테크 유투버bb 영상 잘보고 갑니다 ㅎ,안드유저에게 정말 유용한 유튭채널 같아요 좋은 영상 좋습니다,젠하이저 모멘텀 tw사용 중인데 s20 구입한 김에 버즈 플러스 궁금해서 구입했습니다. 가격 차이가 있어서 인지 소리가 조금 비어? 있단 느낌이 들고 보컬이나 음성이 강조된 셋팅이었어요.,아... 완전 좋은 최고의 리뷰인 것은 맞는데 보면 자꾸 지름신이 와서 테크몽님 채널을 봐야하나 말아야하나 고민되네요. ㅋㅋ,버즈 플러스 살까 고민하고 있었는데  사야겠네요~ 영상 잘 봤습니다~! 벨바의 이어드럼 블루투스 이어폰도 리뷰 부탁드려요~~,"통화를 위해서 플랜트로닉스 보이저를 사용하고 있었는데요, 버즈플러스와 비교하면 통화품질이 어떤게 더 좋을까요?","저는 버즈 플러스 사전예약으로 사서 바로 사용해봤는데 노이즈캔슬링이 없더라도 커널형이라서 그런지 그냥 끼고 있으면 주변소리가 작게 들리지만,노래를 어느정도 소리를 키워서 들으면 주변소리는 거의 안들린다고 해도 될정도입니다.",목소리가 너무 낭낭하셔서 듣기가 참 좋네요....,노캔 나오면 리뷰 기대합니다,몽님 이야기 듣다보면 빠져들어..😳😳점점... 사야할것 같아요...🤤(광고보고..)좋아 잘참아냈어..🥴,"애플의 큰 재주이자 저주
 : 타제조사 제품까지 가격상승 효과가 나타니고 무덤덤해짐.

어느순간 갤럭시 버즈 시리즈가 비교적 저렴한 가격이라고 느껴짐.",오랜만에 방송 봅니다. 전보다 얼굴이 좀더 맑아 보이시는것 같습니다.  항상 건강 하시구요. 방송 잘 봤습니다.,"다중기기연결 지금도 그렇게되나요?
지금은 웨어러블에서 연결을 눌러야만 되는거같아여!",좋은 영상 많이 올리셔서 영상 잘 보고 있습니다! 좋은 정보 감사드리고 앞으로도 잘되시기를 기원합니다,버즈 2세대 나온단 얘기 처음 들었을때 나오면 바로 사야지 했는데 2세대 대신 플러스 나오고 곧 2세대가 나올거같아서 뭔가 고민됐는데 이 영상보니까 엄청 사고 싶네요 다음 세대 언제쯤 나올까여ㅠㅠㅠ 나오면 스펙 비교해보고 살까 싶기도 하고 지금 그냥 사고 싶기도 하고ㅠㅠ,"흰둥이님:애플 짱!
테크몽님:노캔 짱!","노트10플러스 기준 버즈형제들과 에어팟 프로 레이턴시 비교했다고 하셨고 게임모드에서 버즈플러스가 에어팟프로보다 레이턴시 짧다고 하셨는데, 에어팟 프로가 애플기기랑 연결되었을 때랑 안드와 연결되었을 때랑 레이턴시가 유의미하게 차이 많이 나더라구요ㅎㅎ 애플 기기 갖고 계신 분들은 굳이 레이턴시 때문에 버즈플러스 가실 필요는 없을 것 같습니다!",좋은 리뷰감사합니다! 혹시 08:06초에 나오는 mp3 플레이 앱은 기본 어플인가요?? 아니면 별도의 다른 앱인가요?,"와!! 핸드폰 진짜 많네요!!
11시간이면 엄청나네요!!
테크몽님 생활의 달인 나가셔야 하는거 아니에요?? ㅋㅋㅋ","외계인 고문을 얼마나 한거야??
가성비는 짱인듯~~!!!",플립구매하면 99000원 이벤트 해서 조만간 살 생각인데 리뷰감사합니다,정말 디테일하네요!!,"12:50 볼륨 조정 같은 경우는 실험실에 있는 이유를 알겠더라고요 ㅠㅠ
저는 달리면서 이용해 봤는데 달리는 동안 이어버드 가장가리가 귀에 닿았다 떨어졌다를 반복하면서 제멋대로 볼륨 조정이 되었습니다.
개인차가 있겠지만 귀의 모양에 따라 쓰기가 불편한 경우도 있는 것 같습니다 흑흑",솔직히 비싼게 좋음 결론 프로가 젤좋음 하지만 버즈도 나쁘지 않아요,항상잘보고있습니다~ 수원사시는건몰랐네요~ 세류근처이신가 집앞 하천과 비슷하네요ㅎㅎ,너무 좋아요... 버즈 플러스ㅠㅠ 잘샀어요ㅠㅠㅠ,"테크몽님
혹시 버즈3에 만약에 액티브 노이즈 캔슬링이 적용된다면 둘중 무었을 고르실건가요?","비토닉 트루엔진2 도 리뷰 부탁드려요?
레드빈 무선이어버드 블루투스 이어폰도요?
둘다 음질,통화품질 궁금 해요",ㅋㅋㅋㅋㅋㅋㅋㅋㅋㅋ 안녕하세요 ✋🏻👋🏻 ✋🏻👋🏻 ㅋㅋㅋㅋㅋㅋㅋㅋㅋㅋ 아이폰 리뷰어는 많은데 갤럭시 리뷰어는 테크몽님 믿고봅니다 ㅋㅋㅋㅋㅋㅋㅋㅋㅋㅋ,"삼성폰에서는 개발자정보에서 블루투스오디오 코덱 실행선택에서 Scalable Codec를 aac로 바꾸면 저음에서 더 좋게 사용할 수 있다고도 하네여 이외에도 폼팁을 사용하면 더좋은 음질을...
그리고 제가 한번 경험했던 것인데 좌우의 싱크가 서로 다른 현상이 한번 생긴적이 있습니다. 저만그런걸까여?",삼성  번들  이어폰이랑 베교했을 때  음질  어떤게  좋나요?,잘봤습니다 수고하셨습니다,이어폰보러왔는데 목소리 너무좋으심..,"DMX를.......ㅋ 오늘도 믿고 잘 보았습니다...짐 버즈를 사용중인데.....저는 폰을 2년에 한번씩 바꾸는 정도라....이번 s20이후 21쯤이나 되서야 바꿀것 같은데..
그때쯤 되면....버즈+ 다음 세대가 나오겠지요?...그때도 좋은영상 기대 하겠습니다 ㅎ",영상 기다렸어요!!😉 나중 에어팟프로라이트랑도 비교부탁드려요!,"에어팟프로, N400이랑 비교해봤는데 버즈 플러스가 가성비인거같아요 ㅎㅎ","0:19 오프닝 자막의 OOO 으로 나온 순간부터 결과는 예상했다. ㅋ
게임모드 사용하면 다른 무선이어폰은 사용시간이 줄어드는 걸로 아는데 버즈 플러스는 어느정도 될 지 궁금하네요","재택근무 환경인데, 클램쉘 맥북에 유선 이어폰 쓰다가 몇번 떨어뜨릴뻔 했거든요.
마이크 성능이 디게 궁금했는데, 이정도로 좋아졌다면 잘 활용할 수 있겠다 싶어서 구매했습니다. ^^
영상 잘 보았고 감사합니다.",애케플 먹여 40만원인거랑 벌써 할인되서 13만인 버즈플과는 비교불가이긴하죠,Lg V50 쓰고 있는데 이것도 연동이되나요? 기기 업체가 다르다보니.  잘되는지 궁금하네요..,방금전에 결제했는데 이거보니깐 기분 좋네요ㅎㅎ,버즈 잘뽑은거 같더라구요~^^영상 감사히 잘봤습니다^^,"다시 사야하나 고민되네요^^;; 요즘은 최고의 IT생활을 영위하려면 비용이 많이 드네요ㅠ 기술발전 속도도 빠르고, 가격상승도 빠르고요..",저도 akg노이즈켄슬링 무선이어폰 엄청 기대중이라 나중에 나오면 바로 리뷰해주세여!! 버즈 플러스랑 비교도 해주시면 좋겠슴당,제가 버즈를 사용했었는데 왼쪽 귀가 많이 아팠습니다.(qcy t1을 사용할때는 아프지 않았어요) 혹시 착용시 느낌이 버즈와 같나요?? 중요한 문제에요ㅠ,터치에서 버튼으로 바뀐에어팟프로 덕에 버즈플러스 고민없이바로감 전 버즈썼었음,버즈 플러스 진짜 사고 싶지만 버즈를 쓰고 있어서.. 버즈 2세대 존버해야겠네요! ㅠ 근데 버즈 플러스 블루 색상 너무 이쁘네요ㅜ,우와~ 제품 비교와 상황비교가  확실해서 내용이 확 와닿네요! 역시 테크몽!!!,10:53 여기 설마 율현초등학교 앞에 서호천인가요~?ㅎㅎ 제가 나온 초등학교인데 데크몽님이 제 근처에 사실줄을 정말 1도 몰랐네요ㅎㅎ 데크몽 떡상가즈아,개인적으로 에어팟프로는 귀 안으로 덜 들어가는 대신 좀 두꺼운듯한 느낌이 있더라구요,혹시 버즈 플러스 에어팟 프로 둘다 써보신분께 묻습니다. 에어팟 쓰다가 버.플 갈아탔는데 통화할때 내목소리만 웅웅 들리고 상대방목소리가 잘 안들려서 통화중에는 언성이 높아지는데요 통화할때마다 주위에도 민망하구; 에어팟쓸때는 불편함 전혀 없던 부분이라.. 혹시 에.프 는 어떤가 해서요. 버.플이랑 똑같이 고무패킹으로 귓구멍 막는 형태인데.. 요것땜에 에.프로 갈아탈까 상당히 고민중입니다.,안드로이드의 빛 테크몽.,엠지텍 아이언 v50도 이어버드만으로 10시간이긴했지만요 ㅎㅎ,이 분 뭐~~~~ 좋댓구.....! 감사합니다 !!!!,좋은 정보 감사합니다.,뭐지 통화품질 상당히 개선되었네요?!,비슷한 가격대의 에어팟 2세대보다 훨씬 좋은듯합니다.,에어팟프로 라이트도 나온다고 하는데 어떻게 가격은 어느정도로 출시 할지 기대되네요,전 버젼은 에어팟에 많이 밀리는 느낌이였는데 버즈도 많이 발전했네요~~,"둘 다 써봤는데, 지금은 버즈+씀. 둘 다 제값은 합니다. 소리만 놓고보면, 중저음 성향의 쿵쿵거리는 성향을 선호하면 에어팟 프로, 전체적으로 밸런스가 고르며 자극적이지 않은 성향은 버즈+. 가격대비 놓고보면 소리는 버즈+가 압도적. 다만 대중교통이나 항공편 자주 이용하시는분들은 프로가 훨씬 좋음. 노캔은 정말.. 본인 발걸음에서 오는 진동까지 상쇄시켜주는게 소름.",덕분에 버즈 플러스 구입하게 되었습니다. 감사합니다. 테크몽님.,"테크몽님 리뷰 잘봤습니당~~ 근데 버즈 케이스 어디꺼에요?  넘 귀여워서 저도 사고싶어요 ㅠ,ㅠ",버즈 좋아하고 유용하게 이용하고 있는데 가격이랑 생각하면...아직은 고민해야겠네요 ㅎㅎ,에어팟프로보다 통품 좋은거 되게 의외네요?? 리뷰어 중에 에어팟프로 통품 엄청 극찬하든데...,"감사요~~
버즈플러스 검색중이었는데..
배터리부분이 제일 맘에드네요.
감사요~~^^","버플 샀는데,, 따흑 좀만 기다릴걸,, 그래도 버플화이트 존예라 만족!!!!!!!!!!!!",궁금한게 있는데 주변소리를 수용할 수 있는 마이크가 달려있고 그 주변소리를 재생해주는 스피커가 갖춰져 있으면 소프트웨어 업데이트를 통해서 ANC도 가능하지 않나요?(주변소리 반대 파형을 재생해줌으로써) 이론적으로는 가능할 것 같은데 기술적으로 어려운 부분이 있는건지 잘 모르겠네요.,에어팟 프로는 아이폰과 연결했을떄 확실히 레이턴시가 짧아지더 라구요 안드로이드 연결보단 ㅎㅎ,Lg톤프리와 갤럭시 버즈 플러스 고민하다가 폰보고 갤럭시 버즈 플러스갔어요 테크몽님 영상을 보고있으면 진정성과 전문성같은게 느껴져서 좋아요❤❤❤👍,갤럭시s20 사서 9.9로 살 수 있음에도 조금 고민했는데 이거 보고 바로 구매합니다^^,버즈플러스 볼륨조정을 본체 안건드리고 귀를 톡톡 터치해도 됩니다. 가속도센서로 가동하는 기능인가봐요 편함~,아이폰에서 갤럭시 버즈 플러스 사용할때 게임이나 영상 사운드 레이턴시 딜레이가 심한가요??,무선이어폰 처음 살려는데 멀사야할지 고민이에요.. 라이브를살지..플러스를 살지..,에어팟프로보다 버즈플러스가 더 좋군용! 후회없이선택할수있겠네요!,버즈 +외 akg  n400과는 성능이 뭐가 더좋을까오,테크몽님이 보시기에는 버즈 2가 곧 나올것 같나요? 올해 하반기라던가...,설명이 참 좋아요,노캔되는 버즈는 언제쯤 나온데요? 존버중인데 기다리기 힘드네요,통화품질이 팟프로보다 좋은건 진짜 의왼대?@.@,혹시 버즈 플러스 블프까지 기다릴만한 가치가 있을까요?? 12만원보다 더 싸질 거 같지는 않을 거 같아서 그냥 쿠팡에서 살까.. 싶은데 어떻게 해야할지 모르겠네요,"그,따로 출시한다는 새로운 버즈 언제쯤 나올까요?",랩영상 기대할게요,갤럭시 버즈 플러스 출시하자마자 사전예약해서 받아서 잘쓰고있는뎅 그냥 버즈를 안사용하고 바로 플러스를 사용해서 얼마나 좋아진건지 몰랐어요ㅎㅇ 통화품질이 진짜 많이 좋아졌네요!!,5:15 저희는 10시간 이상 비행기를 탈 일이없어요ㅠㅠㅠㅠㅠㅠㅠㅠ,"원래부터 에어팟이 통화품질 좋다는 말이 많기도 했고, 구조상 통화품질은 에어팟프로가 더 좋을수밖에 없다 생각했는데... 버즈플러스가 진짜 이 갈았네보네.",테크몽님 버즈플러스는 일반 커널형 이어폰이랑 비교했을 때 차음이 어떤가요? 물론 노캔없지만요 꼭 좀 참고하고 싶어요ㅠㅠㅠㅠn400인가 그건 가격도 그렇고 단점이 많아서 버즈플러스로 고민중이에요ㅠ,기존에 아이콘 x에서는 터치패드를 위에서 아래로/아래에서 위로 드래그하면 소리 작아지고 커지고 했는데 그 기능이 다시 들어오면 좋겠네요 ㅜㅜ 아이콘x 1세대부터 쭈욱 써왔는데 아쉽네요,이거 보고 버즈플러스 구매했어요ㅎㅎ,S20+출시하자마자 개통해서 오늘 버즈플러스 구매했네요 기대됩니다 후후후,잘 봤습니다~~노이즈캔슬링 기능이 추가된 이어폰은 출시계획이 대략적으로라도 알려져있나요??,갤럭시 버즈도 소리키우고 줄이고 주변소리듣기 재생 다음곡 다 됩니다 ㅠㅠ,전 왜 에어팟 프로 통화음질이 더 안 좋게 들리지.. 노캔 기능이랑 주변소음듣기 등 작은 유닛의 구조적 한계를 독특한 방식으로 극복한걸로 아는데 어쩔 수 없는 마이크 갯수의 한계인가..,나중에는 무선이어폰으로 통역 돼서 들을 수 있는 기능도 생길 거 같네요,버즈는 뭘 어떻게 만들어도 이 아재스러운 디자인 안바꾸면 답이 없음,여윽싀 텍흐몽 👏👍,좋은정보 잘 보고갑니다~이번에 삼성폰으로 기변하면서 처음으로 구매하게되었습니다,제 직업이 방사선사인데 노트10 배경을 보면 첫취직한 병원에서 찍은 노트2 엑스레이 사진이 생각나네요 ㅎㅎ,갤럭시 버즈 플러스 기존보다 2만원 올랐고 퀄리티는 좋아지고 사용해보고 싶네요,버즈+ 노트 5와 갤탭 s6 lite 둘다 연결하고 싶은데 방법을 알려주세요..,"PC나 노트북에 연결 테스트 한번 해봐주세요...
PC에 사용하면 스마트폰에선 되는데 PC에선 안되는 기능들이 있나..
에어팟과 비교해보면 더 좋을듯..","갤럭시 버즈+vs에어팟2
전체적으로 뭐가 더 낫나요?",테그몽님 시계는 어떤 제품인가요?,"누가 사준다하면: 에어팟프로
내돈주고 살거라면: 갤럭시 버즈+",이거 보고 버즈플러스 구매했어요 굿,음악 듣다가 꺼지면 짜증나는데... 11시간이면 충분하겠네요! ㅎㅎ,이번 버즈플러스 보이는 스펙만 신경 엄청 썼습니다. 사용 5일차인데 벌써 환불하고 싶네요. 본체케이스 배터리 질이 qcy t1이하라 방전도 잘되고 유닛 한번 충전하면 본체배터리 90퍼센트이상 잡아먹습니다...,유익하네요 구독 누르고 갑니다~,테크몽님 에어팟1을 쓰고있는데 버즈플러스를 십만원에 구매할 수 있으면 바꾸는게 낫나요?,버즈시리즈에서 오픈형이 나올일은 없을까요??ㅠ 제귀엔 오픈형이 더 잘 맞는데 폰은 갤럭시라 버즈시리즈를 사고싶은데ㅠㅠ,버즈플러스99000쿠폰으로 사려는데 일시품절이 안풀려서 슬픔ㅠ,오 저랑 같은 케이스예요! 그런데 케이스 뺐다가 다시끼면 윗부분이 안붙지않나요?ㅜㅠ저는 처음부터 안붙어서 고민중이에요ㅜㅜ,"오진화했다 가지고싶다 근대노래무료앱이없어ㅠ.ㅠ아이팟터치쓰는대
흰둥이님목소리출연ㅋㅋ아이고반응이무미건조",6:38 귀욤 ㅋㅋㅋㅋㅋ,드디어 버즈끼고 통화하냐고 욕 안먹는 시대가 온건가...,갤럭시 버즈 플러스하고 엘지폰하고 사용하면 배터리상태 보는거랑 연결 등에는 문제가 없는가요?,"테크몽님~~~~ 하셨던 리듬게임 이름이 뭔가요?^^;; 탭소닉 이후로 마음에 드는 리듬게임이 없었는데, 재밌어 보여서요 ㅎㅎ","통화품질이 울린다고 생각을 했었는데, 비교영상 보니... 버즈플러스 통품이 좋은 거였군요, 그리고 볼륨은 설명서에서도 못본거 같은데 몽님이 말해쥬서 알게됨ㅋㅋ 이런건 왜 사용설명서에 안적혀져있나욬ㅋ",사야겠당,갤럭시 버즈 플러스 확실히 좋아진거 같아요,"구워삶겼어요 ㅎㅎ 저전력, 부품 BOM감소 목적으로 IC 새로 만들었어 넣었어요 ㅎ",테크몽님 질문하나 드려요. 혹 버즈플러스 끼고 음성명령으로 전화걸기나 음악재생 기타등등..가능한지요?가능하다면 어떻게 설정하나요?좀 알려주세요.,갤럭시s10+ 사용중인데 에어팟2 쓰다가 버즈+로 바꿨는데 만족도 장난아니에요...,겔럭시버즈 잃어버려서 버즈플러스 샀는데 내일와요ㅎㅎ내일부터 써바야겠어요,S10 쓰는데 버즈 통화품질 실망해서 에어팟 프로로 갈아탔는데 노캔 빼곤 버즈 플러스가 장점이 많겠네요..그렇다고 두개 쓰는건 에바겠죠?ㅜㅜ,겔럭시버즈 플러스 집적 가서 사고싶은데 어디서 살수 있나요?,테크몽님!!!!  저오늘 버즈 플러사서 쓰고있는데 왜이리 힌지 가 덜렁덜렁그러조???  정작 버즈는힌지가 딱딱했는데 플러스는 너무 부드럽고 고정이안되요,"넘 찬사를 하심 ㅎㅎㅎㅎ


당연히 에어팟프로죠 ㅎㅎㅎ",방금 개봉해서 써봤는데 영~~제가 w80쓰다 잠깐 써봤는데 영...음질 차이가 왜이리..흑ㅠ흑ㅠ,핸드폰을 갤럭시만 쓰다보니 이거보고 에어팟2세댜보다 버즈 플러스가 더 나을거 같아서 바꿨는데 버즈로 통화하는 사람마다 주변소리도 다 들리고 제 말도 계석 끊기고 작게 들린데요ㅠㅠ 혹시 어떤 설정을 해야 통화 품질이 더 좋아지나요??,그럼  버즈플러스 사용했을때 터치음이 한박자찍 느린건 어쩔수 없는거죠?ㅜㅜ,나중에 방탄이랑 콜라보한 버즈 + 퍼플이랑 버즈+랑 비교 부탁드려요!,버즈플러스 블루색상 방금..왔어요!ㅠㅠ그래서 방금 버즈 끼고 배그한판하고 바로 보러왔어ㅇ...!,버즈 플러스 관련 말씀드릴게 있는데 그 두번 두드려서 소리조절 하는게 가속도 센서?를 이용해서 버즈 플러스 끼고 달리면 음량이 왔다 갔다 합니다. 모르고 쓰다가 귀 터지는 줄 알았어요ㅋㅋㅋ,"근데 솔직히 터치의 기능은 삼성의 두번째 코드리스 이어폰인 기어아이콘 X2018이 더좋았음  위로 쓸어올리면 소리 키우고 아래로 쓸어내리면 소리 낮추고, 두번 다음곡, 세번 터치 이전곡
유닛의 크기를 작게 만들다보니 스와이프 기능을 없앴다는데 나는 개인적으로 스와이프의 기능이 더 좋았음",버즈 플러스 엄청 좋아졌네요,내일 사러갑니다ㅎㅎ,버즈 플러스 방금 사왔어요 대만족입니다,왤케 사고 싶게 만듭니까....,이거 그대로 anc 탑재하고 버즈x가 나오면 좋겠다,"이제 정말 갤럭시 휴대폰은 버즈 플러스, akg 노캔블투 이어폰 아이폰은 에어팟 2세대, 프로 이런 느낌으로 자리를 잡겠네요.",3:25 노트 10에있는 저런 배경화면 어디서 찾으셨나요?  진짜 계속 찾고있는데. 찾질 못하고 있어요.. .,딴 이야기 인데  애플 워치 충전 도크 거치대 충전기 꽂는거 혹시 갤럭시 워치 충전기랑 호환 되는지 영상 올려주세요!,버즈플러스끼고 전화할때 상대방한테 들리는음질은 어떤가요? 좋다고하건가요?,3:50 보면 뚜껑만 열면 여러 기계가 연결되는데 따로 설정해야하나요...? 플립과 갤탭s4를 사용자에요!! 매번 웨어러블앱 들어가려니 귀찮아요... ㅠㅠㅠ,현재 갤럭시 버즈와 갤럭시 노트 9를 사용하고있는데요! 아이패드에어 3세대를 사고나서 갤럭시 버즈 플러스랑 에어팟프로중에 하나 살려고하는데 뭐가좋을까요??,뺨 때리거나 딱딱한거 먹을 때 소리가 커지거나 작아져요,형때문에 신용카드 뽑아야하나 현금 딸리겠어ㅋㅋㅋ,데크몽님 아이패드7정도면 배그잘돌아가나요?,버즈 플러스 갖고 싶ㄴ네요 ㅠㅠㅠㅠ 버즈 사지말고 좀만 존버할걸 ..,잉?.. 아 숸역가서 자주 놀걸.. 테크몽님 볼 수 있었는뎀...ㅋㅋㅋㅋㅋㅋ,혹시 실험실에 게임모드가 없는데 어떻게 하나요?,이정도면 삼성에서 테크몽님한테 돈줘야된다..,버즈 플러스 사고 싶게 만드네  ㅎㅎ,에어팟2 쓰다 연결이 너무 안되서 버즈 플러스로 바뀠어요 에어팟은 이어팁이 없는거여서 귀가 너무 아팠어요 버즈플러스는 편하더라고요,무슨 짓을 해도 에어팟 프로가 최고임. 노이즈 캔슬링 최고 음질 최고 디자인 최고. 애플 만세!,테크몽님 지금영상하고는 상관이없는데 제가 갤럭시탭S6을 사용중인데 키보드 커버 각도 조절하고 펜도 보관할수있는 뒷쪽이 제가 좀 험하게 사용해 자주 떨어지다보니 접착력이 조금씩 약해져 가는 느낌인데 이걸 해결할수있는 방법은 없나요?,버즈 플러스 구매하고나서 사용하다가 자꾸 끊겨서 서비스센터 다녀왔습니다. 처음에 끼워져있던 중간사이즈 이어팁을 계속 사용하고 있었는데 기사분이 귀에 닿는 센서때문에 그럴 수 있다고 하셔서 제일 작은사이즈로 바꿔서 사용해보라고 하셔서 혹시 저같은분 있으실까봐 댓글 써봅니다. 저는 결국에는 이어버드 교체했습니다... ㅎㅎㅎ,,,,,,,,,,,,,,,,,,,,
