16,미11 가성비가 엄청나네요 정발만 된다면 고민할 것도 없어보이는데요,"스펙이 전부는 아니긴한데,, 삼성이 좀 경각심을 가지고  더 노력해줬으면 하네여",예전 리뷰 영상 보고 i qoo neo3 사용하는데 잘사용하고있습니다.  144hz 이게 짱인듯하네요 스팩도 그렇고 사진이야 뭐 잘 안찍으니까 ㅎㅎ 아직 최신폰에도 144hz 안되는게 좀 아쉽네요,"마지막에 하신 말씀에 정말 공감합니다.
어렸을 땐 삼성 LG 애플 밖에 모르다가
샤오미 화웨이 BBK(비보 오포 원플러스)를
알게 되니 삼성 플래그십은 사고 싶지 않더라고요...",무게에서 밀린건 진짜 충격이다...,샤오미가 더좋네 ㅋㅋㅋ,아롱황님.  항상 좋은 정보 감사합니다 덕분에 애플 삼성 폰 뿐이 모르던 제가 많이 알게되요,요즘 샤오미폰에 실망했었는데 이번 미11 스펙이나 만듬새 보고 간만에 구매욕구가 생기네요.  국내도 저 가격으로 출시하면 좋겠는데...,아론황님 덕분에 좋은 제품들 많이 봤네요 리뷰 해주신점 감사합니다 올 한해 고생하셨습니다 새해 복 많이 받으시고 코로나 조심하세요,미11 디자인 보면 볼수록 괜찮네요,횽님들~ 근데 글로벌 버젼 샤오미11 직구로 사서 국내 통신사 5g 이용 가능한가요?,진짜 우리나란 스마트폰의 갈라파고스다.,사용자 체감도에서 큰 부분을 차지하는 실행 속도에서 가장 중요한게 스토리지 방식인데 그 부분 비교가 빠져서 아쉽네요.,이제 샤오미랑 비벼지네ㅋㅋㅋㅋㅋㅋㅋ,무게는 스테인레스 스틸 써서 무거워 젔다고 하던데,샤오미는 한국에서 쓰기에는 통화 호환 이슈가 있어서.. 직장인이 메인폰으로 쓰긴 조금 그렇던데,샤오미도 요즘 괜찮네요. 굳이 브랜드 값 따져가며 살 필요는 없을듯..,다시 아이폰으로 넘어갈 각을 잡아야하나...ㅠㅠ,샤오미 디자인 이쁘네요 ^^,"질문입니다
구매시 글로벌버젼을 기다렸다 사라는 이유가 시스템 언어설정 한국어 유무말고는 딱히 없죠?",블랙 나오면 참 좋겠다,마지막 말 뼈 때리네요... 한국아님 구지 삼성폰 살 필요가 없을정도로 중국기업 폰이 따라온거 같네요 ㅜㅜ,ㅋㅋㅋㅋ 앗싸리 황! ㅋㅋㅋㅋ 영상 재미있게 잘 보고있어요^^,일본 수순을 따라가는군.....  갈라파고스 한국.....,이젠 진짜 삼성페이 밖에없군...,S21 스펙이 좀 많이 아쉽네요....,"질문있습니다^^
스페셜에디션 백커버보면 물결무늬 패턴이있는데..이것도 손으로 촉감이 만져지나요?
정말 궁금합니다~~^^!",미 11 한 번 써보고 싶다 정말,미11 가즈앗,내년까진 s20+로 만족할 수 있겠네요 ㅎㅎ,샤오미 같은 경우에 업데이트 했더니 volte가 안되는 상황이 벌어지기도 해서 이제 안사려고 했는데 정말 좋게나오긴 했네요.,"지름신이 오시네요. ㅎㅎ
새해 복 많이 받으시고 전염병 조심하세요.",미11 무게 밸런스는 어땠나요? 아무래도 삼성이 무게 밸런스 하나는 잘 잡아서 같은 무게여도 삼성것이 더 가벼운 느낌이 드는데 이번 미11 무게 밸런스는 같은 무게인 삼성 노트10+에 대비해서 어떠셨나요?,삼성 15w 무선은 고속 충전이라 하기에 너무 민망...😅😅,"생각보다 금방 따라잡히네 ㅎㅎ, 그래도 한 1,2년정도는 더 해먹을수 있을줄 알앗거늘...",왜 난 미 11이 훨씬 좋아보이지?,국내 정발만 하면 무조건 사고싶은데 해외직구로 사면 volte 최적화 때문에 안사게 됨 ㅠㅠ,"브랜드 값으로 두배 차이난다니..
as만 되면 꿀릴께 없는데..",이러면 굳이 국산꺼 쓸필요가 없지..,"샤오미11에 충전포트에 랜모듈이 같이 되어 있을까요?

직장이 보안상 무선공유기가 원천 차단되어 있고 사무실 건물에 통신사 중계기도 없어서 폰 인터넷으로 3분짜리 풀에이치디 영상하나 올리는데 세월아내월아 하는 수준입니다.

답은 유선랜선을 어댑터에 꽂아 직접 폰에 연결하는 수 밖에 없는데 샤오미11에 충전포트에 랜모듈도 같이 되어 있는지 궁금하네요.😞",이젠 샤오미가 디자인도 더 이쁘고 스펙도 좋네...ㅋㅋ 정발했으면 좋겠다,근데 결정적으로 왜그런지 샤오미폰들은 6개월만 가도 폰이 너무 느려져요 2대나 써봤는데 6개월만에 느려지고 초기화를 해도 별 차이가 없음,"50w 무선 충전 도대체 ㅋㅋㅋ..
중국 쪽이 충전기술은 넘사네요",안드로이드 스마트폰 점유율 샤오미에게 뺏기겠네요 ;;,스펙 앞서면서 가격 싸면 샤오미긴 하지만 저게 다 중국 보조금일텐데 좀 씁쓸하네.,이번엔 았싸리 황ㅋㅋㅋㅋㅋ,영상잘봤읍니다,아론님은 진짜 고수심..!! 촥촥감김!! 설명이,"'AronHwang님 인트로 알리미'
 
-아로낭
-아리랑
-아로니아
-황선생
-로뢍
-황선~~~~생로뢍
-아롱다롱황
-아로니황
-앗싸리 황",68만원 가격 그대로 직구나 정발로 살 수 있으면 지금 아이폰12pro 팔고 넘어 가고 싶은데...한국 정발이나 국제용 직구면 80-90 일거 같은데 중국산인거 감안하면 가격이 애매해짐...,샤오미 11 국제판  구매 링크 부탁합니다,비교 잘 보고 갑니다. 삼성은 너무 원가절감에 매몰된 느낌이네요. 그렇다고 엄청 싸냐 하면 그것도 아니고... 이도 저도 아닌 포지션,오 ~ 감사한데요 ~# 사랑해요,특허패스 중국이라도 스펙 가격으로 결정나는 이 판국에 삼성이 노선을 갈아타지 않고 급을 올려서 가격을 낮춰 경쟁력을 확보할 수 있을지가..,샤오미11 스펙 진짜 쩌는데다가 QWHD에서 120hz까지 지원하는데 출고가 가격이 70만원 초반 ㄷㄷ,올해 진정한 삼성의 플래그쉽은 갤럭시폴드3가 될거임 100만원초반대의 보급형 폴더블폰도 출시한다고 발표했었지. 삼성은 슬슬 스마트폰분야 대표제품군을 S에서 Z로 바꾸고있음. S시리즈는 지금처럼 계속해서 애매한 성능업그레이드와 아쉬운 가격대로 출시될 가능성이 꽤 높다고 생각함,"아무리 샤오미 광고해줘도..., 늘 써보니 중국제였음. 전 세계가 입증해줄 듯.",돕2의 인생,이제 중국폰이 여기까지 와버렸다 ㅋㅋㅋ,알리바바에서 직구해서써도 괜찮을가용?,일단 샤오미는 디자인부터 꽝임,이것만보면 샤오미 승인가..,샤오미 정발하면 국내시장 점령할거 같다,샤오미가 더 좋군요. 중국폰만 아니라면 좋을텐데 아쉽네요.,우리나라 빼곤 샤오미한테 밀릴듯.........,아니... 샤오미..... 기괴해,미11좋네요.,어느폰이 삼성인지 어느폰이 샤오미인지..,"나와봐야 알겠지만, 현재로는 경쟁력이 많이 약하네요..","솔직히 중국폰이 스펙도 좋고 싸다고해서 우리나라사람들이 많이 사진 않겠지만
진짜 삼성 계속 이런식이라면 큰 위기이다...  뭔가 대책이 필요하지 않을까 싶다 ㅜ
저가공세 중국폰과 고가프리미엄시장에서는 애플이 꽉 잡고 있는 상황이라...",앗싸리 황 ㅋㅋㅋ,"S21 사실상 유출 유머로 너프라는 말이 넘 많아서 요번에는 그닥 끌리지 않더라고요
아이폰12 프로 살래요? 
갤럭시S21+ 살래요?
둘중 선택 하신다면 어떤걸 선택 하시겠어요?","S21 울트라 팔아먹으려는 전략이겠지만,
아무리 그래도 S21+ 면 플래그쉽 라인인데
풀HD가 말이 되나..? 
진짜 사장 바뀌고 이상해진건지 몰라도 
플래그쉽 라인에 풀HD는 아니잖아",와 미11 진짜 가성비가 좋네요...,안드로이드 간판 플래그쉽 샤오미 니가 짱먹어라,삼페만 아니면 넘어가고싶다.,앗따~~ 았싸리 황 신나네용,"S21 전면 디자인은 진짜 맘에듬.
후면은 샤오미기 많이 예쁘네요","긴장해야 되겠지만  대단할  거 없음
스냅드래곤 888 삼성 파운드리 5n 공정/ 삼성 amoled /이미지 센서 삼성 아이소셀/낸드./ D램/삼성 하만카돈 까지  그냥껍데기만 샤오미고  그냥  삼성폰임.",삼성이 짝퉁기업 샤오미량 비교 하는 시대가 오다니...,"작년 미10이랑 비교해야하는 기종이 S20+였다면 
올해는 미11이랑 S21 울트라랑 비교해야할듯 ㅋㅋㅋ
갤럭시 플레그쉽 망신 다시키네요","이제 하다못해 샤오미의 플래그쉽에게 스펙이 밀린다고 비교되는 게 삼성에겐 창피한 게 아닐지.. 
소프트웨어는 광고를 켜고 끌 수 있느냐에 이미 끝입니다",그치 국내에서는 국내 공식 스마트폰 구매 사용해야 혜택이 많으니까,그 페이..,"급나누기가 문제네요. 
아이폰 급나누기도 이정도는 아닌데",삼성이 중국에서 잘안팔리는이유 딱보면 답이 나오네,어차피 샤오미11 한국 직구 가격은 80-100 사이 일텐데 갤럭시s21이랑 가격대가 겹쳐서 큰 메리트가 없음  둘중에 하나 골라야 한다면 한국은 갤럭시가 답임ㅋㅋ 그냥 난 무조건 삼성이 싫다 그러면 샤오미 사는거고,삼성 ㅋㅋㅋㅋㅋㅋㅋㅋㅋㅋㅋㅋㅋㅋㅋㅋㅋㅋㅋㅋㅋㅋㅋ,마지막이 하신말 와 닿네요 삼성이 자초했다. 글로벌 대기업 답지않게 판매 전략이 허술해요. 애플 처럼 예술적인 급 나누기 하는것도 아니고 애플은 혁신이라곤 1도 없는데 그걸 급 내누기를 잘해서 뭔가 소비자가 혹해서 사게 되는데 이놈의 삼성은 출시 기종도 너무 많고 하위 기종이 상위기종을 잡아 먹는 것도 발생하는 지경에 이르러서 소비자로 하여금 신 제품인데 손해 보는 느낌이 들게 합니다,"어차피 제조업은 금방따라잡힘
소프트 파워가 중요하지. 삼성 정신차리길 곳 중국폰 사야할날이 오것군 ...","갤럭시s21 다음 모델에서 혁신이 없다면, 삼성도 일반 스마트 폰 시장에서 도태 될듯.
아니면 일반 스마트 폰 시장에서는 한발자국 빠진다고 봐야 겠네요.",미11 국내정발하면 좋겠네요 ㅠ..,플래그쉽이.... 아닌가?,아무리 이렇게 광고해봤자 중국폰은 거르는데요 차라리 애플로 가지... 마윈 사라지는거 보고 참 어떤 기업이든 중국정부 아래에 있다는게 무섭네요,이러면 중국서 갤럭시 입지는 더 좁아지겠네요 삼성 실망입니다,아니 삼성폰이 비싼걸 떠나서.... 어떻게하면 888을달고 68만원이라는 가격이 나올 수가 있는거지???,"삼성이 저렇게 못만드는게 아니라, 저렇게 만들면 가격이 치속으니, 원가절감 너무하네요. 삼성이 가격경쟁력에서 밀리네요.

미11일반판이랑 21울트라랑 비교해야 할듯",한국에서  구입할수는   있는건가요?,미11 pro가 나올까요?,오늘은 앗싸리 황 입니다.,"안녕하세요
감사합니다. .",샤오미 a1 쓸때만 해도 가성비폰이었는데.. 작년 정도 되어서는 어? 이거... 싶더니 이제 와서는 가격을 빼고 보더라도 샤오미께 더... 라는 느낌이네요.. 솔직히 이제 플립이나 폴드 아니면 굳이 삼성을 써야할 이유를 모르겠음.. 가격도 저 정도면 알뜰폰 쓰는 입장에서는 AS 감내할만하고..,"아무래도 지금 삼전은 휴대폰 사업은 약간 놓은 듯 한 느낌..
폴더블이나 롤러블 같은 새로운 시장 개척과 ap 같은 비메모리 역량 강화를 주 목적으로 선택과 집중을 하겠다는 걸로 보임.

사실 스마트폰 시장이 너무 상향평준화되었고 포화되서 수익창출이 쉽지 않으니 깔끔히 다음 시장으로 넘어가겠다는 것 같은데

그래도 최고를 유지하면서 넘어갔음 했지만 아쉽",성능이나 가성비를 보면 샤오미한테 밀리고 디자인이나 사용성은 애플한테 밀리고.. 원가절감 한답시고 후면에 플라스틱 박아놓은 s21 기본모델이 샤오미 스냅드래곤 888 박은 폰보다 30만원이 비싼게 ㄹㅈㄷ,어차피 국내는 삼성이고 중국 인도는 중국제조사들이 우세인 상황이라서..특히 플래그쉽은 삼성거 안사는 경향이 있음..,샤오미폰 volte되나요?,정신차려야 겠는데,삼성 이제 샤오미랑 비교되네 ;;,삼성은 폴더 많이 만든다고 하던데요.,국가별 탑5 판매스마트폰에는 삼성은 보급형만 올라가는거 보면. 확실히 삼성의 위기라는게 느껴집니다.. 엘지는.. 흑흑,삼성아 멀리안나간다~,삼성페이만 포기한다면 바로 지름각인데요?,아직도 무작정 삼성만 고집하고 중국폰 무시하는 애들보면 우물안 개구리같음,저는 미11,문제는 샤오미 디스플레이 납품 업체가 어디일까? 중국이면.. 화웨이도 당시 스펙표로는 우월한 모습을 보여줬지만 실제 디스플레이 상태 개판 이었는데.,"스냅 888에 디스플레이 배터리 성능 다 바르는데 가격이 반값수준 ㅋㅋ
상대가 안되네",갤럭시는 9세대만 스피커 좋고 지금 전부 오지게 너프 먹었는데 최신 출시 기기마저 너프 먹인다? 이건 폭망하자는거지. 노트20울트라 사용 중인데 한번도 스피커에 만족감 느낀적 없다. EQ 이리저리 만져도 원하는 소리 절대 안 나옴,s20 wqhd해상도에서 120찌로 되게 업그레이드 된다는 말이 있는데 사실인가여,게임 끝났네...샤오미한테도 밀리는 삼성이 됐구나,삼성 애플이 협력할 때입니다... 중국 기업이 무섭게 따라오는데... 제발 스마트폰 점유율 지켜야하지 않습니까?,"솔직히 S21이 꽤 예쁘다고 생각을 했는데, 
미 11 이 나오고 나니까 미 11이 디자인이 더 좋아보여요 ㅋㅋㅋㅋ","삼성 저러다 한방에 훅간다.
물론 난 갤s3이후로 삼성꺼 사 본적이 없어서 좋은지도 모르겠지만.",삼성 뭐하냐...,이제 2021년도 얼마 안남았네.,"근데 중국폰은 삼성 애플 이런 메이저 회사들과 비교하면 단순 스펙차이만 하면 어려움
당장 애플 쓰는 이유중 한가지가 ios와 애플 특유의 폐쇄적 환경인데 
또한 써보면 중국폰은 스펙보다 폰이 성능이 덜 나옴
뭔 말인줄  알꺼임 체감상인지 모르겄는데 그런 느낌이 있ㅇㄷㅁ","s21+:120만원
미11프로 8g,256gb:130만원






살다살다 샤오미가 더 비싸갈 보누",앗싸리황,삼성폰을 쓰는 가장 큰 이유는 소프트웨어 등 편의성이라고 저는 생각하네요... 소프트웨어 측면에서도 한 번 비교부탁드립니다.,중요한건 미11이 한국에 나온다고 해도 살사람 아무도 없음 사람들은 보통 남의 시선 의식 하는데 다른 사람들 모두가 핸드폰에 관심있는것도 아니고 그냥 중국폰 쓴다~이러지 누가 와.. 좋다 이러냨ㅋㅋㅋㅋ,"삼성페이때문에 아이폰도 못써서뭐,.",어 그래도 삼성 쓸거야 ㅋㅋ,"중요한건 고화질,고주사율에서 배터리가 얼마나 빨리 다느냐. 핸드폰 자체의 내구성, 프로세스의 안정성은 어떠냐가 중요할 듯. 샤오미가 이마저도 해결하면 삼성은 샤오미한테 시장 먹힐듯.",상성 작적 하고 주식떨어뜨리기  ?   픽션,앗싸리 황 ㅋㅋㅋㅋㅋㅋㅋㅋㅋㅋㅋㅋㅋㅋㅋㅋㅋㅋㅋㅋㅋㅋㅋㅋㅋㅋㅋㅋㅋㅋㅋㅋㅋㅋㅋㅋㅋㅋㅋㅋㅋㅋㅋㅋㅋㅋㅋㅋㅋㅋㅋㅋㅋㅋㅋㅋㅋㅋㅋㅋㅋㅋㅋㅋㅋㅋㅋㅋㅋㅋㅋㅋㅋㅋㅋㅋㅋㅋㅋㅋㅋㅋㅋㅋㅋㅋㅋㅋㅋㅋㅋㅋ,앗싸리황님 여기서 아론님인척 이름 사칭하고 그러시면 안됩니다!,샤오미한테 모든면에서 밀리네 ㅡㅡ 삼성 폰 사업 신경안쓰는구나 이제,삼성 이름말곤 장점이 없네 이제,한때 애플도 개바르던 갤럭시가 샤오미랑 비벼지네....,"갤럭시 살 이유가 점점 없어지네 
진짜 오랜만에 샤오미폰이 사고 싶네요.
정말 스펙이 가격대비 후덜덜 함",삼성도 이제 슬슬 퇴물 가나,"우리나사 어쩌려고 그러냐 이번에 무슨법 또 바뀌어서 핸드폰 성지에서 싸게도 못산다며
그럼 자급제로 많이넘어갈텐데 가성비 싼폰들사겠지 삼성 금방 추락하겠네",엣지만 아님 사고싶은데,"언제까지 엑시노트쓸껀지ㅋㅋ
개노답 해외버전은 퀄컴넣는 
노답 삼성. . 자국민호구로보는 ㅡㅡ.",아무리 봐도 노사장이 애플 주신 산게 맞어 그러지 않고 갤럴시를 이렇게 만들순 없어,삼성 신경좀 써라~,S시리즈는 점점 망작이 되어가네... S10부터...,신기술도 없고 값만 비싼 삼성폰... ㅋㅋㅋ,울트라랑 비교하면 압승인데 가격이 두 배;,"플래그십에서 FHD+라는 건
정말 어이가 없는 선택이다
8K로 찍는 카메라를 탑재하면서
그 영상을 2K로도 못 본다는 말이며
밸런스가 똥망이라는거다
어떤 커뮤니티에 6인치대 화면에선
FHD랑 QHD를 눈으로 구분하지 못한다는
헛소리를 봤는데
폰으로 유튜브만 봐도 1080p
1440p는 차이가 많이 느껴진다",그래 갤럭시는 아이폰이 아니라 샤오미랑 비교할 수준이지.....,갤럭시 후면 디자인 너무 안 이쁘네요.디자인 진짜 못봐주겠네,한국 판매하나요,"삼페 때문에 고민했는데
사과폰 오니깐 생각보다 불편하지 모르겠음",왼쪽이 샤오미인가요,폰자체는 잘뽑았는데 중국이라 꺼려지네...,그냥 좋든 안좋든 중국폰은 좀 사기 껄끄러움,"삼송 끝났네 !!!!!!!!!!!!!!!!!!!!!!!!








.","샤오미11은 팔아도 이득 정말 안나올거같은데
화웨이 지분 빼앗아오기로 맘먹은건가?",당장에 페이문제만 해결되면 샤오미로 갈아탈거같아요,삼성은 왜 국내에는 스냅을 안쓸까? 우리가 호갱이라서 그래?,"솔직히 전 요즘 중국폰들 상승세보면 대단하다고 생각함. 화웨이도 미국한테 제재 쳐맞기 전에는 진짜 상승세 무서웠고, 화웨이가 제재당해서 힘빠져도 
샤오미, 오포 얘네도 장난아님. 
요즘 동남아 시장 점유율 보면 중국 기업들이 삼성 쉐어 많이 뺏어온 것 같고. 
중국이라고 무시하고 싶은 마음은 알겠는데 그냥 덮어놓고 비웃을 건 아니라고 봅니다.
해외 리뷰어들 비교영상보면 중국폰들 되게 빠릿빠릿하고 충전 속도, 배터리 닳는 속도 이런거 삼성 플래그쉽 S시리즈나 노트보다 나음. 
애플이야 워낙 고가시장에서 입지가 탄탄하고
자기들만의 차별화 된 것이 있으니 그렇다쳐도, 삼성은 중국 기업들 치고 올라오면 제일 먼저 타격 볼 회사임. 안드로이드, 스냅드래곤 등등 중국 회사들하고  다른게 없으니",투애니원~,언제 살 수 있을까요?,삼성이랑 샤오미중 샤오미가 더 높다고하고 자빠졌네 삼성은 앞으로 더 내놓을게 얼마나 많은데 ㅋㅋ,중국 거주중이라면 샤오미도 as가 되나요?,충전 속도는 진짜 미쳤네..근데 샤오미가 아무리 좋게 나와도 삼성 살거라....;;;,갤럭시노트20울트라 중고 사느니 이거사고말지 가격도 중고보다 저렴,지금의 삼성에게서 몇년전 LG의 냄새가 난다...,"샤오미보다 삼성이 나은점.
내정보가 중국에 들어가는가 안들어가느냐? 차이??? 
특히 스마트폰의 경우는 정말 심각할듯..  미국이 괜히 중국산 앱들을 밴 시키는게 그냥 하는게 아님.
스마트폰 특성상, 그냥 모든게 들어있음. 사진, 동영상, 이동경로, 전화번호, 카톡대화, 메세지.. 등등..
샤오미도 백도어 논란이 있는 회사인데.. 한번 했는데 두번하지말라는 법은 없음.

하지만 확실히 S20을 기점으로 너무나 심각한 원가절감이 눈에 띌 정도의 삼성의 행보에서 우려가 나오긴 함.",우리나라는 저가격때 s20fe 이따구 제품이나 만드는데...  갓오미..,이제는 중국폰에게도 밀리겠구나 에휴~~~ 한국기업에게는 미안하지만 겔럭시 빠였던 나는 사과폰을 구매했다. 전혀 불편하지않다.,"애플 삼성 샤오미 차이? 
가격필요없다 갬성차이",내 정보 털릴거 같아서 S10 5G 계속 쓸거같음ㅋㅋㅋㅋ,"근데 못생김
가성비는 인정","사장님들 보고계시죠? 
정발하면 대박납니다",그럼중국폰많이쓰세요 ㅋㅋㅋㄱㅋㅋ,그래도 솔직히 중국폰은 글타 ㅜㅜ아직,코로나가 싫으면 샤오미 쓰지 마십시오. 저 안 좋은 폰.,아니 삼성 갤럭시 마음에 안드는건 왜 애플 따라해 그럴거면 애플에 갤럭시 넘겨라 아무튼 난 다음폰은 아이폰으로 넘어 갈거임,삼성 자꾸 어중간 하게 애플처럼 고급화 시키려고 하네,삼성 이재용 죽이기 효과가 나오네요..일 좀 해라..직원들아..사장 없다고 땡땡이 치지 말고..,엑시노스만은 거르기로 했습니다.,중국   ㅋㅋㅋㅋㅋㅋ황,이제 갤럭시는 바타입은 한물갔음. Z에 역량 집중하려고 s에 일부러 힘빼는거지,드디어 눈이 삐였네요 샤오미11이 제아이폰 11pro보다 이뻐보임니다,"샤오미는.. 스펙은 훌륭한데.. 폰이 훌륭하지 못해.
특히 사진 결과물은ㅎ
왜인지는 모르겠는데 대만에서는 샤오미 폰 쓰는 사람이 없더라.
대신 오포, 리얼미? 이 두 브랜드는 조금 보임.
한 6-70%는 아이폰쓰고.",샤오미 오늘 ㅈㅅ 됫어 트럼프가 아주 사형을 시켯어 ㅋ ㅋ ㅋ,중국폰이 구글이 안되서 안쓰는건가요???유튜브랑 안드로이드 앱들을 사용 할수 없는건가요>???,왜 아이폰이랑 비교  안 함?,한국인중에 샤오미 폰 쓰는 사람이 있긴함...?,"삼성페이라.. 사실 중국에서 위챗결제나 즈푸바오 결제를 써보시면 삼성페이와는 차원이 틀리게 편리합니다.. 삼성페이가 만약 중국에서 출시되었다면 거들떠도 안받을듯한데요.. 거기에 네이버나 페이스북 로그인을 타 앱에서도 쓸수 있지만 중국의 위쳇로그인이 훨씬 강력하고 편하죠.. 위챗 첨 개발할때 카카오톡을 배웠다는데.. 그간 한국의 핀테크가 너무 규제나 기득권세력 때문에 발전을 못하고 중국에 역전을 당해 버렸어요.. 이제 와서 겨우 it를 다시 진흥시켜려 하지만 이명박때 정통부, 과기부 없애버리고 전 it 예산깍고 한나라의 it 산업을 방송통신위원회라는 언론집단의 하나의 부서정도로 후퇴시키면서 정말 중간에 많이 뒤쳐졌습니다. 사용자의 스마트폰 경험환경은 중국이 훨씬 발달되어 있습니다. 배달앱도 비교안되고 각종공과금 납부 절대 은행갈일 없고 위챗에서 다 해결되고, 기차 비행기표 다 간단히 예약결제됩니다. 에구.. 삼성페이 이야기 하다가 너무 나가 버렸네요. ㅋ",저 가격에 샤오미 성능이 역대급이긴하네요.. 하지만 역시 브랜드파워가 아쉽고 후면디자인만큼은 너무 안예쁘네요 허허 s21이 선녀같아보임,아무리싸도 중국폰은 안써서...,너무 뇌피셜이 많아서 참고하기 어렵네요.,백도어폰 안사요 ㅅㄱ ㅋ,,,,,,,,,,,,,,,,,,,,,,,,,,,,,,,,,,,,,,,,,,,,,
