,0,1,2,3,4,5,6,7,8,9,10,11,12,13,14,15,16,17,18,19,20,21,22,23,24,25,26,27,28,29,30,31,32,33,34,35,36,37,38,39,40,41,42,43,44,45,46,47,48,49,50,51,52,53,54,55,56,57,58,59,60,61,62,63,64,65,66,67,68,69,70,71,72,73,74,75,76,77,78,79,80,81,82,83,84,85,86,87,88,89,90,91,92,93,94,95,96,97,98,99,100,101,102,103,104,105,106,107,108,109,110,111,112,113,114,115,116,117,118,119,120,121,122,123,124,125,126,127,128,129,130,131,132,133,134,135,136,137,138,139,140,141,142,143,144,145,146,147,148,149,150,151,152,153,154,155,156,157,158,159,160,161,162,163,164,165,166,167,168,169,170,171,172,173,174,175,176,177,178,179,180,181,182,183,184,185,186,187,188,189,190,191,192,193,194,195,196,197,198,199,200,201,202,203,204,205,206,207,208,209,210,211,212,213,214,215,216,217,218,219,220,221,222,223,224,225,226,227,228,229,230,231,232,233,234,235,236,237,238,239
0,"플래그쉽 급이랑 비교하기에는 아쉬운 부분이 좀 있지만 중급기 부분에서 타 기기들과 비교하자면 따라올 가성비가 없는 폰이겠네요 
한 휴대폰을 오래 쓰지 않거나 그다지 하이스펙 휴대폰이 필요하지 않은 유저들에게는 엄청 좋은 폰인거 같아요",120hz를 완벽하게 소화해낸건 아니지만 20만원대라는 구성에 가성비의 파급성이 진짜 크네요,잇섭님 정말 좋아요 ㅜㅜㅜㅜ 전자기기에 관심도 없는데 항상 챙겨봐요,"중국은 경쟁상대가 안되지만 
샤오미는 경쟁상대로 봐야합니다 
인정할것은 인정하고 경쟁상대로 나아가는것이 좋습니다 삼성 분들",블루 색상 진짜 이쁘다.... 내가 딱 원하던 블루의 느낌이 저거였는데 진짜 색상땜에 탐나네,오오 120hz의 본격적인 상용화 시작인가 (굳굳),"LCD라는 점, 베젤이 굵다는 점, 후면 로고가 대빵만하다는 점 정도만 제외하면 가성비 하나는 완벽한 폰 같네요.","영상 해상도 좋네요 !!
영상볼맛나게 꽉찬화면!!","싼마이로 충분히 써볼만 할것같네요
잘봤습니다.","가격이 똑같다면 포코와 A51, Q92 중에 가장 좋은 폰은 뭔가요?","ㅋㅋㅋㅋㅋㅋ아 형님 오늘도 웃고갑니다
항상 인트로가 너무 재밌어서 영상 끝까지 안볼수가 없드라구요",카메라 ois만 들어있었으면 진짜 넘사벽급 사기였을텐데,33W랑 120Hz는 미쳤다,포코~~~가성비  굿  👍 😎,난 이형 좋은게 다양한 전자제품 리뷰랑 인트로전 광고없는게 너무좋다..,음...미유아이도 깔끔하고 가성비도 진짜ㄷㄷ,8:04 이형 이 치킨 꽤 좋아하네ㅋㅋ,30만원대  이하 라인업에서   원신  최상옵 돌아가는건 포코x3가 유일한듯?,홍미노트5 프로를 지금도 세컨폰으로 사용중인데 샤오미의 기능과 성능은 아직도 감탄이 나옵니다~,포코 F1은 터치씹힘 뽑기 운 때문에 호불호가 심하게 갈렸는데 이건 어떤가요?,실제 사용기가 궁금해 졌습니다. 언박싱 감사합니다~~,"말그대로 가성비는 대박이네요~
최신폰 액정 가격도 안하다니 ㅎㄷㄷ","k30 5g극속판인 768g에서도 미세한 끊김때문에 온전히 120hz를 사용하지 못하고 있다는 느낌이 들더군요

그래도 좋은점은 이런 제품들 덕분에 고헤르츠 시대가 빨리 열린다는 점이겠죠 ㅎㅎ",고장나면 버리고 새로 산다라는 멘트에서 빵 터졌네요ㅋㅋ,5:35 다시가 아니고 샤오미는 항상 넣어줍니다.,"09:30에서 
발음도, 자막도 ""뺏겼다""라고 표현된 것은
""베꼈다""의 상남자 버전이니 참고 부탁드리겠습니다.
이상 잇섭님 발음 번역가였습니다.",제가 스마트폰 성능을 잘 몰라서 그러는데.. 갤럭시 S6 엣지+에서 얘로 넘어가면 성능적인 차이가 어떻게 되나요?,"가짜사나이2기 보고 잇섭님 영상 보는 건 국롤이지!

근데 저 정도 스펙이 20만 원대면... 다른 브랜드는 얼마나 남겨먹는거야?",스냅 800 번대 만 들어가 있었으면 더 좋았을던데 아쉽네요 잘봤어요,방금 운동뚱팔씨름편 보고왔습니다. 정말 재밌었어요~,진짜 역대급 가성비 끝판왕. 혜자스러울 정도.,이걸 또 지르면 흑우가 될수 있나,"크 영상퀄리티 지린다""","잇섭님 핸드폰 스펙 볼때 싱글,멀티 그 두게 어턱해 봐요?
8:34",샤오미 역시 핸드폰 가성비하나는 넘사벽이네 ㄷㄷ,"진짜 지문인식 요새 너무 부러워요 ㅋㅋㅋㅋㅋㅋㅋㅋ 
마스크때문에 어디 페이스 쓰겟나..",8:10 스테레오 스피커의 좌우 소리크기 밸런스가 맞나요? 한쪽이 좀 크지는 않나요?,"형, 가성비 좋은 해체쇼도 진행해주시나요??
일단은 사용기 이후에~",액정글래스 강도는 어떤지 궁금합니다~,상당히 괜찮은 폰이네요 20만원내외의 폰이 이정도면 대단한 성능입니다,헬지는 765g 넣고 899인데ㅋㅋ,근데 듀얼심이 뭐가 좋은거에요?,33w충전기 쩔었다,끊기는 120hz 쓰느니 그냥 안끊기는 60hz 사용하겠음,120hz 쓰고싶은이유가 웹스크롤 끊김없이 하고싶어서인데 그게 끊겨버리면 아쉽네요,"가성비도좋구  겜하고문자어플등등 하기에는  부족함이없음  항상폰비싼거쓰다
분실로인해포코3쓰는데 괜찮음",아니 이거 보다가 질레트 파워업인가 그 광고 나와서 재밌어서 보는데 갑자기 잇섭형 나와서 개깜짝 놀랬자넠ㅋㅋㅋㅋㅋㅋㅋㅋ,"잇섭님 라이젠 9 3900XT가 출시했는데
데스크탑조립 컨텐츠해야하지 않을까요^^?
저 기대하고있어요^^!",가성비 훌륭해 보이네요.. 배터리는 얼마나 오래 가는지도 궁금하네요,구글 플레이 앱들 다 덜아가는지에대해도 다음에 리뷰 부탁드립니다,"행님 포코 언급에 의하면 필요에 따라서
주사율이 알아서 변경된다고 합니다
브라우저가 그거 때문에 느린 게 아닐지..",ㄹㅇ 샤오미는 저 가격으로 이득을 버는지도 궁금하다,이형 33W로도 저리 좋아하는거보니 120W인 미10울트라보면 뿅 가겠네,역시 100회 무료뽑기의 나라,현재 860 ap 달린 x3 pro가 220달러 정도에 팔리죠. 가성비 압도적 원탑,"자급제 20만이면 그냥 사서 영화만봐도 되겠다 ㅋㅋ
스펙이 가격에 비해 ㄹㅇ 넘 사기아니냐","포코폰F1의 터치 이슈는 펌웨어 업글로 어느정도 해결되더군요.
포코X3가 이 정도면 갤A51를 누나 줘버리고 이것으로 갈아타야 겠네요.
포코F1과 포코X3를 두개 들고 다니게 되겠네요.. ㅋㅋ 베터리도 F1처럼 깡패급이면 좋겠네요.",스테레오 스피커만으로도 합격점 ㄷ ㄷ ㄷ,와 저거 절대 안살거긴하지만 가성비 진짜 대박이긴하다.. 애플보다 베젤 얇아보이는데 120헤르츠고 왜케 쌈?? ㄷㄷ,홍미노트 9s랑 스펙이 거의 같네요,"형 질레트 광고 ㅋㅋㅋㅋ 이제봤어
소소하게.. 200만???~~~~  ㅋㅋㅋㅋ
유튜브 광고보다가 빵터짐 ㅋㅋㅋㅋ",서브폰으로 사야겠다...저건 미쳤다,동영상 재밌게 봤네요^^ 제가 봤을때 120Hz지원한다는것과 폰후면 디자인이 괜찮은거 말고는 딱히 좋아보이지는 않네요. 120Hz도 뭔가 제대로 구현되기 힘든 스펙과 액정같구요. 뭔가 눈길을 사로잡는 스펙을 만들기 위해 억지로 120Hz를 끼워넣은것 같네요. 그리고 똑같은 중저가 폰이라도 중국은 인건비와 부품이 상대적으로 저렴해 한국의 비슷한 기종의 폰들보다 좋아보일수는 있겠으나 실제 사용해보면 결국은 후회하고 말죠. 전 후면카레마쪽 디자인은 마음에 듭니다. 개인적으로 한쪽으로 치우친 카메라보단 중앙에 모인 카메라를 선호하는지라^^,"디자인은 엘지 에니메이션은 삼성 제어센터는 애플
이게 뭔조합이지?.. 만 매우 훌룡한 가성비👍","잇섭님 면도기 광고 나올 때 놀랐습니다 ㄷㄷ잇섭님이 면도기 광고 ㄷㄷ
잇섭님 화이팅!!!!!!!!!!!!!!!!!!!!!!!!!!!!!!!!!",인도판이 더 깡패라던대,샤오미는 중국 	브랜드인게 믿기지가 않어 ㅋㅋㅋ 한국에도 저런 회사 있었으면,중국 가격+애플 성능+LG단단함♥+다른거는 삼성= 완벽,저 가격에 펀치홀이라는것에 감탄,어디 과일처럼 생긴 브랜드 폰은 아직 60hz 인데 와우,"04:49 ""게임이 몇 개 설치..."" 이러한 방법으로 휴대폰 회사는 수익을 내는 방법으로 더 저렴하게 폰을 파는 거 아닌지 궁금합니다... 만약 그렇다면 좋은 방법인거 같기도 하네요",잇섭님 아무리 검색으로 찾아봐도 도저히 못찾겠어서 그런데 혹시 워치 액티브2에 사용하시는 스트랩 한국에서 구매 하신건지 여쭐 수 있을까요? 너무 마음에 들어서 찾고 있는데 제 능력의 한계네요,백도어가 없다면 최고~,갠적으로 Oled 보다 lcd라서 더 땡긴다Oled액정 깨지는순간 지옥을 맛보는거라 lcd가 훨 좋다,"잘 봤어요. 근데 카메라 설명 기능 좀 더 해주셨으면 좋았을텐데. 혹시 야간모드 촬영메뉴가 따로 있는지, 품질은 어떤지 등등....참!  홍미노트 9와 비교해서 어느게 더 좋은지도 궁금하고요.","MIUI 는 한국폰이 스마트폰 초창기 똥볼 차고 있을때 샤오미에서 애플의 UI를 베끼면서 나온거임. 
샤오미 자체 UI라고 해서MIUI 이고 이게 우리나라 스마트폰 초창기에 일부 사용자들에게 유명해서 MIUI를 다시 다른 스마트폰에 적용 하는 펌웨어 적용도 많이 했어요.
특히 넥서스 유저들 사이에선 이런게 다른 제조사 폰보다 쉬워서 이런거 전문으로 만지는 분들도 계셨죠.","중궈라 거부감이 들어도 가성비 하나는 인정해줘야함... 알차게도 담았네
공폰으로는 좋지",그래도 뒤에 포코라고 써져있는거는 어떻게든 가려야 쓸듯 ㅋㅋㅋㅋ,모니터 시장을 보면 DCI-P3 90% 이상을 충족하면서 144Hz인 27인치 모니터가 20만원대에 출시됐습니다. 중소기업 제품이고 규격은 다르지만 그만큼 스펙 대비 패널 단가가 줄어서 20만원에 120Hz 패널인 스마트폰을 볼 수 있지 않나 싶네요!,포코는 백도어 괜찮나요,스펙이 그래도 가격대비 혜자라는부분은 우리나라도 배워야할 점이라 생각합니다 (충전부분 특히 120hz),"CPU관련 영상 이것저것 돌아다니다 뜬금없이 나타난 4년전 보습, 손발 오그라드는... 내가 왜 창피한지...풋풋하셨던데.. 지금은 왜....",가성비갓... v20 한4년쓰다 넘어왔는데..참좋네요,120헤르츠긴 하지만 가변형이라...50헤르츠까지 떨어진다고 하더라구요...,루저들을 늘려야 한다는 샤오미 나도 루저인가봐 ㅜㅡㅜ,질레트 광고에 왜 형이 나와 ㅋㅋㅋㅋㅋㅋㅋㅋㅋㅋㅋ,4K 이건 못참지ㅋㅋ,이형때문에 삼성에서 애플 넘어왔는데 이젠 샤오미라니;;,워터미크 기능도 있네.. 이건 좀 칭찬해줘야 할듯,도대체 어떻게 저런 가격으로 출시되는지 진짜 궁금하네요 ㅋㅋ,잇섭님 신기한게 어떻게 눈은 찡그리는데 입은 웃고 있을수가 있죵?,"프로세서만 스냅 855급이상만 넣었어도...










가격이 꽤 올라갔을 거에요",정보를 빼가는 대가로 좋은 폰을 준다,이거 동영상 품질이 어떤가요?  FHD 60 프레임에서 광학식 손떨림 방지 되나요?,기기값 20 + 개인정보값 50 = 도합 70,"잇섭님 ㅠㅠ 삼멤 또 이슈 터졌어요 ㅠㅠ 지금은 해결되었지만,잇섭님이 삼멤에 관련한 영상을 올리면 좋겠어요 ㅠㅠ",와...아직도 노트9 쓰고 있는데.. 가격과 스펙을 보니 듀얼폰으로 쓰고 싶어지네요!!,"poco x3 128G 모델 사용중입니다. (얼리버드 행사가격으로 수수료 포함 31만원 정도)
poco F1 2년 사용하고 갈아탔어요
CPU가 아랫등급이라 걱정했는데~
완전 만족합니다~!!! 
특히 충전 스트레스가 없다는 점  30분=0.5시간 정도로 끝~!
 실 사용측면에서 이보다 적당한 폰이 있을지...
한가지 아쉬운 점은 무선충전 미지원입니다.","미패드4 쓰면서 느낀거지만 샤오미제는 확실히 가성비는 좋지만 잔고장이 많음.
miui가 구버젼이긴 하지만 잠금이 패턴으로 풀리지 않아서 재부팅을 해야한다거나 허구한날 홈 화면 재실행 된다거나 ui도 좀 구림",형 오늘도 사랑해ㅎ,저가형이라는 것이 모든 단점을 커버친다,요새도 기본으로 겜 넣어주는 폰이 있네요 기본으로 게임 탑재된 스마트폰은 마지막으로 본지 7년쯤된거같은데,개인정보 안넣고 게임기로만 써도 나쁘지 않을듯,"중학생떄부터 검노 좋아했는데 케이스가 검노네
샘송에 비하면 가성비가  아주 초기에 사면 샘송은 미완성인데
업데이트 하면서 맞춰가는 폰에 비하면 또 괜찮은 듯",아ㅋㅋ 마지막 한대는 인정 ㅋㅋ,와......배터리 용량이 5000이 넘어? ㅋㅋㅋㅋㅋㅋㅋ 대박 ㅋㅋㅋㅋㅋㅋ,와우 노트20 보다 싼데 성능이 혜자면 금방 기업 컺ㄹ듯ㄷㄷ,"20년 전에 아이리버 mp3 플레이어 256메가인지 512메가짜리를 35만원 주고 샀었는데
신기하다",와이파이 끈 상태에서 usim1을 데이터 설정해두고 usim2 통화시 동시에 인터넷 안되는건 기존하고 같은건가요?,배터리 수명이 얼마나 긴지가 가장 중요한데 안알려 주시나요?,현재 포코폰 쓰고 있는데 가성비 하나는 끝내줍니다 이제 중국산이라고 해서 무작정 무시하면 안될듯 싶어요,샤오미 사용하다 개인정보 살살 녹는거 아닐까 무섭ㅎㅎ,드디어 샤오미가 나왔구만 샤오미 빠로서 기분이 좋네요,"저런건 케이스만 예쁜거 잘나오면 진짜 서고 싶다 특이한 외형의 스마트폰은 케이스 땜에..
..",역시 샤오미 가성비 하나는 죽여주네 ㄷㄷ,와 가성비가 진짜 좋네 20만원 이상의 값어치는 톡톡히 하네,Z폴드는 모르겠는데 노트20U는 45W까지 할수있지 않나요?,심지어 펀치홀도 포코가 더 작네 ㅋㅋㅋㅋㅋㅋㅋㅋㅋㅋㅋㅋ,나도이거 해보고싶엉,"이런 폰들 덕분에 중급기의 기본 스펙 기준이 높아질거고 그로 인해 다른 삼성 같은 브랜드의 중급기 퀄리티도 높아질거임. 이건 꽤 좋은 듯 (근데 저거 얼마나 팔아야 손익분기점 넘기려나 ㅋㅋ)

+ 근데 노트20은 지금 생각해도 진짜 역대급 개창렬 폰이다",q92랑 비교하면 뭐가 더 좋은거에여?,"포코x3랑 미10라이트랑비교하면어떤가요
거의비슷한거같은데",인도판은 어디서 구하나요.. 인도판이 맘에들던데,"좋은 폰이군요. 단언컨데 최고라고 봐야합니다. 최고의 만족도를 줄 것 같아요.




중국폰이  아니라면 말이죠 ㅎ",9:14 100만원이 넘어가도 5w 주는 사과와 비교됨ㅋㅋㅋㅋㅋ,"잇섭님 홍미 노트 7프로와 홍미 노트8프로등과 비슷한 점이 많아서요. 무게는 좀 무겁지 않은지와 하단의 스피커쪽을 막고 소리가 어느정도인지 확인 부탁드려요. 제가 홍미 노트8프로 글로벌 버전인데 주머니에 넣었을때 스피커부분이 막히면 거의 안들릴정도라서요. 확인 부탁드립니다.

그리고 중국폰은 대부분 케이스가 기본탑재입니다. ^^; 그리고 상단 케이스 중간 폰 하단 케이블 및 충전기로 구성되요.","이건 유심만 꼽으면 바로 사용이 가능한가요?
예전에 홍미노트같은건 유심 꼽고 이것저것 설정을 해 주어야 문자가 들어왔는데..",잇섭이 영어하면 어떤느낌일까?,2:37 형.....5160mAH면 넉넉한걸 넘어 많은거잖아........,7:33 잇섭 형의 박수 소리와 함께 혜리님 등장     게스트 ㄷ.....,믿거샤 이제 아니다- 샤오미,20만원짜리 리모컨 플렉스하신 잇섭행님,"조금 상반된 질문일수 있지만
포코x3에 보조공간 있나요?",120hz에서 약~~간 혹하다가 다시 정신차리게되네요 ㅋ 120hz인데 화면 넘기는게 안부드러워보여요 ㅠ,잇섭형이 저렇게 언박싱 하면서 스마트폰 욕 안한거 처음봄ㅋㅋ,20만원에 초고사양 최고의 카메라를 쓰며 중궈대가리와 정보를 공유할수있는 폰!!! 절대  구매안해야지!,노트10과 비교했을때 뭐가 나을까요,3.5랑 usb c 스피커 홀 등등 몇몇 부분은 LG v30~40 과 너무 비슷하네요.,놀랍게도 벤치마크점수가 s20칩과 두배넘게 차이가ㅋㅋㅋㅋㅋ 엌ㅋㅋㅋㅋㅋㅋ,"그 백라이트쪽 검은색 그건
아임백이 제일 심하죠... 지금 골드 쓰고있는데 베젤짝짝이에 저거 너무 심합니다ㅠㅠ",와 좋다 충전기만 하나 가져오고싶네,가성비는 진짜 따라가기 힘들군요 기능을 최대한 넣으려고 하는게 보이네요,잇섭님 처음 시작할때 노트20을 주먹으로 패지말고 도끼로 패지그랬어요,가격이 모든 걸 용서할 수 있는 폰이네요ㅋㅋㅋㅋㅋ,Z축 진동 모터 = 리니어 모터로 갤럭시 플래그쉽 (노트 20 제외) 이나 아이폰에 들어가는 일반 모터보다 비싼 고급 모터입니다,"120Hz는 APU , 램 많이 안 먹나요? 765G도 아니고 732G면 저가형 APU아닌가요?",중국꺼지만 애플 사멋 ㅇ바르는 것은 인정이다.,샤오미..어디까지 올라올셈이냐..,ir블라스터가 탑제된건 좋네요 스마트폰 하나로 여러 기기제어하는거 편했는데 왜없앤건지 ㅜ,늘 소중한 정보 즐겁게 주셔서 감사합니다.,"샤오미같은 기업의 제품을 쓰면 안되는 이유가 대부분의 기업에서 개발하는 하는데서 많은 비용이 발생하고 때문에 가격대가 높게 책정되는 부분도 있는데
샤오미는 다른 기업의 제품의 기술을 훔쳐쓰는 경우가 많아 가격이 낮게 책정되는 것이라고 들었어요",삼성페이만 쓸수 있다면 바로 지르고 싶네요,잇섭님 a 21이나 a31도 리뷰 가능 한가요?,"잇섭님~ 부탁이 있는데요....
뜬금없지만  프나틱기어 미니스트릭 
이라는 키보드 좀 리뷰 해주시면 좋겠어요 ㅎㅎ 가격은 11만원 정도 하는데 지금 네이버 할인가격으로 8만9000원 정도 합니다 꼭 부탁 드려요!","다음 영상 혹시 "" 괴물폰 샤오미 포코 X3 분해해버렸습니다"". 안돼나요??!!ㅋㅋ",배그같은거 돌리면 어떤지 궁금하네요.,6:31 진동 세기도 설정 가능합니다 ㅎㅎ,어디서 사신건가요? 잇섭님이 리뷰하셔서 F1도 그때 샀는데 이번에도 또 끌리네요,우와 필요 없는데 사고싶다 ㅋㅋㅋ,형님 영상은 매번 잘 보고 있습니다. 하지만 아무리 가성비고 대륙의 실수라 불리는 샤오미라도 거르고 싶습니다...ㅠㅠ,카메라가 중앙에 있는 점이 마음에 드네요!!,성능 딸려서 120프레임 못살릴 거면 120이라는거 자체가 의미 없는데 일반 앱들도 그러면 120의 진가를 느낄수 있는 게임같은건 사실상 60보다도 못한거 아니야?,우와X친 대박 이다 .....ㅈ..,"어린이들이 막 쓸수 있는 장난감, 게임기 대용으로는 괜찮은데..🤔","???:이정도 가성비면은~ 광고나와도 참을 수 있다
넌 안돼
둥둥 둥 두두두둥 둥둥",세컨폰으로는 짱이네 부담스럽지도 않고 성능이 가격대비 좋기도 하고,"-어디 하나 모자란 것 없는 스펙에 저 가격이라니  저게 어떻게 가능한지  진짜로 전혀 모르겠다.(요즘 대부분 폰 크기, 배터리 용량, 성능, 카메라가 다 비슷하고 업그레이드 하겠다고 무언가를 제거하기도 하는데 저 크기에 저 스펙이 어떻게 들어갔는지도 이해불가능...
-현재  Redmi note 7  사용 1년 지났는데 처음엔 별로 신경 안쓰인다고 말하지만  오래쓰는 사람은 미세한 끊김이 진짜 최악의 단점임 심지어 지금 삼성 애플  폰으로 바꾸고싶어서 미칠 지경. 물론 그 끊김 뿐만이 아니라 램 용량이 너무 심하게 딸려서 배로 체감하는 걸 수도 있음.  3기가 짜리를 샀는데 실제  메모리는 무려 800메가밖에 안돼서  저사양 게임 켜면 렉 엄청 심하게 걸려서 폰 던지게 만듬.   가끔씩 렉 없을 때도 있고  발열이 진행되면 점점 렉 체감됨
결론은 램을 늘려야 하거나  버벅이는게 싫으면  이 폰을 거르는 게 좋을 듯.",갠럭시 A31 374천원짜리 할인받아서 174천원에 사서 요금제 44천원짜리 할인받아서 기계값7700원 2년약정포함해서 월 39천원 내면 된다. 앗싸~~ 우리모두 하이마트로 가용,엘지가 이런방향으로 가면 좋을텐데,뒷면에 포코 써있는거 귀엽네 ㅋㅋ,스피커에서 빵터짐 ㅋㅋ,포코폰 F1 이후로 샤오미 폰 언박싱은 오랜만 이군요,싼값에 잘만들긴했네 중국이 싫긴하지만 싼인건비로 살만한 제품들이 많은건 팩트인것같다,샤오미는 진짜 미쳤음,형 이것도 갤럭시s20처럼 뒷판을 투명하게 만들어보는게 어때?,집에서 서브폰으로 쓰고 싶다.,선생님 혹시 서피스 듀오는 예정 없으십니까?,잇섭님 면도기 광고 잘봤습니다,8:12 편집 잘하셨네요...,미쳤는데 ㅋㅋㅋㅋㅋㅋ,구글 픽셀5도 리뷰해주세요! 국내폰은 광고많아서 쓰기싫어요 ㅠ,이걸로 게임할때 터치오류 너무 많이 걸림...,스피커 비교 음악 뭔가요,아이폰 se2가 벨벳 관짝행 보내고 LG Q92가 벨벳 트롤하고 샤오미 포코 X3가 주님 곁으로 벨벳을 보내네.,뒷면 디자인 포기했네ㅋㅋㅋㅋㅋㅋ,"재밌는 영상 잘 보고 있습니다~
관심이 없는 제품도 재밌네요 ㅎㅎ
근데... 여기다 요청해도 되려나..
2019아이맥 27하고 같이 쓸 서브모니터 추천해주실 수 있을까요? 울트라파인 영상 보긴했는데 2년전이라 혹시 지금은 어떨까 싶네요!","【다들 샤오미&화웨이만 알고계시더라구요 그래서 다른 핸드폰도 어떤지 평가하면 좋을듯하네요 폰만 전체 놓고보면 말이죠】
★중국휴대폰브랜드★
샤오미(小米)(xiaomi)
어우포          (OPPO)
브이보우      (VIVO)
룽야유(荣耀)(rongyao)
메이주(魅族)(meizu)
화웨이(华为)(huawei)",UI는 진짜 ㄱㅊ네,구성품은 100만원 넘어가는 애플보다 좋네 ㅋㅋㅋㅋㅋ,포코폰 처음버전처럼 하이엔드 프로세서 달아줬으면 샀을텐데,120hz빼면 그냥 포코폰이 나아보입니다....스냅845라,좋네요.. 폴드 2사야겠다,그냥 갓성비 모바일 게임용폰,S20이랑 s20 FE도 120Hz가 되나요?,9:50 맞네ㅋㅋㅋㅋ진짜 사과사용자 앞에서 당당히 못들고다니는 그런...,"진짜 삼성페이만 되면
바로 산다.",대체 샤오미는 어디서사는거지,집에서 쓰기는 좋은듯,"르그폰의 단점: 친중폰, 괴랄한 컨셉, 발열
르그촌의 장점: 겨울철 난방",진짜 개 미친 폰이네.. 가성비갑 ㅎㄷㄷ 서브폰으로 사도 좋을듯.,너무나 좋네요,배그가 원활 극한이 되는지 봐야지 HD 높음 으로 놓고 보여주시네,"라벨
라벨뜯어줘
라벨뜯어줘!!!!!!","통신사와 제조사가 얼만큼 폭리를 취하는지 알려 주는 영상!
단통법 폐지하고 요금제 낮춰라","쭝국산 이상한거 심어 놓거 같아
신뢰가 안가
쓰면서 항상 의심해야하니 된짱",아무리 생각해도 한국 폰 가격은 미쳤어,A/S가능한가요?,폴드2 SD 카드 슬롯이 없다는게 너무나 큰 하자다..,가격이 모든걸 용서하게 만드네요,잇섭 진짜 볼때마다 느끼는 거지만 손 개이쁘네 진짜,"전투용으로 쓰고싶은데, 아직도 정보가 부족해서 백도어 공포가 많아요.. 그래서 저번에 SK에서도 포코폰 팔았음에도 노트20+로 바꿨거든요... 근데 제가 하는 겜이 마이너한 게임이라(무슨 부류인진 다들 아실 듯) 세컨폰을 구매하려 하는데 이거 괜찮을까요? 120Hz쓰니까 60쓰면 멀미나서...",단점:웃긴영상을 보면 핑핑이도 같이 웃음,"노트 20인데
120<20
이라는게 믿기지 않고 나 왜샀지??",아이패드 애어4는 언제 출시해요 잇섭님 궁금해서 물어봅니다,중국이라는 것이 가장 발목을 잡을듯 ㅋㅋㅋㅋㅋㅋㅋㅋ,회사 국적만 바꿨으면 젛겠네 샤오미 ㅜㅜ,가성비는 가성비일뿐,뭔가 쓸데는 없는데 있는데 안쓰는거랑 아예 없는거랑은 느낌이 달라서 유심 2개 안되는거 뭔가 항상 손해보는 느낌,120헤르쯔인데 끈김이 느껴지면 120헤르쯔를 보급형에 다는건 그다지 의미가 없지않나,"1:55 여기 유심 핀을 찌를 수 있는 핀과....
 ????",6인치정도에 160g이하면 바로 샀을텐데,"얼리버드 할인해서 20만원이면
우리가 지금 사기에는 비싼거 아님?",진짜 재밋는 폰이닼ㅋㅋㅋㅋㅋ,"샤오미 = 중국제품
여기에서 끝난것 아닐까요 ㅠㅠ......",11:48 영상 끝내주네~!,이걸 20만원에 팔면... 남는건 없을듯..  오히려 손해일듯 그냥 시장 점유율 노리기 용인듯..,밧데리가 넉넉한덕에 묵직한 무게감 빼고는 모자람이 없는 폰이지 싶네...두달 사용자,"""이게 바로 포코폰이야.""",애들 사주면 좋아 할듯,가격 진짜 도랐네.... 게임이나 넷플렉스 전용으로 써도 좋을듯 ㅠㅠ,"근데 중국꺼라서 a/s라든가,
앱, 카드 등등의 호환이 어렵지 않을까요?","백도어 관련 이슈도 다뤄주실수 있을까요??
써보고싶은데, 걱정되어서 못써보고있어요 ㅠㅠ",스냅드래곤732G한테 120hz는  조금 선을 넘어버린듯...,가격대비 스펙이 혜자.,기본 케이스 애플이보면 환경을 오염시킨다고 기절할 패키징이네여,중국거는 가성비는 좋은데 한달만 지나면 통화품질과 잔고장이...ㅎㄷㄷ....,와 액정 한 번 가는 금액보다 싸네,하지만 모배가 30fps ...,"가성비로 저정도 효율 뽑아낼 정도면 삼성, 엘지 굉장히  긴장해야할듯. 로고 대문짝만하고 중국제라는게 단점이라면 단점이지만...

저 모든 단점을 잊는 가격... 20만원대.....


하나 사볼까나",
