10,"[스페셜 상품을 위한 출석체크 LINK]
https://forms.gle/L79eiiRMr2yFvQ2H6
구독자 1만명 달성 기념 이벤트를 향한
출석체크에 꼭 참여해주세요! 
(자세한 사항은 커뮤니티 공지 참고!)

[6.8mm 초박형(?) 스마트폰!]
00:00 Mi 11 'Lite' ?!
00:34 [디자인/Design]
02:07 [화면/Display]
03:46 [성능/Performance]
05:39 [기능/Functions]
06:09 [스피커/Speaker]
06:34 [카메라/Camera]
09:15 [결론/Conclusion]",디자인 나쁘지 않고~^^잘만든거 같아요 ^^리뷰 감사합니다,측면에 지문인식 들어간건 싱기하네요! 저도 잠시 샤오미 서브폰으로 써봤는데 서브폰으로는 강추👍🏻,"헉! 좋은 영상 감사합니다! 스마트폰에 여러가지 요소들이 있겠으나 아이폰12 보다 확실히 큰 화면에 이런 무게와 두께는 요즘 정말 드문일이라서 끌리는 모델이었습니다. 이제 안드로이드가 사실상 삼성만 남은 지금 조금더 많은 제품이 한국에 정발되었으면 하는 바람이네요... 11 lite의 경우 4g,5g 제품들 전부 무광인데 4g의 블랙 색상만 유광뒷면이더라고요 5g블랙제품과의 차별화를 위한것 같던데 참조 부탁드립니다!",궁금한 제품이었는데 리뷰를 해 주셔서 감사합니다! 구독할게요 ㅎㅎ,"홍미노트5, 홍미노트9 사용자로서 샤오미폰 리뷰라 집중해서 봤네요.
샤오미폰 가성비로 쓰기에 아주 좋지요. 
샤오미폰은  적외선리모컨 기능에 뭔가 집착이 있는거 같긴 하네요 ㅎㅎ
거의 대부분 폰에 이 기능은 넣어주는거 같아요.
사실 별로 쓸 일은 없지요.
식당같은곳에서 티비 채널 변경하고픈 욕구가 가끔 생기기는 하지만요","예산이 빠듯하고, 살림살이 퍽퍽~할 때......
플래그쉽 가격 내려가길 기다리는 존버용으로 따아~악!
아이티보이님, 대박나세여..^^;",노치 화면 정보 찾기 힘들었는데 정말 감사합니다,삼성 플레그쉽 폰의 카메라 성능이 비교를 해보니 정말 좋은거 였네요 ㅎㅎ. 재미있는 리뷰 감사합니다. 좋은 주말 보내세요~,"가격대비 만듦새는 정말 괜찮네요. 보안 이슈는 좀 찝찝하지만..
예전 영상에 익숙해져서 [좋은 하루 보내세요] 속삭임으로 반복해주시지 않으면 허전합니다ㅋㅋ",중국 폰 진짜 많이 발전했네요.... 잘 보고 갑니다,진짜 요즘 중국폰들도 엄청 가성비 좋게 나오네요. 보안같은 부정적 인식만 아니면 좋을것 같아요,방수 테스트 에서 신뢰가 느껴지네요,디자인 참 이쁘네요 ㅎㅎ,가격은 이점이 많은데 ㅎㅎ... 샤오미가 가격이 올라가면 약간의 거부감이 드는건 어쩔 수 없나봐요,"아는 지인분이 샤오미 홍미노트 시리즈를 잠시 사용하셨는데, 금방 느려진다고 해서 그건 어떤지 궁금하네요..!",가성비로 중국폰이 점점 떠오르네요. 카메라가 가장 맘에 듭니다만 국내 UI가 많이 적응되어서...적응만 되면 샤오미폰도 좋은 선택일 것 같아요. ^^,앗 5g인줄 알고 살짝 설렜네요 영상 잘 보고 갑니다,"미11라이트가 주로 스냅 780g가 들어간 5g모델이 국내에선 주로 주목 받는데, 잊혀진(?) 4g모델 리뷰가 나왔군요. 역시 요즘 같이 폰들이 무거운 시기에 가벼운 폰이라 눈에 띄는 듯 합니다. (미10라이트 유저라 그런지 더 눈에 듸는군요)","가볍구 ...색 또한 이뿐 스마트폰 
유혹 에 빠져야 하나..  아직 내 폰  쓸만한데..",초박형.. 다른 어떤 분이 생각나네요.. ㅋ,파란색도 나름 예쁜데요?ㅎㅎㅎ,제가 너무 가지고 싶은 폰입니다ㅠㅠ 혹시 유플러스 지원 되는지 알고 계신지요? 유심만 끼우면 바로 되는지 잘 몰라 직구할 엄두가 안납니다ㅠㅠ,"비슷한 가격의 홍미노트10프로와 비교하면 ᆢ🤔 
역시 홍미노트10프로가 좋을라나?🤔",삼성이 보고 배울점이 많다고 생각합니다,중국꺼라는게 넘 찝찝하지만 생각보다 괜찮아보여용!!,가성비는 정말 좋아보이는데 중국산이라 개인정보 유출이 걱정되요 ㅠㅠ,스펙은 엄청 좋아 보이지만... 역시 샤오미폰은 서브폰으로..,비교가 가격이 너무 다른데요....ㅋㅋ 비슷한 제품이랑 했으면.....외장 메모리 지원 한다는것도 포함 시켜주세요.,5g모델이 스펙 더 좋은데,"샤오미는 미맥스2와 3을 사용해 보았는데...
게임을 안하고 영상의주로 보다 보니..
베터리 용량도 크고 효율도 좋아서....
괜찮았던 기억이... 문서작업및 발표에.. 덱스모드를 사용 하다보니.. 다른 폰으로 넘어가는 것이 살짝 부담스러워서.... 샤오미를 쓰고 싶어도 못쓰네요.",잘보고 갑니다,아이티보이님 리뷰 잘봤습니다. 샤오미 보유 기종이 너무 많아 이번엔 패스해야겠네요. 늘 좋은 리뷰 감사합니다..,구매는 어디서 할 수 있나요?,역시 중국이라면 모를까 한국에서는 S20플러스를 사는게 합리적일거같아요,가성비 좋아보여도 선뜻 중국폰은 손이안가네요 ㅎㅎ,중국폰은 스펙은 다좋아요... 다만 보안이슈가 있어서 문제지 ㄷㄷㄷ,"갤럭시 보급기,중급기가 얼마나 가성비가 떨어지는지 알수있다..",aod가 항상 켜져있는건 아니죠? aod에 한 맺힌 아이폰 유저라서 서브용으로 한번 사보고 싶은데 aod가 제한이 걸려있다고들 해서요,색깔이쁘네요,"샤오미가 가성비는 항상 좋았죠
저도 수년째 샤오미 기기(홍미노트)를 사용하고있고 대체로 만족하는편인데
샤오미 ui 의 장점은 세세한것까지 사용자가 컨트롤하고 설정할수있다는점이고
단점은 역으로 셋팅하는데 손이 많이간다는거겠죠
자가수리용 부품구하기가 쉬운편이고 가격도 저렴합니다
최근기기는 많이 나아졌겠지만 몇년전 기기는 내구성면에선 좀 아쉬움이 있었다고 생각하고 
그당시 기기들을 사용하신분들은 샤오미의 내구성을 욕하는경우가 많았죠..설탕액정이니 하면서 ㅎㅎ 저도 두번이나 디스플레이를 교체했습니다
실사용을해본 입장에선 들인비용대비 성능이 좋아서 전 중국제품들에 거부감이 크진않은데
극혐을 하시는분들도 많이 계신게 현실이니 선택은 스스로 하시는게 좋겠습니다
(현시점에서 과연 중국산 기기나 부품들을 완전히 피하는게 가능하긴한가 하는생각이 있긴하네요)
오늘도 잘봤습니다",스피커는 확실히 아직 중국제품들이 떨어지네요,"보안이 무서워요 ㅜㅜ 가성비는 좋네요 a32급보다 좋으면 ㅋㅋ
오른쪽 하단 귀요미 토끼님은 시선강탈이네요 ㅋㅋㅋ ㄱㄷㅎㄱ ☆",도대체 이게 뭐지ㅎㅎ 삼성 저리가라 ..비싸기만하고..디자인 예술 ㅎㅎ 99만원을 잘못적은듯,volte 되나요?,생각보다 넘 비싸,as와 보안문제..,8빠 ㅠㅠㅠ,이게 어떻게 30만대 입니까? 말이되는 소리를 해야죠 f3가격대인데,,,,,,,,,,,,,,,,,,,,,,,,,,,,,,,,,,,,,,,,,,,,,,,,,,,,,,,,,,,,,,,,,,,,,,,,,,,,,,,,,,,,,,,,,,,,,,,,,,,,,,,,,,,,,,,,,,,,,,,,,,,,,,,,,,,,,,,,,,,,,,,,,,,,,,,,,,,,,,,,,,,,,,,,,,,,,,,,,,,,,,,,,,,,,,,
11,miui는 기본 어플에 있는 광고 잘 끄고 사용하면 의외로 듀얼 유심도 그렇고 듀얼앱도 그렇고 편안하죠,"3년전 폰이랑 비교하면 아무래도 괜찮다고 느낄수있져
그리고 샤오미폰은 언제나 가성비는 좋았어요.",지금 시기에 사시는 분들은 mi11 글로벌 롬 말고 중국내수용 사서 언락하시는게 더 좋은 선택지일 것 같아요.,"지금 홍노7 2년째 잘 쓰고 있는데... 정말 잘 쓰다가 동영상을 찍기 시작하면서 계속 폰을 바꾸고 싶어지더라구요
실내에서 형광등 아래에서 검은색 커튼 현상이 심해요..ㅠ 카메라 설정에서 만져서 덜하긴 한데 설정을 해도 울렁울렁하는게 마찬가지라 갑갑하네요
얘는 괜찮은지 궁금하네요","미10T 프로 구매 예정이라 잘 보고 갑니다
무엇보다 사진 많이 찍는 사람이라 ㅎㅎ 108MP 메리트가 큰거 같아요","대부분 유튜버들이 삼성 갤럭시A 시리즈와  샤오미 REDMI 이렇게 저가라인 끼리 비교는 많이하는데,  갤럭시S 시리즈와 샤오미 MI 이렇게 주력라인 끼리 비교하는 영상은 많이 안올라오네요~ 삼성이 안좋아 하나봐요 ㅋㅋㅋ 갤럭시A51 1년 동안 느려터져서 답답해도 참고 쓰다가 샤오미 산 기념으로 응원하고 갑니다^^  플래그십 말고는 무조건 거르는게 맞는것 같아요~","As만 되면 무조건 사고싶네요.
폰을 떨구지도 않고 10년간 as받은적 없을정도로 폰을 깨끗하게 쓰는편인데 그래도 혹시 모르니깐..ㅎ
A72가 기대되기는 하는데 18일 삼성 런칭 행사 보고 결정 해야겠네요",뚜 뚜뚜우뚜뚜 하는 비프음은 대체 어디서 나는소리인가요?,"홍미노트10 프로
비교시 어느것이 좋은가요","혹시 통신3사 모구 패치없이 volte사용가능한가요?
뭔가해야된다면 통신사에 기기정보만 등록하는정도요",알람설정 하나하나 해줘야하는 단점이 있어서 ㅠㅠmiui는 적응이 안되더라구요쥬ㅠ,"안녕하세요
제가 오늘 미10t프로 주문했는데 궁금한게 있어서요
이기종 언제 출시된 기종인가요?",비닐떼는칼질이 너무보기힘들어욧,근데 샤오미는 백도어? 같은거 걱정 없나요??,어디서 사셨나요?,삼성페이 때문에 삼성 씁니다....,삼성폰이랑 비교해봐도 샤오미가 훨씬 괜찮나요??,"백도어는 ios 안드로이드 어디에다 다 있다
앱설치시 권한승인이  다 백도어이다.
그 정보를 어떻게 쓰느냐가 문제지..
다행히 샤오미는 화웨이와는 다르게 모든 사용자들에게 운영체제 공개가 되어있어 여러사람이 그안을 들여보고 수정을 할수 있다.커스텀롬 또한 활발하다. 그래서 백도어에 대한 불신은 없다고 본다.

누군가에게는 가치가 있을진 모르나..
 2년 남짓쓰는  소모품 스마트폰 따위에  백만원이란 큰 돈 쓸 여력이 나는없다. 그 대안으로 샤오미를 쓰고 있고 성능에 아주 만족하고 가성비 또한 샤오미가 최고다. as또한 사설업체에서 어렵지 않게 받을수 있다. 가격대비 만듦세도 훌륭하다. 한국인이나 중국산폰 깔본다. 전세계 판매 3위이고 개발도상국인 나라에서 샤오미는 언제나 1등 제품이다. .초창기 모델은 ui도 불편하고 터치도 불량이다소 있었으나 가격이 그걸 상쇄하고 남는다. 샤오미 써보기는 해봤나?  그냥 우물안에 개구리처럼 살진않은가..? 

나는 통신사 제조사 합쳐 내국인 호구잡는꼴 보기 싫어 4년째 샤오미폰만 쓰고 뱅킹앱도 사용한다. 듀얼심 활용하여 알뜰폰 통화무제한, 데이터20gb에 18800원 사용중이다. 통신사통해 구입한 국내폰은 절대 이렇게 못쓰지.. 아니 걔네들은 있는 듀얼심조차 없애버리지. 돈 안되니까.. 많이 팔아줘라 호구들아.",잘 밨습니다.skt volte 되는지요? mi 계정이 있어야 언락이 가능한거 아닌지요?,어디서 샀는지 알수있을까요?,"샤오미도 써보고 애플쓰고 삼성 폴드2로 넘어온 사람으로써 샤오미 폰 잘만듭니다. 안드8에서 시작한 기기 안드10까지 업그레이드 지원 해주었고 사용상 문제도 없었습니다. 개인적으로는 중국폰이라고 눈과귀 전부 닫고 백도어 정보유출 어쩌니 하는사람 정말 이해 안됩니다.. 
중국폰 써주세요! 가 아니라 중국에서도 잘만듭니다!가 포인트 입니다. 적을 알고 나를 알아야 백전 백승이라고
세계에서 점유율은 상당부분 가져가는 중국 제조사는 우리에게 도태되지 않게 힘을 준다고 생각합니다 
아무도 님들보고 중국폰 사라고 안하니까 그냥 있는 그대로 봐주는게 좋다고 생각해요
흥분해서 미안합니다..",외국이시라 삼페안쓴다면 중국폰도 좋지요,샤오미 안써바서 요 !!,난 이번에 삼성으로 갈아 탈란다ㅋㅋ,"휴대폰은 요즘시대 하나의 창고라고 생각하면 됨 
그창고비번을 제조사가 아는건 알아서 판단하셈",배틀그라운드 할때극한되나요 ?,나쁘진 않네요!(내가1등인가?),,,,,,,,,,,,,,,,,,,,,,,,,,,,,,,,,,,,,,,,,,,,,,,,,,,,,,,,,,,,,,,,,,,,,,,,,,,,,,,,,,,,,,,,,,,,,,,,,,,,,,,,,,,,,,,,,,,,,,,,,,,,,,,,,,,,,,,,,,,,,,,,,,,,,,,,,,,,,,,,,,,,,,,,,,,,,,,,,,,,,,,,,,,,,,,,,,,,,,,,,,,,,,,,,,,,,
