,0,1,2,3
203,샤오미 어메이즈핏 스마트워치 GTS2 Mini 정식발매 한글 그린,96770,등록일 2021.01.,23
204,샤오미 어메이즈핏 팝 스마트워치(공식 한글판),69260,등록일 2021.01.,23
205,샤오미 샤오미 스마트워치 어메이즈핏 GTS,176220,등록일 2020.01.,23
206,Amazfit X Smartwatch 글로벌 버전 곡선 스크린 티타늄 바디 슬립 모니터링 5ATM 방수 멀티 스포츠 모드,296479,등록일 2020.10.,23
207,어메이즈핏 스마트워치 GTR2e 블랙 국내정식발매 한글판/국내AS지원,148000,등록일 2021.04.,23
208,샤오미 어메이즈핏 버지 스트랩/어메이즈핏 버지,9900,등록일 2019.06.,23
209,샤오미 어메이즈핏 스마트워치 GTS2 Mini 정식발매 한글 그린,95680,등록일 2021.01.,23
210,[어메이징핏] 어메이즈핏 밴드5 스마트밴드 국내정식발매 한글판/국내AS지원/산소포화도 측정 2세대 센서 탑재,49400,등록일 2020.12.,23
211,[하이마트]어메이즈핏 [6% 추가쿠폰] [정품]어메이즈핏 GTS2e 스마트워치[그린][국내정식발매/한글판],148000,등록일 2021.02.,22
212,새로운 Amazfit GTS 2 Mini2 Smartwatch 항상 AMOLED 70 스포츠 모드 수면 모니터링 스마트 워치 안드로이드 iOS 전화,92606,등록일 2021.05.,22
213,샤오미 어메이즈핏 빕 스마트워치 청춘 미밴드 방수,115700,등록일 2020.05.,22
214,[어메이즈핏]스마트워치 어메이즈핏 GTR2 스테인리스 국내정식발매 한글판/국내AS지원,208000,등록일 2021.04.,22
215,어메이즈핏 스마트워치 GTS2 블랙 정식발매 한글판/전국망AS,198000,등록일 2020.12.,22
216,국내배송 샤오미 어메이즈핏 GTS 2 mini 한글판 스마트 스포츠 워치 전자 시계,83900,등록일 2021.03.,21
217,"Amazfit-오리지널 충전기 USB GTS 스마트 워치 GTR 및 T 렉스, GTS, Smartwatch, GTR, 스마트 워치",10673,등록일 2021.06.,21
218,팝바나나 샤오미 어메이즈 핏 빕 Amazfit Bip 액정보호필름,1500,등록일 2018.12.,21
219,샤오미 (빠른직구) Amazfit GTS2 mini 스마트워치 국제판 그린,87470,등록일 2021.08.,21
220,새로운 2021 Amazfit Bip U Pro GPS Smartwatch 컬러 스크린 31g 5ATM 방수 60 + 스포츠 모드 스마트 워치 for Android IOS,80247,등록일 2021.04.,21
221,[카드사 12% 할인]샤오미 (빠른직구) Amazfit GTS2 mini 스마트워치 국제판 그린,89900,등록일 2021.08.,21
222,어메이즈핏 스마트워치 GTR2e 그레이 정식발매 한글판/전국망AS,148000,등록일 2021.02.,21
223,[한국 정식 발매] 어메이즈핏 네오 Amazfit Neo 레트로 스마트워치,59000,등록일 2021.02.,21
224,원래 Amazfit Bip S Smartwatch 5ATM 방수 내장 GPS GLONASS 블루투스 호환 스마트 워치 안드로이드 iOS 전화,83096,등록일 2021.05.,21
225,어메이즈핏 스마트워치 어메이즈핏 GTR2 스테인리스 국내정식발매 한글판/국내AS지원,208000,등록일 2021.04.,21
226,어메이즈핏 스마트워치 Bip U 빕U 국내정식발매 한글판,76000,등록일 2021.07.,20
227,샤오미 어메이즈핏 BIP / Amazfit BIP WITH 화미,82740,등록일 2018.03.,20
228,샤오미 어메이즈 핏 GTR 47mm 프리미엄 강화유리,1700,등록일 2021.02.,20
229,스마트워치 어메이즈핏 GTR2 국내정식발매 한글판/국내AS지원,198000,등록일 2020.12.,20
230,오리지널 Amazfit T-rex Smartwatch 5ATM 내열성 MIL-STD 스마트 워치 iOS 안드로이드 폰용 GPS/GLONASS AMOLED 스크린,144834,등록일 2021.03.,20
231,샤오미 어메이즈핏 빕 라이트 국내 정식발매 A/S1년,58000,등록일 2020.09.,20
232,스마트워치 어메이즈핏 GTR2 국내정식발매 한글판/국내AS지원,198000,등록일 2020.12.,20
233,샤오미 어메이즈핏 빕 라이트 국내 정식발매 A/S1년,58000,등록일 2020.09.,20
234,[하이마트]어메이즈핏 [6% 추가쿠폰] [정품]어메이즈핏 GTS2e 스마트워치[블랙][국내정식발매/한글판],148000,등록일 2021.02.,19
235,샤오미  Amazfit GTS 2 mini (글로벌버전)--그린/무배,91080,등록일 2021.02.,19
236,[하이마트]샤오미 샤오미 스마트워치 어메이즈핏 빕 라이트 블랙,69900,등록일 2020.09.,19
237,[카드사 12% 할인]샤오미 샤오미  Amazfit GTS 2 mini (글로벌버전)--그린/무배,96530,등록일 2021.01.,19
238,[어메이징핏] 스마트워치 어메이즈핏 GTS2e 국내정식발매 한글판/국내AS지원,148000,등록일 2021.02.,19
239,어메이즈핏 GTS2 mini 스마트워치 글로벌 버전/핑크,91080,등록일 2021.02.,19
240,국내발송 1+1 할인 샤오미 어메이즈핏 스마트워치 GTS2 Mini 공식 한글판,164000,등록일 2021.07.,19
241,샤오미 어메이즈핏 Amazfit GTR 47mm 스마트워치 글로벌 알루미늄,90500,등록일 2021.06.,19
242,샤오미 어메이즈핏 Amazfit GTR 42mm / GTR 47mm / GTS / 관부가세 포함가 /,119900,등록일 2019.10.,18
243,"Xiaomi Mi Band 5 6 용 스트랩, 실리콘 블랙 블루 화이트 오렌지 교체용 팔찌 시계 밴드 Amazfit Band5 용",1662,등록일 2020.11.,18
244,(어메이즈핏) 스마트워치 어메이즈핏 GTR 47mm 국내정식발매 한글판/국내AS지원,119000,등록일 2020.10.,18
245,어메이즈핏 스마트워치 Bip U 빕U 국내정식발매 한글판/국내AS지원,76000,등록일 2021.04.,18
246,어메이즈핏 스마트워치 티렉스 T-REX PRO 블루 한글판,188000,등록일 2021.06.,18
247,새로운 Amazfit GTS A1913 A1914 OLED 스크린 원래 터치 스크린 Amazfit GTS 스마트 워치 LCD 화면 1.65 인치 AMOLED,27965,등록일 2021.03.,18
248,샤오미 어메이즈 핏 GTR 47mm 프리미엄 강화유리,1700,등록일 2021.02.,18
249,샤오미  어메이즈핏 GTS 2 mini 스마트 워치 (글로벌버전) - 샤오미 Amazfit GTS 2 mini (글로벌버전)--그린,89500,등록일 2021.05.,17
250,샤오미 샤오미  Amazfit GTS 2 mini (글로벌버전)--블랙/무배,99000,등록일 2021.01.,17
251,샤오미  어메이즈핏 GTS 2 mini 스마트 워치 (글로벌버전) - 샤오미 Amazfit GTS 2 mini (글로벌버전)--블랙,89500,등록일 2021.05.,17
252,"스트랩 Amazfit GTS/GTS 2 실리콘 팔찌 Amazfit Bip U BIP S 라이트 손목 밴드 Amazfit GTR 42, 20mm, Amazfit Bip BIP",2351,등록일 2021.05.,17
253,샤오미 샤오미 어메이즈핏GTS2 Mini 정식한글버전 올블랙컬러,94000,등록일 2021.02.,17
254,스마트워치 어메이즈핏 GTR2 한글판,193430,등록일 2021.01.,17
255,"Huami Amazfit GTS Bip 용 오리지널 소프트 실리콘 스트랩, Huami Amazfit GTR 42mm 손목 스트랩 팔찌 용 스마트 손목 밴드 10 색",2244,등록일 2020.09.,17
256,샤오미  어메이즈핏 GTS 2 mini 스마트 워치 (글로벌버전) - 샤오미 Amazfit GTS 2 mini (글로버전)--핑크,89500,등록일 2021.05.,17
257,샤오미 어메이즈핏 GTR 2세대 글로벌버전 / 혈중산소,172390,등록일 2021.01.,16
258,"Amazfit Bip S/Bip Lite 용 캔버스 나일론 손목 스트랩, Xiaomi Amazfit GTS/Stratos/GTR47mm 용 시계 밴드, 화웨이 GT2 용 팔찌",3202,등록일 2020.10.,16
259,스트랩 Mi Band 6 글로벌 실리콘 밴드 Amazfit Band 5 스마트 팔찌 Correa Sport Opaska Miband 5 Pulsera,1164,등록일 2021.06.,16
260,샤오미 어메이즈핏 빕 라이트 블랙 - 어메이즈핏 빕 라이트 스마트워치 한국어지원정품 A S,70030,등록일 2021.05.,16
261,"Amazfit-GTS 2 미니 스마트 워치 GPS 블루투스 호환 여성용 사이클 추적, 안드로이드 iOS 전화용 스마트 남자 여자 시계",118714,등록일 2021.03.,16
262,무배/1+1 샤오미 어메이즈핏 GTR 42 47 강화 유리,6810,등록일 2019.12.,16
263,샤오미 어메이즈핏 스마트워치 GTS2 Mini 정식발매 한글 블랙,96770,등록일 2021.01.,16
264,글로벌 버전 Amazfit Band 5 피트니스 팔찌 스마트 팔찌 컬러 디스플레이 피트니스 트래커 방수 BT5.0 스포츠 스마트 팔찌,38455,등록일 2021.05.,16
265,GTS2 Smartwatch 블루투스 통화 피트니스 트래커 심박수 모니터 Xiaomi Amazfit 용 혈압 시계 GTS mini 2 스마트 워치,32780,등록일 2021.05.,16
266,샤오미 어메이즈핏 스마트워치 GTS2 Mini 정식발매 한글 블랙,95680,등록일 2021.01.,16
267,Amazfit Stratos 3 스마트 워치 GPS 5ATM 음악 심박수 듀얼 코어 내부 저장 안드로이드 IOS 남자 시계,199448,등록일 2021.05.,15
268,어메이즈핏 스마트워치 GTR2e 그린 정식발매 한글판/전국망AS,148000,등록일 2021.02.,15
269,어메이즈핏 스마트워치 46mm GT2 블루투스 한글판/AS지원,98000,등록일 2021.06.,15
270,샤오미 어메이즈핏 GTS2 mini 단독공식수입사,96500,등록일 2021.01.,15
271,"Amazfit-5 스트랩 팔찌 Miband 6 Opaska 팔찌 Xiaomi Correa 스마트 밴드 5 4 3 Pulseira Mi 6 실리콘 밴드, 샤오미 코레아",1045,등록일 2021.07.,15
272,"Amazfit-T rex T-rex 스마트 워치 스트랩, 새로운 2020 스트랩, 컨트롤 음악 5ATM, GPS, GLONASS 20 일 배터리 수명, 스마트 워치",8171,등록일 2020.12.,15
273,샤오미 어메이즈핏 GTR2 GTS2 GTR2 mini GTS2e GTR2e 호환 마그네틱 충전기 충전독,6500,등록일 2021.01.,15
274,어메이즈핏 스마트워치 GTR 42mm,249000,등록일 2021.06.,15
275,샤오미 (현대Hmall)샤오미 어메이즈핏 GTS 스마트워치 한글판,169550,등록일 2020.09.,15
276,"충전기 Amazfit Stratos 3 sika XiaoMi Huami A1928 용 액세서리, XiaoMi Huami A1928 용",4737,등록일 2021.08.,14
277,[어메이즈핏]스마트워치 어메이즈핏 GTR2 국내정식발매 한글판/국내AS지원,198000,등록일 2020.12.,14
278,샤오미 어메이즈핏 버지 케이스/어메이즈핏 버지,4510,등록일 2019.05.,14
279,스마트 워치 2021 Andorid Men 블루투스 통화 여성 Smartwatch 혈압 Ecg 스마트 워치 Xiaomi Apple Phone Amazfit GTS 2,35567,등록일 2021.03.,14
280,글로벌 버전 Amazfit GTR 2e Smartwatch Alexa 내장 1.39 인치 심박수 5 ATM 스마트 워치 Andriod IOS,166023,등록일 2021.06.,14
281,2021 Amazfit GTR 2e Smartwatch 471 mAh 5 ATM 응답 피트니스 추적 Alexa 내장 스마트 워치 Andriod IOS,166023,등록일 2021.03.,14
282,무배/1+1 샤오미 어메이즈핏 GTR 42 47 강화 유리,6800,등록일 2019.12.,14
283,(어메이즈핏) 어메이즈핏 스마트워치 티렉스 T-REX 국내정식발매 한글판/국내AS지원,150000,등록일 2020.09.,13
284,[어메이즈핏]스마트워치 어메이즈핏 GTS2 국내정식발매 한글판/국내AS지원,198000,등록일 2021.07.,13
285,어메이즈핏 빕라이트 Amazfit Bip Lite 국내정발 한국어 지원,56000,등록일 2020.05.,13
286,어메이즈핏 어메이즈핏 밴드5 스마트밴드 국내정식발매 한글판/국내AS지원/산소포화도 측정/2세대 센서 탑재,49400,등록일 2021.07.,13
287,[하이마트]어메이즈핏 [6% 추가쿠폰] [정품]어메이즈핏 GTR2e 스마트워치[그레이][국내정식발매/한글판],148000,등록일 2021.02.,13
288,샤오미 (빠른직구) Amazfit GTS2 mini 스마트워치 국제판 블랙,85860,등록일 2021.08.,13
289,샤오미 어메이즈핏 GTS 2 MINI 한글판 12가지 스포츠 모드,75000,등록일 2021.02.,13
290,어메이즈핏 어메이즈핏 스마트워치 티렉스 T-REX PRO 블랙 한글판,188000,등록일 2021.06.,13
291,어메이즈핏 네오 스마트워치 그린 한글판 국내정식발매,67250,등록일 2020.12.,13
292,Xiao mi Mi Band 6 5 4 3 2 스트랩 팔찌 Pasek Opaska Pulseira 팔찌 Amazfit 5 용 Correa 실리콘 Mi Band,2351,등록일 2021.07.,13
293,어메이즈핏 스마트워치 GTR2e 국내정식발매 한글판/국내AS지원,148000,등록일 2021.02.,13
294,샤오미 어메이즈핏 GTS2 mini 스마트워치 정식 글로벌버전 한글 지원 보호필름 2매포함,84700,등록일 2021.02.,13
295,어메이즈핏 스마트워치 어메이즈핏 GTS 블랙 한글판 국내정식발매,145000,등록일 2020.11.,13
296,샤오미 스마트워치 어메이즈핏 GTS 그레이 한글판 국내정발,145000,등록일 2020.11.,13
297,[하이마트]어메이즈핏 [6% 추가쿠폰] [정품]어메이즈핏 GTR2e 스마트워치[그린][국내정식발매/한글판],148000,등록일 2021.02.,12
298,"Amazfit-오리지널 GTS 2 미니 스마트 워치 70 스포츠 모드 수면 모니터링 GPS AMOLED 디스플레이 스마트 워치, 안드로이드 iOS 용",118714,등록일 2021.04.,12
299,어메이즈핏 어메이즈핏 스마트워치 티렉스 T-REX PRO 블루 한글판,188000,등록일 2021.06.,12
300,어메이즈핏 스마트워치 어메이즈핏 GTR 47mm 국내정식발매 한글판/국내AS지원,119000,등록일 2020.10.,12
301,어메이즈핏 빕 U 프로 스마트워치  핑크,75960,등록일 2021.07.,12
302,어메이즈핏 Neo 스마트워치 <당일출고/최소5-7일 수령가능/공휴일제외>,46060,등록일 2020.10.,12
303,어메이즈핏 어메이즈핏 스마트워치 티렉스 T-REX PRO 그레이 한글,188000,등록일 2021.06.,12
304,어메이즈핏 빕 U 프로 스마트워치  블랙,75960,등록일 2021.07.,12
305,샤오미 어메이즈핏 GTS2 mini 스마트워치 글로벌 버전/그린,91080,등록일 2021.02.,12
306,2021 글로벌 버전 Amazfit GTS 2e Smartwatch 수면 품질 모니터링 90 스포츠 모드 수영 스마트 워치 Alexa 내장,166205,등록일 2021.03.,12
307,I15 GTR 2 스마트 워치 2021 블루투스 통화 1GB 음악 플레이어 DIY 시계 얼굴 Smartwatch 남성 여성 Huwai amazfit Android,35594,등록일 2021.06.,12
308,어메이즈핏 스마트워치 어메이즈핏 GTR 47mm 스테인리스 스틸 국내정발 한글판,145000,등록일 2020.10.,12
309,샤오미 공식 샤오미 어메이즈핏 GTS  전색상,150270,등록일 2020.01.,12
310,"FIFATA-소프트 보호 프레임 실리콘 전체 케이스 커버, Xiaomi Huami Amazfit Bip BIT 페이스 라이트 청소년 보호 쉘",2502,등록일 2021.02.,12
311,어메이즈핏 빕 라이트 스마트워치 한국어지원 한국공식수입상품,64000,등록일 2019.08.,12
312,샤오미 화미 어메이즈핏 GTR 42mm 47mm 시계줄,4550,등록일 2019.08.,12
313,어메이즈핏 스마트워치 티렉스 T-REX 국내정식발매 한글판/국내AS지원,150000,등록일 2021.07.,12
314,어메이즈핏 빕 U 프로 스마트워치  그린,75960,등록일 2021.07.,12
315,[하이마트]어메이즈핏 [정식발매]샤오미 스마트워치 어메이즈핏 GTS2 미니[핑크/그린/블랙],99000,등록일 2021.01.,11
316,"새로운 Huami AMAZFIT 스포츠 시계 A1602 A1612 페이스 Gps LCD 화면 터치스크린, Huami AMAZFIT Sports Watch A1602 A1612",26108,등록일 2021.05.,11
317,"오리지널 이어 스페어 요소 어메이즈핏 스트라토스 2, 2 쌍",10673,등록일 2021.08.,11
318,Xiaomi Huami Amazfit Bip Youth (Pace Lite) Smart Watch strap leather band sports silicone straps,4410,등록일 2021.03.,11
319,무배/샤오미 화미 어메이즈핏 GTR 42mm 47mm 시계줄,6830,등록일 2019.08.,11
320,어메이즈핏 스마트워치 GTR2e 국내정식발매 한글판/국내AS지원,148000,등록일 2021.02.,11
321,샤오미 샤오미 어메이즈핏 빕 스마트 워치-블랙/중국어버전,41130,등록일 2019.10.,11
322,샤오미 어메이즈핏 GTS2 Mini 미니 국내유일 정식 판매처 A/S 1년,102000,등록일 2021.01.,11
323,스마트 시계 Unisex 시계 손목 시계 실리콘 시계 밴드 스트랩 + Tpu 보호 케이스 Huami Amazfit Verge Youth Watch Clock,10139,등록일 2021.05.,11
324,IWO14 X7 스마트 워치 시리즈 6 블루투스 통화 심장 박동 피트니스 트래커 Smartwatch For Android IOS PK amazfit IWO 13 W26 T500,14540,등록일 2021.05.,11
325,LEMFO 스마트 워치 남자 Smartwatch Gtr 2e DIY 시계 내장 음악 블루투스 통화 260mAh 건강 모니터링 Amazfit Gtr 2,35606,등록일 2021.07.,11
326,샤오미 어메이즈핏 GTS2 Mini 미니 정식 한글버전 12가지 스포츠 모드,82000,등록일 2021.07.,11
327,어메이즈핏 스마트워치 GTR2e 국내정식발매 한글판/국내AS지원,148000,등록일 2021.02.,11
328,샤오미 어메이즈핏 Amazfit GTS 스마트워치 글로벌,119900,등록일 2020.03.,11
329,어메이즈핏 스마트워치 GTS2 그레이 정식발매 한글판/전국망AS,198000,등록일 2020.12.,11
330,어메이즈핏 스마트워치 GTS2e 그린 정식발매 한글판/전국망AS,148000,등록일 2021.02.,11
331,"스트랩 Amazfit GTS/GTS 2 실리콘 팔찌 Amazfit Bip/BIP S 팔찌 Huami Amazfit BIP LITE/GTR 42/20mm, Amazfit Bip",2348,등록일 2021.01.,11
332,[하이마트]어메이즈핏 [6% 추가쿠폰] [정식발매]샤오미 스마트워치 어메이즈핏 GTS2 미니[블랙],99000,등록일 2021.01.,11
333,"새로운 Huami AMAZFIT 스포츠 시계 A1602 A1612 페이스 Gps LCD 화면 터치스크린, Huami AMAZFIT Sports Watch A1602 A1612",26108,등록일 2021.05.,11
334,"오리지널 이어 스페어 요소 어메이즈핏 스트라토스 2, 2 쌍",10673,등록일 2021.08.,11
335,샤오미 샤오미 Amazfit GTS 2 mini (글로벌버전)--블랙/무배,90090,등록일 2021.07.,11
336,Dreamnice Smartwatch 2021 안드로이드 블루투스 전화 스마트 워치 남자 IP68 방수 Smartwatch 여자 Xiaomi Amazfit 애플 전화,35606,등록일 2021.05.,11
337,어메이즈핏 스마트워치  블랙,198000,등록일 2021.07.,11
338,어메이즈핏 빕S Amazfit Bip S 국내정발 한국어 지원,69000,등록일 2020.06.,10
339,원래 글로벌 Amazfit Nexo Smartwatch 도자기 베젤 10 스포츠 모드 GPS Glonass 1.39 인치 AMOLED 디스플레이 안드로이드 전화 번호,125838,등록일 2021.07.,10
340,[롯데백화점1관]샤오미 샤오미 스마트워치 어메이즈핏 GTS2 Mini 미니 국내정식발매 한글판,110080,등록일 2021.01.,10
341,글로벌 버전 Amazfit Stratos + 스마트 워치 5ATM 방수 가죽 스트랩 선물 상자 사파이어 GPS GLONASS Smartwatch for IOS,139491,등록일 2020.09.,10
342,[카드사 12% 할인]샤오미 샤오미 어메이즈핏 GTR 2세대 글로벌버전 블랙 스포츠,169000,등록일 2021.02.,10
343,어메이즈핏 스마트워치 GTS2e 국내정식발매 한글판/국내AS지원,148000,등록일 2021.02.,10
344,무배/샤오미 화미 어메이즈핏 GTR2 케이스,6330,등록일 2020.12.,10
345,Amazfit Stratos Smartwatch GPS 스마트 워치 남성용 칼로리 카운트 50M 방수 블루투스 안드로이드 iOS 전화,111591,등록일 2021.05.,10
346,[카드사 12% 할인]샤오미 샤오미 어메이즈핏 GTS2 mini스마트워치 한글지원 블랙,89900,등록일 2021.08.,10
347,Original Amazfit Stratos Smartwatch 스마트 워치 GPS 칼로리 카운트 심장 모니터 50M 방수,117527,등록일 2020.09.,10
348,어메이즈핏 스마트워치 GTS2e 국내정식발매 한글판/국내AS지원,148000,등록일 2021.02.,10
349,어메이즈핏 어메이즈핏 스마트워치 티렉스 T-REX 국내정식발매 한글판/국내AS지원,150000,등록일 2020.11.,10
350,어메이즈핏 Amazfit GTR GTS 스마트워치 글로벌,105900,등록일 2021.02.,10
351,샤오미 어메이즈핏 스마트워치 GTS2 Mini 국내 AS 정식 블랙,93130,등록일 2021.01.,10
352,어메이즈핏 스마트워치 티렉스 T-REX 국내정식발매 한글판/국내AS지원,150000,등록일 2020.12.,10
353,[롯데백화점]샤오미 스마트워치 어메이즈핏 GTS2 Mini 미니 국내정식발매 한글판,103480,등록일 2021.01.,10
354,[카드사 12% 할인]샤오미 Amazfit Bip U Pro 워치 (한글판)/무료배송,75180,등록일 2021.05.,10
355,Amazfit Nexo-오리지널 스마트 워치 세라믹 베젤 10 가지 스포츠 모드 GPS Glonass 안드로이드 폰용 1.39 인치 AMOLED 디스플레이,130587,등록일 2021.06.,9
356,"Amazfit Bip U 피트니스 트랙 스마트 워치 5ATM 방수 컬러 디스플레이 안드로이드 ios용 수면 모니터링, 오리지널 글로벌 버전",71224,등록일 2021.05.,9
357,[카드사 12% 할인]샤오미 (빠른직구)어메이즈핏 GTR 2세대 글로벌판 블랙스포츠,169000,등록일 2021.01.,9
358,스마트워치 어메이즈핏 GTR2 알루미늄 국내정식발매 한글판/국내AS지원,198000,등록일 2020.12.,9
359,[하이마트]어메이즈핏 AMAZFIT 스마트워치 티렉스 프로[블루][T-REX PRO],188000,등록일 2021.05.,9
360,공식수입사 샤오미 스마트워치 어메이즈핏 GTS2 Mini 미니 국내정식발매 한글판,98000,등록일 2021.01.,9
361,LanJng P8 플러스 스마트 워치 남자 휘트니스 추적기 혈압 IP67 방수 Xiaomi Amazfit 안드로이드 여성 GTS 2 Smartwatch,29195,등록일 2021.07.,9
362,바캉스는 스마트워치와 함께! 어메이즈핏 스마트워치 모음전,98000,등록일 2021.07.,9
363,샤오미 어메이즈핏 GTR 47MM 투톤 스포츠 스트랩,12800,등록일 2020.06.,9
364,바캉스는 스마트워치와 함께! 어메이즈핏 스마트워치 모음전,98000,등록일 2021.07.,9
365,샤오미 샤오미 어메이즈핏GTS2 Mini 정식한글버전 민트그린,91850,등록일 2021.02.,9
366,샤오미 화미 어메이즈핏 GTR2 충전 케이블,4510,등록일 2020.11.,9
367,스마트워치 어메이즈핏 GTS 국내정식발매 한글판,109000,등록일 2020.08.,9
368,공식수입사 샤오미 스마트워치 어메이즈핏 GTS2 Mini 미니 국내정식발매 한글판,98000,등록일 2021.01.,9
369,어메이즈핏 어메이즈핏 GTS2 mini 스마트워치 글로벌 버전/핑크,91080,등록일 2021.02.,9
370,(어메이즈핏) 스마트워치 어메이즈핏 GTS 국내정식발매 한글판/국내AS지원,145000,등록일 2020.12.,9
371,샤오미 샤오미 어메이즈핏 빕 라이트 국내 정식발매 A/S1년,57530,등록일 2020.09.,9
372,어메이즈핏 빕U Pro Amazfit Bip U Pro 국내정발 한국어 지원,79000,등록일 2020.12.,9
373,샤오미 어메이즈핏 GTS2 mini스마트워치 한글지원 블랙,85850,등록일 2021.08.,9
374,샤오미 Amazfit GTS 2 mini 스마트 워치 (글로벌버전) / 국내정발 / 50m 방수기능,84150,등록일 2021.07.,9
375,"Amazfit-GTS 글로벌 버전 오리지널 실리콘 스트랩, 남성 여성 스포츠 SmartWatch 스트랩, 화웨이 어메이즈핏 GTS 글로벌 버전",1898,등록일 2021.05.,9
376,국내 유일 한국 공식판매처 정식 A/S 1년 샤오미 스마트워치 어메이즈핏 GTS2 Mini 미니  한글판,94900,등록일 2021.05.,9
377,글로벌 버전 Amazfit Bip U Smartwatch 포르투갈어 피트니스 트랙 시계 320*302 해상도 60 스포츠 모드 메시지 알림,71224,등록일 2021.04.,9
378,공식수입사 샤오미 스마트워치 어메이즈핏 GTS2 Mini 미니 국내정식발매 한글판,98000,등록일 2021.01.,9
379,[하이마트]어메이즈핏 [6% 추가쿠폰] [정품]스마트워치 어메이즈핏 GTR2 알루미늄 국내정발/한글판,198000,등록일 2021.02.,9
380,샤오미 샤오미 어메이즈핏 GTR 2세대 글로벌버전 블랙 스포츠,159700,등록일 2021.02.,8
381,새로운 Amazfit GTR 2e Alexa 내장 Smartwatch 5 ATM 1.39 ’AMOLED 수면 품질 모니터링 스마트 워치 Andriod IOS,166205,등록일 2021.04.,8
382,어메이즈핏 스마트워치 어메이즈핏 GTS2 국내정식발매 한글판/국내AS지원,198000,등록일 2021.07.,8
383,샤오미 어메이즈핏 GTS GTR 마그네틱 충전기,5900,등록일 2020.04.,8
384,[화미] 어메이즈핏 GTS 스마트워치 [한글판] [골드],139000,등록일 2021.05.,8
385,스마트워치 어메이즈핏 GTR 47mm 국내정식발매 한글판/국내AS지원,119000,등록일 2020.10.,8
386,팝바나나 샤오미 어메이즈핏 GTS GTR 마그네틱 충전기 - 출력 전류 감지 안전하고 빠른 충전,5550,등록일 2020.03.,8
387,새로운 Amazfit X Smartwatch 글로벌 버전 수면 모니터링 곡선 스크린 티타늄 바디 5ATM 방수 멀티 스포츠 모드,356166,등록일 2020.10.,8
388,스마트워치 어메이즈핏 GTR 47mm 국내정식발매 한글판/국내AS지원,119000,등록일 2020.10.,8
389,샤오미 어메이즈핏 GTS2 MINI 국내발송 AS 1년 정식발매 블랙,98440,등록일 2021.02.,8
390,샤오미 어메이즈핏 BIP / Amazfit BIP WITH 화미,89120,등록일 2018.03.,8
391,글로벌 버전 Amazfit Stratos 3 스마트 워치 5ATM GPS 음악 듀얼 모드 14 일 Smartwatch 안드로이드,218444,등록일 2021.04.,8
392,"Amazfit-T-Rex A1918/GTR 42mm/GTR 47mm/GTS 충전기 코드 와이어 충전기용 USB 충전 케이블 라인, 47mm/GTS 충전기 케이블 라인, 스마트 폰,",2099,등록일 2021.06.,8
393,샤오미 어메이즈핏 GTS2 MINI 국내발송 AS 1년 정식발매 블랙,98440,등록일 2021.02.,8
394,국내발송 샤오미 어메이즈핏 GTS2 MINI 스마트워치 A S 1년 - 공식 A S 서비스,96820,등록일 2021.02.,8
395,스마트워치 어메이즈핏 GTS2 국내정식발매 한글판/국내AS지원,198000,등록일 2020.12.,8
396,AMAZFIT VERGE 어메이즈핏 버지 글로벌버전,189030,등록일 2019.01.,8
397,어메이즈핏 어메이즈핏 Amazfit GTS 2 mini 블랙 한글지원,91080,등록일 2020.12.,8
398,[화미] 어메이즈핏 GTS 스마트워치 [한글판] [블랙],135000,등록일 2021.05.,8
399,"Amazfit-새로운 밴드 5 스마트 팔찌 컬러 디스플레이 피트니스 트래커 방수 스포츠 스마트 팔찌, 2020",58769,등록일 2021.05.,8
