,0,1,2,3
0,어메이즈핏 GTS 2 Mini,84980,등록일 2021.02.,1802
1,2020 글로벌 Amazfit Bip S Smartwatch 5ATM 방수 내장 GPS GLONASS 스마트 워치 안드로이드 iOS 전화,71146,등록일 2020.09.,1600
2,필름무료 / 샤오미 어메이즈핏 gts2 mini 한글판,80600,등록일 2021.03.,1404
3,화미 어메이즈핏 GTR2,193430,등록일 2020.11.,1318
4,Original Amazfit Stratos Smartwatch 스마트 워치 GPS 칼로리 카운트 50M 방수 안드로이드 iOS 전화,111469,등록일 2021.01.,1218
5,필름무료/샤오미 어메이즈핏 AMAZFIT GTS 2 MINI 스마트워치 한글판,80600,등록일 2021.03.,1207
6,어메이즈핏 Amazfit GTS2 mini 스마트워치 한글판/한국어 지원,66500,등록일 2020.12.,1138
7,화미 어메이즈핏 GTR 2e,148000,등록일 2021.02.,971
8,샤오미 어메이즈핏 빕,16800,등록일 2018.03.,940
9,화미 어메이즈핏 GTR 47mm,119000,등록일 2020.12.,899
10,스마트워치 GTR2e 블랙 정식발매 한글판/전국망AS,148000,등록일 2021.02.,807
11,Amazfit Bip U 프로 GPS Smartwatch 컬러 스크린 31g 5 ATM 방수 60 + 스포츠 모드 스마트 워치 안드로이드,83006,등록일 2021.03.,788
12,화미 어메이즈핏 GTS,109000,등록일 2020.06.,772
13,글로벌 버전 Amazfit GTS 2 미니 GPS 스마트 워치 AMOLED 디스플레이 70 스포츠 모드 수면 모니터링 안드로이드 iOS 용 스마트 워치,118584,등록일 2021.03.,756
14,스마트워치 어메이즈핏 GTR 47mm 국내정식발매 한글판,119000,등록일 2021.06.,714
15,샤오미 어메이즈핏 GTS 2 MINI 국내유일 정식판매처 A/S 1년 보증,94900,등록일 2021.01.,643
16,재고 있음 글로벌 버전 Amazfit Stratos 3 스마트 워치 GPS 5ATM 음악 듀얼 모드 14 일 Smartwatch 안드로이드 2019,213462,등록일 2020.10.,634
17,화미 어메이즈핏 T-REX PRO,188000,등록일 2021.04.,587
18,"스마트워치 어메이즈핏 모음 GTR2, GTS2, T-Rex, 샤오미 생태계회사 Huami",145000,등록일 2020.04.,574
19,어메이즈핏 스마트워치 GTR2 국내정식발매 한글판,198000,등록일 2021.07.,480
20,원래 글로벌 Amazfit Bip U Pro Smartwatch 1.43 인치 50 시계는 안드로이드 iOS 전화에 대한 컬러 스크린 GPS 스마트 워치 직면,77811,등록일 2021.03.,463
21,화미 어메이즈핏 GTS 2e,142080,등록일 2021.02.,445
22,어메이즈핏 밴드5,49400,등록일 2020.12.,436
23,(보호필름 무료) 샤오미 어메이즈핏 GTS 2 MINI 한글판 국내출고 Amazfit,79700,등록일 2021.02.,433
24,블루투스 전화 스마트 워치 남성 여성 방수 심장 박동 음악 플레이어 보수계 Smartwatch For amazfit Huawei Apple Xiaomi,17778,등록일 2021.04.,427
25,어메이즈핏 스마트워치 티렉스 프로 T-REX PRO 아웃도어 특화 스포츠시계,188000,등록일 2021.04.,425
26,새로운 원래 Amazfit Bip U Smartwatch 5ATM 방수 컬러 디스플레이 스포츠 추적 스마트 워치 안드로이드 iOS 전화,71146,등록일 2020.11.,424
27,어메이즈핏 스마트워치 GTR2e 국내정식발매 한글판,148000,등록일 2021.07.,417
28,"글로벌 버전 Amazfit Stratos Smartwatch 음악 GPS 심박수 모니터 5ATM 방수 남성 야외 시계, 재고 있음",129792,등록일 2021.05.,385
29,재고 Amazfit Bip S 글로벌 버전 Smartwatch 5ATM GPS GLONASS 스마트 워치 안드로이드 iOS 전화,83006,등록일 2020.10.,373
30,글로벌 버전 Amazfit Bip U Pro GPS 스마트 워치 1.43 인치 50 시계 페이스 컬러 스크린 5 ATM 60 + 스포츠 모드 심박수 추적,77896,등록일 2021.02.,368
31,스마트 워치 남성 피트니스 심박수 혈압 모니터링 블루투스 전화 P8 GTS SmartWatch 팔찌 여성 Xiaomi Amazfit,19186,등록일 2021.07.,364
32,어메이즈핏 스마트워치 GTS 국내정식발매 한글판,145000,등록일 2021.07.,355
33,"FIFATA-Huami stratos용 실리콘 밴드 스트랩, Amazfit Stratos 2 2S 3 페이스 GTR 47mm GTR 2 용 시계 교체 팔찌, 실리콘 스트랩",2455,등록일 2020.12.,352
34,샤오미 어메이즈핏 GTS 스마트워치 글로벌버전 한글지원 웨어러블기기,68900,등록일 2021.01.,351
35,화미 어메이즈핏 GTS2,184140,등록일 2020.12.,306
36,AMAZFIT Bip Youth Edition Smart Watch Black,83239,등록일 2020.10.,296
37,샤오미 어메이즈핏 GTS 2 MINI (한글판) 12가지 스포츠 모드,69800,등록일 2021.01.,272
38,스마트워치 어메이즈핏 GTR2 국내정식발매 한글판/국내AS지원 혈중산소포화도,198000,등록일 2020.12.,269
39,스마트워치 GTR2 알루미늄 정식발매 한글판/전국망AS,198000,등록일 2020.12.,257
40,Miband 5 6 4 용 실리카 젤 스마트 팔찌 Mi Band 5 용 스트랩 실리콘 Correas Xiaomi Mi3 Opaska Bend 4 Pulseira Amazfit 5,2838,등록일 2021.07.,250
41,스마트 워치 여성 피트니스 트래커 팔찌 IP68 방수 혈압 Xiaomi Amazfit 안드로이드 남성 스포츠 GTS P8 Smartwatch,21810,등록일 2021.07.,242
42,2021 스마트 워치 전체 터치 팔찌 피트니스 트래커 혈압 Xiaomi Amazfit 스마트 시계 남자 GTS 2 Smartwatch,21786,등록일 2021.05.,235
43,1+1 샤오미 화미 어메이즈핏 GTR 42 47 강화 유리,4630,등록일 2019.12.,233
44,글로벌 Amazfit GTS 2 Smartwatch 5ATM 방수 AMOLED 디스플레이 Alexa 내장 스마트 워치 안드로이드 IOS 전화,213695,등록일 2021.07.,223
45,"Amazfit Bip S Lite 스마트워치 5 ATM 방수 푸시 메시지 스마트 푸시 알림 2020, 새로운 글로벌 버전",71146,등록일 2021.01.,216
46,샤오미 어메이즈핏 GTS2 Mini 미니 스마트워치 국내유일 정식 발매 한글판,103000,등록일 2021.01.,216
47,글로벌 버전 Amazfit Bip S Lite Smartwatch 컬러 디스플레이 5ATM 방수 수영 스마트 워치 1.28 인치 안드로이드 ios 전화 번호,59286,등록일 2021.01.,202
48,혈중산소포화도 측정 어메이즈핏 밴드5 스마트밴드 국내정발 샤오미 생태계회사 화 미밴드5,49400,등록일 2020.10.,194
49,샤오미 어메이즈핏 AMAZFIT GTS 2 MINI 스마트워치,79900,등록일 2020.12.,193
50,"Amazfit T-rex T rex 스마트 워치 5ATM 14 스포츠 모드, GPS, GLONASS, iOS 안드로이드 폰용 2020 년 재고 있음,",130444,등록일 2020.03.,183
51,어메이즈핏 밴드5 스마트밴드 국내정식발매 한글판/국내AS지원,49400,등록일 2021.07.,175
52,(보호필름 1+1) 국내발송 한글판 샤오미 어메이즈핏 AMAZFIT GTS2 MINI,84900,등록일 2021.02.,171
53,어메이즈핏 스마트워치 GTR2e 국내정식발매 한글판/국내AS지원,148000,등록일 2021.04.,169
54,"Amazfit-새로운 밴드 5 스마트 팔찌 컬러 디스플레이 피트니스 트래커 방수 블루투스 호환 2020 스포츠 스마트 팔찌, 5.0",59351,등록일 2020.10.,168
55,2021 새로운 Amazfit GTR 2e Smartwatch 1.39 ’AMOLED 수면 품질 모니터링 5 ATM 스마트 워치 Andriod IOS Alexa 내장,166023,등록일 2021.03.,165
56,스마트워치 어메이즈핏 GTR2e 국내정식발매 한글판/국내AS지원,148000,등록일 2021.02.,162
57,AMAZFIT BIP 컬러 메탈스트랩. 샤오미 어메이즈핏 빕 시계줄,5900,등록일 2021.07.,143
58,"화웨이 Amazfit Bip S/GTR 47MM/Watch3 용 시계 밴드 스트랩, 화웨이 GTS GT 2 2e GT2e, Xiaomi Amazfit Bip S/GTR 47MM",3534,등록일 2020.09.,142
59,어메이즈핏 GTR 스마트워치 47mm,268640,등록일 2021.05.,137
60,화미 어메이즈핏 T-Rex,135280,등록일 2020.10.,135
61,어메이즈핏 GTS 스마트워치  A1914  골드,109000,등록일 2020.06.,131
62,어메이즈핏 GTS 스마트워치  A1914  블랙,109000,등록일 2020.06.,131
63,어메이즈핏 GTS 스마트워치  A1914  그레이,109000,등록일 2020.06.,131
64,샤오미 AMAZFIT GTS 2 MINI 한글지원 블랙 그린 핑크 AOD 국내출고,79800,등록일 2021.02.,118
65,어메이즈핏 스마트워치 GTS2e 국내정식발매 한글판/국내AS지원,148000,등록일 2021.04.,116
66,스트랩 xiaomi mi Band 5 4 3 6 스테인레스 메탈 Opaska Correa Mi Bend 4 Mi band 5 팔찌 Amazfit band 5,4939,등록일 2021.07.,115
67,스마트워치 GTS2e 블랙 정식발매 한글판/전국망AS,148000,등록일 2021.02.,113
68,스마트워치 GTR2e 그린 정식발매 한글판/전국망AS,148000,등록일 2021.02.,110
69,"20MM 오리지널 스트랩 Amazfit Bip Bip U Pace Stratos GTR 용 20MM 스트랩, Amazfit Bip Bip 스마트 워치",11848,등록일 2021.05.,110
70,어메이즈핏 스마트워치  GTS2e 국내정식발매 한글판,148000,등록일 2021.07.,109
71,어메이즈핏 스마트워치 GTS2 국내정식발매 한글판,198000,등록일 2021.07.,105
72,샤오미  어메이즈핏 Amazfit GTS2 mini 스마트워치 글로벌 버전/한글 지원 - GTS2 mini 글로벌 - 그린,80500,등록일 2021.04.,104
73,샤오미  어메이즈핏 Amazfit GTS2 mini 스마트워치 글로벌 버전/한글 지원 - GTS2 mini 글로벌 - 블랙,80500,등록일 2021.04.,104
74,샤오미  어메이즈핏 Amazfit GTS2 mini 스마트워치 글로벌 버전/한글 지원 - GTS2 mini 글로벌 - 핑크,80500,등록일 2021.04.,104
75,스마트워치 GTS2 블랙 정식발매 한글판/전국망AS,198000,등록일 2020.12.,104
76,어메이즈핏 샤오미 어메이즈핏GTS2 Mini 정식한글버전 올블랙컬러,93060,등록일 2021.02.,101
77,어메이즈핏 GTS Amazfit GTS 국내정발 한국어 지원,129000,등록일 2020.03.,99
78,2020 CES Amazfit T-렉스 렉스 Smartwatch 5ATM 방수 스마트 워치 GPS/GLONASS AMOLED iOS 안드로이드,142459,등록일 2020.10.,98
79,어메이즈핏 스마트워치 GTR2e 블랙 정식발매 한글판/전국망AS,148000,등록일 2021.02.,96
80,스마트워치 GTR2e 그레이 정식발매 한글판/전국망AS,148000,등록일 2021.02.,95
81,Amazfit smart sports watch Pottery technology produced ceramic bezel GPS real-time track black silic,153419,등록일 2020.09.,95
82,(공식수입사 재고보유) 샤오미 스마트워치 어메이즈핏 GTS2 Mini 미니 한글판,94900,등록일 2021.02.,93
83,P8 스마트 워치 남자 여자 IP67 방수 적당 추적자 스포츠 심박수 감시자 Amazfit Gts xiaomi를위한 가득 차있는 접촉 Smartwatch,27307,등록일 2020.03.,91
84,어메이즈핏 어메이즈핏 빕라이트 스마트워치 한국어지원 A/S 블랙,63360,등록일 2019.08.,89
85,재고 있음 Amazfit Stratos + 플래그십 스마트 워치 정품 가죽 스트랩 사파이어 유리 Flourorubber 스트랩 안드로이드 전화 번호,133911,등록일 2020.12.,87
86,스마트워치 GTS2e 그린 정식발매 한글판/전국망AS,148000,등록일 2021.02.,83
87,(어메이즈핏) 어메이즈핏 밴드5 스마트밴드 국내정식발매 한글판/국내AS지원/산소포화도 측정/2세대 센...,49400,등록일 2021.07.,83
88,2021 새로운 1.35 인치 스크린 블루투스 스마트 워치 여성 음악 스포츠 삼성 갤럭시 시계 Amazfit 스마트 워치 남자 시계,51836,등록일 2021.07.,79
89,어메이즈핏 GTS 블루,105290,등록일 2020.01.,78
90,2019 New Amazfit Stratos + 플래그십 스마트 워치 Genuie 가죽 스트랩 선물 상자 사파이어 2S,139491,등록일 2020.09.,77
91,밀스펙 스마트워치 어메이즈핏 티렉스 T-REX 50미터 방수 전자시계,150000,등록일 2021.04.,77
92,스마트워치 어메이즈핏 GTS2 국내정식발매 한글판/국내AS지원 혈중산소포화도,198000,등록일 2020.12.,76
93,스마트워치 GTS2 골드 정식발매 한글판/전국망AS,198000,등록일 2020.12.,76
94,어메이즈핏 티렉스 아웃도어 스마트워치 /국내정식발매 한글판/국내AS,150000,등록일 2020.09.,75
95,"Amazfit Bip Bip U Pro Gts 2 미니 스마트 워치, Amazfit Bip Bip Bip 스마트 워치 제외 오리지널 스트랩",11848,등록일 2021.03.,73
96,[★온라인최저가/55%할인★] 스마트워치 어메이즈핏 GTS Amazfit GTS 국내정발 국내AS 한국어 지원,85200,등록일 2020.01.,72
97,2020 새로운 글로벌 버전 Amazfit Band 5 스마트리스트 밴드 5ATM 11 스포츠 모드 측정 스트레스 레벨 피트니스 스마트 밴드,47479,등록일 2020.10.,71
98,스마트워치 어메이즈핏 GTR2e 국내정식발매 한글판/국내AS지원,148000,등록일 2021.02.,70
99,어메이즈핏 스마트워치 GTR2 알루미늄 정식발매 한글판/전국망AS,198000,등록일 2020.12.,69
100,"100cm/3.28ft USB 충전 케이블 라인 Amazfit T-Rex A1918/GTR 42mm/GTR 47mm/GTS 충전기 코드 와이어, Amazfit T-Rex",2849,등록일 2021.05.,69
101,샤오미 어메이즈핏 GTS2 mini 스마트워치 글로벌 버전/블랙,90780,등록일 2021.02.,69
102,[★온라인최저가/최대55%할인★] 스마트워치 어메이즈핏 모음전 GTR GTS T-Rex BIP UPRO Amazfit 국내정발 국내AS 한국어 지원 KC인증-1,42900,등록일 2020.03.,68
103,Original Amazfit Stratos Smartwatch GPS 5ATM 방수 야외 스마트 워치 칼로리 카운트 iOS 전화,120483,등록일 2021.04.,67
104,샤오미 어메이즈핏 빕라이트 스마트워치 정식A/S 저렴한 방수 스포츠 운동 선물용 전자시계,56000,등록일 2019.08.,66
105,샤오미 어메이즈핏 빕 라이트 스마트워치 한국어지원정품 A/S,57960,등록일 2021.03.,65
106,샤오미 어메이즈핏 빕 라이트 스마트워치 한국어지원정품 A/S,57330,등록일 2021.03.,64
107,원래 글로벌 버전 Amazfit Bip S 5ATM 방수 Smartwatch 심장 추적 블루투스 호환 스마트 워치 CES,81434,등록일 2021.05.,64
108,어메이즈핏 네오 한글판 레트로 스마트워치  레드,58900,등록일 2021.05.,64
109,어메이즈핏 네오 한글판 레트로 스마트워치  블랙,53220,등록일 2021.05.,64
110,[하이마트]어메이즈핏 AMAZFIT 스마트워치 티렉스 프로[블랙][T-REX PRO],188000,등록일 2021.05.,63
111,샤오미 Amazfit GTR/GTS 스마트 시계-- (공식한글 버전)/42mm  47mm재고 확보/50m 방수기능/고정밀 GPS기능 / 무료배송,210550,등록일 2020.01.,63
112,"Amazfit-Bip U 피트니스 트랙 스마트 워치 5ATM 방수 컬러 디스플레이 안드로이드용 수면 모니터링, IOS 호환",71224,등록일 2020.11.,62
113,어메이즈핏 GTR2 스마트워치 블루투스 통화 + 음악저장 업그레이드 버젼,198000,등록일 2021.04.,60
114,글로벌 Amazfit GTS 2 블루투스 Smartwatch 수영 Alexa 내장 12 스포츠 모드 스마트 워치 안드로이드 iOS,213695,등록일 2020.11.,60
115,샤오미 화미 어메이즈핏 GTR 42 47 베젤링,4450,등록일 2020.10.,59
116,[카드사 12% 할인]샤오미 샤오미 어메이즈핏 GTS 스마트워치 글로벌 블랙,108900,등록일 2021.03.,58
117,재고 Amazfit Stratos Smartwatch 5ATM 방수 스마트 워치 블루투스 호환 GPS 단계 카운터 안드로이드 iOS,111033,등록일 2021.05.,58
118,스마트워치 어메이즈핏 GTS 그레이 한글판 국내정발,145000,등록일 2020.11.,57
119,원래 새로운 글로벌 Amazfit Bip S 5ATM Smartwatch 멀티 스포츠 모드 블루투스 호환 스마트 워치 안드로이드 iOS 전화,71224,등록일 2020.09.,57
120,샤오미 어메이즈핏 GTS 스마트워치 글로벌 블랙,104000,등록일 2021.03.,57
121,무배/샤오미 화미 어메이즈핏 GTR 시계줄 스트랩,6800,등록일 2019.08.,56
122,AMAZFIT VERGE 어메이즈핏 버지 글로벌버전,169460,등록일 2019.01.,56
123,"""글로벌 버전 Amazfit GTS 2 미니 GPS Smartwatch 1.55 """"301 ppi AMOLED 70 스포츠 모드 스마트 워치 안드로이드 iOS 전화""",130444,등록일 2021.05.,56
124,샤오미 어메이즈핏 Amazfit GTS2 mini 스마트워치 한글판/한국어 지원 / 더욱 길어진 배터리 수명! / 건강 평가 시스템! / 무료배송,83110,등록일 2021.01.,55
125,(어메이즈핏) 스마트워치 어메이즈핏 GTR2 스테인리스 국내정식발매 한글판/국내AS지원,208000,등록일 2021.04.,55
126,"글로벌 버전 Amazfit GTS 2e AlexaBuilt-in Smartwatch 1.65 인치 긴 배터리 수명 90 스포츠 모드 스마트 워치, 안드로이드 iOS 용",166205,등록일 2021.07.,54
127,2020 Amazfit Bip S Lite Smartwatch 항상 표시 메시지 알림 Andriod IOS Phone 용 수면 모니터 스마트 워치,65216,등록일 2021.01.,53
128,스마트워치 GTS2e 퍼플 정식발매 한글판/전국망AS,148000,등록일 2021.02.,52
129,샤오미 어메이즈핏 GTS2 mini 스마트워치 글로벌 버전/그린,91080,등록일 2021.02.,49
130,"Amazfit GTR2 2e Pace Stratos3 2 비즈니스 캐주얼 팔찌 용 22mm 정품 가죽 스트랩, huami Amazfit GTR 47mm 밴드",5218,등록일 2021.03.,49
131,어메이즈핏 스마트워치 티렉스 T-REX PRO 국내정식발매 한글판/국내AS지원,188000,등록일 2021.07.,49
132,글로벌 버전 Amazfit Nexo Smartwatch 도자기 베젤 10 스포츠 모드 GPS Glonass 안드로이드 폰용 1.39 인치 AMOLED 디스플레이,137560,등록일 2020.11.,48
133,Amazfit GTS 2 미니 스포츠 Smartwatch GPS 여성 사이클 추적 스마트 워치 안드로이드 iOS 전화,118584,등록일 2021.03.,48
134,글로벌 버전 Amazfit T-rex Pro GPS 야외 Smartwatch 방수 18 일 배터리 수명 390mAh 스마트 워치 안드로이드 IOS 전화 번호,920000,등록일 2021.04.,48
135,샤오미 화미 어메이즈핏 GTR 42 47 베젤링,4740,등록일 2020.10.,47
136,샤오미 어메이즈핏 스마트워치 Bip S,104000,등록일 2020.05.,46
137,스마트워치 어메이즈핏 GTS2e 국내정식발매 한글판/국내AS지원,148000,등록일 2021.02.,46
138,샤오미 어메이즈핏 GTS2 mini 스마트워치 글로벌 버전/블랙,90090,등록일 2021.02.,45
139,"Xiaomi HUAMI AMAZFIT Pace/Bip a1230/A1607/A1702/GTR 42/47mm 1909/stratos 2 용 USB 충전기 도킹 스테이션 크래들,",4250,등록일 2021.03.,45
140,[하이마트]어메이즈핏 [6% 추가쿠폰] [정품]어메이즈핏 GTR2e 스마트워치[블랙][국내정식발매/한글판],148000,등록일 2021.02.,44
141,샤오미 어메이즈핏 GTS 보호필름 액정2매 측후면2매 세트,11340,등록일 2020.02.,44
142,스마트워치 GTS2 그레이 정식발매 한글판/전국망AS,198000,등록일 2020.12.,44
143,샤오미 어메이즈핏 Amazfit GTR GTS 스마트워치 글로벌,93000,등록일 2020.06.,44
144,"Huami Amazfit Verge Youth Edition 스마트 워치 충전기, 청소년 시계 A1808 교체 용 USB 충전 도크 케이블 Smartwatches",134800,등록일 2021.04.,43
145,Xiaomi Mi Band 6 용 스트랩 Mi Band 5 용 팔찌 Miband 3 4 팔찌 Amazfit Band 5 용 실리콘 손목 Correa 글로벌 버전,2351,등록일 2021.01.,43
146,재고 2020 글로벌 버전 Amazfit Bip S 스마트 워치 5ATM Smartwatch GPS GLONASS 블루투스 안드로이드 전화,83006,등록일 2021.05.,43
147,글로벌 버전 Hot Amazfit Nexo Smartwatch 도자기 베젤 10 스포츠 모드 GPS Glonass 안드로이드 폰용 1.39 인치 AMOLED 디스플레이,250000,등록일 2021.04.,42
148,새로운 Amazfit Bip S 글로벌 버전 Smartwatch 5ATM 방수 GPS GLONASS 스마트 워치 안드로이드 IOS 전화,83096,등록일 2020.08.,42
149,오리지널 글로벌 Amazfit Bip S Smartwatch 5ATM 방수 내장 GPS GLONASS 스마트 워치 안드로이드 iOS 전화,67662,등록일 2021.04.,40
150,스마트워치 어메이즈핏 GTS 블랙 한글판 국내정식발매,145000,등록일 2020.11.,40
151,화미 어메이즈핏 빕 U,75990,등록일 2021.02.,40
152,샤오미 어메이즈핏 GTS2 Mini 미니 국내정식발매 한글판(핑크 그린 7월말 예약발송),95400,등록일 2021.01.,39
153,[카드사 12% 할인]샤오미 샤오미  Amazfit GTS 2 mini (글로벌버전)--블랙/무배,96530,등록일 2021.01.,39
154,원래 Amazfit Bip S 글로벌 버전 Smartwatch 5ATM GPS GLONASS 블루투스 호환 스마트 워치 안드로이드 iOS 전화,71224,등록일 2021.05.,38
155,어메이즈핏 스마트워치 GTS2e 블랙 정식발매 한글판/전국망AS,148000,등록일 2021.02.,37
156,새로운 Amazfit Bip U Smartwatch 컬러 디스플레이 GLONASS 수면 모니터링 안드로이드 iOS 폰용 5ATM 방수 스마트 워치,71224,등록일 2020.11.,37
157,[하이마트]어메이즈핏 AMAZFIT 스마트워치 티렉스 프로[그레이][T-REX PRO],188000,등록일 2021.05.,36
158,LEMFO 2021 GTS 2 Smartwatch 남성 블루투스 통화 스마트 워치 amazfit gts 2 DIY 시계 얼굴 음악 긴 대기,29637,등록일 2021.02.,36
159,샤오미 어메이즈핏빕 20MM 스포츠 스트랩,9900,등록일 2019.04.,36
160,어메이즈핏 어메이즈핏 스마트워치 티렉스 T-REX PRO 블랙 한글판,188000,등록일 2021.06.,36
161,샤오미 샤오미 어메이즈핏 GTS 스마트워치 글로벌 블랙,104000,등록일 2021.03.,36
162,샤오미 샤오미  Amazfit GTS 2 mini (글로벌버전)--블랙/무배,92660,등록일 2021.01.,35
163,2019 새로운 Amazfit Stratos + 전문 스마트 워치 정품 가죽 스트랩 선물 상자 사파이어 2S 안드로이드 iOS 전화 번호,132201,등록일 2020.10.,35
164,원래 Amazfit GTS 2 Smartwatch 12 스포츠 모드 5ATM 방수 Alexa 내장 AMOLED 종일 추적 스마트 워치,213462,등록일 2020.11.,34
165,스마트워치 어메이즈핏 GTR2 스테인리스 국내정식발매 한글판/국내AS지원,208000,등록일 2020.12.,34
166,어메이즈핏 스마트워치 티렉스 프로 T-REX PRO 그레이 국내정식발매 한글판/국내AS지원,188000,등록일 2021.05.,33
167,스마트 워치 GTS 2 1.7 인치 3D 곡선 터치 스크린 심박수 혈압 모니터 GTS2 스마트 워치 남성 2021 amazfit Android 용,24921,등록일 2021.07.,32
168,스마트워치 어메이즈핏 GTS2e 국내정식발매 한글판/국내AS지원,148000,등록일 2021.02.,32
169,[어메이징핏] 스마트워치 어메이즈핏 GTR2e 국내정식발매 한글판/국내AS지원,148000,등록일 2021.02.,32
170,Amazfit Bip U Pro GPS Smartwatch 컬러 스크린 스마트 워치 5 ATM 방수 60 + 안드로이드 폰용 스포츠 모드,83084,등록일 2021.05.,32
171,어메이즈핏 네오 스마트워치 블랙 한글판 국내정식발매,67250,등록일 2020.11.,31
172,"Amazfit Stratos 2 A1609 A1619 용 LCD 스크린 터치스크린, 신제품, LCD 화면",35487,등록일 2021.07.,31
173,(어메이즈핏) 스마트워치 어메이즈핏 GTS2 국내정식발매 한글판/국내AS지원,198000,등록일 2021.07.,31
174,한국 유일 국내 공식판매처 정식 A/S 1년 샤오미 스마트워치 어메이즈핏 GTS2 Mini 미니 한글판,94900,등록일 2021.06.,29
175,[카드사 12% 할인]샤오미 샤오미 어메이즈핏 GTS 스마트워치 글로벌 블랙,108900,등록일 2021.04.,29
176,새로운 IWO 13 X8 스마트 워치 시리즈 6 블루투스 통화 심박수 피트니스 안드로이드 IOS PK amazfit W46 W26 T500 용 Smartwatch 추적,15541,등록일 2021.05.,29
177,어메이즈핏 빕 라이트 스마트워치  A1915  블랙,56000,등록일 2021.05.,29
178,어메이즈핏 스마트워치 티렉스 프로 T-REX PRO 국내정식발매한글판/국내AS,188000,등록일 2021.06.,29
179,국내 유일 한국 공식판매처 정식 A/S 1년 샤오미 스마트워치 어메이즈핏 GTS2 Mini 미니  한글판,97000,등록일 2021.03.,28
180,[카드사 12% 할인]샤오미 (빠른직구) Amazfit GTS2 mini 스마트워치 국제판 블랙,89900,등록일 2021.08.,28
181,샤오미 어메이즈핏 네오 스마트워치 블랙 한글판 국내정식발매,67250,등록일 2020.11.,27
182,★쿠폰가 $79★ 샤오미 어메이즈핏 Amazfit GTR GTS 스마트워치 글로벌 / 추가 스트랩 구매 가능 / AMOLED HD 대형 스크린 / 무료배송,96410,등록일 2021.02.,27
183,어메이즈핏 스마트워치 GTS2e 국내정식발매 한글판/국내AS지원,148000,등록일 2021.02.,26
184,어메이즈핏 Amazfit GTS2 mini 스마트워치 한글판/한국어 지원,99000,등록일 2020.12.,25
185,샤오미 (빠른직구) Amazfit GTS2 mini 스마트워치 국제판 블랙,86930,등록일 2021.08.,25
186,어메이즈핏 GTR 47mm 스마트워치 / 배터리 최대 74일 사용,119000,등록일 2021.04.,25
187,2021 새로운 1.35 인치 컬러 풀 터치 스크린 블루투스 스마트 워치 음악 스포츠 삼성 갤럭시 Watch3 Amazfit 스마트 워치 남성,56039,등록일 2021.07.,25
188,어메이즈핏 스마트워치  GTS2  골드,190080,등록일 2021.07.,24
189,어메이즈핏 스마트워치  GTS2e  퍼플,142080,등록일 2021.07.,24
190,샤오미 어메이즈핏 GTS2 Mini 미니 정식 한글버전 12가지 스포츠 모드,78500,등록일 2021.02.,24
191,어메이즈핏 스마트워치  GTS2e  블랙,142080,등록일 2021.07.,24
192,어메이즈핏 스마트워치  GTS2  그레이,190080,등록일 2021.07.,24
193,샤오미 화미 어메이즈핏 GTR 케이스/GTR 케이스,3590,등록일 2020.09.,24
194,어메이즈핏 스마트워치  GTS2e  그린,142080,등록일 2021.07.,24
195,[하이마트]어메이즈핏 [6% 추가쿠폰] [정품]스마트워치 어메이즈핏 GTR2 스테인리스 국내정발/한글판,208000,등록일 2021.02.,24
196,어메이즈핏 빕S 스마트워치  A1821  레드오렌지,104000,등록일 2021.07.,24
197,어메이즈핏 빕S 스마트워치  A1821  카본블랙,104000,등록일 2021.05.,24
198,[어메이즈핏] 밴드5 스마트밴드 국내정식발매 한글판/국내AS지원/산소포화도 측정/2세대 센서 탑재,49400,등록일 2021.07.,23
199,샤오미 샤오미 어메이즈핏 빕 라이트 국내 정식발매 A/S1년,53940,등록일 2020.09.,23
200,어메이즈핏 스마트워치 GTS2 골드 정식발매 한글판/전국망AS,198000,등록일 2020.12.,23
201,어메이즈핏 어메이즈핏 스마트워치 GTS2 Mini 국내 AS 정식 블랙,93130,등록일 2021.01.,23
202,샤오미 어메이즈핏 빕 라이트 스마트워치 한국어지원정품 A S - 다시 돌아온 대륙의실수 최고의 가성비,70030,등록일 2020.10.,23
