,0,1,2
338,기본형 맥북프로 인치과 최고급형 맥북프로 인치 비교,애플은 년 월 일에  맥북프로 인치를 출시 하였습니다애플이 맥북프로 인치를 새롭게 출시 함으로써 이제 모든 맥북 제품군은 가위식 매직키보드를 장착하게 되었습니다이제 사용자들의 고민은 과연 나에게 맞는 맥북프로는 무엇일까 고민하게 되는데요그래서 가격대가 그나마 비슷한 기본형 맥북프로 인치와 최고급형 맥북프로 인치를 비교해봤습니다현재 애플 온라인 스토어 기준 기본형 맥북프로 인치의 가격은 백만원 최고급형 맥북프로 인치의 가격은 백만원으로 최고급형 맥북프로 인치가 만원 저렴합니다참고로 교육할인 가격은 기본형 맥북프로 인치의 가격은 백만천원 최고급형 맥북프로 인치의 가격은 백만천원으로 최고급형 맥북프로 인치가 만원 저렴합니다먼저 세부적인 기술사양부터 비교하면 다음과 같습니다제품기본형 맥북프로 인치최고급형 맥북프로 인치디자인출시일    출시가격원원만원 저렴교육할인가원원만원 저렴색상종류스페이스 그레이 실버종류스페이스 그레이 실버디스플레이 디스플레이형대각선  백라이트 디스플레이 기술   기본 해상도지원 가능 해상도         니트 밝기넓은 색영역  기술재생률      디스플레이형대각선  백라이트 디스플레이 기술   기본 해상도지원 가능 해상도       니트 밝기넓은 색영역  기술재생률    및    및  프로세스인텔 세대  코어 코어 세대   최대      캐시인텔 세대  코어 코어 세대   최대      캐시저장장치    메모리  온보드메모리   온보드메모리그래픽        메모리 및 자동 그래픽 전환 기능 탑재   배터리 및 전원무선 인터넷 사용 최대시간  앱 동영상 재생 최대시간대기 시간 최대 일와트시리튬 폴리머 배터리 내장 전원 어댑터무선 인터넷 사용 최대 시간  앱 동영상 재생 최대 시간대기 시간 최대 일와트시 리튬 폴리머 배터리 내장  전원 어댑터크기 및 무게두께 가로 세로 무게 두께 가로 세로 무게 비디오 지원억 이상의 색상으로     해상도를 구현하는 외장  디스플레이대억 이상의 색상으로 에서    해상도를 구현하는 외장  디스플레이대  디지털 비디오 출력를 통한 기본  출력어댑터를 통해     출력억 이상의 색상으로     해상도를 구현하는 외장  디스플레이 대억 이상의 색상으로     해상도를 구현하는 외장  디스플레이 대풍부한 색상으로     해상도를 구현하는 외장  디스플레이 대  디지털 비디오 출력를 통한 기본  출력어댑터를 통해      출력카메라   카메라   카메라충전 및 확장다음을 지원하는    포트 개충전최대   세대최대 다음을 지원하는    포트 개충전최대   세대최대 무선기술  무선 네트워크  호환  무선기술  무선 네트워크  호환  무선기술오디오포스 캔슬링 우퍼를 탑재한 하이파이  스피커와이드 스테레오 사운드  재생 지원높은 신호 대 잡음비와 지향성 빔포밍을 자랑하는  마이크 배열 헤드폰 잭높은 다이내믹 레인지의 스테레오 스피커와이드 스테레오 사운드  재생 지원지향성 빔포밍을 자랑하는  마이크 배열 헤드폰 잭키보드 및 트랙패드가위식 키보드백 라이트  역 자 배열의 방향키 개를 포함한 키 키보드터치바주변광 센서터치  센서정확한 커서 제어 및 압력 감지 기능을 위한   트랙패드 세게 클릭 가속도계 압력 감지를 이용한 그리기  제스처가위식 키보드백 라이트  역 자 배열의 방향키 개를 포함한 키 키보드터치바주변광 센서터치  센서정확한 커서 제어 및 압력감지 기능을 위한   트랙패드 세게 클릭 가속도계 압력감지를 이용한 그리기  제스처 지원사용환경선간 전압  주파수 작동 온도 보관 온도 상대 습도  미응결작동 고도 까지 테스트최대 보관 고도 최대 운송 고도 선간 전압  주파수 작동 온도 보관 온도 상대 습도  미응결작동 고도 까지 테스트최대 보관 고도 최대 운송 고도 운영체제제품구성형    전원 어댑터 충전 케이블형    전원 어댑터 충전 케이블맥북프로 인치와 맥북프로 인치의 같은 점니트 밝기의 트루톤을 지원하는 레티나 디스플레이같은 용량의  메모리안정적인 가위식 매직키보드포스터치 트랙패드썬더볼트  포트 개  및   보안칩   카메라  무선 네트워크 블루투스   와이드 스테레오 사운드동일한 색상스페이스 그레이 실버맥북프로 인치가 맥북프로 인치보다 좋은 점최대 시간의 배터리 수명인치 시간넓은 해상도   와 얇은 베젤의 인치 화면레벨의 주사율 지원    개선된 열관리 아키텍처외장 비디오 카드 탑재로 부드러운 동영상 재생과 빠른 랜더링 외장 디스플레이 최대 대 지원인치 대 지원포스 캔슬링 우퍼를 탑재한 하이파이  스피커 시스템스튜디오급  마이크 어레이맥북프로 인치가 맥북프로 인치보다 좋은 점최신 인텔 세대  탑재인치 세대 인치  의 가벼운 무게인치 저전력의  메모리 탑재성능 비교동일한 맥북프로 라인의 모델이지만 외장 비디오를 탑재한 기본형 맥북프로 인치가 인치보다 대용량 비디오 파일 작업을 더 빠르게 처리 할 수 있습니다맥북프로 인치는 기존 디자인에서 변경사항이 없지만 맥북프로 인치는 기존과 다른 얇은 베젤과 전체적인 내부 디자인 개선으로 새롭게 설계된 열관리 아키텍처를 설계하여 보다 빠른 열관리 시스템이 있습니다맥북프로 인치는 최신 세대 인텔  를 탑재 했지만 코어이며 맥북프로 인치는 세대 인텔 를 탑재했지만 코어이므로 맥북프로 인치가 더 빠릅니다결론가격차가 가장 적은 기본형 맥북프로 인치와 최고급형 맥북프로 인치의 선택 기준은 다음과 같이 정리 할 수 있습니다고성능이 필요하지 않는 비디오 작업 문서 작성 인터넷 사용 휴대성 및 큰 용량의 스토리지가 필요한 사람은 최고급형 맥북프로 인치를 빠른 성능과 보다 부드러운 동영상 재생과 랜더링이 중요한 작업을 하는 사람은 기본형 맥북프로 인치를 선택하는 것이 좋습니다맥북프로 인치는 애플의 하이엔드 맥북프로 모델 답게 고성능을 자랑하며 시간의 배터리 수명을 가지고 있지만 의 육중한 무게와 다소 비싼 가격을 감안 할 때 최신 를 탑재하고 의 스토리지를 탑재한 최고급형 맥북프로 인치 역시 가성비를 고려 했을 때 좋은 선택입니다출처플랜김감사합니다,2020.06.04. 17:10
339,아이패드프로 매직키보드 힌지 충전  다이렉트충전 전류차이가 많이 납니다,안녕하세요제가 아이패드에어를 오랫동안 사용하다가 이번에 아이패드프로  셀룰러 기가를 구입하면서고민 끝에 매직키보드를 구입 하였습니다아직 일주일이 되지 않아 지금도 반품 할지 말지 고민 중 입니다 여러가지 테스트를 해 보던중 알게 된 직접적인 사실 입니다매직키보드를 구입하는 이유 중 하나가 힌지를 통하여 다이렉트 충전이 되기 때문이기도 했는데당연히 같이 충전 될 것이라는 저의 기대와 달리 계측기를 통하여 측정 해 보니차이가 많이 나네요제 블로그에 포스팅 한 내용 중 일부분을 올립니다주된 내용은 매직키보드를 반품할지 말지에 관한 내용 입니다 매직 키보드를 구입하시려는 분들은 보시면 도움이 될듯 합니다 블로그 포스팅 일부분전류 전압 측정을 위하여 알리익스프레스를 통해 주문 후 보름을 기다려 실제 계측기를 구입 테스트를 해 보니 매직키보드다이렉트 힌지를 통해 충전하는 것과 아이패드에 다이렉트로 충전할때 충전 량이 다르다는 사실 입니다결론적으로 다이렉트로 하는것이 더 빠릅니다왼쪽 사진이 아이패드에 다이렉트로 충전시 오른쪽 사진이 키보드를 통하여 충전할때의 모습 입니다직접 충전시 전압이 배 가까이 올라갑니다충전에 관련 된 부분은 배터리의 상태에 따라서 달라질수 있지만 둘다 동일 시간 환경에서 측정된 것 입니다이런 차이는 배터리가 거의 방전된 상태에서  정도까지는 시간 차이가 많이 나지만 최종적인 충전 시간은 그리 많이 차이가 나지는 않습니다 충전은 어느정도 이상되면 배터리 보호를 위하여 천천히 충전되기 때문이죠,2020.06.04. 10:49
340,작고 소중한 미니,프로 두개 있지만 휴대성이 떨어져서미니 데려왔습니다너무 귀엽고 예쁘고 가벼워서 대만족중이요 ㅎㅎ,2020.06.03. 00:07
341,내가 맥북에어 에서 맥북프로인치로 갈아탄 이유,안녕하세요맥북 입문한지 한 달 정도 되는 맥린이 입니다한 달 전 맥북에어  인치 를 구매하여 사용하다가이번에 중고로 팔아버리고 맥북프로 인치로 갈아타게 되었습니다이전에 맥북에어 백엔드개발자에게 적합한가리뷰글 이란 글을 작성했었으나일정부분 제 생각과 다른 점들이 있었다는 것을 말씀드립니다갈아타게 된 이유에 대해서 말씀드리려 합니다발열 그것은 문제가 아니다어차피 맥북에어는 사라졌지만 버전의 가 장착되어 있고버전 는 발열에 쥐약임을 알고 있었다가끔 찍는 도 별로 신경쓰이지 않았고 쓰로틀링에 의한 성능저하 원래 성능 낮은 라크게 체감되지도 않았다가장 중요한 문제는 간헐적 재부팅제품을 판매하게된 가장 결정적인 이유특별히 과부하가 심한 프로그램을 돌리지 않았다개발에 필요한 사의     정도왜 어째서 작업 잘 하다가 갑자기 놋북이 재부팅 되는 것일까 에 램도 이다보통 가 저절로 재부팅되는건 이 부족해서라고 판단된다 가 이 부족하여 으아아악 하면서 블루스크린이 뜨는 것처럼아니 그런데 가 부족하다고 그럴리 없다내가하는 작업은   개발하고 만들어서 많아야 몇만개 데이터 조회하는 수준인데그럼 가 문제일까 싶었다너무 높은 온도에 의해 회로를 보호하기 위해 재부팅을 시킨다고 생각했다아니 너무 높은 온도면 쓰로틀링 걸어서 성능 낮추고 온도 낮추고 팬 돌리잖아심지어 쿨러 개 달려있는 거치대까지 쓰고있는데하루에 두 번 일주일에 일 정도 같은 현상을 경험하고 나니주를 기다려 받은 맥북의 애정도는 에서 로 급감했다기본도 못하잖아그래서 그냥 배 주고 맥북프로 인치 고급형을 샀다어제 도착했고 오늘 동일한 작업들을 해보았다쾌적그래 만원짜린데 내가 딥러닝을 하니 데이터 엔지니어링을 하니 영상편집을 하니그깟 개발 툴 개  툴 개 크롬 탭 개 외장모니터 개 카톡 정도 동시에 하는데잘 되야 정상이지아니 그리고 유투브  영상은 왜끊겨인터넷 연결 문제인 줄 알았다와이파이 신호가 약한 줄 알았다무선랜이라 그런 줄 알았다우리집 인터넷 이론상  나오는 인터넷 쓴다그냥 맥북에어라 그런거였다아 물론 영상 시청은 전혀 관심이 없었기에 크나큰 단점은 아니었으나기분이 나빴다 외부모니터를 지원하면 뭐해지 혼자  영상에서 끊기는 주제에그 외에는 훌륭했습니다가벼운 용도의 엔터테인먼트 용도로 사용하기 충분하며하드웨어 마감  의 신기함 등 만족스러운 부분이 꽤 많았으나전 여기까지네요이제 만원 개월 할부로 지른 이 맥북프로는저와 최소 년은 함께 할 예정입니다말이 좀 짧았는데 불편하셨다면 죄송합니다 너그러이 읽어주시고감기조심하세요,2020.06.02. 22:37
342,맥북 프로 년 개월 사용 후기 배터리 중점,심심해서 써보는  맥북프로 약 년 사용기 입니다맥북을 어떤 강도로 얼마나 쓸 수 있을까를 고민하시는 분들에게 도움이 되실지도 모르겠네요년 월에 나오자마자 구매 후월에 받았다 반품 후 재구매 빡세게 사용했습니다사진을 하는게 주업이라 라이트룸여장 작업 자주함 포토샵 돌렸구요 파컷분 영상 작업 하고바로 부트캠프 깔아서 롤 오버워치 배그 했습니다 아 카트도 했네요 ㅎㅎ배그는 하다가 말았어요 프레임 넘 안나와서게임이나 사진 영상 작업은 전원 꼽고 썼구 집 앞에서 간단한 문서 작업이나 밥먹을때 유튜브 보는거 누워서 소파에서 넷플릭스 볼때는 전원 뽑고도 자주 썼습니다현재 사이클이구요 놀라운건 할거 다 하고 빡세게 다뤘는데도 아직도 느려지는건 없고 ㄷㄷ 충전으로 카페 가서 화면 밝기 풀에서 칸 으로 하면 시간 사용할 수 있더라구요 유튜브 보면서 문서나 웹에서 글 작성 등등 이부분이 되게 만족스러웠습니다 그이 년이나 되어가는데 시간이나 쓸수있다니솔직히 처음에 살때 이란 가격이 부담스럽게 느껴졌는데 년째에 이정도 사용할 수 있으니 년은 가뿐하게 사용할 수 있을 것 같습니다다만 걱정되는건 나중에 서멀 작업인데 혼자는 못하겠는게 좀 걸리지만 그래도 매우 만족합니다간단한 이 후기가 누군가에게 도움이 되었으면 좋겠습니다 하핳,2020.06.01. 16:24
343,프로에서 로 갈아탔네요 ㅎㅎ,제곧내프로 너무 무거워서 프로 처분하고 기존에 가지고 있던 사용하려다 오작동이 좀 있어서 포기하던 찰나에  출시되어서 갈아탔습니다 ㅎㅎ지금 너무 만족스럽고 성능 뒤지지않아서 정착폰 될듯하네요,2020.05.31. 17:57
344,맥북프로 프리미어 구동 후기,파이널컷 입문할려고 구입하긴 했지만 아직은 프리미어가 익숙해서 편집중인데요혹 구매하시는데 조금이라도 도움이 되셨으면 좋겠습니다  고급형 팬개 포트개 짜리이구요램은기가 기본입니다 작업중인데요 일단은 결론부터 말씀드리면 생각보다는 상당히 힘겹네요 ㅠㅠ템플릿을 안쓰고 기본 컷편집에 기본 자막만 쓰신다면 할만할텐데요 중간중간 템플릿이 들어가면상당히 버벅거립니다 중간중간 미리보기 렌더링 하게되면 배터리가 광탈하구요 발열도 상당하여 중간중간 식혀가면서 사용 중입니다 쓰로틀링이 자주 걸려 조금 스트레스 받고 있네요 만약 프리미어로 인치 영상편집용으로 컷편집외 조금 무거운 작업을 돌리신다면 조금 비추해드리고 싶습니다혹 궁금하신점이 았다면 댓글 달아주시면 답해드릴게요 감사합니다,2020.05.30. 20:25
345,애플  슈퍼드라이브 리뷰,애플에서 출시한 외장   입니다                뒷면을 보면 심플하게 연결방법과 사용방법이 그려져 있습니다                열면 아주 심플하게 생긴 슈퍼드라이브가 보입니다                뒷면에는 미끄럼 방지를 위한 고무와 애플로고도 보입니다                포트에 연결을 해보았습니다   연결을 하면 슈퍼드라이브 안에서 초 정도 작동한다는 기계음이 들립니다                아쉬운점이 있다면 내구성 문제 입니다                연결되어있는 선들은 내구성이 취약해 보이기도 하고 뜯어서 고칠 수도 없게 생겨먹어서   훗날 망가진다면 고민이 많습니다                가동확인을 위해서 음악시디를 한번 실행시켜 보겠습니다                굉장히 잘만들어진 영화 샤인의  시디 입니다                시디를 살짝 넣으시고 천천히 밀어 넣으시면 알아서 쑥 들어갑니다                       도움말라이센스            동영상 인코딩 중입니다분 이상 소요될 수 있으며 영상의 길이에 따라 소요 시간은 달라집니다    애플  슈퍼드라이브 리뷰    하비클로딩  재생 수     마우스를 드래그 하세요 도움말  멀티트랙의 트랙별 영상은 우측 관련영상에서 볼 수 있습니다선거광고 안내       음소거   화질 선택 옵션                               화질  전체화면         광고정보 더보기초 후 초 후 재생광고 후 계속됩니다 공유소스 코드     주소복사 소스        복사 미지원으로  코드 퍼가기 기능은 더 이상 지원되지않습니다도움말 플레이어  복사 레이어 닫기        요렇게요                음악시디가 들어가면 아이튠즈가 켜지면서 에 있는 파일들을 아이튠즈에 복사할 수 있도록 뜹니다           슈퍼드라이브의 읽기속도        하지만 속도가 별로 좋지않아 그냥 시디로 듣는게 편하네요   자주 들으시면 아이튠즈에 복사해서 들으시면 편합니다                그 다음은 시디를 빼는 방법입니다   버튼도 없고 이거 뭐 어떻게 해야 시디가 나오는지 알 수가 없었습니다                       도움말라이센스            동영상 인코딩 중입니다분 이상 소요될 수 있으며 영상의 길이에 따라 소요 시간은 달라집니다    애플  슈퍼드라이브 리뷰    하비클로딩  재생 수     마우스를 드래그 하세요 도움말  멀티트랙의 트랙별 영상은 우측 관련영상에서 볼 수 있습니다선거광고 안내       음소거   화질 선택 옵션                               화질  전체화면       광고정보 더보기초 후 초 후 재생광고 후 계속됩니다 공유소스 코드     주소복사 소스        복사 미지원으로  코드 퍼가기 기능은 더 이상 지원되지않습니다도움말 플레이어  복사 레이어 닫기           를 눌러주시면 시디가 나옵니다   요새는 많이 사용하지 않는  이지만 저는 음악감상이나 가끔 책을 사면 들어있는 를 사용하기 위해 구매한 터라   오랫동안 사용해 보려고 합니다 외장  저렴하고 좋은 것들도 많지만 애플제품으로 일관성을 맞추려면 슈퍼드라이브가 좋은   선택이 될 것입니다,2020.05.29. 00:09
346,맥북프로 인치 휴대성에 관하여,맥북프로 인치가 성능도 좋고 이번에 아주 잘 나왔다 해서 구입을 고민하시는 분들이 많은데 가장 큰 걸림돌이 휴대성 같습니다 그래서 제가 며칠간 직접 들고 다니면서 나름대로 테스트를 해봤습니다제가 자주가는 카페는 집에서  정도 됩니다 우선 노트북을 사용하려면 몇 가지 준비물이 필요하죠 인치의 경우 구동시간이 생각보다 넉넉하지 않기 때문에 충전기는 필수구요 그 다음에 파우치에 넣고 다니실테고 마우스도 챙기고 허브도 챙기고 해야겠죠 여기까지가 기본 악세서리 여기다 휴대용 스탠드랑 키보드까지 챙기는 분들도 있을 겁니다우선 각각의 무게를 한 번 알아봅시다맥북프로 인치  충전기  약 파우치  약 주머니가 없는 지퍼타입 파우치허브  약  벨킨제품 기준마우스  약  매직마우스 기준다 더해보면  정도 나옵니다그럼 여기에 키보드랑 거치대를 추가해볼까요키보드  약  매직키보드 기준휴대용 거치대  약  접이식 알루미늄 거치대이러면 이 나오죠백팩에 넣는다면 백팩 무게가 있기 때문에 무게는 더 늘어날겁니다노트북 말고 다른걸 더 챙겨야 한다면 마찬가지로 무게가 더 늘어날거구요우선 백팩에  만 넣고 다녀봤습니다좀 더 메고 돌아다니기 위해 가 넘는 곳도 돌아다녀봤는데요 이정도는 생각보다 다닐 만 합니다 지하철 타고 다니는 것도 그닥 무리는 아니었어요 지하철 타고 집에서 회사까지 가면 보통 는 걸을 수 밖에 없죠 역까지 가는 거리 타러 내려가는 거리 도착해서 역을 나오고 회사로 가는 거리 이정도는 괜찮았습니다여기에 제가 늘 들고 다니는 메모장 클리어파일 하나 정도에 들어갈 만한 양의 서류들 정도만 추가해서 메봤어요 여기부터는 조금 무리가 되기 시작합니다 별거 아닌 것 같은데 기존 무게에 가중 되니까 그 무게가 더 크게 느껴지는 것 같아요 만약 키보드와 거치대가 추가되면 이 더 얹어지겠죠 이러고 다녀보니 등에 땀이 나기 시작했습니다 참고로 전 굉장히 왜소한 체격을 가지고 있습니다 운동은 물론 하고 있습니다만결론적으로 매일매일 들고 다닐 만한 크기와 무게는 아닌 것 같습니다  차이가 별거 아닌 것 같지만 기존에 무게가 있는 상태에서 이게 추가되느냐 빠지느냐는 생각보다 차이가 큽니다 우리가 휴대폰을 손 들 때도 마찬가지 잖아요  와 는  차이지만 손에 들고 있으면 그 부담감이 사뭇 다릅니다이동이 잦은 분들 난 충분히 메고 다닐 수 있어 생각하실 수도 있죠 저도 다닐 수는 있었어요 여기서 인치는 메고 다녀보면 신세계를 경험할 수 있습니다 어께가 이렇게 가벼워질 수 있다니 밖에 나가더라도 가까운 곳을 다닌다 차를 가지고 다닐거다 하면 인치 괜찮습니다만 이동거리가 좀 되는 분들이나 가방을 메고 많이 돌아다녀야 하는 분들 노트북을 자주 들고 다녀야 하는 대학생 인치는 조금 무리가 될 수 있습니다전 학생이기도 하면서 직장생활도 하고 있어서 다양한 환경을 토대로 직접 들고다녀 봤습니다확실히 인치는 휴대성과는 거리가 아주 머네요뭐 따지고 뭐 따지고 하면 인치가 물론 좋겠지만 부담되는 무게임에는 분명한 것 같아요인치랑 번갈아 들어보니까 그 차이가 더 심하게 나는 것 같아요성능 가격 다들 중요하지만 본인의 환경과 체력도 잘 생각하셔야할 것 같습니다아무리 좋아도 못들고 다니면 무슨 소용이에요,2020.05.28. 14:27
347,아이패드  매직키보드랑 폴리오키보드 샀다가 폴리오키보드 환불한 후기,개인적으로 엄청 고민했던 부분인데요 매직키보드를 먼저 샀고 너무 무거워서 폴리오키보드를 샀는데 결국엔 매직키보드를 킵하기로 했습니다도움이 될까해서 제가 느낀 폴리오키보드 대비 매직키보드의 장단점을 한번 정리해봤어요장점 차원이 다른 키감개인적으로는 이거 하나만으로도 폴리오대신 매직키보드를 사용할 이유가 된다고 생각합니다 저는  폴리오키보드를 몇년간 아무 불만없이 사용했는데요 이상하게  폴리오키보드는 사용을 못하겠더라구요 이부분에서 매직키보드랑은 비교 불가인거 같습니다 각도와 높이뒤로 많이 넘어가지는 않지만 범위 내에서 각도 조절이 자유로운 부분도 생각보다 굉장히 편했어요 높이가 떠있는것도 꽤 크게 와닿구요 확실히 사용하기 편한거 같아요장점 트랙패드이건 장점이긴 한데 앱에 따라서 터치가 더 편한 경우도 있더라구요 대신 트랙패드를 사용할땐 화면을 좀더 멀리 둘수 있는게 장점아닌 장점 같아요 충전단자제 사용 범위내에서는 장점으로 느껴지진 않았습니다단점 무게무게는 굉장히 큰 단점인것 같습니다 저는 주로 집에서 사용하는 용도인데도 고민이 될만한 무게차이에요 이게 무게가 무거워지니까 사용할때 훨씬 조심스러워지고 편하게 다루지를 못하겠더라구요 어디 모서리에 부딪히면 충격도 많이받구요 최소한 맥북 에어보단 가벼웠으면 좋았을것 같은데 말이죠폴리오키보드랑 비교해서 숄더백에 넣었을땐 확 느껴지는 무게차이구요 백팩은 잘 안느껴지긴 합니다결론적으로 무게때문에 정말 고민을 했지만 폴리오키보드의 키감을 받아들일수 없었네요차라리 일반 폴리오케이스에 매직키보드 를 사용하는게 나을것 같아요,2020.05.26. 12:22
