,0,1,2
105,맥북에어,어제 받아서 오늘까지 일차 입니다 빅서 최신 버전인  적용했습니다발열 진짜 없습니다 전에 사용하던 노트북은  사의 노트북이었는데 크롬만 사용해도 비행기 이륙해서 도서관에서 사용하기 어려운 수준 이었습니다 얘는팬이 없는데도 불구하고 발열이 진짜 느껴지지 않습니다크롬사파리카톡 단순 웹서핑 유튜브 트위치 발열 느껴지지 않습니다 위쪽을 만지면 약간의 온도차가 느껴지긴 하지만 팬이 없다는걸 감안하더라도 열은 없는 수준이었습니다마이크로소프트 오피스 다운로드시 약간의 발열이 있었지만 아주 약간 따뜻하다 손으로 만져도 전혀 뜨겁지 않은정도였습니다배터리도 미쳤습니다 프로에서 시간 사용해서 프로 빠졌는데 진짜 미친것같습니다 단순 계산하면 같은패턴으로 시간 더쓸수 있었습니다 훌륭합니다 진짜 트랙패드는 마우스보다 편하다면 거짓말이고 윈도우 노트북과는 넘사벽입니다 누르는 느낌부터가 비교를 불허합니다 게다가  쓸때는 개월도 사용하지 않았는데 트랙패드가 고장나는바람에 강제로 마우스를 쓰게 되었는데 얘는 그래도 하드한 작업이 아니라면 트랙패드만으로 사용하는게 가능할것 같긴합니다지금 글을쓰는 와중에 한번 만져보니 차갑습니다 ㅋㅋㅋㅋㅋㅋ 이게 진짜 가능한건지 대단합니다 애플 아이폰 아이패드 에어팟 다 사용중이어서 노트북도 필요하기도해서 샀는데 대만족입니다복학하면 호환성의 이슈가 약간 두렵긴하지만 아직까지는 만족입니다 솔직히 램 추가할때 만원 들어가는거보고 진짜 말도 안된다고 생각했는데 그래도 써보니 은 써야할것같습니다 기가 확실히 부족할것같습니다 압축으로 버티는거 아닌가요 진짜 크롬 틀고 카톡키고 몇개좀 키면 기가 순식간에 넘는거 확인했습니다말도 안되는 가격이긴한데 저처럼 오래쓰실 생각으로 사실분들은 기가램으로 가야할것같습니다 추후 업데이트도 있구요그래도 램가격은 진짜 정신나간것같습니다 지금생각해도 말이 안됩니다ㅋㅋㅋㅋㅋㅋㅋㅋ,2021.02.03. 12:44
106,에어 깡통 영문자판 하루 후기,진짜 최고입니다  발열 없고 시간 풀로 쓰는데 배터리도 퍼밖에 안줄었네요 ㅋㅋㅋㅋㅋ,2021.02.03. 01:33
107,맥북에어 실버 약 한달 사용 후기,제가 꿈에 그리던 맥북을 받아 사용한지 이제 약 한달이 되었어요 처음 받았을 때 그 감동을 저는 아침에 일어나서 잘 있나 확인하면서 하루에 한번씩 그 감동을 여전히 받고 있어요ㅎ 포장지 뜯어낼 때 그 떨림을 잊고싶지 않아요ㅎㅎ 한달 가까이 사용해보니 전에 주일간 썼었던 인텔 맥북에어와는 비교하는걸 별로 안좋아하지만 많이 좋아진 것 같아요 전에 썼던건 뭔가 완성되지 않은 듯한 느낌을 받았는데 이번 맥북은 완성된 노트북이라는 생각을 하게 하는 것 같아요 실사용 하면서 느낀 점은 배터리에 대한 놀라움이에요 정말 배터리는 이래도 되나 싶을 정도로 오래가는 것 같아요 유튜브 시청 웹 사이트 영화 시청 스포츠 중계 시청 모두 배터리가 실감나게 안달아요 근데 이상하게 영어를 쓰다가 한글로 바꾸면 첫 글자가 알파벳이 나오네요버그라 생각하고 쓰고 있어요 그리고 확실히 블루투스는 마우스 연결하면 이상하게 좀 버벅이는 듯한 느낌을 받는 것 같아요 근데 너무 이쁜 맥북이라 참고 쓰고 있어요가벼운 작업만 하니 앞으로 년에서 길게는 년정도 오래오래 쓰고 싶네요ㅎ 그럼 이만,2021.02.02. 08:15
108,맥북에어로 음악작업시 수치적인 퍼포먼스,작업 환경이 쾌적해져서 그런지 요즘 진짜 열심히 녹음 중인데요 새싱글 녹음 잘 진행되고 있습니다그냥 기분 말고 실제  맥북 에어의 수치적인 퍼포먼스가 저도 궁금해서 작업 도중 캡쳐해보았습니다 혹시나 궁금해하시는 분들 계실 수 있어 공유합니다  비트 레코딩 프로젝트개 내외의 트랙드럼 플러그인은 총 개를 불러 사용했고일렉 기타는 전 트랙 모두 다 플러그인으로 불러 도배했고각종 신스 등 공간계 플러그인도 트랙에 전부 도배했습니다 작업할 때도 다른 앱들은 끄지 않았고 사무 작업하던 윈도우즈 원격 프로그램도 그냥 띄운채로 음악 작업했습니다 작업 도중 바람개비 본 적 없고 오류 없었습니다 네 시간 연속 녹음하다 작업 끝나기 직전 시스템 리소스 사용 현황을 캡쳐했습니다보시다시피 램을  다 사용하지 못했고 는 심지어 가 그냥 놀고 있네요 지난번  트랙 녹음할 때도 안 뻗더니 이번엔 플러그인을 정말 엄청 사용했는데도 꿈쩍도 안 하네요이쯤되니 살짝 자괴감이 듭니다 아 내가 맥북 에어 하나 뻗게 하지 못할 정도로 소프트한 작업만 하는 그런 작곡가였나 심지어 이 자식 아무리 갈궈도 열도 안 나 아 열 받아ㅡㅡ,2021.02.01. 21:31
109,맥북 에어  짤막한 후기,양품 받은거 같고 모든면에서 너무 좋네요로직프로 유튜브 문서작업 정도해서 호환성 문제는 거의 없네요개인적으로 좋은 점 맥북인데 가성비를 논할만큼 좋은 품질 특히 화면이 지립니다 개인적으로 비교할때  이 영상을 활용하는데 엌 소리 났습니다 확실히 빠릅니다 잠자기 깨어나는것도 그렇고 앱 실행 속도도 그렇고 시원시원합니다 이건 뭐  맥북의 장점은 아니지만 타자감이 쫄깃해서 너무 좋네요 가볍게 눌리지만 그렇다고 바닥을 치는 느낌은 아닌 적절한 감인거 같습니다 오타도 적구요몇가지 팁이랑 발견한거 공유하자면  양품인지 체크할때 하판 수평이 맞는지 확인 하실텐데 꼭 식탁유리판같은데서 하세요 책상 위에서 하다가 수평 안맞아서 심장 덜컹 내려앉았는데 식탁에서 하니까 전혀 문제가 없더라구요 몇번 들어보셨을거 같은데 빅서 에서 블루투스 연결 문제가 확실히 있는거 같긴합니다 저 같은 경우는 에어팟프로로 음악 들을때 초 정도 끊겼다가 재생되는 증상이 종종 일어납니다 빅서 에서 업데이트 될거라고 봅니다 연말정산 때문에 홈텍스에서 공동인증서로 로그인하려고 하니 거기 보안 프로그램이 호환이 안되더라구요 처음 맞닥들인 호환성 문제였습니다 이건 브라우저 인증서 활용하는 방향으로 해결했습니다,2021.02.01. 16:30
110,맥북 에어  사용중 온도,지금 서브모니터 에 사파리로 유튜브  영상 보고 있고 사이드카 아이패드 프로 그리고 본체로 글 작성 중입니다현재 온도는 이렇고 팬리스인데 이정도면 양호한 것 같기도 하고 기대만큼 차갑거나 그렇지는 않아요 어느정도 따땃합니다 ㅎㅎ,2021.01.31. 00:06
111,달 사용 리뷰 머신 러닝 사무용,맥미니 기본형 월 말 구매해서 달간 사용해 보았습니다 개발자는 아니고 학술용으로 머신 러닝 특히 으로   등 사용하고 있고요디자인음악 작업은 전혀 하지 않습니다 최적화가 아직 전혀 되어 있지 않습니다 급히 쓰셔야 하면서 애플  프로그램만 쓰는 것이 아닌 다른 일을 하실 분들은 꼭 참고하셔야 될 것 같습니다 머신 러닝이 빠르다고 광고해놓고 는 알파 버전만  적용되어 있고 정식 버전은 나와 있지 않습니다 부수적인 문제도 많습니다   듀얼 모니터 사용하다고 했는데 로  연결하면  가 있어 현실적으로 사용 불가입니다 계속 깜빡입니다 기술지원 받으면서 며칠동안 여러 시간 시간을 쏟았지만 결국 로  연결은 포기하라는 답변을 받았습니다 해결 중이라고근데  포트에는 모니터가 하나만 연결되니  이상 모니터를 듀얼로 쓰려면 반드시 를 하나 써야 하는데 어떻게 포기하라는 말일까요 포트도 잠자기 모드로 들어가면 연결된 모니터가 다시 켜지지 않는 문제가 있습니다  뽑았다가 다시 꼽아줘야 합니다 모니터 코드를 뽑거나 그래서 컴퓨터 잠자기 모드를 아주 꺼버렸습니다 더 소소한 문제지만 로지텍      사용 중인데  와 가 잘 작동하지 않습니다 다른 컴퓨터에서는 잘 됩니다 찾아보면  문제가 맞나 봅니다   설정하고 다른   또는 에서  으로는 하게 연결됩니다 그러나 그 반대는 한 초 에서 기다려야 넘어갑니다 그나마도 매번 되는게 아닙니다  키들도 되다 말다 합니다 전혀 하지 않습니다 아마   이슈일 것 같습니다 지금 제가 해본것만 이런 것이고 아마 다른 이슈도 많을 겁니다 다 애플의 잘못은 아니고 일부는 에 최적화 안된 타사 소프트웨어 문제겠지만 사용자 입장에서는 마찬가지입니다 애플에서 로 마련한 어플들은 잘 돌아가는 것 같습니다 이외에도 일반적인 웹서핑 문서작업 문제 없었습니다 그런데 당장 이걸 이용해서 업무적으로 어떤 결과를 내실 분들은  맥만 믿고 사용하긴 어려운 단계 같습니다 에서 전부 다 이주한다는데 이제 와서 을 사는 것도 장기적으로는 곤란한 면도 있을 것입니다 각자의 상황에 맞춰 구매하시기 바랍니다 저와 같은 상황인 분들이 있을지 몰라 리뷰 올립니다 그럼 좋은 하루 되세요,2021.01.30. 10:14
112,다음 메인에 노출되었어요 장고 끝에 구매 했던 아이패드프로 매직키보드 반년 사용기,원래는 내 애플기기 사진 게시판에 사진과 함께 간단히 리뷰를 남기고 티스토리 블로그에 쓴 링크를 남겼는데요 갑자기 조회수가 올라가길래 확인을 해봤더니 다음 메인에 올라갔습니다 저희 카페랑은 상관 없고 다음에서 메인에 걸어 준 것 같아요절대 안사려다가 왜 사게 되었는지부터 솔직한 사용기를 썼는데 살다보니 이런 날도 있네요 사실 시원한 바다 배경을 혼자 보기가 아까워서 사진 게시판에 올렸는데ㅎㅎㅎ다음 메인에 걸렸으니 그래도 볼만한 글이라는 뜻이겠죠이런 일이 처음이라 좀 부끄럽긴 하네요  리뷰 내용은 사진까지 다 긁어 오기는 길어서 링크로 올려드리고사진 몇 장을 올려봅니다  기분 좋네요블로그 리뷰 장고 끝에 구매한 아이패드 프로 매직키보드 반 년 사용후 내린 생각저는 인치 아이패드 프로 년형에 매직키보드를 사용하고 있습니다 구매한지 작년 추석때 구매를 했고 거의 개월이 되어 갑니다 애플 악세서리의 출시 주기는 매우 길기 때문에 지금도 분명히 고민하 내 애플 기기 사진 게시판 에 올렸던 글  맥 쓰는 사람들 구 맥북을 쓰는 사  네이버 카페를 쓰는 사람들의 정보공유를 위한 카페   맥북 아이맥 애플 아이폰  애플워치   인증샷,2021.01.29. 02:33
113,맥북 프로인치 약 년간 사용기,작년 월에 첫 맥북을 구입하고 느낀 사용기입니다사양은 고급형이구요 주로 애니메이션 일을 하고있습니다 주 용도는 사이드카를 이용하려고 구매를 했다가 기대한것보다 많이 아쉬웠어요 오히려 아이패드 클립스튜디오를 사용하는게 훨씬 빠르고 부드러웠습니다생각보다 꽤 버벅거렸고 맥북이 쉽게 뜨거워지기도 했구요 그래도 아이패드를 액정타블렛처럼 이용할 수 있다는게 큰 메리트였었는데 이번에 신티크를 구입하고 사용해보는데사이드카를 사용할때보다 훨씬 더 부드럽고 빠르게 동작해서 놀랐습니다 사이드카로 작업을 할때 평균 도가량을 유지하고높을때는 도까지 올라갈 때도 있었는데 신티크는 거의 도를 유지하더라구요대기상태에는 도가량을 유지하고있습니다혹시라도 저처럼 사이드카를 주 목적으로 사용하려고 하신다면 액정타블렛 쪽을 좀 더 추천드립니다이외에 다른 부분 배터리나 음향디스플레이 등은 정말 만족스러웠습니다 다음에 나올 인치 신제품이 기대되네요,2021.01.29. 01:53
114,아이맥   메모리의 진실,년식 인치 아이맥의 램 자가설치를 해봅니다정품으로 의 램을 사용하려면 원이 추가되죠최고급형 아이맥을 하나 더 사고도 남는 가격이네요그렇다면 정품 로 장착되는 램은 어떤 제품이길래 이렇게 비싼걸까요그 진실과 자가 업그레이드의 이점을 알아보겠습니다,2021.01.28. 21:03
115,배터리 스웰링으로 무상수리 받았는데 너무 좋네요,이전에 영어 할줄 아세요 라는 맥북사태를 보고 긴장하고 수리점에 갔었는데기사님 엄청 친절하게 설명해주시고 하나하나 경우의 수 따져주시고 수리를 맡겼습니다년모델 인치 흔히 탑케이스라고 불리는 키보드 배터리 스피커 트랙패드 터치바 손 얹는곳 뚜껑 싹 다 갈아졌는데다 인치 안에서 가장 최신 부품으로 갈아지는건가요스피커랑 키보드랑 이전에 쓰던거랑 체감상 느껴질정도로 좋아진것같네요 ㄷㄷㄷ 진짜 새노트북이 되었습니다제 개인적인 경험으로는 애플 정책상으로의 수리는 정말 잘해주네요,2021.01.28. 19:00
116,에어팟 맥스 초간단리뷰   유선연결,바빠서 제대로 검증은 못했는데어제 유선이 왔길게  유선을 꼽고  맥북프로에 연결해봤습니다다른  가지고 있는  고급 기기에는 연결 못해봤고드래곤플라이 코발트에도 연결은 못해봤습니다그냥 단순 유선 연결해봤는데크게 음질차이는 못 느꼈습니다유선 애플 공홈에 파는 그게 선이 너무 얇고 좀 싸구려 처럼 만들어져 있네요 쩝살짝 돈 날린 느낌  ㅠㅠ,2021.01.28. 12:13
117,매직마우스 연결유실 간단 해결법매직마우스,매직마우스 연결유실 간단 해결법매직마우스안녕하세요 바다 입니다맥북 유저분들 중에 매직마우스 이용하는 분들 꽤 많죠근데 이게 쓰다보면 연결,2021.01.27. 14:53
118,맥북프로 인치 년 사용 간단 리뷰,간단하게 몇줄로만 리뷰하려고 합니다저는 원래 맥북 인치를 사용하고 있던 사람이었습니다 화면에 한계가 많아서 인치로 바꾸었을 때는 정말 신세계였죠이정도 디스플레이 품질에 인치 화면이라니 정말 시원시원했습니다인치가 성능만 좋은 아이였다면 인치는 성능을 제대로 활용할 수 있게 해주는 느낌이었습니다성능에 대해서는 말하지 않아도 아실 것이라 생각이 되구요그리고 어플리케이션 활용이 더 제대로 되니 활용도가 상당히 높아지더라구요작은 화면을 좋아하시는 분들도 있겠지만 최소한 인치 이상 맥북을 사시는 것을 추천드립니다,2021.01.27. 11:28
119,맥미니 기본형 사용기   로지텍,웹서핑과 간단한 문서 작성용으로 이 아닌  로 충분 하네요초기 설정 하고 사진  정도 정리한다고 며칠 뜨끈뜨끈하더니 이제는 안정화 되었습니다평상 시    의  온도 기준 도 정도 입니다사실 맥미니는 맥북에어맥북프로와 다른게 본체 온도를 손으로 느끼지 않기 때문에 발열은 문제 없습니다물론  온도 증가에 따른 팬소음은 거슬릴수 있으나 저 같은 라이트 유저에그 상관 없는 얘기죠 저렴한 가격  기본형 기준 중고 만 에  아이폰아이패드 동기화를 사용할수 있는 장점이 있다고 생각 합니다그리고 맥에서는 매직 트랙패드가 최고라고 생각하고 몇년 사용하였는데스크롤 시 손목에 무리가 많이 발생하였습니다 제가 좋은 하는 그립감을 가진 로 매직트리 제스처 기능을 일부 대체해 너무 만족하며 사용하고 있습니다단  구매가 필요합니다    마우스 앞으로  사파리 탭 또는 실행중인 앱을 닫을 때 사용하는      마우스 뒤로   뒤로가기 모든 앱 적용   스크롤 버튼      없이 시스템 환경설정에서 설정 가능 사용 환경맥미니   리프레쉬  기본형    는 비추 입니다모니터  삼성   스피커   키보드 매직키보드마우스 로지텍 모니터 암 지티기어 모니터암벽선반 이케아 모슬란다 홈팟 미니  애플워치 마그네틱 충전기 에어팟 프로킨들 페이퍼 화이트 미지아 스탠드 샤오미 볼펜  다이소 칫솔꽂이,2021.01.26. 23:49
120,맥북에어 인치 하이시에라  모하비,첫 맥북입문하면서 글 남겨봅니다맥북 가격이 저렴해져서 한달전즈음 맥북에어  램 인치 모델을 구입필수어플등 사용법을 유툽보고 익혀가고 있습니다그중 중요한를 하이시에라 모하비 카탈리나 빅서 설치해보고 최종 하이시에라로 결정했습니다알프레드 스펙타클 등 필수어플들을 설치해보고 사용해보니하이시에라가 가장 쾌적한 느낌이 듭니다카탈리나와 빅서는 선택지에서 제외시켰습니다모하비를 사용중 램용량이 대로 머물러서 그런지 마우스커서에서 종종 로딩이 걸려서 답답했습니다타임머신으로 백업해두고 하이시에라로 클린설치하이시에라에서는 기본 대에 램용량 차지해서 그런지 사용하면서 로딩걸리는게 거의 없었습니다어플 실행속도도 모하비보다 빠르고배터리도 모하비보다 하이시에라가 더 오래가는 것 같습니다 적용해서 사용중인데모하비의 다크모드가 좋지만 서핑시 다크모드에 적응되어 있던 눈이 사파리의 밝은 화면을 보면 피로함을 느꼈습니다 다크모드없이 밝기 조정해서 사용하니 전체적으로 같은밝기느낌으로 봐서 그런지 눈의 피로가 덜하네요램에서는 하이시에라가 쾌적하다라는 결론,2021.01.26. 15:22
121,사용기,안녕하세요월 일 쿠에서        가 가격이 거의 대란급원  쿠페이 환급 시 원으로 내려와 얼른 구입해서 약 이틀 째 사용 중입니다월 일에  교육할인 에서   형 실버 기본형을 주문해서 계속 기다리는 데 묵묵부답이라 조금 답답했는 데 이번에  가 정말 괜찮은 가격으로 내려와 바로 구입해버렸습니다 ㅎㅎ사진은 많은 분들이 올려주셨으니 저의 생각 위주로 사용기를 말씀드리겠습니다우선 저는 현재 기계공학부에 재학 중 입니다많은 분들이 학과에서 사용하기 힘든 컴퓨터를 왜 구입했는 지 등등 의문점이 많이 드실겁니다저도  탑재된 노트북을 년 넘게 잘 써왔습니다클린설치 뿐만 아니라 각종 유틸리티 등등 에 최적화된 제가  그것도 기반의 칩을 탑재한 을 선택하게 된 계기는 바로 합리적인 가격과 그 이상에 걸맞는 성능이었습니다위에서 언급했듯이 기계공학을 전공 중인 저는 학년 과정에서   등 설계툴을 다루고 더 나아가 고학년 때 기사시험 응시 등등 가 절대적으로 필요한 것이 현실입니다그럼에도 불구하고 이번에  를 구입한 것에 대해 절대 후회하지 않습니다만약에 필요하면  탑재된 노트북을 별도로 구매할 예정입니다이유 약 만원 또는 그 이하의 가격대에서 발열 없고 소음 없는 컴퓨터는 찾아보기가 힘듭니다저는 현재 학년으로  로 를 통해 을 공부하고 있습니다아직 실력이 충분하지 않지만 백그라운드에 를 재생하면서 으로 웹서핑  클립 영상을 찾으면서 공부하기에는 버벅거림 없어 만족스러운 성능을 보여줍니다이유       와 같이 보다 합리적인 가격대로 를 접하기에 충분합니다저도 중 고등학생 때 카베에 설치된 을 본적이 있습니다 당시 마이티 마우스가 설치되어 있었는 데 제가 여태껏 사용하던 마우스와 다른 느낌이라 정말 신기했습니다 이후  노트북에 을 통해 과 를 가상머신으로 설치해 써봤는 데 기존에 느껴보지 못한 정말 깔끔한 와 조작감에 매료되었습니다그럼에도 칩이 탑재된 이 출시되기 전에는 동성능대 다른 컴퓨터와 비교했을 시 은 여전히 가격이 거의 배 이상으로 비싸서 접하기 상당히 어려웠습니다 하지만 이번 칩이 탑재된 은 로 메모리나  업그레이드가 없을 시기본형 정말 합리적인 가격에 출시되었다고 생각합니다이유 동성능대의 컴퓨터보다 부피가 훨씬 적어 어디든지 설치해 컴퓨터를 사용하기에 용이합니다가로  세로 에 두께  무게 의 미니 컴퓨터라 책상 위 모니터나 거실의  등 외장모니터가 있으면 어디든지 쉽고 간편하게 쓸 수 있어 편리합니다이유 같은 모니터를 써도 에 연결된 화면의 텍스쳐가 훨씬 깔끔해보입니다저도 찾아본 바로는 운영체제 차이라고 하던데 모니터 신호를 화면으로 송출하는 부분에서 와 와 다르다고 합니다 이 부분은 저보다 훨씬 잘 아는 분들이 많으로 넘어가겠습니다 ㅎㅎ구체적으로 보다 가 매트한 느낌이 있습니다하지만 이 좋은 제품에도 눈에 띄는 단점이 있었습니다바로 입니다아직  가 과 호환이 잘 안 되는 것 같습니다 단순히 에서  아키텍쳐로 변한 부분에서 오기 보다는 다른 프로그램과 부딪히면 자잘한 오류가 계속 발생합니다예를 들자면 저는 공대생이라  문서영문 원서 솔루션 등를 많이 찾아봅니다 그래서 를 쓸 때도  은 저에게 절대적으로 필요한 소프트웨어입니다 하지만 이 프로그램을 에 설치하면 에 오류가 생겨 아이콘에 실종이 되는 일이 생깁니다분명   응용 프로그램 탭에는 존재합니다 이 오류를 기회로 삼아   클린설치에 도전했는 데 안내 절차대로 따라하니 생각보다 쉽고 빠르게 진행되어 놀랐습니다 별도의 설치 드라이브 없이 분만에 깔끔하게 설치되는 모습을 볼 수 있었습니다버전 에서 클린설치 진행했습니다그리고 오늘 오전에도 질문 드렸었는 데 를 구동하면  점유율이 무려  이상 계속 차있는 모습을 볼 수 있습니다 활성 상태 보기에서는 메모리를 총 정도 사용 중인데 에서는 늘  이상 찍힙니다저는 이 부분이 오류라 생각하는 데 제가 잘못 알고 있으면 지적 부탁드립니다 ㅠ또한 많은 분들이 지적하신  연결 끊김 문제에 대해서 저는 느끼지 못했습니다 키보드는    마우스는    수신기 연결로 사용 중인데 한 번씩 네트워크 문제로  스피커가 하루에 번 잠깐 지직하는 소리뿐이었습니다 클린설치 전후 마찬가지였습니다네트워크는 로  대역  이더넷으로   사용 중입니다저의 소감은 여기까지입니다확실히 장점이 단점보다 훨씬 많은 컴퓨터라 생각합니다 이 부분은 어디까지나 전문적인 일을 하는 것이 아니라 단순히 문서 읽기 간단한 프로그래밍 공부 등 학부생 라이트 유저에 한합니다 을 통해 생산적으로 일하시는 분들에게는 아직 플러그인 호환성 등 각종 오류가 많다면 아쉬워하시며 아직은 시기상조라하는 모습을 볼 수 있었습니다 하지만 저처럼 학습 음악 감상 일상으로 가볍게 쓸 컴퓨터로 이 칩이 탑재된 은 더할 나위 없이 좋다고 생각합니다위에서도 말씀드렸듯이 학부 공부 중에 설계툴 해석툴 등 가 꼭 필요한 때가 오면 별도로  를 구입할 생각입니다  와  노트북을 함께 사용하는 것과 하이엔드급  노트북을 사용하는 것을 서로 비교해서 생각해봤는 데 온라인게임을 하지 않고 영화 및 음악 감상을 즐기고 전자기기를 좋아하는 저로써는 전자가 최고의 선택인 것 같습니다 금전적인 측면에서도 서로 비슷한 것 같습니다년    가 원   가 원에 출시되어 저는 이 개의 전자기기로  제품을 쓰기 시작했습니다 마침내 년에  를 구입하면서 에 입문했습니다 정말 만족스러운 제품이고 앞으로도 조심스럽게 차근차근 사용할 예정입니다저의 첫 사용기를 읽어주셔서 감사합니다즐거운 밤 보내세요,2021.01.25. 21:57
