,0,1,2
0,사용기 장여사가 사다 준 홈팟 미니 화이트로 이제 스테레오 사운드를 듣게 됩니다,드디어 완전체가 되었습니다 금년 초에 애플 홈팟 미니 스그색상으로 하나 구입하고 블로그 이웃분들이 홈팟 미니 대로 스테레오 사운드를 들어보면 또 다른 세상이라는 이야기에 넘어가서 기회를 엿보다가 생일을 핑계로 이번에는 화이트 색상으로 하나 더 들여왔습니다 같은 스그색상으로 하고 싶기도 했지만 리뷰를 위하여 다른 색상으로 들여왔네요 애플 특유의 간단한 페어링 구성으로 금방 연결을 하였고 소리를 듣는 순간 저 또한 다른 분들에게 이왕 애플 홈팟 미니를 구입할 거라면 개 구입하시라고 권유하고 있습니다  제 블로그 원문 링크도 걸어둘게요 시간되시면 건너가셔서 다른 글들도 살펴봐 주시기 바랍니다 사용기 장여사가 사다 준 홈팟 미니 화이트로 이제 스테레오 사운드를 듣게 됩니다금년에는 좀 이른 생일 선물을 받았습니다 ㅎㅎ 본의 아니게 가지고 싶은 기기가 있었고 때마침 제 눈에   금년에는 좀 이른 생일 선물을 받았습니다 ㅎㅎ 본의 아니게 가지고 싶은 기기가 있었고 때마침 제 눈에 띈 싸게 구입할 수 있는 정보가 있었기에 이를 가능하게 할 수 있는 장여사에게 부탁했죠 생일 선물은 다름 아닌 애플 홈팟 미니 화이트 색상이고 이전에 스페이스 그레이 색상을 하나 들여와서 잘 사용하고 있었기에 스테레오 사운드를 들어보려고 이번에는 화이트를 하나 들여오게 된 겁니다 제가 알아본 시점 기준으로 가장 최저가로 구입할 수 있는 방법은 바로 오늘의집 모바일 앱을 이용하여 처음 구입하는 경우 할인 쿠폰을 받아서 아주 착한 가격으로 구입이 가능한 겁니다 저는 이미 오늘의집 구입 이력이 있어서 부득이 장여사에게 생일 선물을 핑계로 부탁을 한 거죠    장여사 나 생일이 곧 다가오잖아 미리 당겨서 선물을 받으며 안될까  장여사 나 생일이 곧 다가오잖아 미리 당겨서 선물을 받으며 안될까큰맘 먹고 말해 보았습니다 금년 초 이거저거 애플 기기들을 들여온 것도 있고 얼마 전 애플 이벤트에서  뭐 이미 스페이스 그레이 색상을 구입해서 개봉기를 작성하였기에 그닥 텐션이 올라가지는 않네요 그래도 화이트 색상이라 산뜻한 느낌에 새로운 기기인 듯 느껴는 집니다 지난번 스페이스 그레이 구입할 때는 주 정도 걸렸던 거 같은데 오늘의집에서 구입하니 주일 만에 도착하였습니다 어여 개봉하지요 완전 화이트 패브릭 재질로 둘러싸면서 상단 조작부도 화이트로 처리하여 깔끔하네요 확실히 그레이 색상보다는 밝은 느낌이라 보기에 좋습니다 음 일부러 화이트를 구입하긴 하였는데 깔 맞춤으로 하는 게 오히려 나을지도 모르겠습니다 일단 계속 진행하죠 홈팟 미니 본체 아래 연결 케이블이 똬리를 틀고 있는듯합니다 뭐 애플이니까 이 정도 포장에 대한 깔끔함은 당연한 거겠죠 종이로 케이블을 고정하고 있는데 이런 거 수작업으로 하는 걸까요 아님 기계가 하는 걸까요 엄청 꼼꼼하게 포장을 한 거 같은데 보기만 하고 그대로 다시 박스에 넣어둘 겁니다 사과 모양 스티커 있고요 나머지 설명서랑 주의 사항 같은 게 적혀있는 종이들입니다 아 그리고 요번 제품은 홍콩에서 들여온 제품이라 어댑터 모양이 좀 달라요 지난번 거는 미국에서 들여온 거라 일자 모양이었는데 물론 사용하진 않을 거라 역시 그대로 박스에 넣어 둡니다 홈팟 미니 본체도 화이트 케이블도 화이트 알고 계시겠지만 케이블은 본체랑 분리가 되지 않습니다 괜히 힘줘서 빼려고 하진 마세요 길이는 나름 충분한 편이라 책상 위에 오려두고 바닥에 있는 멀티탭에 연결해서 사용하는데도 전혀 문제가 없습니다 에휴 꼼꼼하기는 홈팟 미니 바닥면에도 요렇게 보호를 위한 스티커가 부착되어 있습니다 요거 제거하고 사용하셔도 되고 미끄럽지 않은 바닥면에 두고 사용한다면 그냥 두셔도 됩니다 저는  오른쪽 북쉘프 스피커 위에 올려두고 사용하려고요 글 마지막 사진을 보시면 아시겠지만 기존 들여온 스페이스 그레이 홈팟 미니가  왼쪽 스피커 위에 올라가 있거든요 박스에 동봉된 어댑터를 사용하지 않으면 뭘로 연결할 거냐고요 요걸로 할 겁니다 여기서 주의 사항 처음 홈팟 미니를 구입해서 사용하신다면 반드시  타입 단자를 지닌 어댑터를 하나 준비하셔야 할 겁니다 아님 미국에서 들여온 거면 자형 단자를 돼지코 단자로 변환해 주는 젠더 같은 걸 연결해도 됩니다 다만 반드시  또는  정도 되는 어댑터여야만 정상적으로 동작한답니다 처음 전원을 연결하면 요렇게그리고 제가 가지고 있는 아이폰 화면에 요런 게 나타나네요 뭐 간단하게 설정부터 하도록 하죠 저는 편의상 작업실이라고 방을 지정하였습니다 근데 스테레오는 어떻게 연결하지 하는 고민을 하고 있었는데 그냥 바로 설정 화면에 나타나네요 스테레오 페어링으로 사용을 눌렀습니다 오홀 요런 센스 새로 들여온 화이트 홈팟 미니가 스테레오 사운드에서 어느 쪽을 담당하는지 확인을 하네요 저는 오른쪽을 선택 그럼 기존 그레이 홈팟 미니는 자연스럽게 왼쪽이 되나 봅니다 그리고 이전과 동일하게 홈팟 상단 중앙 부분을 화면의 동그란 프레임에 맞추면 알아서 설정을 진행합니다 시간이 조금 걸리더군요 기다리면 완료되었다고 요렇게 알려줄 겁니다 너무 간단한걸요 홈팟 미니 들여오면 스테레오 어떻게 구성하는지 알아봐야지 하고 있었는데 너무 쉽게 끝났습니다 뭐 다른 작업하기 전에 바로 음악부터 들어봐야죠 아이폰에 있는  음악 스트리밍 앱을 이용하고 아이폰을 홈팟 미니 근처로 가져가면 자동으로 연결이 됩니다 그럼 소리가 홈팟 미니로 옮겨져서 들리게 되는 거죠 요렇게 확인도 가능하고요 제가 기억이 정확지는 않은데 분명 예전에 홈팟 미니 대만 있을 때는 아래 작업실 이름 앞에 홈팟 미니 그림이 개만 표시가 되었던 거 같은데 이제는 스테레오로 구성되면서 기기 개가 나타나고 있습니다 이런 디테일이라니 음악을 감상하다가 잠시 멈추고 홈팟 설정 부분을 조금 더 살펴보려고 합니다 홈 앱을 열어서 홈팟 위젯을 확인합니다 역시 여기도 홈팟 대가 하나의 위젯으로 나타나고 있네요 설정 항목을 선택하고 아 역시 처음 설정하고 나면 요렇게 소프트웨어 업데이트를 하라고 나타나는군요 해줘야죠 업데이트를 하는 중에도 설정 부분 이곳저곳 돌아다니면서 살펴봅니다 방  작업실 항목에 두 대의 홈팟 미니가 각각 표시가 됩니다 그리고 오디오 설정에서는 좌우를 설정 변경할 수도 있군요 그 외에도 자동화 음악 및 팟캐스트 시리 인터컴 손쉬운 사용 그리고 재시동까지 다양한 제어 작업을 이곳에서 확인하고 진행하실 수 있습니다 이제 업데이트도 마쳤습니다 소리를 들려드리도록 할게요 요렇게 구성하려고 들여온 겁니다 왼쪽은 그레이 오른쪽은 화이트가 조금 맘에 걸리네요 하지만 이제 홈팟 미니 스테레오 사운드를 들어볼 수 있게 되었습니다 기대되네요 오늘의 찬조 출연은 아이패드를 이용하였습니다 음악 스트리밍 앱을 실행하고 소리는 홈팟 미니로 나오도록 음 아이폰으로 녹음을 한 건데 들어보니 실제 그 감동 느낌에 못 미치는 거 같습니다 홈팟 미니 한 대만 하더라도 작은 크기에 꽤 큰 웅장함을 느끼게 해 주었는데 스테레오로 구성하여 사운드를 들어보니 정확하게 중앙에서 소리가 들려오는 듯하고 웅장함은 배가 되었습니다 작업 공간이 거실에 있는 관계로 밤에 볼륨을 좀 높여서 스테레오 사운드로 음악을 감상하면서 푹 빠져있는데 옆에서 장여사가 아랫집에 민폐라고 소리를 줄이라고 하네요 홈팟 미니 조그만 넘이 대단합니다 특히 스테레오 사운드 엄청나네요 왜 홈팟 미니 구입하면 하나 더 구입하라고들 하는지 이제는 알겠습니다,2021.08.10. 22:59
1,,맥북으로 사진 영상 편집하면서 너무 모니터 사고 싶었는데 결국 질렀습니다이번에 새로 나온  를 사고 싶었지만 영국은 아직 많이 안풀려서 가격이 비싸 포기했습니다트랙패드는 새로 나왔다고 하길래 사봤는데 각진 디자인만 둥글게 변했네요기능적인 측면은 똑같은거 같습니다 그리고 패브릭 소재의   라이트닝 케이블이 구성품으로 되어있습니다이번에 새로 나온 터치 아이디 들어간 매직 키보드까지 사면 지출이 너무 커서 가성비 좋은  으로 샀습니다책상이 작긴 하지만 화이트 톤으로 깔끔하네요,2021.08.08. 23:01
2,애플 아이패드 배터리도 조작,아이패드 프로 배터리를 교체하기 위해 여의도 애플 스토어를 방문하여 교체를 못하고 온 이후 확실히 교체 할 수 있는 노하우를 공개합니다 아이패드 프로 배터리 교체 실패 후기아이패드 프로 배터리를 교체하기 위해 여의도 애플 스토어를 방문하여 교체를 못하고 온 이후 확실히 교체 할 수 있는 노하우를 공개합니다,2021.08.06. 15:44
3,맥북프로  인치 년에 구매기 리뷰애플 여의도 서멀구리스 재도포,맥북프로  인치 년 구매기 리뷰애플 여의도 서멀구리스 재도포안녕하세요 라이킷입니다 오늘 드디어 맥북프로  인치 년에도 아직 현역일까라는 리뷰를 하게 되었습니다 일단 결론부터 먼저 말씀을 드리자면 현역이긴 하지만 현재 시점에서는 다소 애매한 쪽  안녕하세요 라이킷입니다 오늘 드디어 맥북프로  인치 년에도 아직 현역일까라는리뷰를 하게 되었습니다 일단 결론부터 먼저 말씀을 드리자면현역이긴 하지만 현재 시점에서는 다소 애매한 쪽에 속해 있는그런 노트북이라고 보시면 될 것 같습니다그 이유는 차근차근 아래에서 설명드리고 일단 오늘 리뷰를 시작하기 전에 앞서먼저 사과해야할 부분이 있어 먼저 말씀드리겠습니다 제가 앞서 맥북기준으로 의 단점 살펴보기라는 글을 올렸는데저의 노트북만의 문제로 발생한 문제를 모든 맥북의 문제라고 하며다른 분들이 사용하시는 맥북을 고려하지 않은점 특히 부트캠프 부분에서의 안정성이 좋지 않은이라는 잘못된 단어 선택으로 인하여 많은 분들께잘못된 정보를 알려드림과 동시에 독자분들의 기분을 언짢게 한 것 정말 죄송합니다 현재 맥쓰사에 올린 글은 수정이 완료가 되었으나다만 블로그에 있는 글은 아직 수정을 하지 못하였음으로 최대한 빨리수정하여 올리도록 하겠습니다  이제 그러면 맥북프로 년형 인치 리뷰를 시작해보도록 하죠   일단 저는 해당 맥북을 사용한지 대략 주정도가 되었습니다물론 그중에서 대략 일정도는 서비스센터에 있었습니다 일단 제가 해당맥북을 받고서 를 좀 했어요   일단 를 한이유는 첫번째로 키보드 문제입니다제가 해당 맥북을 구매하고 사용을 하다보니 키와 키가제대로 눌리지 않는 문제가 있었어요 처음에는 그냥 키 하나만 문제겠지 했지만키 같은 경우 한 번을 누르면 번만 입력이 되는 경우였고 커맨드키는 뒤로기기 단축키  를 할때 안됐기에문제가 있다고 판단하고 를 맡겼습니다 판매자 분의 말씀을 들어보니 거의 년동안 서비스센터에 한번도 가지 않았으며 자신이 하판을 열어본적도 없다고 하셨습니다 결과적으로는 서멀재도포는 물론이고 키보드문제 내부 청소등도거의 하지 않은 상태라는 것이였죠 일단 아무튼 문제가 있다는 것을 애플 공식 서비스 용역업체에서 밝혀주셨고저는 해당 맥북의 수리를 한 일동안 맡겼습니다부품 오는데 시간이 걸리셨다고 다만 이제부터 또다른 문제가 보이기 시작했죠   바로 발열 문제였습니다 제가 수리를 받고서 해당 발열문제가 좀 많이 심각했어요 뭐만 하면 발열은 도 이상이 나오다가 도에 도달 했는데   제가 간 애플 공식 서비스 용역 업체에서는 만 천원으로 분해점검을 통해서내부클리닝 재조립으로 대충 서멀재도포도 해주는 것 같더라고요 그래서 안되겠다 싶어서 수리받은지 하루만에 다시 해당 서비스 센터에 연락을 해서아래처럼 말했습니다 맥북의 서멀 재도포를 하려고 하는데 여기 분해점검 티어 으로 신청하면 될까요어제 하판교체를 받고서 왔는데 발열이 좀 심해서 클리닝 받으려고 합니다 그랬더니 돌아오는 답변은 어 수리를 받으셨다고요 저희 기본적으로 제품 수리할때 서멀 재도포는 해드리는데  그래서 저는 서멀재도포를 했지만 그냥 이모델은 발열이 많이 심한가보다 하면서 사용을 했습니다하지만 도저히 못참겠더라고요 거의 작업을 못하다시피 발열이 나오는 문제 때문에 서멀패드를 붙일까 하면서서멀패드를 알아보던 찰나에 수리 받았던 키보드 키가 망가진 것을 알게 되었습니다 한번누르면 두번 입력수리받은지 한 일 됐던날 그러다가 일이있어서 밖에 나가서작업하다가 이젠 아예 반응이 없고ㅋㅋㅋㅋㅋㅋ 이정도로 나비식 키보드가 약한지는 몰랐어요 아님 제가 뽑기운이 없었을지도 모르겠지만 그냥 여의도 애플스토어를 가자 해서 한시간 걸려서 지하철타고 갔습니다   확실히 가로수길과는 다르게 외국 애플스토어의 느낌이 물씬 나더라고요또 다른 느낌이라서 좀 신기했습니다    아쉽게도 갔는데 예약시간 분이 지나서 다시 예약을 잡아야 하더라구요결국 한시간 뒤로 다시 예약을 잡고서 가지고 온 다른 노트북으로 바로앞 스타벅스에서작업을 하다가 들어갔습니다   역시 가보니 키 불량 판정을 받았고 결국엔 다시또 무상수리를 맡기게 되던 찰나에한번 엔지니어 분께 노트북을 사용한지 좀 오래되서 그런데 혹시 서멀 재도포 가능 할까요솔직히 저는 서멀재도포는 공식 센터에서 안해준다라는 말들이 많아서 안될줄 알았어요 그랬더니 엔지니어 분께서는음 네 가능하십니다 다만 제가 이 맥북을 수리할수도 있지만 다른 분이 하시면 따로 말씀드리겠습니다 이이게 되더라구요   심지어 메일로 받은 진단서에도 이렇게 써머그리스라고 적혀있더라구요써머그리스ㅋㅋㅋㅋㅋㅋ보고서 조금 웃었습니다 아마 이게 주요 부품부위를 교체를 할때 서비스 차원에서 해주시는 것 같더라구요따로 가서 부탁드리는거는 불가능한 것 같습니다 만약 뭐 키보드 무상수리 받으시는 분들 한번씩 서멀그리스 재도포 가능하냐고여쭤보세요   아무튼 그래서 다음날 오전에 맥북 수리가 끝났으니 받으러 오라고 전화가 왔는데또여기서 좀 당황스러운 상황이 나오게 됩니다 전화를 받으면 안녕하세요 님맞으시죠 라고 여쭤보는데제 이름이 아니라 다른 분의 이름이 등록이 되어있더라구요 어제 맡길때 저이름이 있길래 아 엔지니어분 성함인가 보다 했는데그게 고객이름으로 되어있을 줄은 ㅋㅋㅋㅋㅋㅋ암튼 다시 전화해서 이름이 잘못됐다고 말씀드리고 대리인으로 해서 여의도로 가서 다시 수령을 받았습니다물론 대리인 이름도 제가 발음을 제대로 못했는지 맨 뒷글자는 틀려있더라구요ㅋㅋㅋ   아무튼 그래서 다시 잘 수령받고 따로 서멀구리스 재도포 해주셨냐고 여쭤보니해주셨다고 하시더라고요 그래서 근처 밥먹으로 가서 테스트를 해보니정말 서멀구리스를 갈아주셨는지 작업할 때 발열이 원래보다 도정도가 내려갔더라구요ㅋㅋㅋㅋ심지어 코어별 온도편차가 도 이상이였어요 근데 그것도 수리받으니 대략 도밖에 안났고   전이라면 대략 도나 도가 될 작업에서도 도로 정말 안정적으로 발열 유지를 해주었습니다심지어 컴파일이나 그래픽 라이팅 빌드 속도도 엄청나게 빨라졌습니다드디어 한숨 놓았습니다ㅠㅠㅠ  정말 이것때문에 저번 리뷰도 잘못해드려서 독자분들께 정말 죄송하단 말씀드립니다정말 저의 맥북만의 문제였었네요ㅋㅋㅋ    암튼 다시 이제 정말 맥북프로  인치의 리뷰를 시작할께요제 맥북프로의 사양은 다음과 같습니다                  뭐 그냥 그럭저럭 작업용으로 쓸만한 정도의 성능입니다다만 왜 맥북에어 을 사지 않고 왜 이걸 샀냐고 여쭤보실거 같아요실제로도 주변 지인분들도 그렇게 질문해주셨는데 저는 아직까지는 제가 하는 작업에선 애플실리콘이 제대로 최적화가 되어있지 않다고판단해서 애플실리콘 맥북을 구매하지 못하고 인텔 맥북으로 구매를 하였습니다   일단 제가 하는 작업은 게임개발 쪽이기에 유니티 언리얼 엔진등을 사용하긴 합니다만그 중에서도 언리얼을 주로 사용하는 편입니다  다만 유니티이든 언리얼이든 애플실리콘으로 로제타 를 사용해서 실행이 가능하긴 하지만로제타로도 불가능한 시스템적인 요소와 각종 버그들이 많으며 무엇보다 게임엔진에서의 로제타의 성능이 인텔 맥북대비 상당히 느리다고 판단했습니다 주변에 맥북에어 으로 유니티 로 작업을 하는 친구가 있는데 공홈에서 샀다가 일만에 반품하고다시 전에 쓰던 맥북프로 년형 인치를 꺼내들더라고요ㅋㅋㅋ 또 저는 인치 맥북들만 계속해서 써왔기 때문에 무엇보다 인치에 대한 로망이 있었기에 년형 인치 고급형을 질렀습니다   다만 확실히 성능면으로도 아쉬운점이 좀 많아요 일단 가 세대 모바일까진 코어가 최대이기 때문에  맥북보단 확실히성능이 떨어지는 모습을 보이는 것은 어쩔수가 없는 듯 합니다   또한 라데온 프로 이 와 비슷한 성능이라 확실히 예전에 제가 사용하던 젠북 보다는 성능이 많이 딸리더라고요 참고로 예전에 사용하던 젠북은 그래픽이 였는데대략 현재 맥북프로  인치 과 비슷하다고 보시면 될것 같습니다대략 점대 뭐 어짜피 노트북이니 성능은 감소되도 괜찮지 이러면서 사용중입니다자기 합리화중   또 어짜피 맥북 나비식 키보드는 예전부터 많이 사용해 왔기 때문에 나비식 키보들 처음 사용하시는 다른 분들이 느끼시는 이질감이 저는 별로 크지 않았어요 물론 이 맥북을 사자마자 주만에 번 망가지긴 했지만요 내구성이 문제로다ㅠ   또한 터치바를 쓰는건 또 처음이라서 한번쯤은 써보고 싶었는데어다른 분들이 말씀하시는 거처럼 딱히 장점은 찾지 못했습니다ㅋㅋㅋㅋㅋ 초반에 적응이 안되서 자꾸 위에 터치가 되서 걸리적 거리기만 하더라고요 물론 그래도 겉멋은 있어서 이번 맥북프로에서는 사라진다는게 좀 아쉽긴 하지만요그래도 역시 실용성은 그냥 논터치바가 제일 좋은 것 같더라구요   아주 가끔씩 이렇게 밝기 소리와 시리가 나오는 부분이 제대로 안나오는 버그가 있을때가 있어요이때는 그냥 저 옆에 화살표를 눌러서 밝기 소리조절을 하거나 재부팅을 해야하더라구요 아무랟  버그인것 같은데 나온지 년정도 다 되어 가는데 이런 버그가 있는 것은 다소 아쉬웠습니다설마 이것도 내 맥북만인가 또 역시 넓고 큼직한 트랙패드는 좋긴한데가끔씩 그 영역이 너무커서 키보드 타이핑을 하다가 건드리는 경우가 조금씩 있어요ㅋㅋㅋ그냥 이건 제가 따로 습관을 고쳐야 할 것 같습니다   배터리는 로제가 고성능 작업을 많이 하면 대략 시간 정도밖에 가진 않지만웹서핑 문서작업 정도만 한다고 치면 대략 시간정도 가더라구요 밖에 맥북을 가지고 나갈때는 충전기는 필수 였습니다 터보부스트를 끄고 사용하면 대략 한 분 정도는 배터리 타임이 늘어난다고 보시면 될 것 같아요확실히 맥북프로 인치는 배터리 타임이 좀 짧은게 아쉽긴 하더라구요또 터치바가 배터리를 먹는게 상당한것 같아서 좀 아쉽기도 해요그래도 여타 노트북 보다는 좀 더 길어서 좋습니다   스피커는 정말 말할 것도 없습니다  최대 음량으로 설정을 해놔도 소리가 전혀 깨지지도 않고심지어 집에 데스크탑 스피커보다도 훨씬 좋아요노트북중에서는 아마 스피커 최강자가 아닐까 싶어요 물론 옛날부터 계속 그래왔지만 마이크는 좋긴한데 녹음한 걸 들어보니 확실히 목소리가 울리는게 들리는 것 같아서아주 조금 아쉽긴 했습니다    포트는 썬더볼트 포트 개와  헤드셋포트가 전부인데확실히 디자인적으로 보기는 좋지만 허브를 가지고 다녀야 한다는 점은좀 사용하면서 짜증나는 부분이죠  저도 허브를 가지고 다니기 귀찮아서 지금 사용하고 있는 대부분의 저장장치를 대부분 타입 또는 타입과 타입 두개가 모두있는 저장장치로 바꾸고 있는 중입니다  같은 경우엔   를 사용하여 별도의 허브 없이 사용중이고요확실히 요즘 타입이 많이 대중화가 되기도 해서 에전보단 많이 편하긴 하더라구요   디스플레이는 말할 것도 없습니다최대 니트의 밝기에 색영역 풀지원까지 하니 정말 좋아요 다만 조금 아쉬운점은 트루톤 이 년형 맥북프로 부터 들어갔기 때문에 이점은 다소 아쉽더라구요   마무리를 하자면 위에서 말씀드렸듯 성능이 좋은 애플실리콘이 있긴하지만저처럼 사용하는 프로그램이 로제타를 제대로 지원을 하지 않거나제대로 최적화가 되어있지 않아서 이렇게 맥북프로 인텔을 구입하시는 분들이 계실겁니다 저도 꽤나 둘중 하나를 두고 고민을 하긴 했지만 결과적으로는 어쩔수 없이인텔 맥북을 가야한다는 결론을 내렸지만요 하루 빨리 모든 프로그램이 애플실리콘을 잘 지원해서저를 애플실리콘으로 넘어가게 해주었으면 좋겠네요  을 사고 싶기도 했지만 같은 경우 보다 그래픽 성능이 좋지 않으며무엇보다 은  고급형보다도 비쌌기 때문에 저는 구매를 하지 않았습니다워낙 이  맥북을 싸게 구입해서 말이죠ㅎㅎ물론 상태도 말이 아니였지만 하여튼 오늘 포스팅은 여기서 마치도록 하겠습니다이상 라이킷이였습니다 감사합니다    맥북프로  인치 년 구매기 리뷰애플 여의도 서멀구리스 재도포안녕하세요 라이킷입니다 오늘 드디어 맥북프로  인치 년에도 아직 현역일까라는 리뷰를 하게 되었습니다 일단 결론부터 먼저 말씀을 드리자면 현역이긴 하지만 현재 시점에서는 다소 애매한 쪽 인텔맥  발열 배터리 사용량 줄이는 방법  맥린이 필수안녕하세요 또 오랜만에 한참 안오다가 오랜만에 온 라이킷입니다 한참 리뷰를 안올렸는데 오늘 같은 경우는 맥을 실사용할때 가장 문제가 되는 발열을 퍼센트 해소할수 있는 방법을 알려드리겠습니다 이 뉴맥북  인치 년 리뷰 이건좀안녕하세요 라이킷입니다 오늘 리뷰할 제품은 뉴맥북  인치 기본형 모델입니다 저번 서피스 프로  리뷰 포스트를 올린지 얼마 되지도 않았는데 벌써 다른 제품 리뷰가 나오니 조금 당황하셨을것 같네요,2021.07.31. 18:24
